timestamp,tweet_text
,"Don't judge me because I read and enjoy it.!
I don't bite. I don't shift. I don't cast. I can't fly. I don't have fins. I just read. That is just me.",
2019-11-13 00:23:33,"On page 304 of 453 of Capturing the Devil, by Kerri Maniscalco https://t.co/39qcAFRpfl"
2019-11-12 00:53:07,"On page 204 of 453 of Capturing the Devil, by Kerri Maniscalco: It'll all work out. https://t.co/Trq3U3d0fA"
2019-11-11 02:40:41,"On page 106 of 453 of Capturing the Devil, by Kerri Maniscalco: I love cresswell and wad... https://t.co/3QtarfUxTx"
2019-11-09 17:16:38,4 of 5 stars to Love and Other Words by Christina Lauren https://t.co/MkZtrDcBXv
2019-11-07 05:47:22,4 of 5 stars to He Will Be My Ruin by K.A. Tucker https://t.co/EDktk5HvKZ
2019-11-05 23:51:24,RT @glitzandshadows: 🗡giveaway🗡 RT/F by 11/11 for one ARC of RUTHLESS GODS *with* the fancy goth jacket.  Int’l okay 👌🏻 https://t.co/KrZuSt…
2019-11-01 04:22:11,"4 of 5 stars to Red, White &amp; Royal Blue by Casey McQuiston https://t.co/culQYyZrvG"
2019-10-29 02:09:13,4 of 5 stars to Final Girls by Riley Sager https://t.co/NomLoDnERh
2019-10-27 18:39:32,"On page 212 of 342 of Final Girls, by Riley Sager: Getting somewhere https://t.co/N5ZcrFGsM4"
2019-10-26 18:11:32,"On page 60 of 342 of Final Girls, by Riley Sager https://t.co/3AB88X88Tw"
2019-10-26 02:42:50,4 of 5 stars to The Silent Patient by Alex Michaelides https://t.co/SKu3UJG50a
2019-10-23 19:32:22,"On page 220 of 323 of The Silent Patient, by Alex Michaelides https://t.co/10GRslQc6z"
2019-10-22 16:52:18,RT @andrie_cas: 🎉GIVEAWAY *SIGNED COPY OF NINTH HOUSE + MORE*🎉  ✨New video up with details ✨Be subscribed to my channel and comment on the…
2019-10-20 22:53:37,"On page 141 of 323 of The Silent Patient, by Alex Michaelides https://t.co/5iqlpbsrIf"
2019-10-15 17:56:07,3 of 5 stars to The Wicked Deep by Shea Ernshaw https://t.co/72gYyMAij3
2019-10-14 17:09:24,"On page 214 of 310 of The Wicked Deep, by Shea Ernshaw: Yep, that's what I though. https://t.co/SXYHuPVbq5"
2019-10-13 03:25:30,"On page 207 of 310 of The Wicked Deep, by Shea Ernshaw https://t.co/5JyJCOh5OB"
2019-10-12 17:48:44,RT @hafsahfaizal: Hey hey! It's Friday! So let's have a giveaway for this WE HUNT THE FLAME tote bag featuring the zumra and one of my favo…
2019-10-09 04:16:05,4 of 5 stars to The Turn of the Key by Ruth Ware https://t.co/4w8568DC3f
2019-10-06 18:58:26,Book Talk: The Sun is Also a Star by Nicola Yoon https://t.co/twp79fIoGe via @YouTube
2019-10-06 03:25:30,"On page 100 of 384 of The Turn of the Key, by Ruth Ware: Hummmm https://t.co/juSmrRt4op"
2019-10-05 20:58:35,4 of 5 stars to Lock Every Door by Riley Sager https://t.co/I9YFuUY54i
2019-10-05 17:36:58,"On page 270 of 384 of Lock Every Door, by Riley Sager: So I'm pretty I know who the pers... https://t.co/VLMj6Q0AWZ"
2019-10-05 16:08:15,"On page 212 of 384 of Lock Every Door, by Riley Sager: Getting closer.... https://t.co/v7IakGjAeW"
2019-10-04 22:05:43,"On page 117 of 384 of Lock Every Door, by Riley Sager: What happened to ingrid? https://t.co/NJ3PPCLiRi"
2019-10-04 19:43:00,"On page 56 of 384 of Lock Every Door, by Riley Sager: So far I'm digging it. https://t.co/Tnx2XErZQJ"
2019-10-04 19:23:11,RT @Alyssa_Susanna: FLASH GIVEAWAY! Win one of 5 ARCs of #TheBeautiful by Renee Ahdieh! Follow + RT to win.   +1: follow on IG (theeaterofb…
2019-10-03 04:31:13,"On page 28 of 384 of The Turn of the Key, by Ruth Ware: I'm not sure I like the way it's... https://t.co/co0e7n42Iv"
2019-10-03 03:20:44,4 of 5 stars to There's Someone Inside Your House by Stephanie Perkins https://t.co/jARMQYnoRt
2019-10-03 00:08:27,RT @MaskedSingerFOX: RETWEET if you're watching #TheMaskedSinger! 🙌
2019-10-02 18:18:53,E-book Deals: October 2019 https://t.co/IA7H1I4pso via @YouTube
2019-10-02 17:12:22,Love that my husband's learning what things I love are and what fandoms they come. I bought a cup that said 9 and 3… https://t.co/BDCzzHX4nv
2019-10-02 17:05:12,"I'm becoming a sucker for hallmark movies. Especially, if they're about books, authors, and secrets."
2019-10-02 05:48:31,"On page 146 of 287 of There's Someone Inside Your House, by Stephanie Perkins https://t.co/lWzw2Rm3Sx"
2019-10-02 04:23:19,"On page 78 of 287 of There's Someone Inside Your House, by Stephanie Perkins https://t.co/v7wf972b4p"
2019-10-01 16:36:52,RT @laurayjames: I’m giving away 2 copies of this BEAUTIFUL book today on twitter! RT this post + follow me to enter. US&amp;Canada only. Ends…
2019-10-01 16:35:45,TBR Time: October 2019 https://t.co/TlePDAPxF4 via @YouTube
2019-10-01 03:14:50,4 of 5 stars to The Seven Husbands of Evelyn Hugo by Taylor Jenkins Reid https://t.co/3K2dHtB36e
2019-10-01 00:03:09,3 of 5 stars to Meet Cute by Jennifer L. Armentrout https://t.co/9eUgLIpeqD
2019-09-30 03:53:01,"On page 245 of 314 of Meet Cute, by Jennifer L. Armentrout: Something real about two gir... https://t.co/IYH92b3JvH"
2019-09-30 03:15:44,"On page 218 of 314 of Meet Cute, by Jennifer L. Armentrout: Million miles was about a gu... https://t.co/usifAFDAW0"
2019-09-30 01:08:43,"On page 175 of 314 of Meet Cute, by Jennifer L. Armentrout: The dictionary of you and me... https://t.co/5EwZHnpFq2"
2019-09-29 20:55:59,"On page 157 of 314 of Meet Cute, by Jennifer L. Armentrout: Oomph is about a girl who me... https://t.co/oMcEKb48b8"
2019-09-29 20:14:37,"On page 133 of 314 of Meet Cute, by Jennifer L. Armentrout: This story ""the way we love ... https://t.co/jmstEz3iAA"
2019-09-29 16:47:07,@knoxdiver Alice in wonder  Over 60 copies.
2019-09-29 03:48:13,"On page 89 of 314 of Meet Cute, by Jennifer L. Armentrout https://t.co/JAJjJXuzXj"
2019-09-29 01:57:17,4 of 5 stars to Verity by Colleen Hoover https://t.co/5huZDnZo5s
2019-09-28 16:06:59,Watching winter love story on hallmark about a best selling author and a new author going on a book tour and it's a cute story.
2019-09-27 15:28:34,1 of 5 stars to Untapped Pleasures by L.N. Pearl https://t.co/irvW9d2zZn
2019-09-27 01:26:45,"On page 190 of 333 of Verity, by Colleen Hoover: This is a bit fucked up. https://t.co/gTTYpQJVN3"
2019-09-25 01:53:57,"Just fyi gallbladder surgery hurts, but being able to stay in bed and read makes it bet...nope it still hurts."
2019-09-24 02:09:38,"On page 45 of 333 of Verity, by Colleen Hoover https://t.co/sH7fA8kwbN"
2019-09-23 14:01:30,"On page 135 of 391 of The Seven Husbands of Evelyn Hugo, by Taylor Jenkins Reid https://t.co/xsFOPeI5W2"
2019-09-22 03:26:21,3 of 5 stars to The Sun Is Also a Star by Nicola Yoon https://t.co/o6Xn6zg3G7
2019-09-21 16:55:00,✨Giveaway alert! Want a box full of books and bookish goodies? Win a #NOVLbox from @theNOVL:… https://t.co/XvcJoi8tYn
2019-09-20 19:57:44,"On page 208 of 384 of The Sun Is Also a Star, by Nicola Yoon: I like Natasha and Daniels... https://t.co/TUQigFbDzB"
2019-09-20 03:25:19,"On page 145 of 384 of The Sun Is Also a Star, by Nicola Yoon https://t.co/vtQ645MBi0"
2019-09-19 03:09:25,4 of 5 stars to Sorcery of Thorns by Margaret Rogerson https://t.co/hRT0pSorYw
2019-09-18 00:03:14,"On page 317 of 456 of Sorcery of Thorns, by Margaret Rogerson: I love silas, Nathaniel a... https://t.co/9KUa4QGao3"
2019-09-15 03:49:56,4 of 5 stars to Furyborn by Claire Legrand https://t.co/8gIMXKkIwQ
2019-09-14 17:53:04,"On page 436 of 501 of Furyborn, by Claire Legrand: Definitely enjoying it. https://t.co/rhEtktys2W"
2019-09-13 16:39:07,"On page 289 of 501 of Furyborn, by Claire Legrand: Oh the plot thickens! https://t.co/5gH50GPUDM"
2019-09-13 15:21:30,"On page 276 of 501 of Furyborn, by Claire Legrand https://t.co/3RmADblJSS"
2019-09-13 02:52:26,"RT @OLaddieGirl: I'm having a horrible day, so to brighten someone else's I'm giving away signed 1st ed of #Darkdawn (US). RT&amp;F to enter, l…"
2019-09-13 02:50:41,"@pastel_pages Turn, rules and devil!"
2019-09-12 23:43:18,"On page 230 of 501 of Furyborn, by Claire Legrand: The trials give me goblet of fire vibes. https://t.co/VBqJflZ8CB"
2019-09-11 16:23:28,"On page 130 of 501 of Furyborn, by Claire Legrand: It's getting better. https://t.co/vrY78MYF3m"
2019-09-10 23:41:29,"On page 43 of 501 of Furyborn, by Claire Legrand: I'm a bit confused now, but hopefully ... https://t.co/JNtC8NdOe3"
2019-09-09 23:10:09,4 of 5 stars to Girls of Paper and Fire by Natasha Ngan https://t.co/pnwDoMWe9g
2019-09-08 17:57:07,"On page 230 of 400 of Girls of Paper and Fire, by Natasha Ngan: It's ok. Still waiting f... https://t.co/5hm0EQzAVr"
2019-09-07 03:57:16,"On page 100 of 400 of Girls of Paper and Fire, by Natasha Ngan: Interesting so far https://t.co/CZ4DB8OfrX"
2019-09-06 03:15:40,4 of 5 stars to Two Dark Reigns by Kendare Blake https://t.co/0Ezv6iQwOD
2019-09-04 02:58:01,"On page 210 of 464 of Two Dark Reigns, by Kendare Blake: What's up with the mist? https://t.co/wSTjsbdm1r"
2019-09-02 01:00:33,"On page 92 of 464 of Two Dark Reigns, by Kendare Blake https://t.co/G5m5hj6wai"
2019-09-01 01:55:43,4 of 5 stars to One Dark Throne by Kendare Blake https://t.co/cgbsOYyxpr
2019-08-30 00:00:00,"50% done with One Dark Throne, by Kendare Blake: I still font know what queen I like. I ... https://t.co/0X2SkOaRT1"
2019-08-29 23:55:36,"RT @FierceReads: If you've been DYING to get your hands on @alliechristo’s dark &amp; gritty new series starter, INTO THE CROOKED PLACE, you sh…"
2019-08-26 23:50:42,4 of 5 stars to Aru Shah and the End of Time by Roshani Chokshi https://t.co/cOItZ22izz
2019-08-25 14:29:42,"On page 125 of 355 of Aru Shah and the End of Time, by Roshani Chokshi https://t.co/reSrfAZpIu"
2019-08-25 00:28:02,4 of 5 stars to The Tea Dragon Society by Katie O'Neill https://t.co/RRAz7XDBTJ
2019-08-23 22:39:10,4 of 5 stars to The Tea Dragon Society by Katie O'Neill https://t.co/jTIlgqiuma
2019-08-23 12:36:42,"On page 212 of 412 of Falling Kingdoms, by Morgan Rhodes https://t.co/esbREUfrSm"
2019-08-22 17:22:00,"On page 120 of 412 of Falling Kingdoms, by Morgan Rhodes https://t.co/C6i93Sgkpw"
2019-08-21 15:31:59,"On page 26 of 412 of Falling Kingdoms, by Morgan Rhodes https://t.co/wzkR8pCx03"
2019-08-20 20:04:44,4 of 5 stars to Avenged by Amy Tintera https://t.co/OIKDtVucLO
2019-08-18 18:44:22,"On page 240 of 412 of Avenged, by Amy Tintera: I don't care for olivia. https://t.co/MSxGndf1ts"
2019-08-16 02:45:56,"On page 70 of 412 of Avenged, by Amy Tintera https://t.co/M6YffAHOTE"
2019-08-15 19:05:54,"On page 17 of 412 of Avenged, by Amy Tintera https://t.co/wY9SSzeGoZ"
2019-08-15 18:45:24,HARRY POTTER HAUL - OPENING 30 SERIES 2 MYSTERY WANDS FROM WALMART https://t.co/SGNTNznqZW via @YouTube
2019-08-15 17:56:56,4 of 5 stars to Freeks by Amanda Hocking https://t.co/iqtRDXRTBG
2019-08-14 17:53:19,"On page 201 of 400 of Freeks, by Amanda Hocking https://t.co/h03UlZGMFq"
2019-08-12 04:44:18,"On page 100 of 400 of Freeks, by Amanda Hocking https://t.co/QLfxQCKtja"
2019-08-11 18:51:34,3 of 5 stars to The Wicked King by Holly Black https://t.co/P52qfu0NZ1
2019-08-11 17:11:21,4 of 5 stars to The Last Time We Say Goodbye by Cynthia Hand https://t.co/hR92aqOjh4
2019-08-11 15:48:44,"70% done with The Last Time We Say Goodbye, by Cynthia Hand https://t.co/f2b2jxbtYA"
2019-08-06 23:52:28,"On page 204 of 338 of The Wicked King, by Holly Black https://t.co/z8osKAyCXr"
2019-08-05 21:12:32,"On page 146 of 338 of The Wicked King, by Holly Black https://t.co/I74RboLC7b"
2019-08-04 14:44:21,"On page 45 of 338 of The Wicked King, by Holly Black https://t.co/AxZksrifda"
2019-08-04 03:34:59,"@Alyssa_Susanna I don't have any to trade, but if it's just paying for shipping I'm interested in poisoned blade an… https://t.co/zqLgyafDBe"
2019-08-03 23:01:04,"3 of 5 stars to Saga, Vol. 1 by Brian K. Vaughan https://t.co/SLDYbsvMqt"
2019-08-03 04:57:35,5 of 5 stars to Bloodleaf by Crystal Smith https://t.co/SzMdUpNudq
2019-07-31 23:34:37,4 of 5 stars to The Book Thief by Markus Zusak https://t.co/lvhJXnorMO
2019-07-31 13:26:21,"On page 488 of 552 of The Book Thief, by Markus Zusak https://t.co/z8BWYsyN0J"
2019-07-28 13:07:55,"3 of 5 stars to Saga, Vol. 1 by Brian K. Vaughan https://t.co/SLDYbsvMqt"
2019-07-27 22:52:11,"On page 200 of 552 of The Book Thief, by Markus Zusak https://t.co/ZVWkH6VAy6"
2019-07-26 13:09:57,"On page 69 of 552 of The Book Thief, by Markus Zusak https://t.co/63u7if8Rcz"
2019-07-26 01:23:27,3 of 5 stars to The Vespertine by Saundra Mitchell https://t.co/8vfLQq5ahf
2019-07-24 13:05:50,"On page 102 of 293 of The Vespertine, by Saundra Mitchell https://t.co/VXmIJpDkZ1"
2019-07-23 18:30:26,"On page 50 of 293 of The Vespertine, by Saundra Mitchell https://t.co/j3YeAICu1X"
2019-07-23 05:45:13,3 of 5 stars to Vampire Academy by Richelle Mead https://t.co/DxmHbnOspG
2019-07-23 04:08:40,3 of 5 stars to Dead Is a State of Mind by Marlene Perez https://t.co/WGcUPDlT1E
2019-07-20 04:47:12,4 of 5 stars to Maybe This Time by Kasie West https://t.co/DG4BR7iDZl
2019-07-19 03:22:36,"On page 150 of 368 of Maybe This Time, by Kasie West https://t.co/ofjL899f7a"
2019-07-18 03:42:02,"On page 50 of 368 of Maybe This Time, by Kasie West: Aww. I love kasie west books https://t.co/yyNMOKbxAQ"
2019-07-18 02:24:41,3 of 5 stars to Nevernight by Jay Kristoff https://t.co/EwPu9jjggp
2019-07-15 23:50:50,"On page 314 of 429 of Nevernight, by Jay Kristoff: O...some of these scenes. https://t.co/p7gzaTRqhy"
2019-07-14 04:07:23,"On page 276 of 429 of Nevernight, by Jay Kristoff: You guys that scene with tric and mia... https://t.co/G3udRvkzHV"
2019-07-12 03:10:37,"On page 206 of 429 of Nevernight, by Jay Kristoff: Now we're moving. https://t.co/hdPzENAO86"
2019-07-11 04:05:40,"On page 150 of 429 of Nevernight, by Jay Kristoff: A little better https://t.co/7cxq6sYoX1"
2019-07-10 04:41:36,"On page 115 of 429 of Nevernight, by Jay Kristoff: Ok, now that I've gotten past the wha... https://t.co/qOO8foknpb"
2019-07-09 23:18:16,"On page 85 of 429 of Nevernight, by Jay Kristoff: I'm trying. We've made it to the desti... https://t.co/N2ZYKWJ775"
2019-07-09 00:42:36,"On page 50 of 429 of Nevernight, by Jay Kristoff: I'm trying really hard to get into thi... https://t.co/2KLZVQAa8C"
2019-07-08 16:58:07,3 of 5 stars to An Unkindness of Magicians by Kat Howard https://t.co/wOaOgfD9c3
2019-07-08 15:32:20,"On page 331 of 352 of An Unkindness of, by Kat Howard: Im still not sure how I feel abou... https://t.co/mGpgaScodr"
2019-07-06 04:21:19,"On page 137 of 352 of An Unkindness of, by Kat Howard: So many characters to keep up with. https://t.co/oBcIT2qVdo"
2019-07-05 03:03:25,4 of 5 stars to I Believe in a Thing Called Love by Maurene Goo https://t.co/niXOVigI6I
2019-07-05 00:46:06,"On page 222 of 336 of I Believe in a Thing, by Maurene Goo: Such a cute story. https://t.co/LQV4zTLkGj"
2019-07-04 02:23:56,4 of 5 stars to This Book Is Not Yet Rated by Peter Bognanni https://t.co/lWtHa2RnNT
2019-07-02 00:22:27,"On page 63 of 336 of This Book Is Not Yet Rated, by Peter Bognanni https://t.co/YtsbzTGMcF"
2019-07-01 02:16:32,"On page 36 of 429 of Nevernight, by Jay Kristoff: I'm hoping I'll get into it more as it... https://t.co/LOldogZx0U"
2019-06-30 03:16:06,4 of 5 stars to Four Dead Queens by Astrid Scholte https://t.co/tMAa2P0IqR
2019-06-29 20:03:08,"On page 342 of 413 of Four Dead Queens, by Astrid Scholte: SO I was wrong, but what the ... https://t.co/IcbChf3Mxa"
2019-06-28 00:51:30,"On page 257 of 413 of Four Dead Queens, by Astrid Scholte https://t.co/hnTyoQzEP8"
2019-06-27 03:19:56,"On page 160 of 413 of Four Dead Queens, by Astrid Scholte https://t.co/sTCyWuRnpX"
2019-06-26 00:22:49,"On page 112 of 413 of Four Dead Queens, by Astrid Scholte https://t.co/jNVamKy82f"
2019-06-25 20:02:14,4 of 5 stars to Ruined by Amy Tintera https://t.co/LiYRfeDsYf
2019-06-24 01:44:41,"On page 290 of 355 of Ruined, by Amy Tintera https://t.co/qHqzYealZR"
2019-06-21 15:56:19,3 of 5 stars to Sliding Into Home by Kendra Wilkinson https://t.co/wHVYpuGJqn
2019-06-21 04:18:27,"On page 179 of 256 of Sliding Into Home, by Kendra Wilkinson https://t.co/6NXYhUMyVY"
2019-06-19 01:54:21,"On page 83 of 256 of Sliding Into Home, by Kendra Wilkinson https://t.co/5iA1NpH7zz"
2019-06-18 04:42:59,5 of 5 stars to Heir of Fire by Sarah J. Maas https://t.co/X7BEGkXZyo
2019-06-18 04:09:40,4 of 5 stars to Summerlost by Ally Condie https://t.co/QgrcXAcGnI
2019-06-16 00:03:00,"90% done with Heir of Fire, by Sarah J. Maas https://t.co/QXl8nbyxXF"
2019-06-13 18:58:41,"On page 115 of 249 of Summerlost, by Ally Condie https://t.co/3H7V4BUmKX"
2019-06-09 18:38:18,"20% done with Heir of Fire, by Sarah J. Maas https://t.co/6NBdQHjfpL"
2019-06-06 17:18:33,4 of 5 stars to Crown of Midnight by Sarah J. Maas https://t.co/SIA8FhfPHt
2019-06-04 23:05:26,"On page 226 of 418 of Crown of Midnight, by Sarah J. Maas https://t.co/jPBXsMrz4o"
2019-05-27 23:46:53,4 of 5 stars to The Boy Next Story by Tiffany Schmidt https://t.co/Ydj16dLmUc
2019-05-26 04:19:59,"On page 312 of 448 of The Boy Next Story, by Tiffany Schmidt https://t.co/0iDDHY5M9J"
2019-05-25 04:10:38,"On page 211 of 448 of The Boy Next Story, by Tiffany Schmidt https://t.co/0Q7TFV5b5P"
2019-05-14 00:08:43,"On page 128 of 496 of Finale, by Stephanie Garber: Oh, legend and jacks! https://t.co/VENTstmAlv"
2019-05-13 16:58:50,"On page 43 of 496 of Finale, by Stephanie Garber https://t.co/5nRh6c21Dk"
2019-05-12 03:27:51,4 of 5 stars to Every Last Word by Tamara Ireland Stone https://t.co/BItDROPLlZ
2019-05-11 21:19:35,"On page 241 of 368 of Every Last Word, by Tamara Ireland Stone https://t.co/GqYxYTstKs"
2019-05-09 03:39:54,"On page 41 of 368 of Every Last Word, by Tamara Ireland Stone https://t.co/kL6Uh7XfGZ"
2019-05-08 12:51:24,3 of 5 stars to The Glittering Court by Richelle Mead https://t.co/VhwNJf5Xn6
2019-04-26 17:37:28,"On page 130 of 393 of Tracked, by Jenny Martin https://t.co/fJNj1ffW3z"
2019-04-23 04:06:39,4 of 5 stars to Ugly Love by Colleen Hoover https://t.co/NnBTLpd5O4
2019-04-18 04:25:15,3 of 5 stars to Shutter by Laurie Faria Stolarz https://t.co/VBGkLXDCOI
2019-04-17 02:26:52,"On page 300 of 337 of Shutter, by Laurie Faria Stolarz https://t.co/PbtDdwEbiP"
2019-04-13 22:59:45,"On page 70 of 337 of Shutter, by Laurie Faria Stolarz: So far I'm interested. https://t.co/zklUF3AWgU"
2019-04-13 00:44:30,3 of 5 stars to My Life Undecided by Jessica Brody https://t.co/ja1pE07GYo
2019-04-12 02:31:38,"On page 152 of 320 of My Life Undecided, by Jessica Brody https://t.co/A7zdaqHRGX"
2019-04-11 02:54:31,3 of 5 stars to Shut Out by Kody Keplinger https://t.co/rQtkQfVVXq
2019-04-07 16:01:42,4 of 5 stars to The Glass Spare by Lauren DeStefano https://t.co/fqZ6Mc0yX2
2019-04-01 04:45:05,"On page 306 of 448 of The Hate U Give, by Angie Thomas https://t.co/2g9420IesE"
2019-03-31 17:50:27,.:Harry Potter:. Which wands did I get? (Round 4) https://t.co/E8gkYbGDIH on @bloglovin
2019-03-29 15:55:21,"On page 306 of 448 of The Hate U Give, by Angie Thomas https://t.co/ctXfPcAKki"
2019-03-28 01:24:10,"On page 255 of 448 of The Hate U Give, by Angie Thomas https://t.co/20VPZRU1Jj"
2019-03-26 15:31:19,"On page 120 of 448 of The Hate U Give, by Angie Thomas https://t.co/z1Pzj2cYyK"
2019-03-25 22:36:58,"On page 50 of 448 of The Hate U Give, by Angie Thomas https://t.co/qc2lhqPCMz"
2019-03-25 21:38:46,4 of 5 stars to The Deceivers by Kristen Simmons https://t.co/icuevdxouw
2019-03-25 16:51:04,Bookish Subscription Box: Owlcrate Unboxing March 2019 https://t.co/Y8Xk1RG6Cu on @bloglovin
2019-03-25 05:37:13,Cover Wars: Shadow of the Fox by Julie Kagawa https://t.co/WMV5kcjiBO on @bloglovin
2019-03-25 05:37:12,Bookish Subscription Box: Uppercase Unboxing March 2019 https://t.co/yqQXcdRhnu on @bloglovin
2019-03-14 03:52:48,"4 of 5 stars to Fame, Fate, and the First Kiss by Kasie West https://t.co/SjuiQDSk08"
2019-03-09 02:04:07,"On page 100 of 384 of Fame, Fate, and the First Kiss, by Kasie West https://t.co/7y8YZZgJfC"
2019-03-08 03:03:37,"On page 236 of 448 of The Assassin's Blade, by Sarah J. Maas https://t.co/Sj2ybyGfcf"
2019-02-25 01:44:36,"On page 236 of 448 of The Assassin's Blade, by Sarah J. Maas https://t.co/gLMNWmzP9Z"
2019-02-23 02:21:26,.:Harry Potter:. Which wands did I get? (Round 3) https://t.co/yDLzaj7FOU on @bloglovin
2019-02-22 19:51:26,Authors Signage (2) https://t.co/8ZKV9iBHDW on @bloglovin
2019-02-22 17:51:25,Bookish Subscription Box: Owlcrate Unboxing for February 2019 https://t.co/KFaBwA2QjS on @bloglovin
2019-02-21 19:07:29,3 of 5 stars to Elsewhere by Gabrielle Zevin https://t.co/LZDlllDa9X
2019-02-21 03:51:04,Bookish Subscription Box: Uppercase Unboxing for Feb 2019 https://t.co/80uzFZp1vS on @bloglovin
2019-02-21 01:51:04,-Harry Potter- Which wands did I get? (Round 2) https://t.co/NUmGAzDLRD on @bloglovin
2019-02-18 01:37:33,Book Tags: Main https://t.co/WKshaUTKq6 on @bloglovin
2019-02-18 01:37:33,.:HARRY POTTER:. Which wands did I get? (Round 1) https://t.co/Eq27wrvfwY on @bloglovin
2019-02-18 01:37:33,Merchandise Hauls: Main https://t.co/6FAnFhdpw0 on @bloglovin
2019-02-16 03:38:41,4 of 5 stars to Jesse's Girl by Miranda Kenneally https://t.co/b42VJ4bIkj
2019-02-13 19:19:31,4 of 5 stars to A Little Too Far by Lisa Desrochers https://t.co/h1tCbJj8QR
2019-02-13 02:14:41,"On page 112 of 302 of Jesse's Girl, by Miranda Kenneally https://t.co/PIsLrI4R3B"
2019-02-10 17:21:26,Top 8 favorite books of 2018 https://t.co/He5A9XLXq6 on @bloglovin
2019-02-09 17:21:26,Top 8 disappointing reads of 2018 https://t.co/2y8YDLMxWM on @bloglovin
2019-02-07 02:18:43,RT @MaskedSingerFOX: RETWEET if you're watching #TheMaskedSinger! 🙌 https://t.co/Wo0x8jBGOf
2019-02-02 23:51:04,Fun: They Call Me....Gamer https://t.co/tnKVNPl3sL on @bloglovin
2019-02-02 20:12:43,"RT @Alyssa_Susanna: New #diversereads giveaway! Follow me + RT to win a book from the stack, plus a surprise book! 💫  Open INT. Ends 02/04…"
2019-02-01 03:57:36,4 of 5 stars to The Cruel Prince by Holly Black https://t.co/EE7BNCSzd0
2019-01-28 23:21:26,Book Talk: Smoke by Ellen Hopkins https://t.co/SftV6gt369 on @bloglovin
2019-01-28 19:25:02,Bookish Subscription Box: Uppercase Jan 2019 Unboxing: https://t.co/ZpIhxYaVuq via @YouTube
2019-01-28 19:24:52,I added a video to a @YouTube playlist https://t.co/ZpIhxYswlY Bookish Subscription Box: Uppercase Jan 2019 Unboxing
2019-01-28 07:28:43,Bookish Subscription Box: Owlcrate Jan 2019 Unboxing: https://t.co/wjRd2X87aa via @YouTube
2019-01-28 05:58:35,I added a video to a @YouTube playlist https://t.co/wjRd2X87aa Bookish Subscription Box: Owlcrate Jan 2019 Unboxing
2019-01-28 04:41:38,"On page 270 of 370 of The Cruel Prince, by Holly Black https://t.co/SQAhzMUpSF"
2019-01-27 04:45:02,Book Haul: January 2019: https://t.co/o0Xs5LA9G7 via @YouTube
2019-01-27 00:22:03,Wrap-Ups: Main https://t.co/ZvbNEH9WCF on @bloglovin
2019-01-26 22:56:12,Bookish Subscription Box: Uppercase Unboxing for December 2018 https://t.co/jyZgGWgq46 on @bloglovin
2019-01-25 02:42:25,Top 8 disappointing reads of 2018: https://t.co/fe6qqUFyCu via @YouTube
2019-01-25 02:42:03,I added a video to a @YouTube playlist https://t.co/fe6qqUX9u2 Top 8 disappointing reads of 2018
2019-01-24 22:03:14,4 of 5 stars to Down Among the Sticks and Bones by Seanan McGuire https://t.co/h0KKHwpH5m
2019-01-24 04:44:25,"On page 178 of 370 of The Cruel Prince, by Holly Black: I'm liking Locke now https://t.co/dG5q89BUle"
2019-01-23 00:11:23,"On page 124 of 370 of The Cruel Prince, by Holly Black: Ok ..ok now we getting somewhere https://t.co/VTzLp8gPjB"
2019-01-23 00:08:06,top8of2018: https://t.co/l1YGwzgv6A via @YouTube
2019-01-23 00:07:51,I added a video to a @YouTube playlist https://t.co/l1YGwzgv6A top8of2018
2019-01-21 23:07:10,.:Harry Potter:. &amp; .:Nightmare Before Christmas:. Merchandise: https://t.co/6Y3NwiUqcy via @YouTube
2019-01-21 22:55:45,I added a video to a @YouTube playlist https://t.co/6Y3NwiCONY hpand nbxmasmerchandisehaul
2019-01-14 23:21:05,Book Talk: Rumble by Ellen Hopkins https://t.co/gWliKH27U4 on @bloglovin
2019-01-14 23:16:21,Book Talk: The Hazel Wood by Melissa Albert: https://t.co/MfCO77vqyo via @YouTube
2019-01-14 23:15:13,I added a video to a @YouTube playlist https://t.co/MfCO77vqyo Book Talk: The Hazel Wood by Melissa Albert
2019-01-14 19:02:21,3 of 5 stars to Ironside by Holly Black https://t.co/6gv52ia1fE
2019-01-13 05:55:58,.:Harry Potter:. Merchandise (and Nightmare before Christmas): https://t.co/f79LutVwp2 via @YouTube
2019-01-13 04:17:38,I added a video to a @YouTube playlist https://t.co/f79LutVwp2 .:Harry Potter:. Merchandise (and Nightmare before Christmas)
2019-01-12 22:03:48,Book Talk: Pride by Ibi Zoboi: https://t.co/XhYLmCwUu5 via @YouTube
2019-01-12 20:01:24,I added a video to a @YouTube playlist https://t.co/XhYLmCwUu5 Book Talk: Pride by Ibi Zoboi
2019-01-12 05:34:57,4 of 5 stars to Every Heart a Doorway by Seanan McGuire https://t.co/ODf24YWwCc
2019-01-08 16:52:22,Top Ten Tuesday: Anticipated reads for first half of 2019: https://t.co/JjUlZnGh1g via @YouTube
2019-01-08 16:39:25,I added a video to a @YouTube playlist https://t.co/JjUlZnGh1g Top Ten Tuesday: Anticipated reads for first half of 2019
2019-01-07 22:53:03,Book Talk: Burned by Ellen Hopkins https://t.co/FnwjrNZWni on @bloglovin
2019-01-07 03:01:55,Readathon: Bout of Books 24: https://t.co/7n6ZVZbdjd via @YouTube
2019-01-07 02:34:53,3 of 5 stars to The Hazel Wood by Melissa Albert https://t.co/pzbui2dJM0
2019-01-06 02:19:45,"On page 286 of 359 of The Hazel Wood, by Melissa Albert https://t.co/DEMMfsAF3G"
2019-01-05 22:43:27,3 of 5 stars to Pride by Ibi Zoboi https://t.co/3e4OKyLNQy
2019-01-03 22:53:04,Book Tag: To All The Boys I Loved Before https://t.co/RgYjGoYVLO on @bloglovin
2019-01-03 19:53:04,Book Talk: An Enchantment of Ravens by Margaret Rogerson https://t.co/5KK0Z3nLZa on @bloglovin
2019-01-02 21:53:04,Book Talk: Red Queen by Victoria Aveyard https://t.co/Y1I9hmdERl on @bloglovin
