timestamp,tweet_text
2016-08-09 07:54:59,Sharing with the group: End of July 2016: https://t.co/DrWm99BnmG via @YouTube
2016-08-09 04:51:44,tbrtimeaugust16: https://t.co/CcSWQy3YRB via @YouTube
2016-08-09 03:26:06,owlcratejulyunboxing16: https://t.co/vL8bNXdD4v via @YouTube
2016-08-09 02:46:34,litcubejuneunboxing: https://t.co/8mlW7EllxS via @YouTube
2016-08-08 17:33:58,Bookish Subscription Box: Lit Cube July 2016 Unboxing: https://t.co/D1L1VD3f3q via @YouTube
2016-08-08 15:03:24,"On page 254 of 345 of Rebel Belle, by Rachel Hawkins https://t.co/nxNHpCsL5s"
2016-08-05 14:40:51,"On page 155 of 345 of Rebel Belle, by Rachel Hawkins https://t.co/xrBNtEJuxs"
2016-08-03 03:53:39,"On page 193 of 330 of Harry Potter and the, by J.K. Rowling: The world changes and we ch... https://t.co/YCiuwLsuej"
2016-08-03 03:06:52,"On page 120 of 330 of Harry Potter and the, by J.K. Rowling: I love the antics the kids ... https://t.co/Ou5j2cZIp9"
2016-08-02 01:45:29,"On page 56 of 330 of Harry Potter and the, by J.K. Rowling: I keep getting interrupted w... https://t.co/oli9CmR2sg"
2016-08-01 23:31:50,"On page 45 of 330 of Harry Potter and the, by J.K. Rowling: diving in.... https://t.co/1ClE11IVND"
2016-08-01 21:20:49,I caved in and bought the Harry Potter book.
2016-08-01 01:53:37,Mini Book Review: Posioned Apples by Christine Hepperman https://t.co/7FEmpJGM0S on @bloglovin
2016-08-01 00:26:28,2 of 5 stars to Poisoned Apples by Christine Heppermann https://t.co/rXKpTzMeV8
2016-07-29 00:25:10,"On page 305 of 491 of My Lady Jane, by Cynthia Hand https://t.co/vHyYX5Q5b5"
2016-07-28 18:21:10,"On page 216 of 491 of My Lady Jane, by Cynthia Hand https://t.co/6SvgHghBH1"
2016-07-28 01:21:22,"On page 134 of 491 of My Lady Jane, by Cynthia Hand: I love that Jane is so bookish. https://t.co/y3Qhbv763P"
2016-07-26 18:59:15,"On page 24 of 491 of My Lady Jane, by Cynthia Hand https://t.co/qaVLaTUDto"
2016-07-25 21:27:54,"On page 389 of 489 of Blythewood, by Carol Goodman: it really didn't get interesting unt... https://t.co/QdRNpa7hFp"
2016-07-24 00:09:08,I'm at a lost right now so I'm just staring at my shelves
2016-07-23 22:27:57,RT @ThePaige_Turner: Cause y'all stuck around during my political rant...RT/Follow for a chance to win my ARC of Furthermore US ONLY https:…
2016-07-23 22:26:24,RT @ThePaige_Turner: Want to win this boxed set of Harry Potter books? RT + Follow for a chance to win! 📚✨ https://t.co/uBjv9GGBfB
2016-07-21 12:46:17,"On page 203 of 489 of Blythewood, by Carol Goodman: Meh.... https://t.co/4jUy7OBiKG"
2016-07-21 04:14:28,@Winterhavenbook thank you! I'm loving all the books. 😃📚 https://t.co/HDAsnkT5RL
2016-07-19 22:44:49,Sharing with the group: July again: https://t.co/OVLMJNG8og via @YouTube
2016-07-19 21:12:46,Sharing with the Group: July: https://t.co/psGTjy5fnK via @YouTube
2016-07-19 21:02:18,TBR Time: July 2016: https://t.co/nHgOzl2Kco via @YouTube
2016-07-19 17:47:49,Updates: Review Funk and other junk https://t.co/5dp1zFJJOa on @bloglovin
2016-07-19 17:47:49,Book Subscription Box: Unboxing for July 2016 https://t.co/pX1wA2S3dQ on @bloglovin
2016-07-19 16:21:29,Bookish Subscription Box: Uppercase Unboxing for July 2016: https://t.co/qBsT3bGu4S via @YouTube
2016-07-17 18:01:55,"On page 37 of 489 of Blythewood, by Carol Goodman: so far it's a bit slow https://t.co/OmZzdU6Nds"
2016-07-16 02:24:23,"Finished with The Heir and the Spare, by Emily Albright https://t.co/ENxNpNS2RA"
2016-07-15 03:40:41,"On page 165 of 288 of The Heir and the Spare, by Emily Albright https://t.co/lbLtQdgWZV"
2016-07-13 21:16:12,"On page 85 of 288 of The Heir and the Spare, by Emily Albright https://t.co/fMgO1BzvBp"
2016-07-13 00:01:12,Check out the #SummerofSailorScouts event &amp; win 2 Sailor Moon Funkos of your choice! #giveaway https://t.co/FxID6yEQj1
2016-07-12 23:35:02,I read Beautiful Disaster by Jamie McGuire https://t.co/BbveIeOYOT
2016-07-12 03:03:32,"On page 251 of 319 of Beautiful Disaster, by Jamie McGuire: bout time. https://t.co/edYwOz1lsq"
2016-07-11 03:32:01,"On page 205 of 319 of Beautiful Disaster, by Jamie McGuire: it does have disaster writte... https://t.co/ctrbpYXvQw"
2016-07-09 16:29:17,Check out the #SummerofSailorScouts event &amp; win 2 Sailor Moon Funkos of your choice! #giveaway https://t.co/FxID6yneUr
2016-07-08 20:58:55,"On page 80 of 319 of Beautiful Disaster, by Jamie McGuire: I'm getting whiplash just rea... https://t.co/4BJJOafnFR"
2016-07-05 20:58:22,"On page 258 of 336 of Every Other Day, by Jennifer Lynn Barnes https://t.co/9Cc9Vn1Qw5"
2016-07-02 23:44:55,Check out the #SummerofSailorScouts event &amp; win 2 Sailor Moon Funkos of your choice! #giveaway https://t.co/of4pZebpKA
2016-07-01 02:02:25,Bookish Challenge: LIL Bookish June: Wrap-Up https://t.co/RyVZLNOJ4w on @bloglovin
2016-06-30 23:18:40,"On page 81 of 336 of Every Other Day, by Jennifer Lynn Barnes https://t.co/BBBu6Ixg7L"
2016-06-29 05:32:00,"On page 325 of 446 of An Ember in the Ashes, by Sabaa Tahir: ohhh..these twists keep com... https://t.co/ZLxQ7f7U3K"
2016-06-29 04:29:53,"On page 270 of 446 of An Ember in the Ashes, by Sabaa Tahir: I'm hoping things turn out ... https://t.co/AwH3uxnuNS"
2016-06-29 01:46:21,"On page 202 of 446 of An Ember in the Ashes, by Sabaa Tahir: so the commandment is a B..... https://t.co/fXCxTypFgK"
2016-06-25 22:42:41,Bookish Challenge: LIL Bookish June: Beach TBR https://t.co/kNxdYHBbeT on @bloglovin
2016-06-25 01:50:17,"On page 101 of 252 of A Shot of Reckless, by Maddie Paige https://t.co/mBYBbEPVP4"
2016-06-21 15:58:49,@dljensen_ thanks for the opportunity
2016-06-21 15:57:59,RT @dljensen_: RT &amp; follow by Jun 27 to win a signed set of The Malediction Trilogy + swag! #international https://t.co/IC86zxIOEp
2016-06-20 00:58:40,Bookish Subscription Box: Owl crate unveiling for June '16: https://t.co/fQ1HvIf5kX via @YouTube
2016-06-19 22:22:33,Sharing with the Group: June: https://t.co/iboOKmaxQD via @YouTube
2016-06-19 21:02:18,Bookish Challenge: LIL Bookish June: Back Cover https://t.co/1StJAZeWty on @bloglovin
2016-06-19 20:43:10,Enter to #win a bundle of 12 Books for the Summer! #giveaway @Winterhavenbook https://t.co/mnoUPmtOb6
2016-06-18 15:02:42,Blog Tour and Giveaway: Break Me Like a Promise by Tiffany Schmidt https://t.co/IrisqxJyfK on @bloglovin
2016-06-17 16:02:36,Bookish Challenge: LIL Bookish June: First Line https://t.co/rwLDhBadX5 on @bloglovin
2016-06-15 02:37:45,Sharing with the Group: June: https://t.co/XHfnclULEN via @YouTube
2016-06-14 17:32:53,"34% done with Break Me Like a Promise, by Tiffany Schmidt: I love that it's set in Texas,... https://t.co/RWczdCgAH0"
2016-06-13 18:41:31,Book Tag: Marvel Characters: https://t.co/1PN8Her3os via @YouTube
2016-06-13 04:53:29,Book Tag: Bookish Scenarios: https://t.co/xcv3YS2X7q via @YouTube
2016-06-12 22:31:01,"21% done with Break Me Like a Promise, by Tiffany Schmidt: so far loving it https://t.co/az4IdAJNKj"
2016-06-12 11:01:40,Bookish Challenge: LIL Bookish June: Unpopular Opinion https://t.co/VT9saNYnCu on @bloglovin
2016-06-11 20:01:38,Book Challenge: LIL Bookish June: Favorite Mug https://t.co/iTLswFzThO on @bloglovin
2016-06-11 03:49:43,"On page 204 of 352 of 52 Reasons to Hate My, by Jessica Brody: I think I see a little bit... https://t.co/gb7RJg5dWg"
2016-06-10 23:42:45,"On page 165 of 352 of 52 Reasons to Hate My, by Jessica Brody: still a little bratty https://t.co/CPbx043soU"
2016-06-10 15:01:37,Bookish Challenge: LIL Bookish June: Book and a refreshing drink. https://t.co/BvXeRf4rS3 on @bloglovin
2016-06-10 00:31:42,Bookish Challenge: LIL Bookish June: Childhood Favorites https://t.co/Q5WQglTcMN on @bloglovin
2016-06-08 17:55:46,@hauntedsunshine I still want to read the second one too.
2016-06-08 16:01:21,Book Review: The Haunting of Sunshine Girl by Paige Mckenzie https://t.co/gFjT1S9qGv on @bloglovin
2016-06-08 15:49:14,I read The Haunting of Sunshine Girl by Paige McKenzie https://t.co/U3L7bjKIwZ
2016-06-08 02:01:40,Bookish Challenge: LIL Bookish June: Books &amp; Pjs https://t.co/5GG8nEhOdB on @bloglovin
2016-06-07 15:01:53,"On page 42 of 352 of 52 Reasons to Hate My, by Jessica Brody: yes, Lexi is a spoiled brat... https://t.co/0mQRpLYOxz"
2016-06-07 03:41:33,Bookish Challenge: LIL Bookish June: Books and Jewelry Dragon Style https://t.co/EopRQfOfMt on @bloglovin
2016-06-06 22:14:00,@Jkagawa @marimancusi https://t.co/EYSW4ehqbR
2016-06-06 16:11:23,Blog Tour and Giveaway: Ivory and Bone by Julie Eshbaugh https://t.co/OdUkpW65gd on @bloglovin
2016-06-06 02:41:35,Bookish Challenge: LIL Bookish June: Fandom Fun https://t.co/dfauba99cU on @bloglovin
2016-06-04 15:41:18,Bookish Challenge: LIL Bookish June: Book Tower https://t.co/UVg0KlyjtA on @bloglovin
2016-06-04 15:01:02,"64% done with Ivory and Bone, by Julie Eshbaugh: I'm trying to enjoy this but it's not lo... https://t.co/UEPwTM4v1V"
2016-06-04 00:41:18,Bookish Challenge: LIL Bookish June: Books &amp; Donuts https://t.co/njwFREUfqB on @bloglovin
2016-06-02 22:12:27,"42% done with Ivory and Bone, by Julie Eshbaugh https://t.co/HRYricKAPR"
2016-05-31 14:05:06,"16% done with Ivory and Bone, by Julie Eshbaugh: I'm not really feeling the story so far. https://t.co/PeEc84lGh3"
2016-05-31 08:09:04,Bookish Challenge: LIL's June Book Challenge https://t.co/KyjKoJ4eSd on @bloglovin
2016-05-28 15:51:47,"RT @StalkerMamma: GIMME, GIMME! WIN 12 young adult hardbacks &amp; more! via @ingrid_seymour  https://t.co/KHsmxokd0n https://t.co/wYZ9Lnm35z"
2016-05-27 22:11:02,@Wendy_Higgins https://t.co/Yx6fbfkg3A
2016-05-26 17:54:47,"On page 130 of 304 of Nerve, by Jeanne Ryan: the dares are getting interesting https://t.co/OhSzHsToyA"
2016-05-25 02:20:04,"On page 58 of 304 of Nerve, by Jeanne Ryan https://t.co/OXWbpbgSjF"
2016-05-22 22:32:45,This is what I look at when falling a sleep. #booknerd https://t.co/DBN5WI5NzO
2016-05-22 22:17:01,RT @Lost_in_Lit: Like taking bookish photos? Joining me and @Lostinlit_Becca for our June photo challenge!! 👉🏻https://t.co/RQdmXV545C https…
2016-05-22 19:42:40,Sharing with the Group: April 20: https://t.co/bgGXQv9qSb via @YouTube
2016-05-22 18:54:10,Bookish Subscription Box: Owlcrate Unvieling for May: https://t.co/F6tGKmOtDV via @YouTube
2016-05-22 18:09:39,Bookish Subscription Box: Owlcrate February Unvieling: https://t.co/gPS3MWvDd1 via @YouTube
2016-05-22 17:25:30,I read One by Sarah Crossan https://t.co/KSCHYufCbg
2016-05-22 16:19:55,Bookish Subscription Box: Uppercase Unvieling May: https://t.co/UTMzpLwYvf via @YouTube
2016-05-22 13:50:18,TBR TIme: May: https://t.co/xW18C17UmK via @YouTube
2016-05-22 02:35:12,Tag: 15 Weird Things About Me: https://t.co/5CGCpCQ98s via @YouTube
2016-05-21 23:41:17,"On page 70 of 400 of One, by Sarah Crossan https://t.co/IJu0fWcDU9"
2016-05-21 21:59:10,"On page 266 of 287 of Gena/Finn, by Hannah Moskowitz: This is sad...I'm not sure I'm liki... https://t.co/dW47i54C3M"
2016-05-21 21:35:36,Bookish Subscription Box: Owlcrate April Unvieling: https://t.co/fPwSm7GguU via @YouTube
2016-05-21 20:55:38,Book Subscription Box: Lit cube Unvieling for May: https://t.co/BQElQ5Jw3M via @YouTube
2016-05-21 18:43:50,Book Review: Titans by Victoria Scott: https://t.co/zyLXiafFAh via @YouTube
2016-05-21 15:46:44,Book Review: Hold Me Like a Breath by Tiffany Schmidt: https://t.co/NZUQ6DTdwA via @YouTube
2016-05-21 05:54:58,Book Review: Fire and Flood by Victoria Scott: https://t.co/wJKGPqfoWq via @YouTube
2016-05-21 02:57:54,"On page 188 of 287 of Gena/Finn, by Hannah Moskowitz: :( I don't like this..... https://t.co/8RgnRVT7bS"
2016-05-21 02:18:55,"On page 152 of 287 of Gena/Finn, by Hannah Moskowitz: I definitely feel like I can relate... https://t.co/DR5kehmiSR"
2016-05-20 22:26:44,"Enter for a chance to win the May #NOVLbox curated by @virgboecker, author of #TheWitchHunter! https://t.co/Y90zku9vpy"
2016-05-18 03:55:04,"On page 200 of 390 of Hold Me Like a Breath, by Tiffany Schmidt: I did not like what happ... https://t.co/MZPtS3WxXG"
2016-05-17 04:59:16,"On page 128 of 390 of Hold Me Like a Breath, by Tiffany Schmidt https://t.co/HmwGy0S9Au"
2016-05-16 06:25:21,TAG: 15 weird things about me tag https://t.co/NbRrT8Mc7s on @bloglovin
2016-05-15 19:53:54,"On page 20 of 390 of Hold Me Like a Breath, by Tiffany Schmidt https://t.co/nAt7qZ2s1a"
2016-05-15 05:55:13,Blog Tour and Video Interview: Spark by Holly Schindler https://t.co/egWJyDDhbF on @bloglovin
2016-05-14 23:02:37,Help me Win an Apple Macbook. Thanks to @andyneedham101 and @appzthatrock: Click here and thanks!  https://t.co/7hs2R9jOpl
2016-05-14 23:01:12,"On page 31 of 345 of Gena/Finn, by Hannah Moskowitz: I can tell this might get a bit conf... https://t.co/CnDYw08MhB"
2016-05-14 22:37:07,"I could win great prizes, now so could you! https://t.co/3jPqzOPdIB #WinGreatPrizes"
2016-05-14 22:36:05,Win an Apple Macbook. Thanks to @andyneedham101 and @appzthatrock: Click here and enter now! https://t.co/3jPqzOPdIB
2016-05-14 22:35:08,Enter to win a signed copy of The Raven Boys at @MelanieFoust 's blog: https://t.co/YsuuGTPdX2
2016-05-14 01:33:57,"On page 82 of 233 of Cryer's Cross, by Lisa McMann https://t.co/WG0Bkj8kOG"
2016-05-14 01:13:42,Powerless is now available in tradepaper! https://t.co/iC87Tjt5aT #yalit #Powerless #yareads https://t.co/bOCJKBSBdL
2016-05-13 21:55:47,Readathon: Bout of Books: Frightful Foto Fun https://t.co/QJqoTFJe3W on @bloglovin
2016-05-13 21:34:49,Take a look at other pics. https://t.co/wIu7Xu1Asx #freakyboutofbooks #boutofbooks https://t.co/95X8FN0o5k
2016-05-13 17:48:07,I read Spark by Holly Schindler https://t.co/wK6kgxARBN
2016-05-13 00:04:13,"On page 152 of 304 of Spark, by Holly Schindler https://t.co/pU0YfjFbpO"
2016-05-12 19:30:20,"RT @knoxdiver: RT/Follow to win a SIGNED arc of #MyLadyJane! US/CA only. Ends 12 am cst Sunday, May 15! https://t.co/voMoFCI9LP"
2016-05-12 19:30:14,@knoxdiver would love a chance to win
2016-05-12 19:27:56,RT @morganameridius: This book is so good you guys!!!!!! https://t.co/WcC6lUaycQ
2016-05-12 19:26:13,If you like the thrill of the game and the chase...then try Fire and Flood by @AuthorVScott #boutofbooks
2016-05-11 23:25:41,Readathon: Bout of Books: Five Fave Dresses on Covers https://t.co/6wv2MqNvJl on @bloglovin
2016-05-11 04:31:31,"On page 101 of 304 of Spark, by Holly Schindler https://t.co/cXQDxi3cRV"
2016-05-10 20:20:14,5 of 5 stars to Fire &amp; Flood by Victoria Scott https://t.co/NpRHxfXPCt
2016-05-10 18:12:40,Want to win 2 Copies of Powerless? I just entered to win and you can too. https://t.co/Rj9JeTI1mj
2016-05-09 20:38:27,"On page 254 of 320 of Fire &amp; Flood, by Victoria Scott https://t.co/u5tai8099q"
2016-05-09 18:25:21,Readathon: Bout of Books: This is me in 6 words https://t.co/cbwITjpDXP on @bloglovin
2016-05-09 16:36:19,"book hoarding, YA crazed, Texan chick #insixwords #boutofbooks"
2016-05-08 01:43:37,At Texas motorplex watch racing. American outlaws event. https://t.co/i1IKkcNRIx
2016-05-07 00:19:45,"On page 201 of 320 of Fire &amp; Flood, by Victoria Scott: oh....guy......tella... https://t.co/IC270vwrtp"
2016-05-06 17:52:26,"On page 153 of 320 of Fire &amp; Flood, by Victoria Scott: love it....I love the animal-ish a... https://t.co/4UspsCKVtE"
2016-05-04 18:54:22,Book Review: Lark by Tracey Porter https://t.co/2ZlAG9h120 on @bloglovin
2016-05-04 18:53:35,3 of 5 stars to Lark by Tracey Porter https://t.co/AwHOVoMp9L
2016-05-04 03:20:22,Kindle Deals (38) + Giveaway https://t.co/uT9rLWQQo6 on @bloglovin
2016-05-03 04:50:25,Top Ten Tuesday: Reminiscing about the childhood days https://t.co/SxKx01P5Nf on @bloglovin
2016-05-01 22:55:38,"65% done with Titans, by Victoria Scott: I love padlock and astrids bond. https://t.co/LHpq2XFx2E"
2016-05-01 19:50:30,Readathon: Bout of Books 2016: Main Spring Edition https://t.co/ECahYwl3cD on @bloglovin
2016-04-29 19:34:07,"33% done with Titans, by Victoria Scott: so far I'm enjoying it https://t.co/dK5Lu6fdI2"
2016-04-28 02:59:26,Bookish Subscription Box: Unveiling for the Uppercase April box: https://t.co/RmUe7SuBBA via @YouTube
2016-04-28 02:28:22,Bookish Subscription Box: Unvieling for the April Lit cube: https://t.co/scph1ysx6b via @YouTube
2016-04-26 04:39:36,"On page 177 of 295 of The Iron Trial, by Holly Black: I know it's been said that this is ... https://t.co/0Rs1EzixRc"
2016-04-17 15:37:43,Bookish Subscription Box: Owlcrate March Unvieling: https://t.co/yoTtWvLtnH via @YouTube
2016-04-17 05:53:27,Bookish Subscription Box: Lit Cube March Unvieling: https://t.co/boo6OV8lwA via @YouTube
2016-04-17 04:27:18,Book Subscription Box: Uppercase Unveiling for March: https://t.co/j9YlNWE8hi via @YouTube
2016-04-17 01:40:10,TBR TIme: April: https://t.co/daDpZhvzic via @YouTube
2016-04-16 04:41:06,"On page 94 of 147 of Neferet's Curse, by P.C. Cast: I'm not to sure what to think of this... https://t.co/AjiYepWTuA"
2016-04-15 03:18:35,"On page 295 of 336 of The Sin Eater’s Daughter, by Melinda Salisbury https://t.co/VuEeWd7EaN"
2016-04-14 01:56:18,I want to win a random bag filled with ARCs in Fiction Fare's Blogoversary Giveaway!  https://t.co/AgUyBIeDYc
2016-04-13 04:42:55,"On page 201 of 336 of The Sin Eater’s Daughter, by Melinda Salisbury: and now things get ... https://t.co/77fX1cemif"
2016-04-10 20:52:38,I Got: Modern Time. Quiz: Which Period in Literature Do You Belong?  https://t.co/Au0kkbwZrh
2016-04-08 06:07:19,Blog Tour: Dreamology by Lucy Keating https://t.co/i1T9PErYhL on @bloglovin
2016-04-06 04:51:26,Blog Tour: Trial by Fire byChris Cannon https://t.co/g1E6fj0n6j on @bloglovin
2016-04-03 21:30:09,I read The Haunting of Sunshine Girl by Paige McKenzie https://t.co/U3L7bjKIwZ
2016-04-02 23:13:22,"On page 184 of 267 of First &amp; Then, by Emma Mills: I was just starting to like ezra. https://t.co/u0XBSoojwx"
2016-04-02 22:16:24,"68% done with Dreamology, by Lucy Keating: I love the dreaming aspect of the book. https://t.co/xz8GvHnqvA"
2016-04-02 04:21:40,"40% done with Dreamology, by Lucy Keating https://t.co/Snd3adPSA3"
2016-03-31 01:52:28,The @ladyjanies are hosting Wendy Higgins in the #YASH! Come see and enter to win! https://t.co/eHOMS1p4tD https://t.co/nfx5qo8iQH
2016-03-30 21:17:18,"On page 32 of 267 of First &amp; Then, by Emma Mills: I can tell this will be a cute read. https://t.co/08jNu7aoAn"
2016-03-29 20:24:22,Blog Tour Excerpt and Review: Walk the Edge by Katie McGarry https://t.co/Wzs4iJCxbr on @bloglovin
2016-03-28 03:12:05,Book Review: Nowhere but Here by Katie McGarry https://t.co/T2Pk7zO5JW on @bloglovin
2016-03-28 01:27:34,Boredom at its finest. https://t.co/vGvkeWS3CJ
2016-03-28 00:27:34,4 of 5 stars to Nowhere But Here by Katie McGarry https://t.co/C6azPgD8ns
2016-03-27 01:44:07,...my books are what get me through these times though.
2016-03-27 01:43:45,At times I wish I had my own house/apt. It's hard to be happy in a place where there's always yelling for the pettiest stuff....
2016-03-27 01:41:16,-hates being sick-
2016-03-27 01:33:11,about to go see allegiant with the husband..I'm hoping it's better then what the critics are saying
2016-03-27 01:02:41,just started scanning my books in with the @libib app check my page out so far https://t.co/ixaX2zaagK join and follow me
2016-03-26 23:45:02,I'm playing WordBrain and I've just reached brain size 1032! #WordBrain  #words
2016-03-25 01:31:45,"On page 246 of 372 of The Fixer, by Jennifer Lynn Barnes https://t.co/3IdWePZSmh"
2016-03-25 00:38:12,I'm playing WordBrain and I've just reached brain size 816! #WordBrain  #words
2016-03-24 01:47:28,I’m the 4345000th person in the entire world to beat the Frog pack in WordBrain! #WordBrain #words
2016-03-23 03:57:18,"On page 150 of 372 of The Fixer, by Jennifer Lynn Barnes: I'm a bit intrigued now. https://t.co/iyIkARfZz7"
2016-03-21 03:41:18,4 of 5 stars to Four by Veronica Roth https://t.co/eEjyLmIyeI
2016-03-20 05:14:35,"On page 172 of 208 of Four, by Veronica Roth: enjoying these insights into our Tobias Eaton. https://t.co/VZDgBvMPNk"
2016-03-19 05:28:29,"On page 109 of 208 of Four, by Veronica Roth: it's okay to not be okay, ya know? -zeke https://t.co/dTvqOlGYil"
2016-03-19 04:27:11,"On page 50 of 208 of Four, by Veronica Roth: it's like falling in love with divergent all... https://t.co/M7uIqShsbI"
2016-03-17 05:04:54,"On page 500 of 526 of Allegiant, by Veronica Roth: this ending..I knew it would happen, b... https://t.co/pG3sohYTkF"
2016-03-16 22:00:03,"On page 400 of 526 of Allegiant, by Veronica Roth https://t.co/Obe6w88iz5"
2016-03-15 04:39:48,"On page 352 of 526 of Allegiant, by Veronica Roth: I don't know what to think of the bure... https://t.co/5uBXR90Pcm"
2016-03-15 02:12:30,"On page 257 of 526 of Allegiant, by Veronica Roth: finishing the series so I can see watc... https://t.co/A8pG3Zi2W7"
2016-03-11 19:09:20,Enter #AGatheringOfShadows @Veschwab #BlogTour + #Giveaway to #Win a ARC of AGOS @AliciaBatista1 @Torteen https://t.co/dtQxO3bA25
2016-03-11 00:19:19,Fun: Giveaway/Trade Books https://t.co/ujQLgbswCF on @bloglovin
2016-03-08 22:26:15,"On page 162 of 496 of Nowhere But Here, by Katie McGarry https://t.co/uyfDC74J3e"
2016-03-07 21:32:05,TBR Time: March https://t.co/a5SuQtzegp on @bloglovin
2016-03-07 17:16:42,I read Walk the Edge by Katie McGarry https://t.co/qei2wlv7cR
2016-03-07 03:50:11,"61% done with Walk the Edge, by Katie McGarry https://t.co/agsS1AnGBz"
2016-03-06 05:29:03,Sharing with the group: Week of 3-5-2016: https://t.co/NHlIuKPfLW via @YouTube
2016-03-06 03:21:57,TBR Time: March: https://t.co/Td5cLTjA6e via @YouTube
2016-03-06 01:56:48,Hero. Villain. Liar. Who's who? #WinkPoppyMidnight https://t.co/SPPci4nNtJ https://t.co/04oPf8OKFd
2016-03-06 01:55:32,Risk everything for freedom. Stop at nothing for love. #TheGlitteringCourt https://t.co/wfD6WsgE54  https://t.co/KQcSRUzOC6
2016-03-05 02:35:30,4 of 5 stars to Bluescreen by Dan Wells https://t.co/3V9Q8u4TdG
2016-02-29 02:33:36,New phone
2016-02-28 14:49:36,Giveaway: Leap into Books Hop https://t.co/JG8VbES6KW on @bloglovin
2016-02-28 06:19:19,Blog Tour and Review: Bluescreen by Dan Wells https://t.co/YT2PBasBvp on @bloglovin
2016-02-27 09:19:35,Blog Tour and Review: A Study in Charlotte by Brittany Cavallaro https://t.co/ilPsrJCFKq on @bloglovin
2016-02-26 07:49:16,Blog Tour and Review: Blood Passage by Heather Demetrios https://t.co/RzUmOoNSXf on @bloglovin
2016-02-26 02:49:17,BOok Subscription Box: Lit Cube Unveiling for February https://t.co/DRdDlLkGQq on @bloglovin
2016-02-26 02:19:41,Book Subscription Box: Uppercase Unveiling for February https://t.co/XsC9xiGspQ on @bloglovin
2016-02-22 03:45:21,LoveAThon: Book Spine Poetry https://t.co/woJYt4yQNz on @bloglovin
2016-02-22 03:15:16,LoveAThon: Mix and Match: Reading with Wine https://t.co/yn4TaFT2CQ on @bloglovin
2016-02-21 07:08:04,Blog Tour &amp; Review: Kingdom of Ashes by Rhiannon Thomas https://t.co/nqJllHXYIg on @bloglovin
2016-02-21 07:08:04,LoveAThon: Merry Meet Me https://t.co/p6cyc4RFmn on @bloglovin
2016-02-20 18:50:28,Enter the release day giveaway of Riders by Veronica Rossi at Stories &amp; Sweeties! https://t.co/mWqFt4HPaD
2016-02-20 04:38:19,Subscription Box: Uppercase February Unveiling: https://t.co/HVteYxfMjD via @YouTube
2016-02-20 04:35:36,Subscription Box: Lit Cube February Unveiling: https://t.co/dAflnj1mYb via @YouTube
2016-02-18 16:22:11,"50% done with A Study in Charlotte, by Brittany Cavallaro https://t.co/SWtyhhfLYm"
2016-02-10 22:06:31,"On page 150 of 288 of Sisters of Blood and Spirit, by Kady Cross https://t.co/856oTfJMGi"
2016-02-10 20:56:51,I read The Truth About Alice by Jennifer Mathieu https://t.co/N0uL0jqNk7
2016-02-10 19:12:54,Book Review: The Truth About Alice by Jennifer Mathieu https://t.co/BWxeJ6YD3O on @bloglovin
2016-02-10 04:49:07,"On page 11 of 288 of Sisters of Blood and Spirit, by Kady Cross https://t.co/4QceVoT2Yp"
2016-02-09 05:28:11,Top Ten Tuesday: Hearty Covers https://t.co/1EJR2dumms on @bloglovin
2016-02-04 23:30:44,I read Daughters Unto Devils by Amy Lukavics https://t.co/XJhkkZuL4n
2016-02-04 03:52:43,"15% done with Kingdom of Ashes, by Rhiannon Thomas https://t.co/Cr3VZ4VkwF"
2016-01-29 04:32:51,@WordsThatStay1 Julie started to spell it with a H because we were talking about how to spell your name. She said tell here I'm sorry.
2016-01-29 04:30:02,@WordsThatStay1 I got it just email me where I need to send it at ashleyjowens@gmail.com https://t.co/BnMSFTcoNw
2016-01-28 21:19:51,@WordsThatStay1 :) No problem.
2016-01-28 21:04:01,Raady for tonight's Event https://t.co/zhExSBH21O
2016-01-28 21:01:17,RT @OriginalFunko: RT &amp; follow @OriginalFunko for a chance to win a Deadpool box from @CollectorCorps! https://t.co/ZyzSM4e0Wb
2016-01-28 21:00:07,RT @OriginalFunko: RT &amp; follow @OriginalFunko for a chance to win a Quidditch Harry Potter Pop! https://t.co/rURf1BGB2k
2016-01-28 20:54:29,@WordsThatStay1 Looks like I will be getting the copy signed for you! What name would you like me to it signed to?
2016-01-28 19:19:35,Book Review Soundless by Richelle Mead https://t.co/tvxWuYC9ev on @bloglovin
2016-01-28 19:11:02,Giveaway: signing tonight and I will get Dumplin by Julie Murphy signed for the winner just leave me a comment here why you want to win
2016-01-28 18:57:29,3 of 5 stars to Soundless by Richelle Mead https://t.co/ZXAv3sF5QN
2016-01-28 18:11:21,"tell me why I should get it signed for you, and I'll pick a winner at 330p today. @ me or leave a comment on my site at bookaholicsanoynmous"
2016-01-28 18:10:08,"I'm going to a signing with Julie murphy, Jessica Brody, Jenny Martin, and Lori Goldstein. I have an extra copy of dumplin to get signed...."
2016-01-23 20:09:38,Sharing with the Group: The end of 2015 Haul https://t.co/c2QQPCLPsJ on @bloglovin
2016-01-23 19:29:55,Sharing with the group: December 2015: https://t.co/EqZtoUVKX7 via @YouTube
