timestamp,tweet_text
,"30 sumptin' delivered @34w3d (6-29-11) a healthy baby boy. IF, IUI, cerclage and preeclampsia. Never a dull moment here!!",
2019-11-09 18:49:46,"On page 30 of 192 of Gentle Ben, by Walt Morey https://t.co/SbF8MPj0Jb"
2019-11-02 04:01:40,"On page 20 of 192 of Gentle Ben, by Walt Morey https://t.co/pZ6ujEwaMr"
2019-10-31 14:14:05,"91% done with Bad Memory, by Lisa Gray https://t.co/8Ri72nedOy"
2019-10-29 19:11:34,"On page 14 of 192 of Gentle Ben, by Walt Morey https://t.co/ZNvIgom7GU"
2019-10-08 23:08:42,"On page 50 of 208 of Divide By One, by Steve Justice https://t.co/ZWc17WeZ2H"
2019-10-02 02:01:54,"On page 37 of 208 of Divide By One, by Steve Justice https://t.co/8KEHaj20GU"
2019-10-01 17:17:08,"57% done with The Secrets of Lost Stones, by Melissa Payne https://t.co/rCljQYMCSD"
2019-07-15 16:30:11,"On page 246 of 461 of Gray Mountain, by John Grisham https://t.co/BQAqvFJhW4"
2019-06-25 13:43:27,"80% done with The Woman in Our House, by Andrew Hart https://t.co/rxnhfeZ2MO"
2019-06-15 21:45:46,"16% done with Paper Wife, by Laila Ibrahim https://t.co/gv0EAaVxDN"
2019-05-09 15:18:16,"Starting Chasing Shadows, by Catherine Bybee https://t.co/nNgUjEqfV3"
2019-04-21 04:39:09,"25% done with No Niche Necessary, by Kristen Leigh King https://t.co/zqraOqCX7A"
2019-04-19 17:59:35,"56% done with What the Wind Knows, by Amy Harmon https://t.co/625wJevTNT"
2019-04-07 22:05:28,"50% done with Winter Cottage, by Mary Ellen Taylor https://t.co/OcxSjOPID9"
2019-03-21 02:55:36,"14% done with Zero Sum, by Barry Eisler https://t.co/NatcKzhpGz"
2019-03-08 00:51:03,"38% done with The Detachment, by Barry Eisler https://t.co/vwBREQWdfF"
2019-03-07 14:35:07,"Starting The Detachment, by Barry Eisler https://t.co/tu6fYIMbAa"
2019-02-20 05:02:04,"49% done with A Clean Kill in Tokyo, by Barry Eisler https://t.co/KB8vhhh9nX"
2019-02-13 20:13:15,"On page 50 of 401 of The Killer Collective, by Barry Eisler https://t.co/TE3aj0zVax"
2019-02-13 20:13:14,"On page 50 of 401 of The Killer Collective, by Barry Eisler https://t.co/IldiUzT642"
2019-01-30 16:10:44,"90% done with Dark of the Moon, by John Sandford https://t.co/IlXVFX8b8V"
2019-01-29 01:28:09,"On page 38 of 160 of Just Open the Door - Bible Study Book, by Jen Schmidt https://t.co/Kd9LlDidF1"
2018-12-31 18:00:06,"88% done with Winter Loon, by Susan Bernhard https://t.co/YymhYpxdhY"
2018-10-27 22:57:40,"89% done with A Killer's Mind, by Mike Omer https://t.co/1waXRGp1JG"
2018-07-18 13:58:35,"On page 215 of 352 of No One Ever Asked, by Katie Ganshert https://t.co/kRBx4yivd1"
2018-07-16 18:39:48,"On page 198 of 352 of No One Ever Asked, by Katie Ganshert https://t.co/PWBxZclWLS"
2018-07-16 15:45:02,"On page 83 of 352 of No One Ever Asked, by Katie Ganshert https://t.co/Yo2E2rATZr"
2018-07-13 19:35:52,"20% done with The Last Thing She Ever Did, by Gregg Olsen https://t.co/jRIwMgGoL6"
2018-06-25 20:02:24,"25% done with Twist of Faith, by Ellen J. Green https://t.co/BHHFlh674u"
2018-05-29 15:28:57,"On page 25 of 304 of Born a Crime, by Trevor Noah https://t.co/oBDHgge6rb"
2018-03-25 18:54:07,"15% done with Married by Monday, by Catherine Bybee https://t.co/oIYcUbFly6"
2018-03-25 18:54:07,"15% done with Married by Monday, by Catherine Bybee https://t.co/TTwcIINzVE"
2018-03-25 18:54:07,"15% done with Married by Monday, by Catherine Bybee https://t.co/KzKdfragG5"
2018-03-24 00:12:27,"Starting The Cleaner, by Mark Dawson https://t.co/2LJtsxezam"
2017-12-21 15:59:53,"96% done with Blood on the Tracks, by Barbara Nickless https://t.co/wRBZL9WUXY"
2017-10-07 13:13:41,"43% done with A Dark Lure, by Loreth Anne White https://t.co/H5urP9mDsq"
2017-08-25 14:00:00,"90% done with The Saturday Evening Girls Club, by Jane Healey https://t.co/wmmjczDjoi"
2017-08-07 15:37:11,"65% done with A Merciful Death, by Kendra Elliot https://t.co/hDPMNKmZJd"
2017-07-20 17:03:53,"75% done with Island of Glass, by Nora Roberts https://t.co/PVjZhj8YSK"
2017-07-17 16:35:47,"50% done with Island of Glass, by Nora Roberts https://t.co/OIHrD7IezS"
2017-07-06 16:40:35,"On page 250 of 266 of Brain on Fire, by Susannah Cahalan https://t.co/gTSLQJpEpP"
2017-07-01 02:01:26,"On page 150 of 266 of Brain on Fire, by Susannah Cahalan https://t.co/jLe8AVahRV"
2017-06-28 04:27:45,"On page 82 of 266 of Brain on Fire, by Susannah Cahalan https://t.co/AE70T1OyHy"
2017-06-23 04:37:14,"77% done with Written in Fire, by Marcus Sakey https://t.co/kJdPKuDCmr"
2017-06-16 14:04:12,"Starting Written in Fire, by Marcus Sakey https://t.co/XqO6Hroal1"
2017-06-15 19:49:11,"80% done with A Better World, by Marcus Sakey https://t.co/XMa7cHvMzZ"
2017-06-15 02:42:26,"44% done with A Better World, by Marcus Sakey https://t.co/4umnGGK8wV"
2017-06-12 08:44:09,"62% done with Brilliance, by Marcus Sakey https://t.co/fWk59R3q0i"
2017-05-10 13:58:26,"74% done with The Tea Planter's Daughter (Tyneside Sagas #1), by Janet MacLeod Trotter https://t.co/G8phlaTK5t"
2017-05-02 16:20:08,"On page 25 of 333 of Ask Him Why, by Catherine Ryan Hyde https://t.co/PGzBoeRWqK"
2017-04-27 16:29:26,"25% done with In Order to Live, by Yeonmi Park https://t.co/YpetfUAWS5"
2017-04-11 16:09:18,"80% done with Memory Man, by David Baldacci https://t.co/6toeacGnXe"
2017-03-08 20:47:24,"56% done with Dumplin', by Julie Murphy https://t.co/WghMLwvlWQ"
2017-01-28 20:38:41,"37% done with The Trapped Girl, by Robert Dugoni https://t.co/cPfv2y5zkX"
2017-01-18 10:44:49,"Starting The Chemist, by Stephenie Meyer https://t.co/GYKNzgxeaR"
2017-01-03 03:56:31,"On page 25 of 256 of Virgins, by Diana Gabaldon https://t.co/E0766z8qGP"
2016-12-27 23:08:07,"On page 2 of 256 of Virgins, by Diana Gabaldon https://t.co/QEjmm9nKTX"
2016-11-22 20:02:56,"Starting Turn to Me, by Tiffany Snow https://t.co/j6LU40Ow5B"
2016-11-16 14:41:15,"64% done with Follow Me, by Tiffany Snow https://t.co/VBjkoyTM4c"
2016-11-10 15:21:16,"48% done with The 7th Canon, by Robert Dugoni: I can not get into this book https://t.co/F5mnUtVaWf"
2016-11-04 13:46:38,"85% done with The Wrong Side of Goodbye, by Michael Connelly https://t.co/TzG4qqYCae"
2016-10-20 22:56:01,"96% done with The Last Woman Standing, by Thelma Adams https://t.co/YzrR4dyHBJ"
2016-10-16 14:21:01,"33% done with The Last Woman Standing, by Thelma Adams https://t.co/s3vuTSdag0"
2016-10-15 15:59:47,"85% done with Small Great Things, by Jodi Picoult https://t.co/PhvEz9bEnP"
2016-10-12 23:52:17,"On page 65 of 240 of Through the Eyes of a Lion, by Levi Lusko https://t.co/2b4q6kuTY7"
2016-10-03 14:14:18,"49% done with Pretty Dead, by Anne Frasier https://t.co/malDJUMjNQ"
2016-10-01 19:17:44,"30% done with Pretty Dead, by Anne Frasier https://t.co/sIoIR51i6k"
2016-09-30 05:20:03,"Starting Pretty Dead, by Anne Frasier https://t.co/YPVmnL9Xu6"
2016-09-29 13:19:49,"53% done with Stay Dead, by Anne Frasier https://t.co/rHxNmddNst"
2016-09-15 13:34:26,"On page 30 of 240 of Through the Eyes of a Lion, by Levi Lusko https://t.co/WHgDHbed4D"
2016-09-14 14:07:48,"26% done with The Gilded Hour, by Sara Donati https://t.co/GRPm1UQMTr"
2016-09-11 11:17:19,"75% done with The Buried Book, by D.M. Pulley https://t.co/i1gXMfyLDW"
2016-09-06 17:48:53,"39% done with Pillsbury Crossing, by Donna Mabry https://t.co/7csocoMuSF"
2016-09-06 00:17:27,"68% done with Targeted, by Kendra Elliot https://t.co/EqWoiE2CEo"
2016-09-02 01:15:19,"53% done with Everything We Keep, by Kerry Lonsdale https://t.co/bZ1Fwpgo3m"
2016-08-22 13:40:46,"72% done with Wedding Cake and Big Mistakes, by Nancy Naigle https://t.co/Vzq4j5p7bI"
2016-08-18 12:47:44,"93% done with Out of Focus, by Nancy Naigle https://t.co/zCG2QFdcXJ"
2016-07-24 13:06:10,"85% done with Anna Karenina, by Leo Tolstoy: Sooooo loong. LOL https://t.co/QscU6kzD3C"
2016-07-08 15:57:24,"10% done with Song of the Spirits, by Sarah Lark https://t.co/XMpH4IdCHI"
2016-07-07 22:08:58,"On page 322 of 496 of When We Were Sisters, by Emilie Richards https://t.co/X5LuXsd3qB"
2016-07-05 21:37:54,"63% done with In the Land of the Long White Cloud, by Sarah Lark https://t.co/aaErrynrz0"
2016-06-27 04:18:19,"75% done with Jessica, by Donna Mabry https://t.co/88DiuEu840"
2016-06-25 14:56:16,"Starting In the Land of the Long White Cloud, by Sarah Lark https://t.co/PMjB7zEo56"
2016-06-23 21:59:31,"54% done with Worth the Trouble, by Jamie Beck https://t.co/0Rds3F2AvK"
2016-06-16 17:00:09,"49% done with Worth the Wait, by Jamie Beck https://t.co/NHDZxK2EsS"
2016-06-14 04:48:13,"67% done with Evil Never Dies, by T.R. Ragan https://t.co/kTn9lorJDP"
2016-06-06 16:13:19,"18% done with Obsessed, by T.R. Ragan https://t.co/HJXezOWssU"
2016-05-31 23:46:07,"99% done with Dead Weight, by T.R. Ragan https://t.co/ZcE0vNX6e5"
2016-05-30 14:33:03,"12% done with Dead Weight, by T.R. Ragan https://t.co/RZobZY3IYb"
2016-05-28 13:58:26,"22% done with Abducted, by T.R. Ragan https://t.co/JDZSLq4avn"
2016-05-27 11:43:25,"50% done with The Handmaid's Tale, by Margaret Atwood: Oy. This book is kind of frighten... https://t.co/UINutpzxM3"
2016-05-27 02:36:55,"49% done with The Handmaid's Tale, by Margaret Atwood https://t.co/3b1RFZ0uV1"
2016-05-24 03:54:46,"7% done with The Billionaire's Touch, by J.S. Scott https://t.co/IOAMsLoB1k"
2016-05-23 19:26:51,"79% done with The Forbidden Billionaire, by J.S. Scott https://t.co/q7rXmymYpb"
2016-05-18 17:19:58,"46% done with No Ordinary Billionaire, by J.S. Scott https://t.co/D3fGcnC7bt"
2016-05-17 00:52:05,"94% done with Maude, by Donna Mabry https://t.co/2ZQTBmam7E"
2016-05-14 18:32:13,"76% done with Maude, by Donna Mabry https://t.co/cv95OFY5D8"
2016-05-01 01:40:24,"On page 286 of 400 of Who Do You Love, by Jennifer Weiner https://t.co/JYhLsRu2bo"
2016-04-22 08:15:09,"80% done with The Rumor, by Elin Hilderbrand https://t.co/rM0u0TGxIy"
2016-04-21 21:45:42,"20% done with The Rumor, by Elin Hilderbrand https://t.co/mZJy2HMHgC"
2016-04-02 20:51:02,"15% done with Queen of Swords, by Sara Donati: Great so far!!! Headed to 1814 Pensacola!! https://t.co/QSlQCu6hTK"
2016-03-15 13:27:41,"75% done with Into the Wilderness, by Sara Donati https://t.co/0W50NGE28H"
2016-03-09 23:52:43,"28% done with Into the Wilderness, by Sara Donati https://t.co/kZb4EvXXjl"
2016-01-21 14:00:58,"62% done with Dragonfly in Amber, by Diana Gabaldon https://t.co/N0AKHz4ZoJ"
2016-01-20 16:07:51,"47% done with Dragonfly in Amber, by Diana Gabaldon https://t.co/cu5bVxb24a"
2016-01-20 03:35:41,"On page 9 of 486 of The Science of Good, by Cook's Illustrated: lordy I don't have time t... https://t.co/XVjNC0RYbB"
2016-01-19 18:55:04,"37% done with Dragonfly in Amber, by Diana Gabaldon: Listening at 1.25 and 1.5 speed and ... https://t.co/Emc84C5Dx4"
2016-01-15 19:05:46,"Starting Dragonfly in Amber, by Diana Gabaldon: Time to read before the new season. Lest... https://t.co/3qFooxdEyx"
2016-01-12 23:49:51,"17% done with The Paradise of Glass, by Petra Durst-Benning https://t.co/fAagxiLA4q"
2016-01-12 19:54:51,"8% done with The Paradise of Glass, by Petra Durst-Benning https://t.co/qBsuMP3cz5"
2016-01-07 18:20:30,"11% done with The American Lady, by Petra Durst-Benning https://t.co/0f2yQ7WmpT"
2016-01-06 16:41:08,"36% done with The Glassblower, by Petra Durst-Benning https://t.co/ddHlbw8LpX"
2016-01-03 04:54:27,"Reading Ugly Young Thing, by Jennifer Jaynes: I just finished Ugly Young Thing (Strangers... https://t.co/BAxCFDq8lm"
2016-01-02 23:14:24,"On page 9 of 486 of The Science of Good Cooking, by Cook's Illustrated Magazine https://t.co/UaF6xDxsu1"
2016-01-02 00:04:21,"17% done with Sugar, by Deirdre Riordan Hall https://t.co/9DeA9L2WjK"
2015-12-18 21:41:13,"35% done with Ugly Young Thing, by Jennifer Jaynes https://t.co/h0zqOMBcGx"
2015-12-16 20:37:15,"87% done with The Midwife's Revolt, by Jodi Daynard https://t.co/5undsxSStO"
2015-12-16 14:26:32,"40% done with The Midwife's Revolt, by Jodi Daynard https://t.co/lZUKg7WCor"
2015-12-15 14:33:28,"6% done with The Midwife's Revolt, by Jodi Daynard https://t.co/sJQiZTS6kR"
2015-12-11 15:16:33,"77% done with The Good Neighbor, by A.J. Banner https://t.co/Wve3QV6oa4"
2015-12-10 01:10:46,"On page 22 of 224 of Shattered Dreams, by Larry Crabb https://t.co/YMW1vctLZJ"
2015-11-30 19:18:48,"On page 53 of 448 of The Keeper, by David Baldacci https://t.co/xuVXZZUzQm"
2015-11-08 15:16:58,"Reading Her Final Breath, by Robert Dugoni: I just finished Her Final Breath (The Tracy C... https://t.co/yOTvUH3GFe"
2015-10-23 14:56:39,"12% done with Her Final Breath, by Robert Dugoni https://t.co/PHNUfpkasF"
2015-10-17 23:40:42,"Starting Her Final Breath, by Robert Dugoni https://t.co/RsFMZeZcrq"
2015-10-17 20:37:33,"On page 270 of 326 of Younger, by Suzanne Munshower https://t.co/RYtTABjxye"
2015-10-14 18:51:23,"On page 50 of 497 of The Finisher, by David Baldacci https://t.co/umGmGLsPni"
2015-10-09 15:37:32,"2% done with Faking It, by Elisa Lorello: Not a book I would have normally considered, but... http://t.co/yZge3UnS5s"
2015-10-08 03:02:09,"80% done with The Martian, by Andy Weir http://t.co/aorKp8fWTL"
2015-09-29 06:15:44,"2% done with Faking It, by Elisa Lorello http://t.co/4dnwGilL4O"
2015-09-28 12:59:55,"99% done with Olivay, by Deborah Reed http://t.co/1GYBITcyCz"
2015-09-22 14:23:25,"51% done with Olivay, by Deborah Reed http://t.co/hQejQ8vDnv"
2015-09-08 15:34:39,"Starting The Girl in the Spider's, by David Lagercrantz: SO EXCITED ABOUT THIS BOOK!! http://t.co/rXszpOSkjA"
2015-09-03 15:35:20,"8% done with Olivay, by Deborah Reed http://t.co/sNYNaZN5t9"
2015-09-01 13:27:19,"50% done with The Secret Place, by Tana French http://t.co/mbVfZIKmqM"
2015-08-26 05:17:19,"14% done with Twenty-Eight and a Half Wishes, by Denise Grover Swank http://t.co/k3TZ9RYhnQ"
2015-08-22 22:31:24,"Reading Cold Moon, by Alexandra Sokoloff: I just finished Cold Moon (The Huntress/FBI Thri... http://t.co/l2eNliVaYJ"
2015-08-22 15:19:02,"85% done with Cold Moon, by Alexandra Sokoloff http://t.co/6Q1AOomwvX"
2015-08-21 06:34:47,"36% done with Cold Moon, by Alexandra Sokoloff http://t.co/SUGCVUsJoh"
2015-08-18 16:45:03,"Reading Angry Birds Playground, by Jill Esbaum: I just finished Angry Birds Playground: Di... http://t.co/3zwMLyhORn"
2015-08-18 16:45:03,"Finished with Angry Birds Playground, by Jill Esbaum http://t.co/jiuWn2P3Y7"
2015-08-18 14:51:58,"33% done with Blood Moon, by Alexandra Sokoloff http://t.co/4FapMpSeg7"
2015-08-17 02:00:42,"27% done with Blood Moon, by Alexandra Sokoloff http://t.co/TjTfTtQRa2"
2015-08-16 03:47:27,"Reading Huntress Moon, by Alexandra Sokoloff: I just finished Huntress Moon (The Huntress/... http://t.co/t7ktuv8ka7"
2015-08-16 00:58:13,"77% done with Huntress Moon, by Alexandra Sokoloff http://t.co/Lz3e2ligtw"
2015-08-15 14:03:41,"71% done with Huntress Moon, by Alexandra Sokoloff http://t.co/dANEk3fRLz"
2015-08-14 13:33:18,"30% done with Huntress Moon, by Alexandra Sokoloff http://t.co/BV893PacCL"
2015-08-12 14:31:53,"84% done with Beautiful Broken Promises, by Kimberly Lauren http://t.co/70pRZzYhgV"
2015-08-12 01:02:54,"58% done with Beautiful Broken Promises, by Kimberly Lauren http://t.co/BToxhoVvlm"
2015-08-10 15:40:44,"63% done with Beautiful Broken Mess, by Kimberly Lauren http://t.co/dyRhYhf2Aa"
2015-08-09 07:52:50,"Reading Beautiful Broken Rules, by Kimberly Lauren: I just finished Beautiful Broken Rules... http://t.co/qLNK9s9QI3"
2015-08-07 04:07:26,"Reading The One That Got Away, by Simon Wood: I just finished The One That Got Away and ga... http://t.co/VeeHrok9a7"
2015-08-07 03:32:37,"84% done with The One That Got Away, by Simon Wood http://t.co/C0ZDGGWMpB"
2015-08-06 01:46:35,"35% done with The One That Got Away, by Simon Wood http://t.co/99BhirgrsT"
2015-08-05 00:12:25,"74% done with My Sister's Grave, by Robert Dugoni http://t.co/xctFEk5mG0"
2015-08-04 16:00:36,"39% done with My Sister's Grave, by Robert Dugoni http://t.co/Z410k84rRc"
2015-08-03 21:50:26,"2% done with My Sister's Grave, by Robert Dugoni http://t.co/E7FtPdiSoO"
2015-08-03 20:26:23,"89% done with The Mermaid's Sister, by Carrie Anne Noble http://t.co/7M0M2M0lCw"
2015-08-01 17:29:44,"62% done with Sincerely, Carter, by Whitney Gracia Williams http://t.co/AtJAgD4eyB"
2015-07-31 21:22:56,"35% done with The Great American Cast Iron Cookbook, by Rachael Eddins http://t.co/WyjapQzhlM"
2015-07-30 21:02:36,"14% done with Sincerely, Carter, by Whitney Gracia Williams http://t.co/rlKtjPKPIP"
2015-07-29 19:06:35,"72% done with What She Left Behind, by Ellen Marie Wiseman http://t.co/EClJ9QZezL"
2015-07-14 14:33:02,"46% done with Bridged, by Kendra Elliot http://t.co/8totMPj1Fq"
2015-07-08 20:01:54,"26% done with Vanished, by Kendra Elliot http://t.co/RLQqPMCPVV"
2015-07-08 05:17:52,"Reading Twisted, by Andrew E. Kaufman: I just finished Twisted and gave it stars. http://t.co/tJtuwk6RoV"
2015-07-08 00:58:00,"89% done with Twisted, by Andrew E. Kaufman http://t.co/GZ2RsrrdtO"
2015-07-07 23:05:51,"72% done with Twisted, by Andrew E. Kaufman http://t.co/2xA02LcFWk"
2015-07-07 14:12:50,"24% done with Twisted, by Andrew E. Kaufman http://t.co/JfjBH4xDW4"
2015-07-06 22:44:30,"2% done with Vanished, by Kendra Elliot http://t.co/s4WpXg3A4W"
2015-07-06 13:35:56,"54% done with Almost Like Love, by Abigail Strom http://t.co/iwpCfRQXZ0"
2015-07-05 19:05:05,"15% done with Almost Like Love, by Abigail Strom http://t.co/Rqa49qLWd7"
2015-07-05 18:07:38,"Starting Almost Like Love, by Abigail Strom http://t.co/NIi0YLykw3"
2015-07-04 14:09:01,"69% done with Wreckage, by Emily Bleeker http://t.co/SJvGipqWSK"
2015-07-04 00:35:32,"33% done with Wreckage, by Emily Bleeker http://t.co/ZxTzql4Gy3"
2015-07-03 17:06:25,"11% done with Sincerely, Carter, by Whitney Gracia Williams http://t.co/5MGnXJ1TGh"
2015-07-01 04:10:39,"89% done with Twelve Years a Slave, by Solomon Northup http://t.co/tfQWzqbGdz"
2015-07-01 03:07:22,"74% done with Twelve Years a Slave, by Solomon Northup http://t.co/CwC3zxs5aY"
2015-06-26 23:03:05,"35% done with Twelve Years a Slave, by Solomon Northup http://t.co/1cqYwfMNVF"
2015-06-26 22:17:27,"23% done with Twelve Years a Slave, by Solomon Northup http://t.co/CQtzHavBhB"
2015-06-26 20:12:18,"4% done with Twelve Years a Slave, by Solomon Northup http://t.co/Fiy03ZNQ7S"
2015-06-24 19:26:59,"58% done with Trail of Broken Wings, by Sejal Badani: So so good. Bringing out emotions. http://t.co/I8doyvT1Rg"
2015-06-23 03:09:07,"13% done with Trail of Broken Wings, by Sejal Badani http://t.co/bJ2F8vEl9s"
2015-06-22 16:56:07,"13% done with Trail of Broken Wings, by Sejal Badani http://t.co/vqP6qzNE8Z"
2015-06-21 13:24:51,"Starting Trail of Broken Wings, by Sejal Badani http://t.co/1bjjU3iXgW"
2015-06-20 09:16:30,"90% done with The Last Town, by Blake Crouch http://t.co/X5YhmJ4TL3"
2015-06-19 20:32:34,"79% done with The Last Town, by Blake Crouch http://t.co/iZnB39Qn0f"
2015-06-18 17:48:54,"Starting The Last Town #3, by Stephen Knight http://t.co/rnxU8ExpJB"
2015-05-01 15:59:08,"Starting When a Child is Born, by Jodi Taylor http://t.co/xLB8HcW1y5"
2015-04-23 14:11:02,"10% done with A Desperate Fortune, by Susanna Kearsley http://t.co/n0s5NNOvJ8"
2015-02-27 02:13:58,"75% done with Echo Burning, by Lee Child http://t.co/48u2X7sXvi"
2015-02-22 20:57:53,"15% done with The Talented Mr. Ripley, by Patricia Highsmith: Ugh. Couldn't get into it. ... http://t.co/6bcU0wKcsZ"
2015-02-22 05:35:59,"58% done with Running Blind, by Lee Child http://t.co/QwOlkXullS"
2014-12-31 12:46:35,"90% done with Bad Blood, by John Sandford http://t.co/ytH2WZSEeS"
2014-12-07 09:33:39,"90% done with Bad Blood, by John Sandford http://t.co/csp0JRm76F"
2014-11-20 20:01:46,"On page 80 of 473 of Unbroken, by Laura Hillenbrand: Amazing. Just amazing. http://t.co/Afug82rQSD"
2014-11-12 06:54:57,"75% done with Night Road, by Kristin Hannah http://t.co/clYndOq2mZ"
2014-11-05 00:45:32,"80% done with What Alice Forgot, by Liane Moriarty: So good http://t.co/PKBKruUuXk"
2014-11-01 03:15:47,"25% done with A Symphony of Echoes, by Jodi Taylor http://t.co/eRybjzAXbw"
2014-11-01 03:15:47,"25% done with A Symphony of Echoes, by Jodi Taylor http://t.co/X81vi7I9ak"
2014-10-30 22:51:41,"50% done with Just One Damned Thing After Another, by Jodi Taylor http://t.co/yhYsgyqDUz"
2014-10-30 22:01:54,"50% done with Just One Damned Thing After Another, by Jodi Taylor http://t.co/vpklffekQB"
2014-10-24 18:22:00,"75% done with All the Light We Cannot See, by Anthony Doerr http://t.co/nKXtM7JUvb"
2014-09-09 14:53:57,"50% done with The Hundred-Foot Journey, by Richard C. Morais: This book is making me hungry. http://t.co/AKk8AGHiy9"
2014-08-28 04:09:16,"60% done with The Silkworm, by Robert Galbraith http://t.co/J3A3Z77V5A"
2014-08-26 20:30:17,"50% done with The Silkworm, by Robert Galbraith http://t.co/g5PtnOW952"
2014-08-21 04:24:34,"75% done with The Midwife's Confession, by Diane Chamberlain: So good http://t.co/UWYPWMlTqw"
2014-08-17 23:53:11,"25% done with Attachments, by Rainbow Rowell http://t.co/9r0ziGdAmo"
2014-08-15 16:22:11,"75% done with Mr. Mercedes, by Stephen King http://t.co/ARe1uNkaM1"
2014-08-13 15:24:21,"40% done with Mr. Mercedes, by Stephen King http://t.co/g6xnowSIiL"
2014-08-12 20:27:09,"20% done with Iron Lake, by William Kent Krueger http://t.co/hwbOHHWG9X"
2014-08-06 01:34:13,"46% done with The Space Between, by Diana Gabaldon http://t.co/aQ4qoWFiW7"
2014-07-30 14:31:28,"60% done with Fangirl, by Rainbow Rowell http://t.co/LynBCDBCJ8"
2014-07-09 07:02:42,@Anlaknits hi!!!!!!
2014-07-09 07:02:17,@meiermadness cooking kale!!!
2014-07-01 22:32:43,RT @AIMatMelanoma: Perhaps the Ellen Show would appreciate some photos about the real suffering caused by a sunburn. http://t.co/8KI5IfYwed
2014-07-01 22:32:30,RT @TeamBluebird: . @TheEllenShow hoping you’re planning on dropping “funny” sunburn segment. #melanoma kills. Sunburns are no joking matte…
2014-06-24 13:21:49,"10% done with Fangirl, by Rainbow Rowell http://t.co/d2fC1eT19S"
2014-06-19 22:28:49,"96% done with Written in My Own Heart's Blood, by Diana Gabaldon http://t.co/g2FE5tscuD"
2014-06-18 14:47:45,"80% done with Written in My Own Heart's Blood, by Diana Gabaldon http://t.co/DEfzkmMUG9"
2014-06-17 17:52:17,"58% done with Written in My Own Heart's Blood, by Diana Gabaldon http://t.co/Rd6Ltwxt1r"
2014-06-16 10:47:16,"48% done with Written in My Own Heart's Blood, by Diana Gabaldon http://t.co/JloyetkCRc"
2014-06-16 09:12:06,@ExLibris_Kate @thehappyhours YAYYYYY!!!!!
2014-06-13 13:55:29,"32% done with Written in My Own Heart's Blood, by Diana Gabaldon http://t.co/bE9AeMhQjS"
2014-06-13 03:17:15,@audible_com KUDOS!!! #ws4a is working on my #moby  copy now!!  YAY!!!!!
2014-06-11 21:02:29,@BioGirl I am only so far bc of audible. Lol.
2014-06-11 17:39:03,"20% done with Written in My Own Heart's Blood, by Diana Gabaldon http://t.co/elWfugiZjk"
2014-06-10 18:17:08,@audible_com I hope so.  This is causing me to lose valuable manually finding my place.  ;)
2014-06-10 17:12:58,@audible_com  who so I have to personally pay to get #moby #ws4a? This is insane #outlander #diabnagalbadon
2014-06-10 17:11:25,@MyReality blah
2014-06-10 03:12:38,Do people with no uteruses get ovarian cysts still?
2014-05-29 18:40:33,Flight will only be reimbursed if cancelled.  It is currently scheduled for 440p They want everyone gone so they won't know it is cancelled?
2014-05-29 17:40:27,Only food in this airport is bagels...which we are paying for ourselves.  Did I mention I have a toddler? Worst travel day ever. @Delta
2014-05-29 17:39:27,@Delta has failed us majorly today. Waited 4 hours for the WRONG PART to be flown in. Flying AA now and had to pay again for our bags. &gt;:(
2014-05-28 15:37:49,"RT @AndiMN: #yesallwomen I can't help wondering how many women, like me, still can't bring themselves to post the worst thing that happened…"
2014-05-28 15:35:15,I share the previous tweet for all Disney/Dr Who fans.  :) $11 t shirts!! Only available for 12 hours and they are awesome.
2014-05-28 15:32:28,Check out TeeFury.   http://t.co/L9kJmsTs4K Use this link for a chance to win a signed tee from one of our top artists!
2014-05-25 13:25:10,"80% done with An Echo in the Bone, by Diana Gabaldon http://t.co/oZ3bf8AKmF"
2014-05-25 13:24:47,The fact that Echo in the Bone isn't WhisperSync ready is REALLY CRAMPING MY STYLE @audible_com #ws4a.
2014-05-22 03:26:43,"70% done with An Echo in the Bone, by Diana Gabaldon http://t.co/kQcPNUoenJ"
2014-05-21 05:00:19,RT @AnimatedWoman: This. RT @Jamericanspice Facebook have a new ask button? how about a WHY button so that people can explain all the dumb …
2014-05-21 04:59:23,@thehappyhours awesome!!!!! Good luck!!!!!!
2014-05-21 04:58:03,#Clothdiaper RT @wootoff: $7.99 : Adjustable Cloth Diaper 3-Colors http://t.co/dFmVPrCpEW
2014-05-17 21:59:17,"49% done with An Echo in the Bone, by Diana Gabaldon http://t.co/iOVrxQ6oTB"
2014-05-16 02:15:24,"@postcrossing  RT @tricialeedom: Look what I found at #RT14: #Outlander postcards!! If u want one, (cont) http://t.co/Jhb80REoud"
2014-05-16 02:14:41,This would be awesome for my @postcrossing addiction.                    RT @tricialeedom: Look (cont) http://t.co/dbSRxMiGcM
2014-05-13 21:02:06,"34% done with An Echo in the Bone, by Diana Gabaldon http://t.co/jk0rkJPFEJ"
2014-05-13 18:00:09,"30% done with An Echo in the Bone, by Diana Gabaldon http://t.co/TZZVWftnKf"
2014-05-13 03:16:12,"14% done with An Echo in the Bone, by Diana Gabaldon http://t.co/V0UpMb9OYf"
2014-05-10 22:15:44,"On page 64 of 848 of An Echo in the Bone, by Diana Gabaldon http://t.co/l0VgGWDRxi"
2014-05-09 16:20:05,"95% done with A Breath of Snow and Ashes, by Diana Gabaldon http://t.co/clS9jZn5dD"
2014-05-09 00:00:10,"90% done with A Breath of Snow and Ashes, by Diana Gabaldon http://t.co/0JfhEmTQpK"
2014-05-08 14:35:27,@fertilityauthor is she thinking of her child. So sad.
