timestamp,tweet_text
,"Ser curioso, senderista, relatista y lector. Alma friki, fan del manga, anime, figuritas y todo lo relacionado con Japón. A veces me meto donde no me llaman.",
2019-11-12 18:04:01,RT @A2TwillDraw: Just made #nezuko in 9 different #animestyles on my Instagram! https://t.co/6EYFXxCeKp
2019-11-12 17:39:11,"Esto es la calidad de Fots, antes me compro una pirata de Aliexpress que comprar algo de ellos... 🤷🏻‍♂️ https://t.co/6f9hr870X9"
2019-11-12 17:33:31,Woow 😮 https://t.co/Q781ytMI1p
2019-11-11 18:49:43,RT @Cieminfo: #TránsitodeMercurio Ya lleva realizado más de la mitad de su recorrido por el disco solar... https://t.co/b5UspTiIZq
2019-11-10 19:10:20,"@blogvisual Yo tengo la del 25º aniversario y algún DVd suelto (pena que perdí el VHS jajaja), y con esa me conform… https://t.co/0F7MU7umth"
2019-11-10 19:06:41,"@Suly_mami Pues imagínate una conejita de esas que tanto te gustan (🤭) que son 1/4 xD PD: Gracias, las Puella Magi… https://t.co/74ptDeMPFE"
2019-11-10 18:57:50,"Creo que es la temporada que más series he dropeado, y ya veremos si no añado No Guns Life al drop... así ha quedad… https://t.co/WHmPjIF5gk"
2019-11-10 18:48:30,Dropped Special 7: Special Crime Investigation Unit - https://t.co/4FwvvY7tx2 #animeplanet
2019-11-10 18:48:22,Dropped Case File nº221: Kabukicho - https://t.co/ySkdFoZwKS #animeplanet
2019-11-10 18:20:45,"@blogvisual @SelectaVision ¿Te digo la verdad? Me esperaba algo más... pero, ¿hay otra edición coleccionista con más cosas, no?"
2019-11-10 16:05:00,"@orionSy13 Ay, ese 13 jajaja. Es que me ha gustado ese que sale Dororo, entre otros 😊 Mira, te hago una proposición… https://t.co/uOsk9kvkng"
2019-11-10 15:36:10,"@orionSy13 Ay, si vendieras... https://t.co/By4CXe8XO8"
2019-11-10 15:32:23,"@orionSy13 Ah, como molan los de Dororo, yo quiero 😍"
2019-11-10 11:41:52,"@Suly_mami Diferencias 1/6, 1/7, 1/8 https://t.co/ALZR5YSaiN"
2019-11-10 11:35:54,"@Suly_mami Pues esa Asuka es 1/7, imagínate con una 1/8. Con Kotobukiya estoy muy contento con su línea horror bish… https://t.co/NEqELOJ8Uh"
2019-11-10 11:28:05,@orionSy13 Que sepas que soy muy fan de Alf... https://t.co/bGrRATNkUI
2019-11-10 11:26:19,"Pues me ha molado este Model Kit, tal vez caíga... https://t.co/n1jLIn4WKK"
2019-11-10 11:11:16,"@orionSy13 Junto al gato, mete también antihistamínicos, por fi. No querrás ser culpable de que me hinche como un g… https://t.co/tEY0esR7pc"
2019-11-10 11:02:57,"Termino mostrándola en la vitrina (podéis ver a lo que me refiero al verla de frente), junto a Asuka de Alter, y Mi… https://t.co/85mXlFxVux"
2019-11-10 10:59:56,"Seguimos mostrando más de cerca, al ser una escala 1/6, acostumbrado a las 1/8, se ve grandecita incluso estando de… https://t.co/a8QSah3jYP"
2019-11-10 10:55:04,"La pose que tiene es para ""disfrutarla"" desde arriba, así que mejor exponerla en un lugar bajo (me ha tocado cambia… https://t.co/5z8spzE4cm"
2019-11-10 10:47:16,"Por fin he podido ""unboxear"" a Ayanami Rei de Kotobukiya, de la serie Evangelion. Con una escala 1/6, la figura es… https://t.co/1XA9RWDCVG"
2019-11-10 10:40:52,@Figura4official A mí me que me envíen los arcos solo jajaja (sigo con el trauma de los arcos rotos :( )
2019-11-09 19:07:20,Y mi lectura para esta noche es... ¡Pescado del Banano! https://t.co/hbB3gIsLwz
2019-11-09 18:56:56,"Y ya que estoy con RWBY, el volumen 7 se estrenó el 2 de noviembre (y yo ni me acordaba) https://t.co/58KEejE6Vu"
2019-11-09 18:51:52,3 of 5 stars to RWBY by Shirow Miwa https://t.co/XQdRuDGmLG
2019-11-09 18:30:19,"Los cuatro trailers que adapta son estos: Red, White, Black y Yellow (en referencia al color de las protagonistas).… https://t.co/o2bYwAfO8u"
2019-11-09 18:25:09,"Pues no ha estado mal la adaptación un tanto libre del comienzo de RWBY, introduciéndonos en Remant y sus protagoni… https://t.co/esWfgvq5vi"
2019-11-09 18:10:21,"4 of 5 stars to Nuestra salvaje juventud, Vol. 5 by Mari Okada https://t.co/Qq3svi4Xm3"
2019-11-09 14:04:11,RT @CRCiencia: Para hacer una tarta de manzana primero tienes que crear un universo (Carl Sagan) https://t.co/c555T4OSpj
2019-11-09 14:02:16,"@HiroManga @mwediciones Es que tiene un arranque muy bueno, hay cosas que me dejaron a cuadros..."
2019-11-09 13:59:23,Lectura para antes de la siesta 👀 https://t.co/ZOUocJGqUo
2019-11-09 13:50:03,"@PalomiAnime Sí, nos harán sufrir su espera xd"
2019-11-09 13:06:52,"Muchas ganas, espero que no tarde mucho en salir en Netflix, por que... ¿saldrá en Netflix, verdad? https://t.co/huF19nVjLD"
2019-11-09 10:49:41,@drewanet @Figura4official @YumiiMitsuki https://t.co/p5biMjzhLj
2019-11-09 10:46:03,"Pues gracias a @Figura4official y @drewanet (y gracias @YumiiMitsuki por ofrecerte también), me han llegado las com… https://t.co/wrJMHCKQyg"
2019-11-09 10:25:51,"@PalomiAnime Pues con la semana que he tenido, y más ayer que la Ley de Murphy me golpeó con toda su fuerza, espero… https://t.co/nUyrFpElPG"
2019-11-09 09:48:46,"@Okamin_Net No es la primera vez que hace sorteos de este tipo, no creo que sea fake, pero juer, menudo regalado si es verdad"
2019-11-09 08:56:30,Pero... ¿cómo regalas unas Godoka? 😱 https://t.co/6WuKK1FFz3
2019-11-08 18:28:47,"@Tempomantis Espérate, que se han estropeado los ascensores y estoy bajando material desde el piso doce, y luego subir, hoy me muero...."
2019-11-08 17:59:07,"Toda la semana de puta mare, y hoy, todo lo que podría salir mal trabajando, sale mal... yo ya... https://t.co/ghy3NatShb"
2019-11-08 13:23:52,"@PalomiAnime @Perikoperro Oye, que el anime está muy bien, pero... ha dicho pene https://t.co/2NJ6OOlQks"
2019-11-08 10:56:43,"@eduartyf Cuantos Plan to read tienes ya, ¿mil millones? No te va a dar la vida 🤣"
2019-11-08 09:57:38,"@Cieminfo Sí, ya me lo han avisado xD"
2019-11-08 09:14:19,"Ah, que Holo más bonita 😍 Pero 16000yens (unos 135€) más gastos de envío (y si no cae en aduana, que hay que sumar… https://t.co/KvMAorGUp2"
2019-11-08 07:30:06,"@Cieminfo Aunque algo sí es verdad, me devuelve a mi niñez. Estoy a punto de acabarla y pienso que ya que están, po… https://t.co/TBnIkE4Zyd"
2019-11-07 21:22:22,RT @NASAWebb: (Human for scale.)   This photo showcases just how big #NASAWebb is! We'll be sharing more behind-the-scenes images captured…
2019-11-07 20:13:30,"@PalomiAnime Acabo de ver un capítulo, juju..."
2019-11-07 19:55:01,"@JotaCSGO Pues por ahora por el mismo camino, pero es que el manga es muy explicito, no se corta nada en cuanto las… https://t.co/dONqw9LvY6"
2019-11-07 19:26:24,"Me he leído el libro y he visto la peli (donde sale Takeshi Kitano) un par de veces, me faltaba el manga... y vaya… https://t.co/qi8B0cqbZ8"
2019-11-07 19:22:24,4 of 5 stars to Battle Royale by Masayuki Taguchi https://t.co/dI9ys51151
2019-11-07 18:41:53,"@editorialKODAI Pues viendo el panorama y las expectativas que parece haber, espero que sea la primera de muchas licencias"
2019-11-07 16:04:50,@Tempomantis Por eso ahora es ex-amigo 😎
2019-11-07 11:12:22,"Me acaba de decir un EX-amigo que no le gusta la serie de Cristal Oscuro porque es ""para niños"" 🤷🏻‍♂️ https://t.co/p86DP0rinu"
2019-11-06 19:12:35,"Me llega Rei y descubro que Asuka ya tiene fecha de lanzamiento, el 15 de este mes. ¿La tendré antes de que acabe e… https://t.co/A1noKzjKMZ"
2019-11-06 19:05:09,Que gran comienzo. Tras regresar la protagonista al lugar de su niñez y reencontrarse con sus amigos en el institut… https://t.co/NwiDiBiql9
2019-11-06 18:55:20,4 of 5 stars to The Golden Sheep #1 by Kaori Ozaki https://t.co/yHydNs4dkk
2019-11-06 18:51:35,Ya ha llegado la Rei(na) de la casa. Aunque hoy ya no la abro xD https://t.co/xYBACWfAsM
2019-11-06 18:41:46,"@4taevia Ah, jajaja, yo es que ""no puedo"" tenerlos en la caja. Tengo nendos por todos los sitios esparcidos xD"
2019-11-06 18:33:38,"@4taevia Y encima tengo a estos dos aquí al lado, para hurgar más en la herida xD https://t.co/NBRmNNJFa1"
2019-11-06 18:31:53,"@Khazar_XIV Me refería a que en su día vi la peli y sabiendo que esta serie es una precuela, se sabe como va a acab… https://t.co/WCKXP3UmSc"
2019-11-06 17:59:05,"Vamos, como las maquinillas de afeitar y su número de cuchillas... https://t.co/pLzLLk7xdT"
2019-11-06 17:53:38,"Me está gustando la serie de Cristal Oscuro, pero juer, sé como va a acabar... y no. https://t.co/LEbAGxrRtI"
2019-11-06 17:39:28,"A ver si se dignan de entregármela hoy, que esta mañana han pasado y la han vuelto a sacar para la tarde. Pero sigo… https://t.co/SnGIXbX2Ff"
2019-11-06 17:20:06,"@4taevia En breve lo tengo para leer, vamos a sufrir de nuevo xD"
2019-11-05 19:45:37,"@orionSy13 ¡Eh! Tú me has dicho que quite un espacio, pero no cual... y he quitado el primero :P https://t.co/H7FwCxrwID"
2019-11-05 19:44:11,"No voy a negar que el dibujo está chulo, pero parece que lo haya patrocinado Turismo de Islandia. Que sí, que me pa… https://t.co/LFe337YZqq"
2019-11-05 19:41:33,3 of 5 stars to Sigue las nubes al nornoroeste 2 by Aki Irie https://t.co/lRIQystixD
2019-11-05 19:40:29,@orionSy13 Quito un espacio... entonces... ¡EL ÉXITO OTAKU! https://t.co/SmtkapTPKM
2019-11-05 19:33:01,"@orionSy13 ¿La ""devota"" (bota) otaku? 😬 https://t.co/cW29xsX1eV"
2019-11-05 18:46:38,Pues ya sé cuál será la siguiente serie que vea en cuanto acabe Cristal Oscuro 👀 (Aunque no entiendo la continuació… https://t.co/C2WVBVdDfa
2019-11-04 20:26:22,Ya ha llegado Ayanami al aeropuerto y a la espera a que me la traigan en unos días si no pasa nada. Y este mes espe… https://t.co/Nyvk6CKZKd
2019-11-04 19:24:55,"¿Dónde están las 4 páginas a color de Sigue las nubes al Nornoroeste de @NormaEdManga ? A ver, que yo lo vea... xD https://t.co/wJV29pERo4"
2019-11-04 19:12:06,4 of 5 stars to Bloom Into You nº 02 by Nio Nakatani https://t.co/Ozf47WKk8l
2019-11-04 18:09:37,"@PalomiAnime @danypunkz Aunque a mi aún me falta alguna por empezar, por ahora es de las más interesantes de la temporada"
2019-11-04 13:13:59,@PalomiAnime @CoaliseEstudio @ed_babylon @eccediciones @TomodomoEd @Ivrea @mwediciones @NormaEdManga @SelectaVision… https://t.co/6k3BffA19o
2019-11-04 13:13:26,RT @PalomiAnime: Recopilamos en una única entrada TODAS LAS LICENCIAS #manga y #anime anunciadas en #25MangaBCN. ¿Con cuál de todas os qued…
2019-11-04 11:49:17,"@La_Orda Ah, mola!"
2019-11-04 11:17:26,"@eduartyf Ya, si ya lo sabía, por eso he puesto el tuit de Pd. Dos años han tardado xD"
2019-11-04 11:14:32,@eduartyf Pd: https://t.co/jzWNpOW8z2
2019-11-04 11:13:47,@eduartyf Tanto tiempo? 😱 👇 https://t.co/Dyo2FAglAL
2019-11-04 10:33:15,"Tanto hablar el otro día de alisar gotelé y hoy, zasca 🤣 https://t.co/E6e1AGBfec"
2019-11-04 06:56:24,"@Suly_mami @AnimeGirl210 Yo estuve viendo alguna, y al poner la de MW y ver el tío ese sentado, la quité xD"
2019-11-04 06:48:30,"@Suly_mami @AnimeGirl210 Yo no la vi, me enteré de las licencias por aquí."
2019-11-03 22:47:58,"RT @apod: Daphnis and the Rings of Saturn: https://t.co/kThkk8DrJS by @NASA, @NASAJPL, Space Science Institute, Cassini https://t.co/7sK0WC…"
2019-11-03 22:44:41,"@AnimeGirl210 Lo veo tan innecesario como en la presentación del año pasado y Bakemonogatari, pero bueno, que cada… https://t.co/E6O7qhyIwa"
2019-11-03 20:46:36,"@arganthonios Pero lo hago sin darme cuenta, sin querer. No sé si toco algo desde el móvil o qué. Me he quedado loco al verlo 😅"
2019-11-03 20:22:59,"Tengo que averiguar que toco o como lo hago, porque a veces silencio a gente sin darme cuenta y a saber cuánto tiem… https://t.co/5u2AS9ZWlJ"
2019-11-03 18:22:12,@JotaCSGO 😅
2019-11-03 18:17:02,"3 of 5 stars to Kamisama no Joker, Vol. 2 by Michiharu Kusunoki https://t.co/j9F8K7Umzd"
2019-11-03 13:01:13,"@eduartyf Con el odio que le tengo a Selecta, le he pillado lo de coleccionistas 4x100€ xD"
2019-11-03 10:35:56,5 of 5 stars to Spice and Wolf 3 by Isuna Hasekura https://t.co/BWGgg8hrAX
2019-11-02 19:18:50,@PalomiAnime https://t.co/n4jLpU7wiC
2019-11-02 19:11:25,Me he saturado de licencias hoy xD. Aunque realmente pocas son las que me interesan a primera vista... mejor mañana… https://t.co/j1Ki4wk16m
2019-11-02 19:09:34,"Al hilo, que está bastante bien para ver las licencias del Manga Barcelona 👀 https://t.co/qGv3hIlE6I"
2019-11-02 19:08:04,"@osomitaaa Sí, he entendido lo mismo, que tiene muchas páginas color pero que iban a respetar el precio. Debe ser esa"
2019-11-02 19:03:20,"@mwediciones 3 de 7 seguras, y habría que estudiar un par más 👀 ."
2019-11-02 19:01:35,"@PalomiAnime Pues si sale mañana ya es mucho antes de lo que esperaba O_O, que hay muchas licencias y ya sabemos co… https://t.co/4qC3fsIbP2"
2019-11-02 18:57:47,@PalomiAnime ¡Y fin! Pues me parecen muy interesantes las propuestas de Satori ^^
2019-11-02 18:44:42,"@osomitaaa Yo seguía lo que ibas poniendo, pero tenía la gran esperanza de que llegara antes de leerla por algún ot… https://t.co/EBVpSwAM7l"
2019-11-02 18:43:41,"@PalomiAnime @satorilibros Bueno, el recuerdo, recuerdo.... no me acuerdo ni de la mitad xD, así que espero que est… https://t.co/wGHV0xNUni"
2019-11-02 18:37:32,"@PalomiAnime @satorilibros Ánimo, menuda maratón hoy xD"
2019-11-02 18:28:12,"@eduartyf Pues ni me he enterado, cuando empieza a hablar él mi mente se pone así 👇🏻 https://t.co/JjjiJOVN2R"
2019-11-02 18:25:56,"@eduartyf ¿Por? Bueno, a mí realmente nunca me ha gustado, pero bueh..."
2019-11-02 18:24:34,@eduartyf ¿Qué ha pasado? (Cotilla mode on)
2019-11-02 18:23:47,¡Otra! Como siempre MW se lleva la palma... https://t.co/HbWczhkBhl
2019-11-02 18:22:34,"Woow, otra, por fin de nuevo Oshimi y más esta historia. Y esperando al de Furuya que ya tienen... https://t.co/b8mgcpL8Aq"
2019-11-02 18:21:16,"Woow, esta le tenía ganas tras Kuro ^^ (Y me imagino que a @osomitaaa también) https://t.co/7GsbADghxw"
2019-11-02 18:10:23,"3 of 5 stars to Atelier of Witch Hat, Vol. 5 by Kamome Shirahama https://t.co/6zPP5sP25a"
2019-11-02 15:06:47,@osomitaaa Yo me voy a leer Atelier jaja.
2019-11-02 14:15:07,"@PalomiAnime Ah! Mola, pero ojalá sacaran más cosas de Madoka Magica, pero veo que nop :("
2019-11-02 14:14:24,😱 https://t.co/QfpPfozm7H
2019-11-02 12:44:49,"@meadows_of De muchos sitios durante años xD. Shinobu y Senjougahara son ediciones especiales, que venía con cosita… https://t.co/G3weiPAKQg"
2019-11-02 12:39:54,Tengo que empezar a replantearme a cambiar la disposición de la estantería de Bakemonogatari 🤔 https://t.co/2nODeDCaBv
2019-11-02 12:29:13,"Por ahora: -Tomodomo y Hagio compra segura -Curiosidad por el yuri de Babylon -Fiasco con la Rosa de Versalles, que… https://t.co/NczcEjAvas"
2019-11-02 11:51:11,"3 of 5 stars to Made in Abyss, tomo 8 by Akihito Tsukushi https://t.co/sGWYnOG4SA"
2019-11-02 11:48:06,"RT @HiroManga: Me parece bien que se decida contestar a los haters con humor, pero cuando alguien te hace una crítica constructiva con la m…"
2019-11-02 11:47:58,"@HiroManga Ay, si llego a estar ahí xD https://t.co/uKHIyK54YK"
2019-11-02 10:49:09,"@PalomiAnime Bueno, el tomo 3 está a la venta desde el año pasado, el cuarto y final ha salido ya."
2019-11-02 10:43:48,"@eduartyf Acabo de ver que han preguntado por ella, no saben ni que el cuarto está ya en Japón... vaya editores."
2019-11-02 10:41:28,"@eduartyf Si es que con la mierda de edición, llena de ""burbujas"" como dice él, normal que no venda. Yo no lo compr… https://t.co/NzwUgNMBaU"
2019-11-02 10:39:40,"@eduartyf Joder, hacen reediciones de Junji Ito a tope, de flexibok de ese y de otras obras porque sí, y de los niños del ""moire"", no..."
2019-11-02 10:37:35,"@eduartyf Vaya tío, me pone de los nervios... si estuviera allí le iba a dar unas cuantas preguntas y contestaciones..."
2019-11-02 10:36:13,"@LukeElSoler @Oddly_Pleasing Pues del primero aún no me he encontrado ninguno, por mala suerte para nosotros, pero… https://t.co/ULTq5R2FrC"
2019-11-02 08:57:05,Me voy a perder la presentación de Ecc porque estaré comprando 🤨 Con el salseo y sangre que va a haber en la ronda… https://t.co/IIC3wTJxon
2019-11-02 08:19:14,Ah...aaaaaah.... ¡aaaah! ¡AAAAAAAH! 😱 https://t.co/k3E7W6mFds
2019-11-01 22:24:04,@Suly_mami ¿Lo de la humedad del techo porque lo dices? Es que es un lío eso de quitar el gotelé porque te puedes e… https://t.co/gLjwfvsrJ2
2019-11-01 21:02:59,"@PalomiAnime Aiss, gracias por ponerme los dientes largos jaja. No suelo comprar muchas ""prizes"" (soy más de nendor… https://t.co/RfIPGXihXF"
2019-11-01 20:45:55,@Oddly_Pleasing ¡Mis pelotas se quita el gotelé así! Venga ya... 👇🏻 https://t.co/NIOE4XThKw
2019-11-01 20:41:57,"1º se le da con esa maquinita, que es el demonio tras un rato de uso. No quita el gotelé ni de coña pero lo alisa a… https://t.co/iwxtXrnoYa"
2019-11-01 20:24:21,"Estoy trabajando de esto, ojalá fuera así de sencillo como muestra el vídeo. Eso no es gotelé, eso es harina pegada… https://t.co/nrkDOFqeOe"
2019-11-01 19:08:19,"No estoy en el Mangabcn, vivo a 370km, y aun así me he gastado hoy 120€ en ""cositas"" de allí. Imaginad si algún año… https://t.co/M2n57AC1xL"
2019-11-01 19:02:03,"@PalomiAnime Figuritas, figuritas... ¿será por Rams y Rems en la tercera foto? xD"
2019-11-01 18:52:59,"@Tempomantis Llega la crisis, la crisis xD"
2019-11-01 18:19:53,"4 of 5 stars to Bakemonogatari, Vol. 6 by NisiOisiN https://t.co/M2ajVh07TB"
2019-11-01 18:12:04,"Está para ""comérsela"" https://t.co/XJ4uNvJJ4o https://t.co/3uLNlzkBrY"
2019-11-01 17:13:46,@HiroManga @TomodomoEd Que lo sepan xD https://t.co/hH5Uj8P2GV
2019-11-01 17:09:14,"@PalomiAnime Más Moto Hagio, ¡bien! https://t.co/p2HPa2S29n"
2019-11-01 17:05:40,"@eduartyf Bueno, tal vez de plástico y a pilas xD"
2019-11-01 17:03:37,"@HiroManga @TomodomoEd Ah, pues nos han oído xD"
2019-11-01 17:02:28,"@eduartyf @osomitaaa No entender, Ran y Atelier se parecen en la ¿magia? Yo creo que ni eso xD"
2019-11-01 17:01:29,"@Tempomantis Tanto tanto que hasta me he gastado dinero y todo jajaja (son unos soletes, la verdad)"
2019-11-01 11:44:49,5 of 5 stars to 20th Century Boys nº 10/11 by Naoki Urasawa https://t.co/Pez0PFGklw
2019-11-01 10:42:59,"No conseguí casi ni una sola foto del ""cornudete"" a mi paso por la Font Roja, buscando información, (creo que es un… https://t.co/xrnmhZJsCC"
2019-11-01 10:27:38,"@Khazar_XIV La que tú has puesto es la de Kotobukiya, y no, solo enseñaron el prototipo. Ni en color, ni fecha o pr… https://t.co/sTrJtYwMsO"
2019-11-01 09:21:36,"@eduartyf Ni ellos se lo creen, siempre dicen lo mismo... y luego tienen el valor de anunciar más cosas xD"
2019-11-01 08:40:27,Y así acabó nuestra historia de amor... (Casi 190€ en Tom 😱) https://t.co/UOvpCQZ1fa
2019-11-01 07:23:16,Quién me iba a decir que pensaría que Pennywise sería tan adorable 😊 https://t.co/gspmBk7iYV
2019-10-31 18:07:28,3 of 5 stars to El puente de Clay by Markus Zusak https://t.co/PiK03AFmsq
2019-10-31 16:12:22,Hosti con Myethos https://t.co/YmLkK4rQHR https://t.co/rdz4y6e7Gx
2019-10-31 13:12:57,@Suly_mami La única conejita que se salva 👇 https://t.co/vHzfD1WDEl
2019-10-31 13:01:23,"Pues ya he establecido su orden de lectura, de izquierda a derecha. Creo que empalmo ya con las novedades de noviem… https://t.co/vgGOwB9E9K"
2019-10-31 12:38:05,Anoche me tuve que cambiar al pijama de verano del calor que tenía y hoy andando por el sol parece que estemos en p… https://t.co/F8UAyRjXYc
2019-10-31 12:16:39,"@Suly_mami @NormaEdManga @OscarValiente_ @Annabel_Norma Buff, donde los compro no llegan así..."
2019-10-31 12:15:49,No me digáis que no leo variado 🤣
2019-10-31 12:06:00,Este mes han caído unas pocas novedades (me ha faltado Planet Manga que estaba agotada 😐). En cuanto acabe con el l… https://t.co/h5DI4n2NmS
2019-10-31 11:55:19,@HiroManga @NormaEdManga Habrán contado la sobrecubierta 🤔
2019-10-31 11:33:27,"@Khazar_XIV @mwediciones A ver si empiezo yo a leerme las novedades del mes, este entre ellos, que le tengo ganas.… https://t.co/aZJo5gRHit"
2019-10-31 10:58:28,"Me han pagado hoy dinero extra que no esperaba, me ido a la tienda de comics, que tenía que ir hoy, y menos unos eu… https://t.co/L4faHyx99R"
2019-10-31 10:51:24,@Suly_mami @nefariuss Hacéis bien jajaja
2019-10-31 10:50:59,"@Suly_mami Ques Q suele ser cara, pero no esperaba este precio, pensaba que rondaría por los 16000yens y más siendo… https://t.co/wZG7XglF3M"
2019-10-31 10:47:07,"Ay, que ya queda poco para la tercera 😊 https://t.co/xjycmHcKgA"
2019-10-31 10:28:29,"No os podéis ni imaginar lo que pesa la mochila, más que la que llevo a la montaña 😅"
2019-10-31 10:08:08,"Lo dudo que llegue el jabón, los otakos de aquí no nos bañamos  💪😎 https://t.co/BcA288e7J8"
2019-10-31 10:06:56,"@eduartyf Dos si son pequeñas (no hablo de Lolis, ¿eh?)"
2019-10-31 10:06:09,"@sgreensan1 Ahora me pegarán con el canto de un manga por no entender buen, estoy en la puerta de la tienda 🤣"
2019-10-31 10:04:05,@eduartyf Pah la sieshta
2019-10-31 10:03:05,"@sgreensan1 Ya me lo han aclarado, mi comprensión lectora s ese tuit me ha llevado a la confusión"
2019-10-31 10:02:09,"@La_Orda Vale, borro, me había dado a entender eso, sorry."
2019-10-31 09:51:06,"RT @Hobbyfiguras: La compañía Ques Q muestra imagenes oficiales de su figura a escala 1/6 dedicada a Coco, la brujita protagonista del mang…"
2019-10-31 09:48:24,@La_Orda @NormaEditorial @NormaEdManga Anda que ya les vale... al menos la única que quería de ellos la tenéis
2019-10-31 09:46:44,Me voy a la tienda de comics a celebrar mi propio salón 😅 Son tantas las novedades que he preferido llevarme una mo… https://t.co/zKrFDmIxwd
2019-10-31 09:20:35,@PalomiAnime @MANGAbcn Seguro que no me tocaría... https://t.co/pzOlf0Uh2D
2019-10-31 09:20:14,@PalomiAnime @Hekiren_ Estaré atento https://t.co/l8Hag6g5BB
2019-10-31 09:13:16,"@Figura4official Tío, respira y mira el Twitter que le he dado RT, la compañía que es xD"
2019-10-31 08:52:20,"@PalomiAnime @Hekiren_ Ah, estaba pensando si ibais a estar en ""persona"" en el Manga. Ya veo que sí, a ver si nos m… https://t.co/xNPYiolZ6D"
2019-10-31 08:50:27,"@PalomiAnime @MANGAbcn @mwediciones @PlanetadComic Ya lo dije ayer,  si estoy allí me llevo el supermarcapáginas de Atelier 😈"
2019-10-31 08:12:18,"@ann_m_2507 @mwediciones Me he acordado de este tuit y mira, ya ha salido en precio. Pero malas noticias, se han pa… https://t.co/CT8i17q2fd"
2019-10-31 08:03:35,"19800 yens , 164€ euros al cambio. Se han pasado un pasote, mi Godoka y Homura no fueron tan caras si no recuerdo m… https://t.co/8g2IxJ1zCP"
2019-10-30 20:05:40,Yo quiero un marcapáginas de ese tamaño xD https://t.co/4PXJ4hDbNx
2019-10-30 19:54:14,"@editorialKODAI @sddist Uy, para las compras del mes que viene ^^"
2019-10-30 19:46:29,"@HiroManga @mwediciones Yo no puedo ir :( (otro año más), así que tendré que buscar alguien que lo haga en directo por algún sitio..."
2019-10-30 19:43:13,"@HiroManga @mwediciones Vamos a ver, no voy a entrar en detalles otra vez 😅, a mí me gustó, pero no como se solucio… https://t.co/K4cjO81oCG"
2019-10-30 19:40:02,"@HiroManga @mwediciones Buah, justo a ese le cogí manía, los de Milky lo saben xD"
2019-10-30 19:35:47,"@HiroManga @mwediciones De esos chulos que sacan a veces, ojalá xD (aunque algo de Furuya u Oshimi no le diría que no, ¿eh?)"
2019-10-30 19:27:13,"@HiroManga @mwediciones Se les va de las manos, espero que sean la mayoría cortas xD"
2019-10-30 19:01:00,"Juer, este tuit lo he mandado a las cinco de la tarde y sale ahora 🤦🏻‍♂️"
2019-10-30 18:58:24,"Y se acabó, maravillosa la ruta por la Font Roja https://t.co/BXGBFBk2Z4"
2019-10-30 15:05:55,"Si esto es el infierno, que me guarden una plaza 😊 Menudo encuentro he tenido con cinco bichos de estos, y uno de e… https://t.co/5vfFD5Q2W8"
2019-10-30 13:56:20,"Otra vez en marcha, hasta llegar a un nuevo mirador, el de Pilatos. Me lavo las manos y sigo, que en breve me desvi… https://t.co/rFGqbUrUbH"
2019-10-30 13:28:24,"Uy, que acabo de descubrir durante el descanso que se me ha puesto en camino esta cosita... https://t.co/ov7P5czgyK"
2019-10-30 13:01:49,"Creo que es un buen sitio para comer, ¿verdad? https://t.co/chcj73D7tU"
2019-10-30 12:36:28,1-Con Belén incluido en la cruz 2-Otra vista de la Cava Coloma 3-¿Serán granos de café? 4-Proxima parada: Más de Te… https://t.co/6hohDICLQR
2019-10-30 12:31:27,En la Creu de la Teixereta. ¿Será por vistas? https://t.co/GwTg5g13YZ
2019-10-30 12:00:08,El camino sigue hasta la Cava Coloma Pd: qué curiosa esa nube https://t.co/kxCJW8Xc2V
2019-10-30 11:59:30,"La senda se abre igual que las vistas, visitando un patrimonio silencioso de un oficio extinto. -Pou del Canyo -Cav… https://t.co/ndGvA2IKcC"
2019-10-30 09:22:02,@MribelReal2 Por la Font Roja 😍
2019-10-30 09:15:36,"Bienvenida a mis pies, nueva cima. El Menetjador, 1356mt. Se ven tantas montañas conocidas, y que aún no he pisado.… https://t.co/CCg7pLxgbe"
2019-10-30 08:39:13,"Mi mente no para de darle vueltas a una palabra: ""Privilegiado"" Sí, será mi palabra del día... https://t.co/fczFwPZV9b"
2019-10-30 08:08:39,"@osomitaaa Es la primera vez que vengo, a disfrutar, sin prisas 😊"
2019-10-30 08:08:00,"El principio te lleva por unas escaleras, al cielo, para convertirse en un zigzagueante ascenso que te engulle entr… https://t.co/vSQC1tHkg2"
2019-10-30 07:58:33,@osomitaaa Cerquita estoy (en rima :P)
2019-10-30 07:43:22,"Primera parada, Mirador de la Mina, pasando antes por la Cova Gelada y un Forn de Calç y una Carbonera. Sin prisa,… https://t.co/e4erFCqzOl"
