timestamp,tweet_text
2019-09-20 10:50:53,"@PalomiAnime @PlanetadComic ¡qué va! Quedan apuntadas a mi lista y luego a final de mes, después del mangademediano… https://t.co/RHPnZYkLPX"
2019-09-20 08:36:53,"@PalomiAnime @PlanetadComic Pues los dos yuris, sobre todo Bloom into you porque me encantó el anime (¿Koita, en se… https://t.co/3dNvHgLjPi"
2019-09-19 20:37:44,"Lo que lleva leído de ella me ha gustado, así que me imagino que caerá ^^ https://t.co/1PUVGStz11"
2019-09-19 19:18:03,"Juer, menudo tramo final el capítulo 22 de Carole &amp; Tuesday 🥺 https://t.co/GiM1dFrFE8"
2019-09-19 18:42:14,Rated To the Abandoned Sacred Beasts (anime) 2.5/5  - https://t.co/w80oh01ebN #animeplanet
2019-09-19 17:56:43,@Figura4official Que lo vean mis ojos el prototipo pintado 👀
2019-09-19 17:21:51,"@Lastro87 Es que vaya putada, y si luego lo intentas pagar tú para que salga más barato, todo son problemas... buen… https://t.co/oiRn9eksos"
2019-09-19 17:12:47,"@YumiiMitsuki Bueno, ¿cuántas figuras hay anunciadas y luego se quedan en el limbo? Yo hasta que no las vea a la ve… https://t.co/zbeeTf3iBk"
2019-09-19 10:27:21,@mwediciones Oiss... https://t.co/9pdjvOB98A
2019-09-19 08:35:39,@mwediciones Oiss... https://t.co/hZUzMURmxj
2019-09-19 07:15:49,"@Figura4official Siguen sin decir nada, ahora que eres amiguito de ellos, pregunta 😎"
2019-09-19 06:30:28,"A ver por qué me la sacáis en dos colores, a ver... bueno, de todas formas si no anuncian a Rei, como que no creo q… https://t.co/AyqJF32AL2"
2019-09-18 22:08:34,"RT @kevinmgill: Jupiter's North Equatorial Belt and the Shadow of Io, @NASAJuno Perijove 22 - https://t.co/xrLr9x45ks https://t.co/W1ABDQtp…"
2019-09-18 21:05:49,"A Ed lo veo un poco raro (la cara de cabreado), pero este action doll de Al es una pasada (y valdrá un dineral...) https://t.co/tYaTsQcueK"
2019-09-18 20:55:06,"@osomitaaa Qué perturbador, ¿no?"
2019-09-18 20:52:31,"@blogvisual Oye, pues a lo mejor sirvo para esto y nunca he jugado al Pokemon, ¿habré tirado mi talento por la borda? 🤣"
2019-09-18 20:46:41,"@4taevia Alguna vez he oído que en aduanas ""fichan"" pero vete a saber. Yo en el tiempo que llevo comprando solo me… https://t.co/1Zi3v49jgG"
2019-09-18 20:43:52,"@orionSy13 La verdad es que no miro demografías, pero al ver los nominados del salón, pues me he quedado un poco de… https://t.co/kylsaX3Run"
2019-09-18 20:41:00,"Sigue ahí, la voy a adoptar xD https://t.co/VTuwpZRp1R"
2019-09-18 20:12:05,"Misión salvamento, menudo bisho dándose cabezazos en el techo. He conseguido atraparla y en el primer intento, ha s… https://t.co/5lIc1LdriZ"
2019-09-18 19:36:27,"@4taevia Yo he tenido suerte y solo me ha caído un paquete, pero hay gente que la tienen martirizada los de aduanas… https://t.co/jVJVK9AL7R"
2019-09-18 19:02:34,"Coleccionistas de moñecas y compradores de otakadas en general a japón, a parte de que tenemos a los de aduanas de… https://t.co/i5ue6Hq5OR"
2019-09-18 17:51:26,"Suma y sigue, Ecc... https://t.co/afNfMQINYb"
2019-09-18 17:41:50,@PalomiAnime ¿Se termina hoy? Aiss... las ha cumplido de sobra y aunque la cantidad de giros que tiene ya los sabía… https://t.co/jg1RWamhQE
2019-09-18 17:38:03,"@AnimeGirl210 @MishaBraden @Mikeranjero98 Ibitsu me llama mucho la atención, seguro que caerá al final en las compras del mes"
2019-09-18 12:04:00,"Ya que estoy, si me hubieran dado los tres mangas y las tres demografias sin saber cuál es cuál yo hubiera dicho qu… https://t.co/mlhS8LfzKx"
2019-09-18 11:58:57,Me acabo de enterar que: Bakemonogatari es un shonen Atelier un seinen Children of the whales un shojo Realmente me… https://t.co/qalCPPoWzE
2019-09-18 08:40:23,18 de septiembre y Alter aún no ha dicho fecha de salida. Esto huele a retraso.... https://t.co/rcsIkWR6f0
2019-09-17 18:47:46,"Pues oye, me ha dado curiosidad por ver este live action de Jigoku Shoujo, y a Enma Ai en acción de nuevo... Ippen… https://t.co/17D4dy7XnO"
2019-09-17 17:34:11,@mwediciones ¡Fiessssshtaaaa desde el móvil!   🤣 https://t.co/XSx5Jo0zEq
2019-09-16 11:47:23,Er vidéo  https://t.co/j5TKQFvyFR
2019-09-16 11:46:32,"Los de Mixta ya lo predijeron... ""Tú lo que estás viendo es un cerdo volando, tututu"" https://t.co/j5TKQFvyFR https://t.co/kDFvqtYIrY"
2019-09-16 11:41:46,@PalomiAnime @crunchyroll_es Vista. ¡Espectacular! Me llamaron la atención en casa para que bajara el volumen xD
2019-09-16 08:44:33,"O cruzabas por la Avenida del Puerto, o por el Águila o por una pasarela que daba cerca de Justo y Pastor. Guardo e… https://t.co/TPU3Her565"
2019-09-15 20:31:00,@PalomiAnime ¡Enhorabuena! https://t.co/UuPnncei0U
2019-09-15 18:36:14,Rated Kabaneri of the Iron Fortress Movie: The Battle of Unato (anime) 3.5/5  - https://t.co/JKm1nP0V43 #animeplanet
2019-09-15 17:07:35,"Si el otro día la sesión de cine le tocó a Tanya, hoy le toca a Mumei y a la continuación de la serie con Koutetsuj… https://t.co/dlDrJE9YoU"
2019-09-15 14:32:37,"RT @BaloncestoESP: 🏆 CAMPEONES DEL MUNDO 🏆  Por segunda vez en la historia, #LaFamilia es CAMPEONA de la #FIBAWC ‼️   🏆 @FIBAWC 🇪🇸 🆚 🇦🇷 (FI…"
2019-09-15 13:58:25,RT @SeBaloncesto: 13 años después ¡LO HEMOS VUELTO A HACER! 🏀🥇🇪🇸 #CampeonesDelMundo #FIBAWC https://t.co/RhZcY88Fed
2019-09-15 13:06:05,@orionSy13 Luego irá a por tu alma https://t.co/8OV2peg3bK
2019-09-15 10:43:19,"Soy otako, no me representan 🤷🏻‍♂️ https://t.co/BWqgEMDRDd"
2019-09-15 10:08:50,"@osomitaaa @PalomiAnime O eso recuerdo, dentro de los arcos que se podría llamar, se van conociendo los personajes,… https://t.co/EbvrAENDBt"
2019-09-15 10:04:49,@osomitaaa @PalomiAnime Tiene trama
2019-09-15 09:37:06,"@osomitaaa @PalomiAnime Es una de esas series que hay que verlas o al menos, darle una oportunidad"
2019-09-15 09:35:56,"@osomitaaa Ah, es verdad, no me acordaba de la hora"
2019-09-15 08:49:47,Hacedme casito 🥺 https://t.co/47wFEq011C https://t.co/GVEf9AAZmR
2019-09-15 08:46:18,"@Lastro87 @eccediciones Su línea manga la tienen abandonada, si fuera yo al salón y me dejaran preguntar... me echan del recinto xD"
2019-09-15 08:34:13,"@orionSy13 @blogvisual Me acabas de subir el nivel de azucar con el tuit, así que, buenos días."
2019-09-15 08:28:13,"@Figura4official Te vas a ganar un instant block, 1er aviso..."
2019-09-15 08:00:10,"Pues... ¿añadiendo ""Player 2 Game over""? 🤷🏻‍♂️ https://t.co/EiynhLOEqS"
2019-09-14 18:09:16,"... y el de ""Girls Last Tour"", el cual hay que decir que tiene una bso espectacular (y ya dejo de dar la turra por… https://t.co/sKHAkH3CZF"
2019-09-14 18:09:16,"Tengo la obligación ahora de dejar el PV de ""A place further than the Universe"" y... https://t.co/FQT6pm7F3N"
2019-09-14 18:09:15,"Y finalizo haciendo algo que muy pocas veces suelo hacer, un llamamiento para ver si alguien se anima a licenciar e… https://t.co/ejgZwddeKN"
2019-09-14 17:49:03,"Y ahora sí, un último set de fotos con ellas montadas en el Ketterkrand, con todas sus posesiones, con el que recor… https://t.co/LyWv5v9QLa"
2019-09-14 17:46:29,"Turno para la empaná (para lo que quiere) y glotona de Girls Last Tour, Yuuri (nendo 1073). 3 rostros (de empaná, e… https://t.co/p9GhzmrlCL"
2019-09-14 17:40:00,"Ahora la racional y paparazzi del apocalipsis de Girls Last Tour, Chito (nendo 1072). Viene con tres rostros (cara… https://t.co/t7vGerIxUj"
2019-09-14 17:31:28,"Termino el hilo con las nendoroid que me han llegado del manga y anime ""Girls Last Tour"". Empezando por el Kreter..… https://t.co/hfWzfMJdYr"
2019-09-14 12:32:00,"Junto a la compi, (y como llegó antes que ella, se quedó la moto; tal vez le compre un patinete), amenazándome de q… https://t.co/3qFDsmaPMM"
2019-09-14 12:27:59,"En posición de ataque, las 4 espadas se pueden desenvainar (tiene 2 manos pero más vale que sobre que no que falte)… https://t.co/55uj9DRCsr"
2019-09-14 12:21:17,"Turno para la figma de Shi, de la línea ""Heavily Armed High School Girls"" de Max Factory, ilustradas por Neco. Se d… https://t.co/lCuPJOX5BD"
2019-09-14 10:51:29,"@MeteoBetera @avachemtrail ""Te como las nubes, me bebo la lluvia"" Alejandro facts"
2019-09-14 10:29:37,"@GgKlimt @ChidoriBooks Sí, sé que es Nara, pero no todos son así, conozco a una persona que estuvo allí la estuvieron ""acosando"" xD"
2019-09-14 08:40:30,Una figura de Nezuko como en la portada del tomo 11 de Kimetsu y les tiro todos mis dineros a la cara....
2019-09-14 08:25:17,"@osomitaaa Bueno, por ahí también ha caído, pero no ha sido tan desastre, ¿no?"
2019-09-14 06:44:01,"@osomitaaa Pero tú eras de la zona por dónde está todo el lío, ¿no? O cerca. Ayer decidimos no trabajar por si acas… https://t.co/vb7r49vCvY"
2019-09-14 06:26:21,"Ayer aquí estábamos en aviso rojo y al final cayeron cuatro gotas (y mucho viento), ahora en aviso amarillo no ha p… https://t.co/lacdJzSNvL"
2019-09-14 06:21:00,"@osomitaaa Mejor, me lo pongo de fondo y me quedo tieso en la cama en segundos xD"
2019-09-13 21:04:53,@PalomiAnime Me encanta Black Lagoon xD https://t.co/6hn6CyS1Ty
2019-09-13 20:50:27,"No puedo dejar de verlo en bucle, jajaja https://t.co/WJrzPF5YkW"
2019-09-13 19:55:17,"Me ha emocionado a tope, las batallas espectaculares, los efectos de sonido a tope (me han echado la bronca en casa… https://t.co/4q6yUY8sXW"
2019-09-13 19:51:57,"Estoy muy indeciso porque me ha gustado, y estaba pensando en darle un 9, no sé si me paso por la emoción del momen… https://t.co/O7FIpzDm7r"
2019-09-13 19:50:28,Rated Youjo Senki: Saga of Tanya the Evil Movie (anime) 4/5  - https://t.co/P6cwapPYsM #animeplanet
2019-09-13 17:48:01,"Día lluvioso... tarde de ""cine"" 😛 Empezando por la peli de Youjo Senki https://t.co/MU26RwDRo9"
2019-09-13 17:26:06,"Bueno, hoy ya no me da tiempo de más, para mañana aún me queda esto... https://t.co/FDDEA4Mfri"
2019-09-13 17:05:41,Ya tengo a los tres exploradores junto al manga de Made in Abyss editado por @Ivrea y la figura de Freeing que capt… https://t.co/K1fykf55Av
2019-09-13 16:56:51,"Riko viene con menos cositas, aunque trae tres rostros (sonriente, sin ver tres en un burro y cuando le mira el pit… https://t.co/e0VWAf6aPg"
2019-09-13 16:53:51,"Ahora le toca el turno de saludar (a ver si consigo seguir el hilo xD) a la compi de Reg, Riko, también de Made in… https://t.co/8DWGiS4bVV"
2019-09-13 13:53:04,"Yo no sé que estoy haciendo con el hilo, que entre el problema de mención por la web y que no pasa en la app, y aho… https://t.co/bMrjGozizM"
2019-09-13 12:21:47,"Aquí detalles de la caja y lo que trae: tres caras, varios brazos y manos, incluso una extensible, un rayo de plást… https://t.co/GPMAbGW3Ub"
2019-09-13 12:20:39,"Continúo con la nendoroid 1053, Reg, perteneciente a la serie manga Made in Abyss del autor Akihito Tsukushi. Tiene… https://t.co/GnIudbRdjc"
2019-09-13 11:41:24,"Empiezo el hilo de las últimas figuras que me han llegado, poco a poco. Sin embargo, lo primero es el precioso artb… https://t.co/yqg4aOrwWp"
2019-09-13 11:18:01,"Hola @Twitter , deberíais dejar una opción fácil de denunciar tweets de bulos, sobre todo los que pongan en situaci… https://t.co/A0rsnKzuuI"
2019-09-13 11:11:55,"@PalomiAnime @NormaEdManga Mi opinión en un tuit (yo no sirvo para estas cosas, pero tenía que dejarla, jajaja) https://t.co/op33TrtlVR"
2019-09-13 11:09:07,"La verdad que está bien como empieza, historia palomitera y entretenida 😎 https://t.co/U1gg8UOXLg"
2019-09-13 11:06:45,"@PalomiAnime @NormaEdManga A mí me ha gustado como ha empezado, justo lo que andaba buscando y tal como no lo vende la sinopsis 😈"
2019-09-13 09:56:27,@ChidoriBooks @Teppodama28 @YouTube Es que estoy hecho un reseñador nato jajajaja 🤣
2019-09-13 09:01:35,"Aún me quedaba un paquete por llegar, esto de parte de @ylliasviel , os enseño un poco del artbook para que veáis q… https://t.co/lQ9ngznzU6"
2019-09-13 08:57:35,"@editorialKODAI Yo decía para tenerlo ya, jajaja. La santa paciencia xD"
2019-09-13 08:46:00,@editorialKODAI ¿Y para que lleguen a mi casa?  😎
2019-09-13 08:44:29,"@PalomiAnime Apuntada estaba 👀 (Los de Polygon se podrían dejar de pelis y demás y meterse en la 3ª de Sidonia... ejem, ejem...)"
2019-09-13 08:42:07,"@ChidoriBooks @Teppodama28 @YouTube La verdad es que tal como iba leyendo, iba viendo las escenas en B/N, como esas… https://t.co/lUpZwxvdHo"
2019-09-13 08:22:54,"@ChidoriBooks @Teppodama28 @YouTube Muy chula, me enganchó de principio a fin. Un drama muy japonés, donde la muert… https://t.co/R9snJ4nqF1"
2019-09-13 08:17:51,"Uiss, que tarde de cine anime mw voy a pegar, a Tanya por un lado, y a Mumei por el otro. Y con el mal tiempo que h… https://t.co/dDCLlAQMZM"
2019-09-13 07:36:29,"@osomitaaa Es que con el dibujo de Irie, a ver quién se olvida 😅"
2019-09-13 07:33:13,RT @Cieminfo: El agua se lleva un puente del Siglo XVI en #AielodeMalferit  La crecida del río #Clariano se ha llevado un puente del SXVI d…
2019-09-13 07:33:04,@Cieminfo Muy fuerte...
2019-09-13 07:32:25,"Desde que me he despertado dándome la tabarra para que la bajará. Una vez bajo, ya no tienen tantas ganas de estar… https://t.co/lohfWFHC9B"
2019-09-12 21:52:22,"En esta lista me faltan dos, Makinami de Kotobukiya, que la pediré en breve (en cuanto tenga algo de dinero y hagan… https://t.co/cKS8DwRkUM"
2019-09-12 21:47:39,"¡Qué curioso! Desde que empezó el año todo lo que me iba llegando eran nendoroids con alguna figma o plastic model,… https://t.co/nEtBedb3Hv"
2019-09-12 21:45:18,"@PalomiAnime Esa, Kabukichou está en mi lista y alguna más, pero tal como van empezando voy añadiendo más y más xD.… https://t.co/MxE5m0ObIA"
2019-09-12 21:33:59,"@Haarp_project ¿Y observar el temporal a lo lejos? 🤔 Bueno, no, mañana tengo que aprovechar y hacer cosas 😅, aunque… https://t.co/57wgcvpZr2"
2019-09-12 21:32:18,RT @PalomiAnime: 🦋🍂¡Aquí os dejamos con nuestra guía #anime otoño 2019!🍂🦋 Un artículo elaborado por toda la redacción que recoge todos los…
2019-09-12 21:32:14,"@PalomiAnime Anda, echaré un ojo, que aún no sé muy bien que viene en la próxima temporada (creo recordar que muchas continuaciones xD)"
2019-09-12 21:13:29,"¿Alguien puede expulsar del Universo a esta persona? Bueno, no, que no era una paella, sino fideuá... ¿Alguien lo p… https://t.co/Ghtn3nMH8g"
2019-09-12 20:58:00,"¡Qué cosas! No podía ir al cine a verla por vivir en otra ciudad, y veo que la estrenan en aquí también, pero no es… https://t.co/V1SjVJ1V8a"
2019-09-12 19:58:08,"@sgreensan1 Sí, la verdad que sí, pero te queda esa sensación de que se ""corta"". Me hubiese gustado unos tomitos má… https://t.co/lDP8tiQ8cW"
2019-09-12 19:55:29,"Están graciosas, pero...  ¿Y Cid? ¿Y Caith Sith? ¿Y Vincent? ¿¡Y YUFFIE!? (Bueno, tal vez las saquen cuando aparezc… https://t.co/k3J3AJCpdm"
2019-09-12 19:47:07,¿Ahora sabéis por qué mañana me tomo el día libre (no solo por abrir moñecos chinos xD)? https://t.co/TJl3YmF9nm
2019-09-12 19:45:53,@osomitaaa Aquí ha habido censura 😎✂️  🤣
2019-09-12 19:44:08,"@sgreensan1 Es muy buena esa historia, pero creo haber leído que tuvo que acabar la historia porque la revista cerr… https://t.co/7UBWF7Qyu1"
2019-09-12 19:37:19,@HiroManga @blogvisual Parecen los lapices de colores de cole jajaja
2019-09-12 19:36:25,"Y luego dicen que hagamos caso de las cuentas oficiales... la A3 pasando por Villena (será la A-31), y ponen en Val… https://t.co/107LpfzL9G"
2019-09-12 19:28:05,"@HiroManga @blogvisual A mí me hubiese gustado que lo sacaran en una edición especial, con algún libreto por ejempl… https://t.co/rb0cKpTRFn"
2019-09-12 18:21:56,"La leshe, me voy a por una cosa a Correos y se me había olvidado que aún están en el horario de verano y no abren p… https://t.co/uU6TMHqyAi"
2019-09-12 18:19:08,@Tempomantis @Japan_Weekend @SelectaVision Ya puedes decir lo que quieras que hacen oídos sordos mientras se ríen e… https://t.co/YdSRkq6j03
2019-09-12 18:13:24,"@YumiiMitsuki Yo, en serio, me alegro que las circunstancias me impedieran, si llego que ir... fuego en cantidades apocalipiticas...."
2019-09-12 18:11:22,"@Figura4official @Hobbyfiguras @pulcjp @mwediciones Pues por raro que parezca, esta vez coincidimos... te reto a un duelo 😎"
2019-09-12 17:49:29,@Tempomantis https://t.co/oyIOi4mY1e
2019-09-12 17:33:39,"Mañana por el tema de la alerta por la gota fría nos tomamos el día de descanso, así que mañana me voy a unboxear t… https://t.co/SJbZSY7qIX"
2019-09-12 17:25:39,"@Figura4official @Hobbyfiguras @pulcjp @mwediciones Yo pensaba que te gustaría más las cantante por los ""flotadores… https://t.co/BJ2I8WjTJq"
2019-09-12 15:58:36,"@Figura4official @Hobbyfiguras @pulcjp @mwediciones Es una filial de Fots. Así que ya sabes, yo la quité de la lista en cero coma..."
2019-09-12 11:33:04,"@minotaurolibros Ahora me dejáis indeciso, ¿me busco la colección como buenamente pueda o me armo de paciencia a la… https://t.co/aOmJSaq7YF"
2019-09-12 11:28:41,"@Tempomantis Hale, los dineros!!!"
2019-09-12 09:51:40,"Los tres paquetes que llevan todo, sin aduanas, en reparto. Espero que no lleguen pasados por agua, sobre todo por… https://t.co/kqdGCatPAF"
2019-09-11 18:53:08,@4taevia @CoaliseEstudio Falta ella 👇🏻.... y el anime 😎 https://t.co/EIXLTnc2PD
2019-09-11 18:50:37,@PalomiAnime Es que os lo trabajáis ^^ https://t.co/iec8QeUvhs
2019-09-11 18:49:12,"@PalomiAnime @eduartyf Bueno, suelo estar bien informado jajaja xD. Pero si lo hacéis a vuestro estilo, estaría de… https://t.co/Fw2BodsdNJ"
2019-09-11 18:31:08,"Si no me equivoco, y añado, creo que no sale aún en este primer ¿episodio? Y que tampoco he visto ninguna imagen nu… https://t.co/UbnbBH85mv"
2019-09-11 18:27:15,"Todo el mundo hablando de FFVII Remake, que si Tifa, que si Aeris... ¿soy el único que tiene ganas de ver a Yuffie? https://t.co/JlvtZ9lzB1"
2019-09-11 18:22:58,"RT @NASAHubble: For the first time, researchers using Hubble have detected water vapor signatures in the atmosphere of a planet beyond our…"
2019-09-11 17:44:58,"@eduartyf @PalomiAnime Exacto, da gusto leerlos... solo les falta una sección de figuritas manga anime jajaja https://t.co/3khmMk3Ewj"
2019-09-11 17:39:48,@eduartyf @PalomiAnime No hacen copy paste como hacen los de RePeti2 (que los tengo hasta bloqueados) como los llam… https://t.co/opUst75Rnl
2019-09-11 17:34:36,"@eduartyf @PalomiAnime +1 es de las pocas webs que sigo, se podría decir la única. Ellos y blogvisual"
2019-09-11 11:04:09,"Tengo los tres paquetes en Madrid, y parece que se han salvado los tres. A ver si me los entregan antes de que acab… https://t.co/aclTthJE5W"
2019-09-11 10:59:34,"Hola @minotaurolibros , ¿alguna respuesta? https://t.co/iiM8wlYUiL"
2019-09-11 10:29:01,@PalomiAnime @crunchyroll_es @palacioprensa Ojalá :(
2019-09-10 19:14:18,"@Lastro87 Hay forma de hacerlo tú mismo, pagando solo el iva a través de hacienda sin pasar por ADT, pero lo tienen… https://t.co/BDZtiZ88K1"
2019-09-10 17:56:07,RT @Windrelyn: For Gondolin Week 2019 on Tumblr  Day 5 - Houses of the Mole and the Wing  In the other world where Maeglin call Idril “my d…
2019-09-10 17:53:49,"@ElAnilloUnico @Windrelyn Ese es un troll (nunca mejor dicho), ya me gustaría un manga o una serie de animación (El… https://t.co/Mz8ZBU16IQ"
2019-09-10 13:05:51,"@Lastro87 Están poniéndose la pilas los de aduanas, se pasan, no se salva el Airmail, pero tampoco el SAL, ¿eh? Que… https://t.co/TbEH6vvoW9"
2019-09-10 12:58:56,"@YumiiMitsuki @Japan_Weekend @SelectaVision Yo iba a ir por esos dos, si llego a ir, me gasto el dinero y me pasa e… https://t.co/1Lcito0ain"
2019-09-10 12:53:29,"@Japan_Weekend @YumiiMitsuki @SelectaVision A ver, ¿dónde pone en este anuncio algo de Selecta? Yo veo que pone ""do… https://t.co/KdJNLwsom2"
2019-09-10 12:47:27,¡MENTIRA! https://t.co/9n7TgbarZh
2019-09-10 12:34:00,"@SelectaVision Sois unos chapuzas, como todo lo que hacéis"
2019-09-10 12:32:34,"""Ahora que tenéis las entradas y no avisamos desde el principio, nos reímos en vuestras caras."" Estuve a punto de i… https://t.co/XYYOrD4BvY"
2019-09-10 12:29:22,"@Japan_Weekend @YumiiMitsuki @SelectaVision No dijistéis nada desde el principio. Yo no voy, pero si llego a compra… https://t.co/dRrP37gshf"
2019-09-10 12:11:46,"@osomitaaa Me gustaría que llegara algún día, pero pido demasiado xD"
2019-09-09 20:36:17,"3 of 5 stars to La Balada del Viento y los árboles, V... by Keiko Takemiya https://t.co/TU63bhJQsz"
2019-09-09 19:30:32,"@JotaCSGO Pero yo la versión ""Renault"" xD"
2019-09-09 19:09:49,@Lastro87 @HikariN0Yume @PaniniComicsEsp @SakuraPhoebe El primero de Spice &amp; Wolf estaban también igual de mal el e… https://t.co/4muE7RuRBu
2019-09-09 19:05:46,"@YumiiMitsuki Bueno, yo la muñeca y las gafas las tengo de las parform... pero aún así, son sosas. Lo único lo que… https://t.co/wbqiBM4NVU"
2019-09-09 18:51:17,"@YumiiMitsuki Es que Rei siempre será más mona que Asuka 😎 Yo no sé que hacer por lo mismo, Rei está bien, pero sob… https://t.co/hWn46QJN60"
2019-09-09 18:49:35,Llevo todo el día tarareando la canción de la Historia Interminable por culpa de Stranger Things que la acabé anoch… https://t.co/T8QlDD9qw9
2019-09-09 12:49:11,@editorialKODAI @imagicabranch_a Yo tengo muchas ganas de que llegue ya... santa paciencia 😅
2019-09-09 12:35:40,Me llama muy mucho... y va a caer. https://t.co/l2LVHoothk
2019-09-09 12:08:57,"Aunque sea para llorar por cometer estos errores, me he reído del fallo garrafal. Es para flipar... https://t.co/ONuIScgJUZ"
2019-09-09 11:38:33,@ylliasviel Me parto jajaja
2019-09-09 09:00:20,@Figura4official https://t.co/CAGXcIwnzI
2019-09-09 08:43:24,"Soy el único que ve rara la cara de la nendo de Asuka. A parte, la veo muy muy sencillita... https://t.co/BjXaHjoq3I"
2019-09-08 18:36:44,Este corto siempre estará en un huequito de mi corazón 😊 https://t.co/IEywIpOJHh
2019-09-08 17:00:22,"""Yo no sé por qué os compráis figuras originales si las falsas están muy bien...""  Pues a ver si encontráis las dif… https://t.co/FI0AUr1Vg3"
2019-09-08 14:12:55,"Por fin han dicho cuando empieza, en enero 😊 https://t.co/yfz9YZfVaI"
2019-09-08 14:02:09,@blogvisual @palacioprensa @crunchyroll_es Ojalá estar en Madrid :(
2019-09-08 10:26:33,"@Figura4official A mí me gustó, es tope gore. El manga veo que no se cortan nada xD"
2019-09-07 18:54:51,Rated Modest Heroes (anime) 3/5  - https://t.co/UZ9kD52RZj #animeplanet
2019-09-07 16:37:25,"@JotaCSGO La veré en cuanto pueda, la uno me refiero xD"
2019-09-07 16:34:32,"Hostis, que no me había enterado yo de esto por culpa del dichoso ataque de alergia que sufrí ayer 😮 https://t.co/fdy2mks2od"
2019-09-07 10:08:34,Ya sé que ver esta tarde si no pasa nada...  https://t.co/FBayrUBvFN
2019-09-07 09:59:53,"@JotaCSGO Acabo de ver que la primera la acaban de poner en Netflix, que susto me ha dado xD. La veré entonces."
2019-09-06 17:44:18,RT @microsiervos: Esta noche es el momento de la verdad para la misión india a la Luna Chandrayaan 2. https://t.co/889InUrkuY
2019-09-05 21:40:10,"Como las de ""les gallines"" se enteren de la forma que tienen de reproducirse ciertos insectos  como las chinches, p… https://t.co/PbbGbdo76a"
2019-09-05 18:02:11,"4 of 5 stars to Given, Vol. 2 by Natsuki Kizu https://t.co/KV4n0ukRn6"
2019-09-05 18:01:14,"@ChidoriBooks ""Consigue tu muñeca de la gatita parturienta estas navidades"" xD"
2019-09-05 17:43:11,Esto... ¿eh? 😶 https://t.co/1FUZMGTspG
2019-09-05 15:36:12,"@HiroManga Si me dices, pues por problemas A o B vamos a pasar la periodicidad a bimestral, trimestral, semestral..… https://t.co/zXHlLxjE25"
2019-09-05 15:22:04,"@HiroManga Es más, el cuarto de Tanya me lo compré en italiano para probar, pero es que tiene tanta palabra xD"
2019-09-05 15:20:20,@HiroManga Si solo fuera esa... Diario de guerra la tuvieron también muy parada. De Killing Morph ya no se sabe nad… https://t.co/nOxzWpgO2L
2019-09-05 12:21:09,@Tempomantis Y hay prizes que me gustan más...
2019-09-05 10:43:56,"@Tempomantis No me seas un dramas como Jose,  Gatith, vamoh a calmarnoh 🤣"
2019-09-05 09:43:25,"A los que pedís por SAL confiados de que no va a caer en aduanas, acabo de ver como a una conocida le han retenido… https://t.co/2EFRBwRhPl"
2019-09-05 08:34:53,@Figura4official https://t.co/WCv5dWLPCZ
2019-09-05 08:33:44,"@AnimeGirl210 Bueno, como tiene iman la pones y se sujeta y parece que no este rota, la primera foto ya está así xD… https://t.co/RX75TKk0iV"
2019-09-05 08:20:01,@Tempomantis Al menos no ha sido la cabeza... ... ... 😬
2019-09-05 08:19:03,"@AnimeGirl210 Sabes que las cupoche llevan iman en los pies, no? Pues la iba a quitar para limpiarla y cambiarla de… https://t.co/A8HQIKt8J5"
2019-09-05 08:06:20,"Francamente prefiero gastarme el dinero en, por ejemplo, artbooks o merchan variado de la serie o autor"
2019-09-05 07:44:14,F https://t.co/NTFv2e8AFQ
2019-09-05 07:43:20,"@eduartyf Jajaja, no pasa nada, entre tanta gente es normal, yo solo sé inglés nivel porno 😬"
2019-09-05 07:09:14,"@eduartyf No sé ningún idioma, así que para mí como que no 😕"
2019-09-05 06:59:22,"@eduartyf Yo antes me las compraba por ""coleccionar"" ya que tengo algunas que no he puesto ni los bluray, solo abie… https://t.co/NyOHdSnTt1"
2019-09-05 06:45:27,@eduartyf *libretos
2019-09-05 06:44:51,"@eduartyf Pero no le imponen no sacar unos libreros cutres que parecen propaganda (bueno, he visto propaganda con m… https://t.co/Hd3cbLXIjy"
