timestamp,tweet_text
,We love kids books. Home to a growing number of amazing imprints and authors. We can't wait to introduce you to a fantastic book.,
2019-11-13 17:03:48,"Out of tragedy, ordinary people became heroes. This is their story.  TORPEDOED by Printz-honor winning author… https://t.co/1tDoWjN5Na"
2019-11-13 16:01:12,"Andy and Terry are on the run from the Story Police!  To escape, they draw a dot, which becomes a manhole. Then, th… https://t.co/NyESfL27w5"
2019-11-13 15:31:00,Happy World Kindness Day!  Celebrate today &amp; every day with FINDING KINDNESS by @underwoodwriter &amp; Irene Chan. Don'… https://t.co/pgchZTg4Se
2019-11-13 15:01:07,Do you want bestselling author of WISHTREE @kaaauthor to visit your community? Create your own wishtree in your sch… https://t.co/BJQnDJEOg2
2019-11-13 00:00:41,"Set during the Syrian refugee crisis, NOWHERE BOY by @MarshKatherine is a heartwarming story about friendship, resi… https://t.co/DyPP0v9iRo"
2019-11-12 22:00:14,".@underwoodwriter and Irene Chan's picture book, FINDING KINDNESS, is the perfect read for World Kindness Day and e… https://t.co/yLccwkjKrI"
2019-11-12 20:00:37,"A moving picture book from Queer Eye star Karamo Brown, his son Jason Brown, and illustrator @foxville_art, I AM PE… https://t.co/OEkRXwkdV6"
2019-11-12 19:00:50,"Friends come in all sorts of shapes and sizes. In Amos McGee's case, all sorts of species, too! Celebrate 10 years… https://t.co/W2G5I37E8H"
2019-11-12 18:00:07,"Discover your new craft obsession with TINY WORLD from @odddotbooks! Created for beginners, these kits are equipped… https://t.co/1mh3kvZgSB"
2019-11-12 17:00:56,"Meet Doug Underbelly!   He just wants to be normal, but... He lives in a creepy mansion. He's lousy at sports. AND… https://t.co/uYpnU2n0VR"
2019-11-12 16:00:31,SPY PENGUINS: THE SPY WHO LOVED ICE CREAM written by Sam Hay and illustrated by @mjcartoons features two young adve… https://t.co/oUjlLM9fUx
2019-11-12 15:29:11,"RT @Loveofxena: The moon is nearly full, sitting in a clear sky.  I want to take Fry Bread: A Native American Family Story by @noblemaillar…"
2019-11-12 15:00:34,"Meet BABY, the newest addition to @JimmyFallon's bestselling picture book collection. In stores now!… https://t.co/IiZESrTiNk"
2019-11-12 00:00:09,Looking for the perfect baby shower gift? Look no further than the newest book by @Nancy_Tillman. Enter to win a si… https://t.co/uhKvSCInGT
2019-11-11 23:00:28,"November is #NationalAdoptionMonth and we're currently reading @marilock's FOR BLACK GIRLS LIKE ME, a lyrical comin… https://t.co/JqVQ0toGtv"
2019-11-11 22:00:34,"In THE 117-STORY TREEHOUSE, Terry tries to narrate as well as draw and the story goes out of control! Order… https://t.co/FN4ubnOrNZ"
2019-11-11 20:38:41,RT @01FirstSecond: Calling all @GeneLuenYang fans! Don't miss your shot at winning an advance copy of his upcoming #DragonHoops and this EP…
2019-11-11 20:01:32,"Best friends Little Elliot and Mouse are back for another adventure—and this time, they're looking for the Christma… https://t.co/p9jWb9k2TE"
2019-11-11 18:01:47,THIS IS BABY by @JimmyFallon is the perfect book for new babies and parents alike! Get your copy:… https://t.co/rtTjHjZVC9
2019-11-11 17:34:10,RT @HeatherKassner: AHHHHH!!! ARCs for THE FOREST OF STARS arrived!!! 🎪🖤✨ @MacKidsBooks https://t.co/MI7XsMvaut
2019-11-11 17:33:59,"RT @HornBook: #Poetry #ReviewoftheWeek: ""Up Verses Down: Poems, Paintings, and Serious Nonsense"" by @CalefBrown; illus. by the author (Otta…"
2019-11-11 17:33:46,RT @RaincoastBooks: Watch Queer Eye star Karamo and his son Jason talk about their new children's book 'I Am Perfectly Designed' on the @TO…
2019-11-11 17:33:35,RT @BookPeople: Co-authors (and father &amp; son) Karamo and Jason “Rachel” Brown read their picture book I AM PERFECTLY DESIGNED! Y’all are a…
2019-11-11 17:33:23,"RT @PhilBildner: ""And in giving Burke a place to shine, his book is worthy of several high fives, forearm bashes, chest bumps, daps, and an…"
2019-11-11 17:33:16,"RT @HornBook: Starred #PictureBook #ReviewoftheWeek: ""Vroom!"" by Barbara McClintock (@MacKidsBooks) https://t.co/ZQoflMjDok https://t.co/sB…"
2019-11-11 17:01:49,"Hop on board @petergbell's middle-grade fantasy series, THE TRAIN TO IMPOSSIBLE PLACES, with book 2 THE GREAT BRAIN… https://t.co/QFqgWan0Zo"
2019-11-11 16:00:59,"If you've ever experienced a bully you'll definitely relate to the newest characters in @JBurtBooks novel, THE TORN… https://t.co/yBc9TdmwtP"
2019-11-11 15:01:27,FRY BREAD by debut author @noblemaillard &amp; award-winning illustrator @juanamartinez is a celebration of old and new… https://t.co/fqlJewInmm
2019-11-11 00:00:46,Try your hand at easy-to-learn craft projects with TINY WORLD from @odddotbooks! These DIY craft kits come with mat… https://t.co/QZTE3DTSQ4
2019-11-10 23:00:31,Did you love YOUR BABY'S FIRST WORD WILL BE DADA and EVERYTHING IS MAMA by @JimmyFallon? Then you won't want to mis… https://t.co/2psKMjU6ys
2019-11-10 22:00:14,Celebrate kindness with FINDING KINDNESS 🎈🎈 by @underwoodwriter and Irene Chan. You and your little readers will le… https://t.co/n51OemuCp6
2019-11-10 20:00:38,"A celebration of everyday accomplishments and achievements to come, @Nancy_Tillman's I KNEW YOU COULD DO IT! is the… https://t.co/dQTBTclsom"
2019-11-10 19:00:32,Do you love non-fiction novels about strong female athletes? Look no further than MIGHTY MOE by @rachelswaby and… https://t.co/WbPv9Nt7ju
2019-11-10 17:01:21,"Uncover a new batch of mysteries with Moxie and Milton in THE REAL MCCOYS: WONDER UNDERCOVER, the newest book in th… https://t.co/G0L9wG8kfm"
2019-11-10 15:30:00,Happy 50th Anniversary @SesameStreet!!!  Thank you for introducing us to some of our very favorite life long friend… https://t.co/CVHtOAince
2019-11-10 00:00:54,Museums are filled with lost things from the past—so what happens when a boy loses his new toy in this land of hist… https://t.co/CTkTB4sne1
2019-11-09 23:00:42,"Read all three in THE REAL MCCOYS, a middle-grade series full of humor and mysteries galore by @writingmatthew and… https://t.co/1d4TOsRPAg"
2019-11-09 22:00:13,"I KNEW YOU COULD IT! is the perfect book to tell a child, ""I believe in you."" Enter to win a prize pack of goodies… https://t.co/ovclRcgy7H"
2019-11-09 21:00:07,Want to win a piece of exclusive art from @PaulGilligan10's KING OF THE MOLE PEOPLE? Enter for your chance now:… https://t.co/gInOF46rF1
2019-11-09 20:00:30,"Calling all booksellers, educators, and librarians! Do you love WISHTREE by Katherine Applegate? Create your own wi… https://t.co/yJVb0urlcm"
2019-11-09 19:00:27,"In FRY BREAD by @noblemaillard &amp; @juanamartinez, discover how a traditional recipe can mean so much more than food.… https://t.co/0NgfpTO8Fx"
2019-11-09 18:00:32,".@underwoodwriter and Irene Chan's picture book, FINDING KINDNESS, is the perfect read for World Kindness Day and e… https://t.co/R0UPYLrrVX"
2019-11-09 17:30:00,Ever wondered how the CIA and FBI were formed? Learn more by entering our @goodreads giveaway for a young reader's… https://t.co/bWIDjPspLf
2019-11-09 17:00:12,Are Little Elliot and Mouse your favorite picture book duo? Join them on their journey to find the Christmas spirit… https://t.co/SGcB83e0LH
2019-11-09 16:01:23,.@alyssa__holly's middle-grade novel is a heartwarming tale about a young boy's mission to buy his grandfather's pr… https://t.co/tErMTGsAb9
2019-11-09 15:30:00,THE REMARKABLE JOURNEY OF COYOTE SUNRISE by @DanGemeinhart is a heartbreakingly beautiful middle-grade novel AND it… https://t.co/34SM2Jihiv
2019-11-09 15:01:02,"A moving middle-grade survival story and true account of the sinking of “The Children’s Ship” during WWII, TORPEDOE… https://t.co/RNav4rQsf2"
2019-11-08 23:00:33,.@JBurtBooks has done it again! Don't miss Bell's unforgettable story as he navigate how to deal with the class bul… https://t.co/xAEqFxDSJw
2019-11-08 21:00:35,"🚨ADORABLE PICTURE BOOK ALERT!🚨  Learn all about THIS IS BABY, bestselling author @JimmyFallon's newest picture book… https://t.co/rHvZg378U9"
2019-11-08 20:00:17,It's back-to-school season! The perfect time to discover a new series. Meet our favorite penguins Jackson and Quigl… https://t.co/yNcBmjsxWW
2019-11-08 19:00:43,"In the #TreehouseSeries, Andy tells the stories and Terry draws the pictures. But what happens when they decide to… https://t.co/TKpvRIZe6o"
2019-11-08 18:01:14,Author/illustrator @Nancy_Tillman returns with a new inspirational picture book about resilience and achievement. O… https://t.co/Vo8QmXxcpK
2019-11-08 17:00:36,How can we be kind in our community? Check out the #FindingKindness checklist below for all the different ways we c… https://t.co/dxhpk2RO2B
2019-11-08 15:00:42,Book 2 of THE TRAIN TO IMPOSSIBLE PLACES is out now! Start reading THE GREAT BRAIN ROBBERY by @petergbell now:… https://t.co/LDBhEg5XAJ
2019-11-08 00:00:22,"Told in lively and powerful verse, FRY BREAD by debut author @noblemaillard &amp; award-winning illustrator… https://t.co/HpqQyorsHk"
2019-11-07 23:30:00,"Calling all nonfiction fans, CHARLES AND EMMA by acclaimed author @DHeiligman is on sale for $2.99 TODAY ONLY… and… https://t.co/BInWjbfonY"
2019-11-07 23:00:13,Calling all non-fiction fans! Don't miss MIGHTY MOE: The True Story of a Thirteen-Year-Old Women's Running Revoluti… https://t.co/uCQVghpKgt
2019-11-07 22:00:11,"Little ones are sure to love MERRY CHRISTMAS, LITTLE ELLIOT by @MikeCurato, the newest selection in the Little Elli… https://t.co/SPSqeOu1ME"
2019-11-07 21:01:07,"If you've ever wondered how Michelangelo got it done, Lynn Mercoiret's TINY WORLD: SCULPTING! for you! For first-ti… https://t.co/gYYoRn1JkG"
2019-11-07 20:00:14,"Both heartbreaking and hopeful, @dianeguerrero__'s MY FAMILY DIVIDED is a powerful testimony to the nightmarish str… https://t.co/X3qJ4kExKc"
2019-11-07 19:00:55,There's a new addition to the @JimmyFallon picture book collection: it's time to meet BABY! Start reading THIS IS B… https://t.co/Xy7LKOmvCz
2019-11-07 18:01:49,SNAZZY CAT CAPERS: THE FAST AND THE FURRIEST written and illustrated by @DeannaandNeil has fun heist adventures fil… https://t.co/eFAfECS4XW
2019-11-07 17:00:57,Celebrate everyday accomplishments with the newest book by @Nancy_Tillman! Enter to win a signed copy of I KNEW YOU… https://t.co/wVzJUBVTs8
2019-11-07 16:30:00,@DHeiligman's CHARLES AND EMMA is a thought-provoking account of how Charles Darwin's marriage influenced his work… https://t.co/hAzexZGvgP
2019-11-07 15:00:12,"Download the activity kit based on @cordellmatthew’s new picture book, EXPLORERS today! Activities include a scaven… https://t.co/BiobPOBaLE"
2019-11-07 00:00:37,"""I believe in you."" Words we don't often hear but need more than we imagine. @Nancy_Tillman's new picture book reas… https://t.co/b8T96rr41X"
2019-11-06 23:00:07,Do you love THIS IS BABY by @JimmyFallon? Enter to win a signed copy by posting a photo of your kiddo reading Jimmy… https://t.co/kzAkLOx9l9
2019-11-06 22:00:37,"Suzy has a package to deliver, and only the Impossible Postal Express can help her! Read about her adventure with a… https://t.co/BLvnNPGwTt"
2019-11-06 20:00:40,"Moxie McCoy, fourth grade detective, goes undercover in the third book of @writingmatthew and @drawingrobb THE REAL… https://t.co/FjLpehFi2m"
2019-11-06 19:23:00,"Self care and face mask fanatics, we have a book for you! Enter to win MAKE YOUR OWN BEAUTY MASKS, a glam and gifty… https://t.co/YgBosf4kSj"
2019-11-06 19:00:36,"According to @AuthorAnnMartin, @JBurtBooks is a ""storytelling magician."" Don't miss his next unforgettable novel, T… https://t.co/1HY1C8GNNI"
2019-11-06 17:08:24,RT @DHeiligman: So grateful for this review of Torpedoed  https://t.co/ouMBx9iWJv @MacKidsBooks https://t.co/BzBOcwfPyA
2019-11-06 17:00:24,"⭐️""Nonfiction maestro Heiligman here tells a riveting wartime story.""—Horn Book  Start reading TORPEDOED by award-w… https://t.co/XJHXGj3wtT"
2019-11-06 16:01:51,Don't open the Door of Doom in the latest installment of the @nytimes bestselling #TreehouseSeries! Get ready for t… https://t.co/x2FXFRWZy0
2019-11-06 15:01:09,"Calling all booksellers, educators, and librarians! Do you love WISHTREE by @kaaauthor? Create your own wishtree an… https://t.co/6gvyoGlXoW"
2019-11-06 00:00:42,"You'll laugh out loud, shed a few tears, and cheer for Coyote Sunrise as she takes a 3,600-mile journey home in THE… https://t.co/Zr95FbT8TW"
2019-11-05 23:00:29,"Life is short. Save the world, live to tell the tail.   In SNAZZY CAT CAPERS: THE FAST AND THE FURRIEST, the second… https://t.co/sjySMPlRmI"
2019-11-05 21:00:08,A toy bird lost in a museum. Two families meet by chance.  An unexpected friendship forms. Don't miss Caldecott Med… https://t.co/dC0YH9JWpP
2019-11-05 19:00:12,"Where do you find kindness in the community? Order your copy now, so you can read all the wonderful ways we can be… https://t.co/AQhKJDEYF8"
2019-11-05 18:31:00,Calling all cat lovers! 😻  We've got the PURR-fect prize pack for the cool kittens in your life! Enter for your cha… https://t.co/IDqqugpnKC
2019-11-05 18:01:37,Printz honor-winning book VINCENT AND THEO by @DHeiligman is now available in paperback! Get your copy of this hear… https://t.co/uG3X9yvWLY
2019-11-05 17:00:50,"Shake off your pins and needles and create a tiny, adorable cactus with El Patcha's TINY WORLD: EMBROIDERY! This cr… https://t.co/DPj9N94ofa"
2019-11-05 16:00:37,Don't miss out on the second book in the Spy Penguins series! Join penguins Jackson and Quigley as they embark on a… https://t.co/nDVlYCRcv7
2019-11-05 15:54:53,I AM PERFECTLY DESIGNED is finally here!  Follow the link to order this heartfelt picture book by @QueerEye star Ka… https://t.co/YQg57DSiqi
2019-11-05 15:53:13,"RT @Tiff_Liao: Happy Book Birthday, Karamo, Jason &amp; @foxville_art!  #IAmPerfectlyDesigned is out today! You have poured your hearts &amp; souls…"
2019-11-05 15:00:23,"Let's meet...  Baby!  From Baby’s HEAD to Baby’s TOES, there are so many parts of Baby you should know. But what’s… https://t.co/vbYb9olqeE"
2019-11-05 00:00:08,Looking for the perfect baby shower gift? Look no further than the newest book by @Nancy_Tillman. Enter to win a si… https://t.co/tzzo4qbKQH
2019-11-04 23:00:57,"In TORPEDOED, award-winning author @DHeiligman masterfully tells the true story of the attack and sinking of the Ch… https://t.co/0hPILArsqi"
2019-11-04 22:00:24,Calling all #TreehouseSeries fans! Andy and Terry are back at it in THE 117-STORY TREEHOUSE by @AndyGBooks. Can you… https://t.co/DmJwUBrEuZ
2019-11-04 21:00:06,Babies! Books! Babies reading books!  Share a photo of your baby w/ @JimmyFallon's latest book &amp; #ThisIsMYBaby for… https://t.co/2NxouRxGFV
2019-11-04 20:00:22,"Tag along with Little Elliot and friends on their quest to bring back the Christmas spirit in MERRY CHRISTMAS, LITT… https://t.co/mTsQsNi2vg"
2019-11-04 18:51:37,RT @MacKidsSL: 📣 Announcing #MacKidsStaffPicks Winter 2020 Picture Books!  🚘 ALICE ACROSS AMERICA @SG_Marsh @gilbertford ☀️ SUNNY @CeliaKra…
2019-11-04 18:01:00,THIS IS BABY by bestselling author and TV personality @JimmyFallon is FINALLY HERE! Learn all about this adorable n… https://t.co/oLJJ2EZzMm
2019-11-04 17:01:12,"Journey through impossible places like Trollville, Uncanny Valley and Cloud Forge in THE TRAIN TO IMPOSSIBLE PLACES… https://t.co/sT1fsFv5gr"
2019-11-04 16:00:54,Bell Kirby may be an expert at systems and planning but he doesn't have a plan in place for dealing with Daelynn Go… https://t.co/36oPw3bWcm
2019-11-04 15:01:11,4 stars for FRY BREAD! ⭐️⭐️⭐️⭐️ Find out why everyone is raving about the vibrant new picture book by debut author… https://t.co/y8Y2sPhjAM
2019-11-04 14:00:59,"Middle-grade mystery fans, we have a book series for you! Start reading THE REAL MCCOYS by @writingmatthew and… https://t.co/7DcmvtIBw1"
2019-11-04 00:05:46,Linda Li-Chee-Ming's TINY WORLD: FELTING! will teach you how to make a tiny bear and bird duo from scratch! With ea… https://t.co/nHATbP0doO
2019-11-03 23:01:12,"First DADA, then MAMA, now BABY! Don’t miss THIS IS BABY by #1 @NYTimes bestselling author @JimmyFallon! Get your c… https://t.co/NjNvLEL95s"
2019-11-03 22:00:11,.@underwoodwriter and Irene Chan's FINDING KINDNESS reminds us that we all have the ability to be kind in our commu… https://t.co/DKySytKpPW
2019-11-03 20:00:21,"A celebration of everyday accomplishments and achievements to come, @Nancy_Tillman's I KNEW YOU COULD DO IT! is the… https://t.co/OZmYKe5JFi"
2019-11-03 19:00:29,"In 1967, Maureen Wilton broke the women’s marathon world record at age 13 but was met first with misogyny and contr… https://t.co/gocwCr4HM4"
2019-11-03 17:00:41,Hey @QueerEye fans! @KaramoBrown and his son Jason have a new picture book! Preorder I AM PERFECTLY DESIGNED and en… https://t.co/uPEbiwJu2h
2019-11-03 15:00:39,Each chapter in SNAZZY CAT CAPERS: THE FAST AND THE FURRIEST written and illustrated by @DeannaandNeil is headlined… https://t.co/DU78jg5b06
2019-11-02 23:01:03,A toy bird lost in a museum. Two families meet by chance. An unexpected friendship forms. Enjoy Caldecott Medalist… https://t.co/Ep7cNpE24O
2019-11-02 22:00:40,"Don't miss THE REAL MCCOYS: WONDER UNDERCOVER, the third book in @writingmatthew and @drawingrobbcritically acclaim… https://t.co/obVF6HoGrf"
2019-11-02 21:32:00,ICYMI: We're celebrating Bad Kitty all week long with the PURR-fect prize pack!  Enter for your chance to win an ad… https://t.co/nCIMlvLTcV
2019-11-02 21:00:15,"I KNEW YOU COULD IT! is the perfect book to tell a child, ""I believe in you."" Enter to win a prize pack of goodies… https://t.co/eDHxNaH9Fi"
2019-11-02 20:00:31,"VINCENT AND THEO, the Printz honor-winning book by acclaimed author @DHeiligman, is now available in paperback! Sta… https://t.co/BO6R9uU3Ii"
2019-11-02 19:00:27,"Schools, libraries, &amp; bookstores around the US have celebrated WISHTREE by creating one of their own! Take a photo… https://t.co/szUg7kWqbd"
2019-11-02 18:00:29,"Discover why the @nytimes called FRY BREAD by @noblemaillard &amp; @juanamartinez ""a wonderful and sweet book that take… https://t.co/bbJSL3jVTb"
2019-11-02 17:00:35,"Do you love picture books with a classic Christmas feel? MERRY CHRISTMAS, LITTLE ELLIOT by @MikeCurato has all of t… https://t.co/WpcD0v2S4a"
2019-11-02 16:00:19,THIS IS BABY sweepstakes alert!  Post a photo of your cute kiddo reading @JimmyFallon's latest book with… https://t.co/FPmwbsYL4O
2019-11-02 14:00:51,"⭐️""Impressively crafted."" —Kirkus Reviews ⭐️""Compelling."" —Booklist ⭐️""Riveting."" —Horn Book ""Harrowing.""—Publisher… https://t.co/aD8efak44x"
2019-11-02 13:30:00,"Our favorite author and cookie loving friend @MeCookieMonster, is celebrating a birthday TODAY!!!… https://t.co/JMfF185ODy"
2019-11-01 23:00:13,"There is nothing like having a best buddy to share all the special moments. Two of our favorite BFFs, @SesameErnie… https://t.co/J0xccg6ULY"
2019-11-01 22:00:25,Only a force of nature can stop this bully... 🌪  THE TORNADO by @JBurtBooks is here! Pick up a copy of this incredi… https://t.co/9x872qbukO
2019-11-01 21:00:50,Join Suzy as she travels through the depths and heights of Trollville to deliver a package in THE TRAIN TO IMPOSSIB… https://t.co/u4QX29AI4I
2019-11-01 20:00:25,#1 @NYTimes bestselling author @JimmyFallon is back with another adorable picture book... THIS IS BABY! Get your co… https://t.co/63HmRTvJkW
2019-11-01 19:00:20,"In SPY PENGUINS: THE SPY WHO LOVED ICE CREAM written by Sam Hay and illustrated by @mjcartoons, two young adventure… https://t.co/hxAkUL2M1K"
2019-11-01 18:01:02,"It started with a 13-story treehouse, but Andy and Terry decided to add more floors of games and adventures. Find o… https://t.co/QzpqIbOPEN"
2019-11-01 17:33:00,A comedian without funny tools is like Batman without his utility belt. Enter our Ultimate Joke Master giveaway for… https://t.co/0UuBylV20f
2019-11-01 17:01:30,Author/illustrator @Nancy_Tillman returns with a new inspirational picture book about resilience and achievement. O… https://t.co/0FYMPn3MmR
2019-11-01 16:00:24,I knew you could do it.  I knew that you could.  Of everyone out there  I knew that you would.   Read… https://t.co/zP2RklUGbi
2019-11-01 00:00:41,FRY BREAD by debut author @noblemaillard &amp; award-winning illustrator @juanamartinez is a celebration of old and new… https://t.co/wbHNTZLZOT
2019-10-31 23:00:44,".@KaramoBrown fans, listen up! Preorder I AM PERFECTLY DESIGNED &amp; submit your receipt for a chance to win a PHONE C… https://t.co/IEuDXKdKEF"
2019-10-31 22:02:11,".@rachelswaby and @kitfoxwrites present MIGHTY MOE, the untold true story of runner Maureen Wilton, whose world rec… https://t.co/3ZQ7kFFffn"
2019-10-31 21:00:17,"Little Elliot and Mouse are in search of the Christmas spirit in @MikeCurato's latest MERRY CHRISTMAS, LITTLE ELLIO… https://t.co/NYZKhN6zE4"
2019-10-31 20:00:38,Always wondered how to create your own mini-pins? @keithZoo's TINY WORLD: PINS! craft kits come with the materials… https://t.co/y3Epzbn7pg
2019-10-31 19:00:57,"Moxie McCoy is back and ready to uncover more mysteries in THE REAL MCCOYS: WONDER UNDERCOVER, the third book in th… https://t.co/KO6rOx755E"
2019-10-31 18:30:00,Every day is National Cat Day when you are hanging out with Bad Kitty!  Don't miss your chance to enter to win the… https://t.co/Zqxd5hHZDW
2019-10-31 18:00:22,"Looking for the perfect gift for the new mama (or dada!) in your life? Pick up a copy of THIS IS BABY, bestselling… https://t.co/D6iPYdm5mw"
2019-10-31 17:02:07,"In SNAZZY CAT CAPERS: THE FAST AND THE FURRIEST written and illustrated by @DeannaandNeil, each chapter is headline… https://t.co/SNNpDTlvy4"
2019-10-31 16:02:20,"Don't miss TORPEDOED, a heartbreaking and powerful middle-grade nonfiction story by award-winning author… https://t.co/bSOWb4nfWt"
2019-10-31 14:30:00,#HappyHalloween!  Celebrate with the funny new picture book TWINS by @Ciccotello. It's about a boy and his twin gir… https://t.co/Ijy3ZE7ygm
2019-10-31 14:02:06,"RT @Jess__Red: 🍁THE MIRACULOUS has been out for 3 months! And it is very much an October book, w changing leaves &amp; graveyards &amp; Halloween!…"
2019-10-31 14:01:02,"Discover history, adventure, and friendship in Caldecott Medalist @cordellmatthew's new picture book, EXPLORERS. Ou… https://t.co/Rqizb1Hism"
2019-10-31 00:00:22,"Hop on board @petergbell's middle-grade fantasy series, THE TRAIN TO IMPOSSIBLE PLACES, with book 2 THE GREAT BRAIN… https://t.co/wgLmQkTF8h"
2019-10-30 23:00:53,"""I believe in you."" Words we don't often hear but need more than we imagine. @Nancy_Tillman's new picture book reas… https://t.co/6WRm2Szmpx"
2019-10-30 22:00:07,Hey @JimmyFallon fans!  Post a photo of your little one reading THIS IS BABY with #ThisIsMYBaby now through 11/7 an… https://t.co/T4lVqZtC4q
2019-10-30 20:02:16,National Book Award finalist @SteveSheinkin's latest is the gripping story of the fearless women pilots who aimed f… https://t.co/txhtzbeMXt
2019-10-30 18:00:41,"A story of friendship, bullies, and standing up for what's right, don't miss THE TORNADO, the newest novel by… https://t.co/9ZuURnDYog"
2019-10-30 16:00:26,What would you do to keep the magic of books alive? Learn about Dita's courageous story in THE LIBRARIAN OF AUSCHWI… https://t.co/DjZ8zjyx1N
2019-10-30 16:00:22,"RT @thestartupsquad: 📚Sneak peek at the cover of our second book, Face the Music! The Startup Squad’s journey continues on May 5, 2020 and…"
2019-10-30 15:30:00,".@Theresa_Julian's THE JOKE MACHINE is the only joke book you will ever need, and we've got some helpful tools to h… https://t.co/Izlhel9Xeu"
2019-10-30 15:00:47,"Do you love the #TreehouseSeries? Get ready for DOTS, PLOTS, AND DARING ESCAPES in Andy and Terry's latest adventur… https://t.co/X6xIm6XRFh"
2019-10-30 14:01:00,Do you want bestselling author of WISHTREE @kaaauthor to visit your community? Create your own wishtree in your sch… https://t.co/ulMwlFM4oC
2019-10-29 23:00:40,The Baby-Sitters Club meets Goosebumps in the Babysitting Nightmares series by @bookatshepherd! Read the first book… https://t.co/8i5T8UsadU
2019-10-29 22:30:00,Looking for inspiration for your Halloween costume this year? Check out this @BNBuzz guest post by @LindsayWrites o… https://t.co/JPK8ibof4b
2019-10-29 22:00:24,Don't miss out on SNAZZY CAT CAPERS: THE FAST AND THE FURRIEST written and illustrated by @DeannaandNeil! It has fu… https://t.co/PVlQoB4EJr
2019-10-29 21:00:14,"Culture Expert @KaramoBrown wrote a book with his son, Jason! Beautifully illustrated by @foxville_art, I AM PERFEC… https://t.co/DE78bcvb35"
2019-10-29 20:34:05,"RT @Tiff_Liao: 1 WEEK until #IAmPerfectlyDesigned, Karamo &amp; Jason Brown's ode to loving who you are, exactly as you are!   Pre-order for a…"
2019-10-29 20:28:00,JUNO VALENTINE AND THE FANTASTIC FASHION ADVENTURE by @evachen212 &amp; @derekdesierto has arrived!  Join Juno as she c… https://t.co/THNNf49Fek
2019-10-29 20:00:55,Have you ever lost something in a museum? How did you find it? Read EXPLORERS by Caldecott Medalist @cordellmatthew… https://t.co/a2TdwTapQA
2019-10-29 19:00:36,"Do you want to know the answer to the question: ""How to be best friends forever?"" Read all the guidelines to a grea… https://t.co/QpcJFK6tBs"
2019-10-29 18:00:12,How can we be kind in our community? Check out the #FindingKindness checklist below for all the different ways we c… https://t.co/LuOknO6hhd
