timestamp,tweet_text
2019-03-12 16:01:04,"Some legends are real. Arlo and his friends are back to evade trolls, decipher codes, and survive summer camp in AR… https://t.co/u1Cbtm2tWZ"
2019-03-12 15:03:00,It's JOKES GALORE in the #treehouseseries. Get your copy of THE 104-STORY TREEHOUSE by @AndyGBooks now for a joke o… https://t.co/izs35H5xoo
2019-03-12 14:19:20,RT @MacKidsSL: So many #newbooks to celebrate today! Happy #BookBirthday to @Adam_Auerbach @AndyGbooks @jasondhenderson @colleenaf @etcillu…
2019-03-12 00:00:58,Falling asleep isn't always easy... especially for a rumbling bulldozer. BEDTIME FOR LITTLE BULLDOZER is a reassuri… https://t.co/zJIHvjmYHR
2019-03-11 23:07:52,Don't miss out on Andy and Terry's newest #treehouseseries adventures in THE 104-STORY TREEHOUSE by @AndyGBooks. Pr… https://t.co/GEGKH2shLL
2019-03-11 22:00:07,"How do you cope with loss? For Ruby, it's a matter of building walls to protect herself. But when unexpected friend… https://t.co/6lYkOZt2Nj"
2019-03-11 20:00:25,"In the second book of this FANGtastic spin-off of My Big Fat Zombie Goldfish chapter book series, an aspiring evil… https://t.co/LMLYLigCPE"
2019-03-11 19:01:43,"Already ready for summer vacation? We are too with exclusive @EvaChen212-designed @JanieandJack sunglasses, BOTH Ju… https://t.co/DSM2KG4J77"
2019-03-11 18:00:08,Happy National Women's History Month! Award-winning author @TanyaLeeStone's book WHO SAYS WOMEN CAN'T BE DOCTORS? a… https://t.co/QHxk2ChLqy
2019-03-11 17:02:10,"From the author of DIARY OF A SIXTH GRADE NINJA, comes a snappy, funny mystery about an ordinary boy attending a sc… https://t.co/eH5FhbqlQn"
2019-03-10 23:31:00,"AMAZING EDEAL ALERT: Download A WRINKLE IN TIME by Madeleine L'Engle, the coming-of-age fantasy which has captivate… https://t.co/RxTOocOzP3"
2019-03-10 23:00:42,Want a Superhero Prize Pack with superhero swag &amp; both Ben Braver books? Enter our Ben Braver Drawing contest! Draw… https://t.co/x6D33iox8j
2019-03-10 22:00:53,"Sometimes, when things don’t go as planned, you can still have a whole lot of fun! Start reading IN A MINUTE, MAMA… https://t.co/0d5Oa8D9nu"
2019-03-10 20:00:37,"THE REMARKABLE JOURNEY OF COYOTE SUNRISE by @DanGemeinhart is a book about finding yourself, the connection you mak… https://t.co/2FoJI36vEw"
2019-03-10 19:00:11,"Do your little bears get nervous sometimes? So does Bearnard, especially when the Queen of Storybook land invites h… https://t.co/aLMz35fyhw"
2019-03-10 18:00:09,"Humor and adventure abound in GEEKED OUT, a post-apocalyptic middle-grade diary fiction series by @Obertskye. Enter… https://t.co/RERDdSTV06"
2019-03-10 17:01:17,"With a little splash of red, a dot of blue, &amp; hint of yellow, you can make your own color word too with the HONEYSM… https://t.co/fBwGmUVCuJ"
2019-03-10 16:00:59,"Calling all #JunoValentine fans! @evachen212 and @derekdeserito are back with A IS FOR AWESOME, an ABC tribute to i… https://t.co/bLpPFEMSF7"
2019-03-10 15:33:00,A WRINKLE IN TIME by Madeleine L'Engle is one of the most significant and acclaimed fantasy novels of our time. Exp… https://t.co/yV9bAf8Gu2
2019-03-10 00:00:56,"Turn your reluctant reader into a super reader! Enter for a chance to win 10 fun-filled chapter books, a new book b… https://t.co/tozf5zH8DW"
2019-03-09 23:00:13,Hmmm... can take evil kittens on space stations? 🐈 Find out in @Mo_OHara 's SPACE CAT-ASTROPHE!… https://t.co/y8sicBnBd7
2019-03-09 21:00:15,Andy and Terry made a JOKE WRITING PENCIL in the newest installement of the #TreehouseSeries! Preorder your copy of… https://t.co/GlAb42HoMU
2019-03-09 20:01:15,"Superheroes and super-zeros collide in BEN BRAVER AND THE INCREDIBLE EXPLODING KID, new from the author of DIARY OF… https://t.co/jR1m7LPzmG"
2019-03-09 19:35:00,Have you heard?! @nbcSNL alum @VanessaBayer wrote her first picture book! Look for #HowDoYouCareforAVerySickBear on… https://t.co/i3gXhKZdml
2019-03-09 19:00:19,"Something was coming. Arlo is certain of that. Don't miss all of the mystery, magic, and non-stop action in ARLO FI… https://t.co/iyrf4QagEp"
2019-03-09 18:00:16,"Start reading GOOD ENOUGH by @jpetroroy—the book @kaaauthor says ""will save lives"" and @ellyswartz calls ""raw and h… https://t.co/UdbpmRNIvQ"
2019-03-09 17:00:38,The board book version of EVERYTHING IS MAMA by @JimmyFallon is now in stores! Pick up your copy of this adorable r… https://t.co/YqeTHtx6tx
2019-03-09 01:00:11,This #WomensHistoryMonth celebrate the iconic women of history &amp; today—including yourself &amp; your girls! Enter to wi… https://t.co/A48cBUJJy1
2019-03-09 00:00:31,"From A for Amelia Earhart to Z for the zillions of adventures you'll go on, A IS FOR AWESOME by @evachen212 celebra… https://t.co/ouxSapngi2"
2019-03-08 23:00:33,"Meet Bearnard, a charming bear who is SO excited (but also a bit nervous) to star in his very own book. Read all ab… https://t.co/B9WLe7BmbB"
2019-03-08 21:00:29,"Barbara O'Connor says of RUBY IN THE SKY by @JZulFerr: ""Bravery, friendship, heartbreak, and a dog. This book has i… https://t.co/GbDzuww40c"
2019-03-08 19:01:17,"Perfect for fans of literary middle grade fiction, THE REMARKABLE JOURNEY OF COYOTE SUNRISE by @DanGemeinhart is a… https://t.co/YloL8AdRkG"
2019-03-08 18:00:38,Ada Lovelace was history's first computer programmer—she imagined them 100 years before they existed! Read her stor… https://t.co/ggCyHFGNj8
2019-03-08 17:01:01,The second book in @Obertskye's post-apocalyptic parody series GEEKED OUT comes out next month! Enter our sweepstak… https://t.co/09VVMewkfZ
2019-03-08 00:01:47,"Will Ben Braver finally get his super power? In @NinjaEmerson's BEN BRAVER AND THE INCREDIBLE EXPLODING KID, Ben di… https://t.co/pDdZYDRj4T"
2019-03-07 23:01:01,EVERYTHING IS MAMA by @JimmyFallon is sure to be your new favorite storytime read! Pick up your copy today.… https://t.co/k4Wj1MkAJV
2019-03-07 21:01:56,"""The three of us are always in danger,"" said Arlo. ""That's sort of our thing."" Don't miss the spellbinding second i… https://t.co/fpg99E9clG"
2019-03-07 20:02:01,From bestselling author @Rachel_Bright2 comes a new picture book that perfectly details the parent/child relationsh… https://t.co/Cvew28WjZD
2019-03-07 19:00:24,Have you read all of the @NYTimes Bestselling #TreehouseSeries by @AndyGBooks? The newest installment comes out nex… https://t.co/D17phh1q81
2019-03-07 18:01:33,Love to draw? We have just the contest for you! Draw yourself as a superhero for your chance to win the Ben Braver… https://t.co/aCRwZg1yst
2019-03-07 16:12:00,Big news! @VanessaBayer wrote a picture book and you can meet her this spring! Get your tickets and preorder your c… https://t.co/9YwEhLsB0I
2019-03-06 17:57:31,Want to inspire a girl to start her own business?@TheStartupSquad has teamed up with @Girls_Inc to share the messag… https://t.co/yEonYUjjWi
2019-03-05 20:59:33,"DREAMS DO COME TRUE! @Oprah, you are awesome!!!  Have you read A IS FOR AWESOME yet? Oprah is just one of many grou… https://t.co/n76ret37Vt"
2019-03-05 20:00:16,"Do you love #JunoValentine by @evachen212 and @derekdesierto? Don't miss A IS FOR AWESOME, an ABC tribute to iconic… https://t.co/MUZD86WtcH"
2019-03-05 19:18:45,RT @NinjaEmerson: Happy #BookBirthday to Ben Braver and the Incredible Exploding Kid!! It’s out now - run and grab one quick!! I got my spe…
2019-03-05 19:17:25,RT @MacKidsSL: Happy #BookBirthday to @melissathomson @NinjaEmerson @7Brewington7 @cathygjohn Aki &amp; Elise Broach!   #NewReleaseTuesday #new…
2019-03-05 19:00:24,We're so excited that Ben Braver is back—with BEN BRAVER AND THE INCREDIBLE EXPLODING KID—that we're hosting a cont… https://t.co/XUZHo2RgiM
2019-03-05 18:01:43,"Calling all mamas! Share your favorite #MamaMoment with us to celebrate the release of IN A MINUTE, MAMA BEAR by… https://t.co/tM0QHrTcQB"
2019-03-05 17:01:10,"Trolls, time warps, and forest spirits? Sounds like summer camp in Pine Mountain! Don't miss ARLO FINCH IN THE VALL… https://t.co/zhbecMZUMq"
2019-03-05 00:00:29,"Come on up to the tallest treehouse Andy and Terry have ever built! THE 104-STORY TREEHOUSE comes out next month, s… https://t.co/hmSW71tnJi"
2019-03-04 23:00:47,"Ruby's facing a new school, a new home, and a new way of life. She's not keen on making any friends, but they still… https://t.co/twM1VMqOSR"
2019-03-04 21:00:14,"Mark's epic summer has just gotten even more epic, because Evil Scientist Summer Camp just turned into Evil Scienti… https://t.co/Rww5uUB6VH"
2019-03-04 20:01:41,RT @vanessabayer: I'm excited to share that my debut children’s book is out this June! HOW DO YOU CARE FOR A VERY SICK BEAR is about being…
2019-03-04 20:00:12,"Read BEARNARD'S BOOK by @underwoodwriter and @MisaSaburi, a sweet story about an anxious bear, an encouraging goose… https://t.co/Y7PA4rMgUu"
2019-03-04 19:39:47,RT @kaaauthor: The fantastic team at @MacKidsBooks has created a discussion guide for parents and children reading #wishtree together. If y…
2019-03-04 18:10:12,"RT @HeatherKassner: 🖤💀 ARC GIVEAWAY 💀🖤  Only 5 months until THE BONE GARDEN releases so it's time for another giveaway! To enter, RT/F by M…"
2019-03-04 18:00:04,Take a peek into @NinjaEmerson's BEN BRAVER AND THE INCREDIBLE EXPLODING KID with the official book trailer! https://t.co/9DSIBT93px
2019-03-04 17:00:16,"Enter for a chance to win 10 books that will transform your reluctant reader into a super reader, plus a brand-new… https://t.co/dS0OyPWtTo"
2019-03-04 16:34:30,RT @01FirstSecond: We're giving away a special prize pack for moms of little ones to celebrate the release of @LucyKnisley's new book KID G…
2019-03-04 16:11:00,Today is the LAST DAY of Barnes &amp; Noble's #bookhaul BLOWOUT! 50% off some of our favorite books online—don’t miss i… https://t.co/lBMb7jiUVM
2019-03-04 15:49:06,RT @nidhiart: Thank you @KirkusReviews for the wonderful words about I WILL BE FIERCE.  It was a wonderful challenge to illustrate @BeaBird…
2019-03-03 23:00:24,"Do you ever feel like your to-do list is never ending? Mama bear gets it, but how can she say no to Bella Bear when… https://t.co/caCOictWYe"
2019-03-03 21:00:58,"You'll laugh out loud, shed a few tears, and cheer for Coyote Sunrise as she takes a 3,600-mile journey home in THE… https://t.co/HYe3lII37V"
2019-03-03 19:00:10,".@Obertskye fans, enter our sweepstakes for a chance to win book one in the GEEKED OUT series plus an advance copy… https://t.co/v93xCnDSBq"
2019-03-03 18:01:28,"Have you picked up HONEYSMOKE yet? Enjoy these activities based on the new book from @honeysmokeblog with vibrant,… https://t.co/U0XspUa8ag"
2019-03-03 17:00:23,"Do you love #JunoValentine by @evachen212 and @derekdesierto? Don't miss A IS FOR AWESOME, an ABC tribute to iconic… https://t.co/wgoYMUec1m"
2019-03-03 00:01:35,"Turn your reluctant reader into a super reader! Enter for a chance to win 10 fun-filled chapter books, a new book b… https://t.co/IqW14baEHz"
2019-03-02 23:00:33,"Astronaut Neil Strongarm is looking for evil apprentices for his next space mission, which means that Mark could to… https://t.co/XzPHQXiopq"
2019-03-02 21:00:11,Andy and Terry's jokes never stop with their new Joke Writer 2000™. Find out what crazy adventures they're up to ne… https://t.co/lp8FXeboMT
2019-03-02 20:01:40,"Ben Braver is still an ordinary kid despite attending a secret school for extraordinary kids with superpowers, but… https://t.co/Rf6W5Hm8jj"
2019-03-02 19:00:15,".@ransomriggs calls #ArloFinch by @johnaugust ""a masterful mix of mystery and adventure."" Start reading today!… https://t.co/1AXcXyKB9V"
2019-03-02 18:00:15,"In YOU ARE ENOUGH, @jpetroroy delivers real talk about eating disorders and body image, drawing from her own experi… https://t.co/JUYu2jsdTb"
2019-03-02 17:01:03,Looking for the perfect gift for a new MAMA in your life? Look no further! EVERYTHING IS MAMA by @JimmyFallon is it… https://t.co/bQSJig1Q7K
2019-03-02 00:00:19,"Why stick with plain old A, B, C, when you can have Amelia Earhart, Beyonce, and Coco Chanel? Don't miss A IS FOR A… https://t.co/idze3ADhdX"
2019-03-01 23:00:15,BEARNARD'S BOOK by @underwoodwriter and @MisaSaburi is a charming story about one bear's journey to self confidence… https://t.co/KNdSvcvaT9
2019-03-01 21:46:03,"Have you checked out SPY RUNNER by @eyelchin? @WSJ calls it ""a clever and vertiginous adventure for children ages 8… https://t.co/XQMHvnsN0R"
2019-03-01 21:00:28,"""You stood tall. You didn't run away. Sometimes that's enough."" Join Ruby on her journey to bravery in RUBY IN THE… https://t.co/STWBNF7djo"
2019-03-01 20:00:38,".@Rachel_Bright2 is back with another adorable picture book series, sure to be a hit with mama (or dada!) and baby… https://t.co/Jdpt2yRn0E"
2019-03-01 19:23:46,RT @odddotbooks: We love our School &amp; Library fam (and of course all of our @MacKidsBooks peeps!). https://t.co/blDoa2pnHa
2019-03-01 19:02:21,"""There's nothing like a good book for bringing folks together."" THE REMARKABLE JOURNEY OF COYOTE SUNRISE by… https://t.co/xvRczGUxH3"
2019-03-01 17:00:16,"Start reading the GEEKED OUT series by @Obertskye, described as ""Dystopia meets Wimpy Kid."" Don't miss out on your… https://t.co/vjOBP44NqG"
2019-03-01 00:21:54,RT @SamMaggs: So excited to finally share that I'm writing my first novel!! CON QUEST! is a middle-grade book about two kiddos at a comic c…
2019-02-28 23:00:32,"Don't miss EVERYTHING IS MAMA by @JimmyFallon, now in board book! https://t.co/y3SaEbQMBh #MAMABook https://t.co/PA6yCy7ZaZ"
2019-02-28 21:54:34,RT @DanielNayeri: That @odddotbooks is in @ShelfAwareness y'all. https://t.co/HzJ3ttUl51 https://t.co/Kk7ilQ1edD
2019-02-28 20:01:22,"Wind spirits, pinereading, and a mystery decades in the making... find out what happens to Arlo and the rest of the… https://t.co/T5iT4dpgsU"
2019-02-28 19:00:42,Andy and Terry's jokes never stop with their new Joke Writer 2000™. Find out what crazy adventures they're up to ne… https://t.co/LhvQQPSSp8
2019-02-28 17:17:29,RT @PatZMiller: Do you know a young reader with enough love to fill an ocean? Then they might love PUP 681: A SEA OTTER RESCUE STORY from a…
2019-02-28 17:01:56,Hey puzzle solvers and code crackers! Unlock more secret codes with the WINTERHOUSE series downloadable puzzle at… https://t.co/ySPkF7HcTy
2019-02-28 15:17:43,"RT @MacKidsSL: 📣 BIG NEWS! 📣 We're excited to share our new School &amp; Library website! Visit https://t.co/22FvF9Cpnw to find book giveaways,…"
2019-02-28 00:00:56,GOOD ENOUGH by @jpetroroy is the moving and honest portrayal of a young girl recovering from an eating disorder. St… https://t.co/en20Ai4Zrk
2019-02-27 23:01:04,"For #BlackHistoryMonth, read HONEYSMOKE, a book all about learning and celebrating how you identify with color. Ava… https://t.co/Ms6KC3SQHo"
2019-02-27 21:01:03,"BETTY BEFORE X is a powerful middle-grade fictionalized account of the childhood activism of Betty Shabazz, Malcolm… https://t.co/qg7X2JtmLX"
2019-02-27 20:00:48,Hmmm... can take evil kittens on space stations? 🐈 Find out in @Mo_OHara 's SPACE CAT-ASTROPHE!… https://t.co/vq4pSSecl1
2019-02-27 19:00:56,"Enter for a chance to win 10 books that will transform your reluctant reader into a super reader, plus a brand-new… https://t.co/LIQTKwtXMq"
2019-02-27 18:00:07,RUBY IN THE SKY by @JZulFerr is a poignant middle-grade novel about facing your biggest fears and being brave enoug… https://t.co/tewmt5hMsz
2019-02-27 17:02:00,Bearnard has been invited to star in a book by the Queen of Storybook Land! What kind of story will he tell? Read a… https://t.co/nM2CX9aq53
2019-02-27 00:01:00,"Join Coyote, Rodeo, and their friends as they board Yager (AKA the big yellow school bus) for a 3,600-mile road tri… https://t.co/AWtwN9TkQ4"
2019-02-26 23:00:07,The second book in @Obertskye's post-apocalyptic parody series GEEKED OUT comes out next month! Enter our sweepstak… https://t.co/rvYopcTLV1
2019-02-26 21:29:57,It’s the 100th anniversary of the #GrandCanyon National Park! We’re celebrating by reading GRAND CANYON by… https://t.co/OwpBQqiYrO
2019-02-26 21:01:03,Adorable baby penguins? ✅ A must-have board book by @JimmyFallon? ✅ Check out EVERYTHING IS MAMA today!… https://t.co/HdjbWdyJJu
2019-02-26 20:00:15,"Do you love #JunoValentine by @evachen212 and @derekdesierto? Don't miss A IS FOR AWESOME, an ABC tribute to iconic… https://t.co/seLuFpt1Ku"
2019-02-26 19:01:19,Some trails lead to magic. Some lead to danger. Are you ready to take the Ranger's Vow? ARLO FINCH IN THE VALLEY OF… https://t.co/0WkhDvRYPg
2019-02-26 18:01:43,"Bella Bear wants to play but Mama Bear’s to-do list keeps getting in the way! Start reading IN A MINUTE, MAMA BEAR… https://t.co/S8c9amqMxP"
2019-02-26 17:00:51,"Something was coming. Arlo is certain of that. Don't miss all of the mystery, magic, and non-stop action in ARLO FI… https://t.co/xv4AOTDtgH"
2019-02-26 00:00:43,Get ready for a joke on every page with Andy and Terry's newest Joke Writer 2000™ in THE 104-STORY TREEHOUSE by… https://t.co/NTym02WFwe
2019-02-25 23:00:45,Will Ruby find the courage to protect her newfound friends and family? Find out in RUBY IN THE SKY by @JZulFerr!… https://t.co/tCKlkcTWPW
2019-02-25 20:00:15,YOU are invited to star in your very own book! What's your special story? Design a book with your little readers an… https://t.co/1eKJxKODTR
2019-02-25 19:00:11,"Inspired by Betty's real life, @ilyasahShabazz and @reneewauthor illuminate four poignant years in her childhood wi… https://t.co/CxuT3P8T6d"
2019-02-25 18:00:06,"In the second book of this FANGtastic spin-off of My Big Fat Zombie Goldfish chapter book series, an aspiring evil… https://t.co/EeUMOtv2Eu"
2019-02-25 14:58:45,"RT @Ciccotello: I bought this t-shirt from @twindadjoe, and thought it was the perfect pairing for a photo with my debut picture book, TWIN…"
2019-02-25 00:00:39,IN THE SHADOW OF LIBERTY @kennethcdavis explores our country’s great tragedy—that a nation “conceived in liberty” w… https://t.co/t5WNHAprfK
2019-02-24 23:30:00,"Did you know that THE SHAPE OF WATER is also a bestselling, must-read novel? Grab an ebook copy ON SALE TODAY for j… https://t.co/52zxw41jph"
2019-02-24 23:00:14,"Perfect for fans of LOVE MONSTER, @Rachel_Bright2's newest book IN A MINUTE, MAMA BEAR is an adorable ode to the pa… https://t.co/MKxUIEiqyT"
2019-02-24 21:01:26,Now you can make your own #memorybox just like Coyote Sunrise in THE REMARKABLE JOURNEY OF COYOTE SUNRISE by… https://t.co/TUJYzht0dQ
2019-02-24 20:00:13,".@ransomriggs calls the Arlo Finch series ""A thrilling adventure."" Get your copy of ARLO FINCH IN THE VALLEY OF FIR… https://t.co/B9mpW9JTfi"
2019-02-24 19:00:07,"Humor and adventure abound in GEEKED OUT, a post-apocalyptic middle-grade diary fiction series by @Obertskye. Enter… https://t.co/xcZkGqHtgH"
2019-02-24 18:01:43,Explore color &amp; finding the right one to represent you with Simone &amp; the HONEYSMOKE downloadable activity pages!… https://t.co/Fw0is786qP
2019-02-24 17:29:00,"The Academy Award's Best Picture of last year is also a @nytimes bestselling, must-read novel. Download the ebook o… https://t.co/6xcS6WHKFo"
2019-02-24 17:00:30,"From A for Amelia Earhart to Z for the zillions of adventures you'll go on, A IS FOR AWESOME by @evachen212 celebra… https://t.co/eO59HX7dpg"
2019-02-23 23:00:19,"Astronaut Neil Strongarm is looking for evil apprentices for his next space mission, which means that Mark could to… https://t.co/FlIIHCZgrb"
2019-02-23 21:00:14,Get ready for a joke on every page with Andy and Terry's newest Joke Writer 2000™ in THE 104-STORY TREEHOUSE by… https://t.co/Kxo7qUg0FU
2019-02-23 20:01:07,"Make your New Year's resolution a promise to welcome others. Read WISHTREE by @kaaauthor, a beautiful story about k… https://t.co/dDS4YFIJ0L"
2019-02-23 19:00:49,Welcome to Pine Mountain. Watch the #ArloFinch trailer and take the Ranger's Vow! https://t.co/Y3MO4XmaQa https://t.co/elukMH2A7l
2019-02-23 18:00:13,"""@jpetroroy writes... with knowledge, compassion, empathy, and inclusivity. [Her] encouragement and honesty will sp… https://t.co/Xqs2ogSBrX"
2019-02-23 17:00:43,"Psst... books make great baby shower gifts, and we have the perfect one for you! Buy EVERYTHING IS MAMA by… https://t.co/1OlJWZiiKi"
2019-02-23 00:00:20,Looking for the perfect gift for the little game changer in your life? A IS FOR AWESOME is an alphabet book packed… https://t.co/6jh4qeylzS
2019-02-22 23:00:06,"Meet Bearnard, a charming bear who is SO excited (but also a bit nervous) to star in his very own book. Read all ab… https://t.co/gl7W5l0OGw"
2019-02-22 21:00:45,"How do you cope with loss? For Ruby, it's a matter of building walls to protect herself. But when unexpected friend… https://t.co/2Kp5KbAx22"
2019-02-22 20:00:45,"Sometimes, when things don’t go as planned, you can still have a whole lot of fun! Start reading IN A MINUTE, MAMA… https://t.co/WmIxk5uwc0"
2019-02-22 19:01:20,THE REMARKABLE JOURNEY OF COYOTE SUNRISE by @DanGemeinhart is here! Grab your tissues and get ready to have all the… https://t.co/8J8k0Qf7Vu
2019-02-22 17:01:45,PORT CHICAGO 50 is an astonishing civil rights story from Newbery Honor winner and multiple-time National Book Awar… https://t.co/DrRl63MGwk
2019-02-22 16:00:14,"Humor and adventure abound in GEEKED OUT, a post-apocalyptic middle-grade series by @Obertskye. Enter here for a ch… https://t.co/tANpceI3Uw"
2019-02-22 15:12:07,"RT @MrSchuReads: ""I hope The Tornado shows readers that sometimes the best thing you can do for yourself is to stand up for someone else.""…"
2019-02-22 14:49:50,"RT @ALA_Booklist: ★ #ReviewoftheDay ""This story skillfully depicts everyday injustices and how those in power control the narrative unless…"
2019-02-22 14:49:38,RT @MisterTrimmer: Thrilled to be working with Caitlin on her first picture book--V IS FOR VOTING! And mesmerized by this system! @MacKidsS…
2019-02-22 00:00:06,"Arlo has no idea what he's in for when his family moves to mysterious Pine Mountain, CO. Don't miss ARLO FINCH IN T… https://t.co/ZfzHx8q5YB"
2019-02-21 23:00:39,.@JimmyFallon's bestselling EVERYTHING IS MAMA is now available in board book and is perfect for little and big han… https://t.co/3zuNEBXmUe
2019-02-21 20:00:37,"Some legends are real. Arlo and his friends are back to evade trolls, decipher codes, and survive summer camp in AR… https://t.co/gsFzyljuNl"
2019-02-21 19:00:16,New from the Joke Writer 2000™: What do you call a cow’s bedtime stories?   Dairy Tales! Get your copy of THE 104-S… https://t.co/0isRW1ouDL
2019-02-21 18:00:12,"CLAUDETTE COLVIN by @PhillipHoose is an outstanding, ground-breaking account of an almost forgotten civil rights pi… https://t.co/ubFNnDdNgx"
2019-02-21 17:00:32,Do you have what it takes to crack the puzzles in THE SECRETS OF WINTERHOUSE? Master more incredible word puzzles a… https://t.co/5cI4wlG6MD
2019-02-21 16:02:18,"RT @BookishHQ: .@jpetroroy , author of #YouAreEnough and #GoodEnough, opens up about her own experiences with an eating disorder and her pa…"
2019-02-21 01:00:34,"Start reading GOOD ENOUGH by @jpetroroy—the book @kaaauthor says ""will save lives"" and @ellyswartz calls ""raw and h… https://t.co/7xKnOwI8O1"
2019-02-21 00:00:19,"Celebrate Black History Month with HONEYSMOKE, the wonderful new picture book about exploring who you are through c… https://t.co/JirxbUbOpK"
2019-02-20 21:00:33,WE MARCH by @oluizumz is an important story about the African American civil rights movement for young readers. Dow… https://t.co/Jb1rLYUVZB
2019-02-20 20:33:00,"While everyone's powers are getting stronger, Ben is still hiding his lack of super skills and wondering if he'll E… https://t.co/lVOca97fXN"
2019-02-20 20:00:16,Celebrate this Valentine's Day with a collection of your favorite @Nancy_Tillman books and tell your little one how… https://t.co/kiAhO5niOc
2019-02-20 18:00:11,"Barbara O'Connor says of RUBY IN THE SKY by @JZulFerr: ""Bravery, friendship, heartbreak, and a dog. This book has i… https://t.co/G3Eyi8GaNp"
2019-02-20 17:01:00,Bearnard &amp; Gertie want YOU to join them in all their exciting Storybook Land adventures! Act out the next chapter o… https://t.co/ALsriVipCF
2019-02-20 00:00:37,How far would you go to save something you love? Read THE REMARKABLE JOURNEY OF COYOTE SUNRISE by @DanGemeinhart an… https://t.co/ZgHnO9Y9dL
2019-02-19 23:01:45,RT @Mermaids_Asleep: Now you can listen to the Lullaby that became the book Mermaids Fast Asleep! https://t.co/KWDfFGANSR
2019-02-19 23:00:13,Elizabeth and Freddy are in for another myterious adventure filled with more secrets. Don't miss THE SECRETS OF WIN… https://t.co/uBAnT446vQ
2019-02-19 21:00:16,"Learning new words is hard, but also adorable! Get EVERYTHING IS MAMA by @JimmyFallon for the kiddo in your life!… https://t.co/yeYdKr8eAU"
2019-02-19 20:00:07,"Why stick with plain old A, B, C, when you can have Amelia Earhart, Beyonce, and Coco Chanel? Don't miss A IS FOR A… https://t.co/HfGTfZIv7C"
2019-02-19 19:00:36,"Do you have what it takes to join Arlo, Indra, and Wu in the Pine Mountain Rangers? ARLO FINCH IN THE VALLEY OF FIR… https://t.co/jfQ84qu1Fy"
2019-02-19 18:00:51,"With an inspiring (and relatable!) message and adorable art, IN A MINUTE, MAMA BEAR by @Rachel_Bright2 is the perfe… https://t.co/XkV4PMC8Gp"
2019-02-19 17:00:33,Have you seen the trailer for the Arlo Finch series by @johnaugust? This adventure series about the magic that lies… https://t.co/OM6YRpaexe
