timestamp,tweet_text
2019-06-04 17:01:44,"Prepare for the 50th anniversary of the moon landing with our STELLAR prize pack, including an astronaut costume an… https://t.co/SHoVGtdbh4"
2019-06-04 16:00:17,Calling all Nerdy Parents! NERDY BABIES: SPACE and NERDY BABIES: OCEAN by @EmmyKastner are the books for you! These… https://t.co/pxqYDzSt50
2019-06-04 15:00:07,Is Bob a zombie? A chicken? Or something else entirely? Find out in BOB from bestselling authors @wenmass &amp;… https://t.co/KejBZCpObr
2019-06-04 14:53:31,RT @ImprintReads: Wily Snare and his friends fight to save the kingdom in the 2nd book of the epic Snared series! #ImprintReads #SnaredLair…
2019-06-04 13:28:50,RT @stacymcanulty: Thought I'd share some of my favorite Moon facts. These are things I learned while researching for the new book. And whe…
2019-06-04 00:00:21,"THE LOST BOY'S GIFT, a stunning middle grade novel about friendship, forgiveness, and the magic that comes with lis… https://t.co/nVb0lrvyMs"
2019-06-03 23:00:32,Resa just wants to win the lemonade stand competition. Find out what happens when four girls try to perfect the rec… https://t.co/iaC8ULWGg0
2019-06-03 22:01:42,"Tinker, make, and engineer to learn through play! With TINKERACTIVE WORKBOOKS, learning leaps off the page and into… https://t.co/pijnyXMxov"
2019-06-03 21:24:42,This interview is a must read 💖🐻💖 https://t.co/HCC0iKY32A
2019-06-03 20:00:57,Are you ready to take on the day? @BeaBirdsong and @NidhiArt's I WILL BE FIERCE encourages kids to be brave like bo… https://t.co/hNK34y7TRK
2019-06-03 19:30:00,"""I am a girl but most days I feel like a question mark."" Writing from personal experiences, @MariLock explores fami… https://t.co/xqUoeI2jBW"
2019-06-03 18:00:07,"Are the League of Average &amp; Mediocre Entities ready to take on new enemies? In @Obert Skye's BIGGER, BADDER, NERDIE… https://t.co/SJwCepo69K"
2019-06-03 17:00:24,"THE WAY THINGS WORK co-creator David Macaulay's newest is CROSSING ON TIME, a picture book history of the era of th… https://t.co/lGgs2Yttd3"
2019-06-03 16:32:00,Calling all Ohio readers! @VanessaBayer will be celebrating the release of her debut children's book @CuyahogaLib o… https://t.co/U9By8rnDsX
2019-06-03 16:00:39,"50 years ago, this summer, men landed on this moon for the very first time. Explore our universe with these space-t… https://t.co/7h2nE2wva4"
2019-06-03 15:56:56,Check out an exclusive preview of IT FEELS GOOD TO BE YOURSELF by @theresathorn and #NoahGrigni on @romper! This en… https://t.co/51nTKrHuSj
2019-06-03 15:01:09,"We all have feelings and the main character in @GirlMacFarlane and @SpencerLaudiero's newest picture book, HARRISON… https://t.co/3lzPce4yIB"
2019-06-03 14:01:36,"In search of a bookclub read for you and your child, don't miss our recommended read: THE REMARKABLE JOURNEY OF COY… https://t.co/x3FXwxw6l0"
2019-06-03 00:00:26,"A picture book that invites readers to try new things, see the sky through the trees, and form friendships with peo… https://t.co/2L63H3bXDS"
2019-06-02 23:21:00,A prize pack that's just as awesome as he is.  Enter the Ultimate DADA Day Sweepstakes for a chance to win a signed… https://t.co/p49mMtil9K
2019-06-02 23:00:54,Looking for your next #SummerRead? So was Lenora when she discovered THE LIBRARY OF EVER—a library with all the kno… https://t.co/5lHwu9s3hc
2019-06-02 22:00:18,"With bright artwork by @EmmyKastner, NERDY BABIES: SPACE is a book that the very littlest nerds will want to return… https://t.co/sezxGp8Nhz"
2019-06-02 19:00:25,"On Monday, Llama eats way too much cake. On Tuesday, Llama rips his dancing pants (due to the cake). By Friday, Lla… https://t.co/E3JJUtPkw1"
2019-06-02 18:07:08,"Sometimes life isn’t a piece of cake… it can be complex, challenging, and full of unbelievable adventure! Start rea… https://t.co/X86xSG1j3u"
2019-06-02 17:00:12,Calling all chapter book readers! Check out the first books in a series from kid lit 👑 @RachelVailBooks! A IS FOR E… https://t.co/JNlrfRWEBm
2019-06-02 16:00:36,"In their starred review, @PublishersWkly calls SUMMER by Cao Wenxuan and Yu Rong an ""exquisitely calibrated fable.""… https://t.co/mUlfa7BsEc"
2019-06-02 15:29:00,#NYC! Don't miss your chance to meet Emmy Award-nominated actress and SNL alum @vanessabayer! Get your tickets for… https://t.co/UgKLokqj3l
2019-06-02 15:00:15,@kaaauthor's WISHTREE shows us how traditions have the power to build a community. What are some traditions in your… https://t.co/v69C6LCDkF
2019-06-02 14:00:20,"Anthoni is not the kind of kid who believes in fairies, unicorns, or even the word “maybe.” So when she hears that… https://t.co/l5feL7o73v"
2019-06-02 00:00:38,"Return to the post-apocalyptic world of @ObertSkye's Geeked Out series with BIGGER, BADDER, NERDIER! In another irr… https://t.co/mZcrK7p0tP"
2019-06-01 23:26:00,"Pajama party alert! Don't miss @VanessaBayer's storytime event at Children's Book World on Saturday, 6/8! Teddy bea… https://t.co/54wW83nSvb"
2019-06-01 22:00:08,"Friendship will lead you home in BOB, a heartfelt novel from @wenmass &amp; @rebstead - now available in paperback!… https://t.co/QXcDBHr4bE"
2019-06-01 21:00:33,"An autobiography from the earth's ever-present friend the moon. With characteristic humor &amp; charm, @StacyMcAnulty &amp;… https://t.co/fU6Gcgxqbv"
2019-06-01 20:00:13,Did you know that #nerdybabies turn into nerdy scientists?! @EmmyKastner's NERDY BABIES encourage tiny readers to s… https://t.co/AMINfJX0K2
2019-06-01 19:00:41,From the award-winning co-creator of THE WAY THINGS WORK comes a fascinating history of steamships framed in a touc… https://t.co/tOsZQfMarg
2019-06-01 18:00:30,Sports + books? A summer equation we can support. Introduce your reluctant readers to the EPIC ATHLETES series from… https://t.co/eft9l645XX
2019-06-01 17:01:08,"Who says a knight can't also be a dancer? HARRISON DWIGHT, BALLERINA AND KNIGHT is taking on gender stereotypes and… https://t.co/joBF3ehgsD"
2019-06-01 16:00:24,"After a long day of playing with your dinosuar, don't forget to put him to bed with a story. 🦖📖😴 HOW TO CARE FOR YO… https://t.co/1PTM2y5zvj"
2019-06-01 15:32:00,"Wishing our grouchy friend and author, @OscartheGrouch a not-so happy trash-filled birthday!… https://t.co/wUJc7KGMBO"
2019-06-01 14:01:03,"The most inseparable pair wasn't always friends... In WHEN PENCIL MET ERASER, Pencil learns the value of admitting… https://t.co/TGF9Q92ijM"
2019-05-31 23:00:27,"With its vivid die-cut art, captivating poetry, &amp; timeless story of selflessness, this ""exquisitely calibrated fabl… https://t.co/ftbDo46lBT"
2019-05-31 22:30:00,Calling all Ohio readers! @VanessaBayer will be celebrating the release of her debut children's book @CuyahogaLib o… https://t.co/Zh31tJmZdf
2019-05-31 21:00:42,"Our mouths are watering just thinking about all the cakes Jingwen and Yanghao are cooking up in PIE IN THE SKY, the… https://t.co/ByeRwe8ZzR"
2019-05-31 20:01:02,"Come visit While-A-Way Lane, where Tilda Butter talks to animals and people read on the ferris wheel. This coming-o… https://t.co/dovLhaVfx1"
2019-05-31 19:00:51,Elizabeth is in 2nd grade. Her first project: make a poster of her name. The only problem? Elizabeth has a bajillio… https://t.co/bnpDSmTn1G
2019-05-31 18:00:07,"“Full of whimsy and pluck, THE LIBRARY OF EVER is a total delight!” —New York Times bestselling author Wendy Mass.… https://t.co/JGykNZHqgL"
2019-05-31 17:30:00,"Celebrate #FathersDay with a signed copy of @jimmyfallon’s hilarious and heartwarming DADA book, and more! Enter no… https://t.co/jmFgVYoZnW"
2019-05-31 17:01:13,"""The oddest/sweetest mix of LITTLE HOUSE ON THE PRAIRIE and X-MEN...Prepare to have your heart warmed.""—Stephanie M… https://t.co/QVrEY91k52"
2019-05-31 16:00:10,"Tinker, make, and engineer to learn through play! With TINKERACTIVE WORKBOOKS, learning leaps off the page and into… https://t.co/EpQ7oY27Nu"
2019-05-31 15:00:40,"No matter the challenge, we're ready to face it. @BeaBirdsong and @NidhiArt's I WILL BE FIERCE is an uplifting pict… https://t.co/FDqWth5cDG"
2019-05-31 14:12:10,RT @marilock: #Giveaway ALERT! @MacKidsBooks is giving away 25 Advanced Reader copies of #FORBLACKGIRLSLIKEME on @goodreads this week! Ente…
2019-05-31 14:00:35,THE PRIZE: line-skipping tickets to Adventure Central THE COMPETITION: Sell the most lemonade! THE BIGGEST OBSTACLE… https://t.co/HI7fBAvmpr
2019-05-31 00:00:51,12-yr-old Coyote &amp; her father Rodeo have been on the road for 5 years. That's also how long ago they lost her mothe… https://t.co/7fgBhlP28T
2019-05-30 23:00:07,"In HOW TO CARE FOR YOUR T-REX, @KenBakerBooks and @speedbumpcomic give kids helpful tips for their new pet. 🦖 Check… https://t.co/TZhKTzjkfW"
2019-05-30 22:00:57,"As Summer approaches what better time to add to your TBR list, and we have a book for everyone! Order your copies o… https://t.co/xOnvwBAp9A"
2019-05-30 20:00:14,Everyone has the power to make a difference. You and your child can both take the first step by reading WISHTREE by… https://t.co/b185jivoUt
2019-05-30 19:28:00,#NYC! Don't miss your chance to meet Emmy Award-nominated actress and SNL alum @vanessabayer! Get your tickets for… https://t.co/rhTqAYKZgN
2019-05-30 19:00:06,Is Bob a zombie? A chicken? Or something else entirely? Find out in BOB from bestselling authors @wenmass &amp;… https://t.co/hWk2kxSSTw
2019-05-30 17:00:33,LLAMA DESTROYS THE WORLD the the hilarious picture book debut from @dustdancestoo and @adoodlefox. Prepare for worl… https://t.co/0hksemtphl
2019-05-30 16:00:13,Have you heard?! @nbcSNL alum @VanessaBayer wrote her first picture book! Look for #HowDoYouCareforAVerySickBear on… https://t.co/MyZtPzptR8
2019-05-30 14:31:00,Did you hear?!!? #BadKitty KITTEN TROUBLE has been nominated for a Kids' Comic Award for Funniest Comic! Cast your… https://t.co/AhjPb3jT3N
2019-05-30 14:00:43,Sports + books? A summer equation we can support. Introduce your reluctant readers to the EPIC ATHLETES series from… https://t.co/kmoujAZhU3
2019-05-30 00:00:22,"With his signature curiosity and heart, THE WAY THINGS WORK co-creator, David Macaulay's, newest work, CROSSING ON… https://t.co/uRofhuS6yJ"
2019-05-29 23:00:25,"Calling all Justin Case fans! @RachelVailBooks has a new chapter book series, starring Justin's little sister, Eliz… https://t.co/kanZ0rLZsJ"
2019-05-29 22:00:29,"Reminding us that we should never be afraid to express ourselves, HARRISON DWIGHT, BALLERINA AND KNIGHT is… https://t.co/FvmhUM3d5Q"
2019-05-29 21:26:35,RT @baronchrisbaron: One last GIVEAWAY before ALL OF ME is out 6/11  RT/F &amp; tag a friend in comments for a chance to win a signed ARC of AL…
2019-05-29 21:00:50,".@ObertSkye's next book in the Geeked Out series is BIGGER, BADDER, NERDIER, and it's available now! Start reading… https://t.co/K0KIUcCuuf"
2019-05-29 20:00:57,Does a pencil really need an eraser? Not according to Pencil. But Eraser shows Pencil—and the rest of us—how to try… https://t.co/d5YAZOmZiy
2019-05-29 19:00:06,"Tinker, make, and engineer to learn through play! With TINKERACTIVE WORKBOOKS, learning leaps off the page and into… https://t.co/O0WRrdLd0e"
2019-05-29 18:28:00,Are you ready for 50th Anniversary of the Moon Landing in July?!?! Don't miss the rerelease of Michael Collin's aut… https://t.co/IjwehqhUOa
2019-05-29 18:00:18,These girls mean business! THE STARTUP SQUAD is the first book in a series about four girls in a lemonade stand com… https://t.co/LtZ1gZAHfD
2019-05-29 17:00:09,"A classic coming-of-age tale about a child grappling with divorce and a new neighborhood, with a charming magical t… https://t.co/7ZaxHRHuVK"
2019-05-29 16:00:26,Meet Earth's best friend MOON! She's LITERALLY never left earth's side. @StacyMcAnulty and Stevie Lewis' book MOON!… https://t.co/QhPV7MWrBh
2019-05-29 15:39:57,RT @MacmillanUSA: 📣 Calling all #BookCon19 goers and advance planners!   You can now check out our full schedule @thebookcon: https://t.co/…
2019-05-29 15:39:35,"RT @Jess__Red: 📽📖The trailer for THE MIRACULOUS is up! And I would love for you to watch &amp; share!📖📽️  📚Thank you to @MrSchuReads, @mcrockef…"
2019-05-29 15:00:54,.@ZAlexanderBooks spends his days in his lavish underground bunker throwing dinner parties and chronicling the stor… https://t.co/tosWo4CHGZ
2019-05-29 14:00:12,Meet Jingwen &amp; his little brother Yanghao. Together they’ll manage life after the death of their father &amp; living in… https://t.co/jHFMnuTPmG
2019-05-29 00:00:39,"Piper McCloud can fly. Just like that. Easy as pie. But the good folk of Lowland County are afraid of Piper, &amp; even… https://t.co/xSRODQnzfk"
2019-05-28 23:00:15,"What could go wrong when cake, a dancing llama, and a black hole combine? Find out in LLAMA DESTROYS THE WORLD by… https://t.co/UvGsMlEiM9"
2019-05-28 22:00:40,Actor @VanessaBayer was inspired to write HOW DO YOU CARE FOR A VERY SICK BEAR by her own experience being diagnose… https://t.co/vMAduwxTz6
2019-05-28 21:00:20,"Bestselling author &amp; celebrated sports journalist @DanWetzel penned Epic Athletes, a new series of biographies that… https://t.co/vYJ94y1y11"
2019-05-28 19:11:08,RT @jonasbrothers: For those of you who have been with us since the beginning... #BLOOD is our family’s story and we can’t wait to share it…
2019-05-28 19:00:47,"Did you know that Tyrannosaurus Rex actually means ""tyrant lizard king""? 🦖 Learn this and much more in HOW TO CARE… https://t.co/8pTEkD8cdp"
2019-05-28 18:00:36,"⭐️""As in fables of yesteryear, Cao holds a mirror to selfishness as well as to an individual's ability to transcend… https://t.co/evqSsil0It"
2019-05-28 16:15:47,"RT @macmillanbooks: Happy #bookbirthday, @KarenKilgariff + @GHardstark, Jeff Rovin, @OLearyBeth, Karen Kilpatrick + Luis O. Ramos Jr. + Ger…"
2019-05-28 16:00:17,Looking to introduce your littlest reader to early science concepts? Don't miss NERDY BABIES: SPACE and NERDY BABIE… https://t.co/m3NZ63FNtc
2019-05-28 15:00:09,"Friendship will lead you home in BOB, a heartfelt novel from @wenmass &amp; @rebstead - now available in paperback!… https://t.co/voif3mn2Br"
2019-05-28 00:00:19,Join Daniel on his move to the odd but inviting While-A-Way Lane in Kimberly Willis Holt's coming-of-age middle gra… https://t.co/c1ZWDKQGfa
2019-05-27 23:00:37,Resa just wants to win the lemonade stand competition. Find out what happens when four girls try to perfect the rec… https://t.co/fGQt97h7uf
2019-05-27 22:00:06,"Tinker, make, and engineer to learn through play! With TINKERACTIVE WORKBOOKS, learning leaps off the page and into… https://t.co/s8UlaT8pa1"
2019-05-27 20:00:53,"Face your fears with the courage of a knight, the confidence of sorcerer, and the kindness of a princess. I WILL BE… https://t.co/ZX9KvdS7JR"
2019-05-27 18:00:13,"Full of clever humor and hilarious illustrations, @ObertSkye's Geeked out series is ADVENTURE TIME WITH FINN &amp; JAKE… https://t.co/0gjec2urUA"
2019-05-27 17:00:18,The invention of the steamship transformed transatlantic transportation forever. David Macaulay's CROSSING ON TIME… https://t.co/GelpcGsB1o
2019-05-27 16:00:47,Are you prepared to celebrate the day that man stepped foot on the moon for the first time? Embark on your own spac… https://t.co/A1dd8SWp6c
2019-05-27 15:00:54,"Celebrate individuality and self-expression with HARRISON DWIGHT, BALLERINA AND KNIGHT by @GirlMacFarlane and… https://t.co/U2P1LB8uD5"
2019-05-27 14:01:38,Looking for a new book to share with your child? @DanGemeinhart's REMARKABLE JOURNEY OF COYOTE SUNRISE takes us on… https://t.co/5bP6psNF0H
2019-05-27 00:00:23,"Don't miss WHEN PENCIL MET ERASER, a story about accepting strengths and weakness, appreciating differences, and ma… https://t.co/Om4jJ8k4eH"
2019-05-26 23:00:49,"Meet the young librarian of THE LIBRARY OF EVER: Lenora. When a great nothingness threatens the library, Lenora mus… https://t.co/FbuCww400a"
2019-05-26 22:00:42,NERDY BABIES is a new series that will ignite curiosity in even the youngest readers and encourage them to ask ques… https://t.co/60nT1Xig4q
2019-05-26 20:00:47,"You can't keep a good girl down... especially not Piper McCloud, no matter what the institute for normalcy does. St… https://t.co/ZbEtayRISU"
2019-05-26 19:00:09,What's better than a cake-eating Llama? A cake-eating Llama with some serious dance moves. Don't miss LLAMA DESTROY… https://t.co/EnWSj5QjVp
2019-05-26 18:00:07,"PIE IN THE SKY by @Remy_Lai is a poignant novel about losing a parent, the transition a family makes when they move… https://t.co/44kGONbLID"
2019-05-26 17:00:17,Looking for a chapter book series to dive into? Don’t miss the A IS FOR ELIZABETH series by @RachelVailBooks. Featu… https://t.co/uhmM8J8rwb
2019-05-26 16:00:19,"Spring has finally sprung, but are you ready for the summer heat? SUMMER by Cao Wenxuan and illustrated by Yu Rong… https://t.co/RGRsxUiDAk"
2019-05-26 15:00:42,"@kaaauthor's WISHTREE shows us how we can make the world beautiful by opening ourselves to new thoughts, traditions… https://t.co/2hnRv4yGeT"
2019-05-26 14:00:19,"Order #CoyoteSunrise, #RubyintheSky, #AstonishingMaybe and #MaybeaMermaid for a few middle-grade adventures that wi… https://t.co/JS1DOw5G4e"
2019-05-26 00:00:48,".@ObertSkye fans, get ready for a ton of laughs with BIGGER, BADDER, NERDIER, the sequel to GEEKED OUT.… https://t.co/L4dCjGJ72W"
2019-05-25 22:00:08,"An old friend, a magical secret, and a promise that can't be broken. You won't want to miss BOB from @wenmass &amp;… https://t.co/k2zzUS9xpX"
2019-05-25 21:00:31,"She'll never turn her back on the earth, literally! @StacyMcAnulty and Stevie Lewis' MOON! EARTH'S BEST FRIEND is a… https://t.co/yR3wFgvhi4"
2019-05-25 20:00:21,Want to introduce your littlest reader to early science concepts? Don't miss NERDY BABIES: SPACE and NERDY BABIES:… https://t.co/E4FufQojf3
2019-05-25 19:00:25,"THE WAY THINGS WORK co-creator David Macaulay's newest is CROSSING ON TIME, a picture book history of the era of th… https://t.co/WY3zryFAhJ"
2019-05-25 18:00:18,Calling all #NBAfinals fans! EPIC ATHLETES: STEPHEN CURRY from bestselling author &amp; sports writer @DanWetzel is ava… https://t.co/P5q0o061sl
2019-05-25 17:01:05,"Meet Harrision! Some days he's a knight, others he's a dancer, but he knows he can always be himself.… https://t.co/9CNjUS5QkG"
2019-05-25 16:00:08,Fun fact! A T-Rex could grow to be forty feet long. 🦖 That's about as long as a school bus! HOW TO CARE FOR YOUR T-… https://t.co/AiN66thEZM
2019-05-25 15:33:00,"In the BERNIE SANDERS GUIDE TO POLITICAL REVOLUTION, congressman, presidential candidate and activist… https://t.co/g4yLbHT5OS"
2019-05-25 14:01:00,"Don't miss WHEN PENCIL MET ERASER by creators Karen Kilpatrick and Luis Osvaldo Ramos Jr., and illustrated by Germá… https://t.co/ZUGoJ3bFYR"
2019-05-25 00:00:23,We're celebrating our universe in preparation for the 50th anniversary of the first moon landing! Adventure into sp… https://t.co/zupr0tejQI
2019-05-24 23:00:16,Prepping your child's #SummerReading list? SUMMER by Cao Wenxuan &amp; illustrated by Yu Rong introduces kids to poetry… https://t.co/KnF13NZKa5
2019-05-24 21:00:44,"Do you like books that are a little emotional, a lot funny, and full of cake baking hijinks? Well, you’ll love PIE… https://t.co/AJeWkg6dls"
2019-05-24 20:00:32,"THE LOST BOY'S GIFT, a stunning middle grade novel about friendship, forgiveness, and the magic that comes with lis… https://t.co/26r9IYAffw"
2019-05-24 19:00:09,Calling all chapter book readers! Check out the first books in a series from kid lit 👑 @RachelVailBooks! A IS FOR E… https://t.co/dWfjWCosGk
2019-05-24 18:00:11,You'll find every book ever written and every fact ever known in THE LIBRARY OF EVER by @ZAlexanderBooks. Prepare t… https://t.co/BRCn93a4Jz
2019-05-24 17:01:35,"""The oddest/sweetest mix of LITTLE HOUSE ON THE PRAIRIE and X-MEN...Prepare to have your heart warmed.""—Stephanie M… https://t.co/iFcb0rBCGd"
2019-05-24 16:04:10,"Tinker, make, and engineer to learn through play! With TINKERACTIVE WORKBOOKS, learning leaps off the page and into… https://t.co/HNueLX0kKc"
2019-05-24 15:00:20,Are you ready to take on the day? @BeaBirdsong and @NidhiArt's I WILL BE FIERCE encourages kids to be brave like bo… https://t.co/IyeJdf6Vic
2019-05-24 14:00:28,THE PRIZE: line-skipping tickets to Adventure Central THE COMPETITION: Sell the most lemonade! THE BIGGEST OBSTACLE… https://t.co/GpvH44k3ok
2019-05-24 00:33:45,"RT @dustdancestoo: DON'T FEED THE COOS! In case you missed it... this is the cover for the next book by @adoodlefox and I, it's our warning…"
2019-05-24 00:00:54,@DanGemeinhart's REMARKABLE JOURNEY OF COYOTE SUNRISE is a father-daughter adventure with a cast of eclectic charac… https://t.co/kiM9n8NIbE
2019-05-23 23:00:10,"After a long day of playing with your dinosuar, don't forget to put him to bed with a story. 🦖📖😴 HOW TO CARE FOR YO… https://t.co/mhsrTKaCZp"
2019-05-23 22:00:48,"Is your TBR pile in need of a few new additions? Well we've got you covered with #CoyoteSunrise, #RubyintheSky,… https://t.co/cViUiCQ41o"
2019-05-23 20:00:17,"@NYTimes says @kaaauthor's WISHTREE is ""a beautifully written, morally bracing story that will leave its imprint on… https://t.co/zwT5YfFBZh"
2019-05-23 19:00:07,"Friendship will lead you home in BOB, a heartfelt novel from @wenmass &amp; @rebstead - now available in paperback!… https://t.co/kEToib9w0I"
2019-05-23 17:00:17,"Llama is a dancer, a scholar, and a cake enthusiast... and now he's the picture book hero out to steal your heart i… https://t.co/eLOLKvyYxQ"
2019-05-23 16:02:16,"Perfect for fans of BE KIND and A SICK DAY FOR AMOS MCGEE, @VanessaBayer's debut picture book is a story about empa… https://t.co/CyHptIaZaL"
2019-05-23 14:00:39,"Bestselling author &amp; celebrated sports journalist @DanWetzel penned Epic Athletes, a new series of biographies that… https://t.co/L7zvuDpde7"
2019-05-23 00:00:32,"Prior to the 1800s, ships crossing the Atlantic relied on wind. Then, steam power was invented. In CROSSING ON TIME… https://t.co/DmuKzVME3M"
2019-05-22 23:00:11,Move over June B. Jones and Judy Moody! Second grader Elizabeth is your new chapter book favorite! Start reading wi… https://t.co/E542urdnXX
2019-05-22 22:00:43,".@GirlMacFarlane and @SpencerLaudiero's are back with HARRISON DWIGHT, BALLERINA AND KNIGHT, available now! A funny… https://t.co/cEdJG79FQF"
2019-05-22 21:00:44,"Read the latest addition in @ObertSkye's Geeked Out series: BIGGER, BADDER, NERDIER! The evil Darth Susan is up to… https://t.co/6BtVWqYzO3"
2019-05-22 20:01:02,Pencil doesn't need Eraser. Pencil doesn't make mistakes. But when the page always gets better when Eraser takes so… https://t.co/7L777ILzoH
2019-05-22 18:00:32,These girls mean business! THE STARTUP SQUAD is the first book in a series about four girls in a lemonade stand com… https://t.co/la82UvdqCg
2019-05-22 17:00:18,"Come visit While-A-Way Lane, where Tilda Butter talks to animals and people read on the ferris wheel. This coming-o… https://t.co/b7oJctuc5m"
2019-05-22 16:00:17,"An autobiography from the earth's ever-present friend the moon. With characteristic humor &amp; charm, @StacyMcAnulty &amp;… https://t.co/7J7Qo9Ohi5"
2019-05-22 15:00:30,It's summer vacation! Take a trip across time and space with @ZAlexanderBooks' LIBRARY OF EVER. Join Lenora on her… https://t.co/rGkLMZwOLt
2019-05-22 14:39:37,RT @PhilBildner: Cover Reveal Day!  Thank you to @PeterMDeWitt DeWitt and @educationweek  for allowing me the opportunity to share the cove…
2019-05-22 14:01:20,"Get the book that @KirkusReview says, “Like salted caramel, a perfect balance of flavors, this deftly drawn story i… https://t.co/gy1r8eyZKA"
2019-05-22 00:00:37,"Piper McCloud can fly. Just like that. Easy as pie. But the good folk of Lowland County are afraid of Piper, &amp; even… https://t.co/vbk3G3EsOQ"
2019-05-21 23:00:29,LLAMA DESTROYS THE WORLD the the hilarious picture book debut from @dustdancestoo and @adoodlefox. Prepare for worl… https://t.co/wgwNwIJACO
2019-05-21 22:00:36,"Everyone has trouble finding the right things to say or do for someone they love is sick, whether it’s a serious il… https://t.co/cuSuCVaCh7"
2019-05-21 21:00:08,Stephen Curry. 🏀 Alex Morgan. ⚽️ Tom Brady. 🏈 Serena Williams. 🎾 They are EPIC ATHLETES. Discover the full series t… https://t.co/P4yJkDWKlb
2019-05-21 20:00:46,"No matter the challenge, we're ready to face it. @BeaBirdsong and @NidhiArt's I WILL BE FIERCE is an uplifting pict… https://t.co/tCQx0ImrB2"
2019-05-21 19:00:18,"In HOW TO CARE FOR YOUR T-REX, @KenBakerBooks and @speedbumpcomic give kids helpful tips for their new pet. 🦖 Check… https://t.co/3RSjqf9TMz"
2019-05-21 18:00:31,"Both vibrant and lyrical, SUMMER by Cao Wenxuan and illustrated by Yu Rong is an original, captivating picture book… https://t.co/w3h9bBBDfR"
2019-05-21 17:51:57,RT @SquareFishBooks: We can't get over these gorgeous covers for #TheBrightsiders by @jenmariewilde and #IntergalacticPS3 by @MadeleineLEng…
2019-05-21 17:00:13,Calling all Nerdy Parents! NERDY BABIES: SPACE and NERDY BABIES: OCEAN by @EmmyKastner are the books for you! These… https://t.co/BOyJV96XuA
2019-05-21 16:00:19,Teachers and parents: @kaaauthor's WISHTREE is a book that will move you and your children to action. Take the pled… https://t.co/R8FQO5oSPJ
2019-05-21 15:00:10,"An old friend, a magical secret, and a promise that can't be broken. You won't want to miss BOB from @wenmass &amp;… https://t.co/kUlRIuechB"
