timestamp,tweet_text
2019-09-01 18:00:17,THIS BOOK OF MINE written by Sarah Stewart and illustrated by David Small celebrates reading—and especially young r… https://t.co/wapq5kLgCx
2019-09-01 17:00:26,"With books, anything is possible... ✨✨✨⁠ ⁠ ...including getting ready for back to school! Enter to win a back to sc… https://t.co/NraAZioJ2d"
2019-09-01 16:00:05,"According to @KirkusReviews, ""The Wimpy Kid's got nothing on THE KING OF THE MOLE PEOPLE--he's got more laughs and… https://t.co/uodTDEpd7g"
2019-09-01 15:00:25,#CoyoteSunrise is the perfect middle-grade read to dive into this summer. @DanGemeinhart's THE REMARKABLE JOURNEY O… https://t.co/YcdHqHSAwY
2019-09-01 14:00:09,"Whether it's a goblin in the garden or a fairy in the attic, Bailey Buckleby and his dad can rid your home of whate… https://t.co/NzxQsiucZO"
2019-08-31 23:00:05,Listen  with your heart. It is your ears your eyes your nose your mouth your hands—   Preorder the lyrical and insp… https://t.co/ZOZEvxUkMa
2019-08-31 22:30:00,"Score the biggest, best books at amazing prices during Barnes &amp; Noble’s #bookhaul BLOWOUT! 50% off books by… https://t.co/7uYpMMJ1ju"
2019-08-31 22:00:08,"Draw and revise with Pencil and Eraser, download the activity kit! These activities will remind kids of WHEN PENCIL… https://t.co/qmQPx0Mz3T"
2019-08-31 20:00:06,Check out the heartwarming and clever picture book TWINS by @Ciccotello. A boy and his twin do everything together—… https://t.co/0UvLhtNYEf
2019-08-31 19:00:34,Looking for an #OwnVoices novel about transracial adoption? Look no further than FOR BLACK GIRLS LIKE ME by… https://t.co/lQPYcNnXwe
2019-08-31 18:00:29,Want to win a set of #TinkerActive Workbooks for your child's entire classroom? 😱 Enter the TinkerActive Back to Sc… https://t.co/GlyBubpaLI
2019-08-31 17:00:14,"In her hilarious, moving middle-grade debut  PIE IN THE SKY, @Remy_Lai delivers a scrumptious combination of vibran… https://t.co/f0reaUVhLj"
2019-08-31 16:00:39,"The world's #1 cat burglar, Ophelia von Hairball V of Burglaria, international kitty of mystery, is fishing for a n… https://t.co/J2vvkKGjLF"
2019-08-31 15:00:16,It's picture day &amp; Juno Valentine is having a fashion emergency! Join Juno &amp; her brother as they return to the magi… https://t.co/qWqeLiC70w
2019-08-31 14:00:25,Everybody has a favorite food. Some enjoy sweet treats and others prefer savory comforts. Don't miss WHAT'S YOUR FA… https://t.co/bvDveAzlXi
2019-08-30 23:00:21,Calling all educators! Don't miss this teacher's guide for Jess Redman's THE MIRACULOUS over at @MGBookVillage!… https://t.co/4g6LU3paNE
2019-08-30 22:30:00,.@ericcarle has teamed up with 13 other beloved children's book artists to illustrate their favorite foods and why… https://t.co/O0a7AaUP1c
2019-08-30 22:01:00,Don't miss THIS IS BABY!  Bestselling author @JimmyFallon newest picture books is available on 10/8/19 and is a mus… https://t.co/O627jCsqkt
2019-08-30 21:00:11,"Doug didn't ask to be King of the Mole People, but it's a job he can't really avoid, like the eel sandwiches his da… https://t.co/evGSL9lTJn"
2019-08-30 19:28:00,RAINBOW RANGERS to the rescue! Don't miss the books based on the hit animated series on Nick Jr.!… https://t.co/CRwE0Ets59
2019-08-30 19:02:23,".@VossWriter's Hoot &amp; Olive are back in another captivating, tender picture book IMAGINE THAT! Join them as they tr… https://t.co/9fTjQIvxE8"
2019-08-30 17:26:00,Happy BEST FRIENDS release week!  We can't wait for everyone to read the latest from @HaleShannon and LeUyen Pham.… https://t.co/FWFUjEVb5J
2019-08-30 17:02:10,THE TRAIN TO IMPOSSIBLE PLACES by @petergbell is a middle-grade fantasy where a clever young girl joins an impossib… https://t.co/qyaZT8wQeH
2019-08-30 16:33:00,THIS BOOK OF MINE is a dazzling depiction of the connection between readers of all ages and their books. Enter for… https://t.co/IaqrvrhYay
2019-08-30 16:00:14,"Written by Sarah Stewart &amp; illustrated by David Small, THIS BOOK OF MINE is a celebration of the power of reading,… https://t.co/vSWBEocmWd"
2019-08-30 14:51:01,"From debut picture book author-illustrator @Ciccotello, father of fraternal twins, comes a sweet and silly celebrat… https://t.co/ZK1yL716Xo"
2019-08-30 14:01:54,"It's back to school season, so why not celebrate with #TinkerActiveWorkbooks? Available now with hands-on activitie… https://t.co/pWMZXSBvyY"
2019-08-29 23:00:15,In search of the perfect book to help pass the summer days? Pick up a copy of THE REMARKABLE JOURNEY OF COYOTE SUNR… https://t.co/Sedaio1Rc2
2019-08-29 20:01:01,"""It always seems impossible until it is done."" - Nelson Mandela   A back to school MOOD!   Enter to win the ultimat… https://t.co/7w2xq2fxbr"
2019-08-29 19:07:19,"RT @PatZMiller: Just in time for the start of school, BE KIND has climbed back onto the New York Times bestseller list. Thank you to everyo…"
2019-08-29 19:00:05,"Author @HollyMMcGhee and illustrator Pascal Lemaitre ask you, me, and all of us to inspire empathy by exploring wha… https://t.co/n9vs26QWBS"
2019-08-29 18:00:21,"In WHAT'S YOUR FAVORITE FOOD? by @ericcarle and 13 other children's book artists, everyone shares their favorite fo… https://t.co/GDG9JxaID3"
2019-08-29 17:00:10,"Engaging art, adorable characters, and a clever ending, don't miss, WHEN PENCIL MET ERASER! Click here to watch the… https://t.co/7QQNFUtJ7G"
2019-08-29 16:30:00,Last call to all @junovalentine fans! Don't miss your chance to enter the JUNO VALENTINE AND THE FANTASTIC FASHION… https://t.co/QvRNCpsdYR
2019-08-29 16:00:08,"Pass the summer days with a hilarious middle-grade adventure full of giants snakes, goblins, fairies, and more! Kid… https://t.co/L1yJkbou8a"
2019-08-29 15:14:12,RT @Kris10MFAF: Who’s your best #bookish friend?  Bestselling creators of Real Friends Shannon Hale and LeUyen Pham are back with a true st…
2019-08-29 15:00:24,"""I am a girl but most days I feel like a question mark.""  Start reading FOR BLACK GIRLS LIKE ME by @marilock and le… https://t.co/fwTWfNssLK"
2019-08-29 14:06:34,RT @01FirstSecond: BEST FRIENDS by @haleshannon and LeUyen Pham is on-sale and we're celebrating all week long! Follow your heart. Find you…
2019-08-29 00:30:00,"Score the biggest, best books at amazing prices during Barnes &amp; Noble’s #bookhaul BLOWOUT! 50% off books by… https://t.co/egJl2xIrxH"
2019-08-28 23:00:07,"THIS BOOK OF MINE, written by Sarah Stewart and illustrated by David Small, is a unique gift for bibliophiles young… https://t.co/iFF7i1G4MY"
2019-08-28 22:30:00,BEST FRIENDS by @haleshannon and LeUyen Pham is finally here and we're celebrating all week long!  Follow your hear… https://t.co/05kTDqe902
2019-08-28 22:01:58,The perfect rainy day activity: imagining a wild adventure with your best friend. But Olive's best friend Hoot has… https://t.co/rmJB3J9a9x
2019-08-28 21:00:11,"Adventure, heists, and teamwork abound in SNAZZY CAT, a fun, young middle grade series brimming with cat-tastic bla… https://t.co/QsHvjSO7Nu"
2019-08-28 20:00:21,Is THE SUPER LIFE OF BEN BRAVER by @NinjaEmerson on your summer to read list? Find out how you can get a FREE copy… https://t.co/pV0Jh1olwL
2019-08-28 19:00:57,Juno Valentine is having a fashion emergency! She's not sure what to choose for school picture day. Find out what h… https://t.co/UaogFFwHnR
2019-08-28 18:01:22,This time BABY is the star of the show! Preorder your copy of @JimmyFallon's newest picture book THIS IS BABY today… https://t.co/hz1shl3tWq
2019-08-28 16:02:15,"Does your reader love tinkering, and making, and engineering? Help you child learn through play! Enter to win a set… https://t.co/UOM5XpwXoI"
2019-08-28 15:00:11,"Start off the school year right by reading PIE IN THE SKY by @Remy_Lai, which is a fun middle-grade novel with beau… https://t.co/xUyaXaA3FV"
2019-08-28 14:00:58,"""I loved this extraordinary debut."" —Leslie Connor, author of the National Book Award Finalist THE TRUTH AS TOLD BY… https://t.co/xIQaCpKN0M"
2019-08-27 23:00:34,ARLO FINCH IN THE VALLEY OF FIRE by @johnaugust is a story about a twelve-year-old boy who joins a special scout te… https://t.co/JK0AjunsLz
2019-08-27 22:00:25,Makeda is black. Her adoptive parents are white. She always wonders: What would it feel like to grow up with a fami… https://t.co/s7tteovijz
2019-08-27 20:30:00,"Celebrate the power of reading with THIS BOOK OF MINE by Sarah Stewart, illustrated by David Small. Enter for your… https://t.co/amObTH8q1g"
2019-08-27 20:00:11,"In search of a bookclub read for you and your child, don't miss our recommended read: THE REMARKABLE JOURNEY OF COY… https://t.co/yfFrlLi0mC"
2019-08-27 19:00:09,".@PaulGilligan10's smart and funny illustrated middle grade series KING OF THE MOLE PEOPLE stars Doug, King of the… https://t.co/rxpWbjX6eJ"
2019-08-27 19:00:00,"First DADA, then MAMA, now BABY!  Don’t miss THIS IS BABY by #1 @NYTimes bestselling author @JimmyFallon! Preorder… https://t.co/PKPT9eCz9r"
2019-08-27 18:02:00,"Celebrate back to school season with #TinkerActiveWorkbooks! With the hands-on activities, learning leaps off the p… https://t.co/6eOWIsXaUY"
2019-08-27 17:51:35,RT @LindsayWrites: Almost there! Just a week to go. You can still enter to win this adorable back to school prize package from @MacKidsBook…
2019-08-27 17:49:08,"RT @sfillner: The jacket, the cover, the endpapers, the story...just love this book and all that can be learned from this story by @noblema…"
2019-08-27 17:47:58,RT @Loveofxena: It's a happy book birthday for This Book of Mine the newest collaboration by #SarahStewart and #DavidSmall @MacKidsBooks @M…
2019-08-27 17:47:29,RT @haleshannon: BEST FRIENDS is out today! It feels like a long time in the making. I started the script in summer/fall 2017 and finished…
2019-08-27 16:33:00,We're only a week away from the ultimate mash-up in MIGHTY JACK AND ZITA THE SPACEGIRL &amp; we can't wait! Be sure to… https://t.co/br36OqB2wy
2019-08-27 16:00:09,"TWINS by @Ciccotello is an upbeat, optimistic view of the twin relationship, and acknowledges the ups and downs of… https://t.co/AlLGRTzmei"
2019-08-27 15:31:00,SWEEPSTAKES ALERT!  It's an @ericcarle bonanza! Enter this sweepstakes and you could be the lucky winner of a signe… https://t.co/0jSeukEsTA
2019-08-27 15:00:09,A tortoise named after Tuck Everlasting ✅ A notebook full of impossible things ✅ An powerful middle grade debut ✅… https://t.co/XqkSYVu5l1
2019-08-27 14:00:10,It's #BackToSchoolSeason and you know what that means... school supply shopping! Don't go too crazy with the new pe… https://t.co/KXNlx54KLX
2019-08-26 23:00:07,.@nytimes bestselling author @evachen212 is back with JUNO VALENTINE AND THE FANTASTIC FASHION ADVENTURE! This time… https://t.co/QyhvKRQ455
2019-08-26 22:29:00,Don't miss out on your chance to meet @evachen212! You could win a trip to her @junovalentine book launch in NYC an… https://t.co/PwvHWoK4Xv
2019-08-26 22:10:47,"RT @sljournal: SLJ reviews 'Stargazing': ""With this spot-on glimpse into the emotional landscape of tweens, [Jen] Wang joins the ranks of m…"
2019-08-26 22:01:00,⭐#SWEEPSTAKES ALERT!⭐⁠ Enter to win #TinkerActive workbooks for your child's entire classroom! TinkerActive aims to… https://t.co/V1aCxAzcJp
2019-08-26 20:00:07,"Check out PIE IN THE SKY by @Remy_Lai now! This novel is perfect for summer reading, named Amazon Best Book of the… https://t.co/1dwHcTq3LA"
2019-08-26 19:00:21,Calling all girl entrepreneurs!  📣 📣 📣 📣  @TheStartupSquad wants to hear about how you started your own business. E… https://t.co/pnHCrm7I1O
2019-08-26 18:00:12,"When Bad Kitty suddenly starts believing she's a dog, she and a freaked out Puppy get sent away to Murray's Camp fo… https://t.co/uIqLGgqFsq"
2019-08-26 16:33:00,"Today's the last day to preorder BEST FRIENDS, @haleshannon &amp; LeUyen Phams' vivdly honest follow-up to the runaway… https://t.co/LhoXFiwHRZ"
2019-08-26 16:01:26,This year marks 50 years since Neil Armstrong took his first steps on the moon. Celebrate with these titles celebra… https://t.co/llLbciwq6i
2019-08-26 14:01:06,"Return to the world of Hoot &amp; Olive with IMAGINE THAT, the next adventure in @VossWriter's captivating, heartfelt w… https://t.co/uYghOtdFsd"
2019-08-25 23:01:18,"It's almost time to get ready to head back to school! Don't panic, be sure to get a good night's rest, finish your… https://t.co/CGrwWNjw5q"
2019-08-25 22:01:11,"Did you love REAL FRIENDS by @HaleShannon and LeUyen Pham? You won't want to miss BEST FRIENDS! And, if you preorde… https://t.co/GKwoTLxeE3"
2019-08-25 21:00:43,ODDITY by @saille is a story about a tough 11-year-old that explores a small New Mexico town as she faces down invi… https://t.co/K3CzrBMrF4
2019-08-25 19:00:23,There are miracles all around us. If anyone can find them it's you.   Start reading @Jess_Red's powerful #mglit deb… https://t.co/B0qrXo77EQ
2019-08-25 17:00:09,A tortoise named after Tuck Everlasting ✅ A notebook full of impossible things ✅ An powerful middle grade debut ✅… https://t.co/FopQdfK0kv
2019-08-25 15:30:00,"Score the biggest, best books at amazing prices during Barnes &amp; Noble’s #bookhaul BLOWOUT! 50% off books by Natalie… https://t.co/A04wUrFFAn"
2019-08-25 15:00:16,12-yr-old Coyote &amp; her father Rodeo have been on the road for 5 years. That's also how long ago they lost her mothe… https://t.co/1AbO0JJcGd
2019-08-25 14:00:59,"Whether it's a goblin in the garden or a fairy in the attic, Bailey Buckleby and his dad can rid your home of whate… https://t.co/YAt3f9IPMC"
2019-08-24 23:00:10,"Have you seen the trailer for PIE IN THE SKY by @Remy_Lai? Check it out to learn more about this poignant, laugh-ou… https://t.co/wNFPhuj9Fp"
2019-08-24 22:00:09,Ever wonder how a pencil and an eraser became friends? Watch the trailer for WHEN PENCIL MET ERASER and learn how t… https://t.co/SPC4zd6Cer
2019-08-24 21:00:44,Excited for camp? BAD KITTY CAMP DAZE is perfect for any kid with or without camping experience. Join Kitty &amp; Puppy… https://t.co/yVtmdfjtD1
2019-08-24 19:27:00,Enjoy your own fantastic fashion adventure with the #junoxjanieandjack collection! Enter now for your chance to win… https://t.co/9BekAeDnDY
2019-08-24 19:00:44,"In FOR BLACK GIRLS LIKE ME, a lyrical coming-of-age story about family, music, race, and identity, @marilock draws… https://t.co/xJwEtEOHP6"
2019-08-24 18:00:17,Want to win a set of #TinkerActive Workbooks for your child's entire classroom? 😱 Enter the TinkerActive Back to Sc… https://t.co/Jm8MB98U1z
2019-08-24 17:32:00,Celebrate the ways in which books launch our adventures with THIS BOOK OF MINE! Enter for your chance to win a sign… https://t.co/A3YWyvUUKt
2019-08-24 16:00:23,"""Snazzy Cat Capers is fabulous, funny and fin-tastic fun.” —Mo O’Hara, New York Times bestselling author of the My… https://t.co/5XDunzKWVW"
2019-08-24 15:00:27,"In JUNO VALENTINE AND THE FANTASTIC FASHION ADVENTURE by @evachen212 &amp; @derekdesierto, Juno discovers the self-conf… https://t.co/ESroWdrVOY"
2019-08-24 14:00:49,"Shannon knows that sixth grade is going to be perfect. She's a got a spot in ""The Group"" and she's BFFs with the mo… https://t.co/u2yD6L4hct"
2019-08-23 23:29:00,"A unique gift for bibliophiles young and old, THIS BOOK OF MINE written by Sarah Stewart and illustrated by David S… https://t.co/gs8XfvYqPe"
2019-08-23 23:01:24,There are miracles all around us. If anyone can find them it's you.   Start reading @Jess_Red's powerful #mglit deb… https://t.co/7TtpYPbRoK
2019-08-23 22:00:10,"Pass the summer days with a hilarious middle-grade adventure full of giants snakes, goblins, fairies, and more! Kid… https://t.co/pu2xHyr097"
2019-08-23 20:01:11,"For fans of WINNIE THE POOH and FROG AND TOAD, the newest in @VossWriter's Hoot &amp; Olive picture book series will ca… https://t.co/QfLEMDvu6X"
2019-08-23 17:02:01,"THE TRAIN TO IMPOSSIBLE PLACES by @petergbell plays out over a kaleidoscope of unforgettable settings, from frozen… https://t.co/gPAJPwsQBz"
2019-08-23 15:31:00,"It’s Barnes &amp; Noble’s #bookhaul BLOWOUT: 50% off books by @shauntagrimes, @emmykastner, @verabee, @Remy_Lai, and mo… https://t.co/R138LOieAD"
2019-08-23 15:00:12,"In THE STARTUP SQUAD by @weisfeld and @nicoleckear, young girls raise themselves and become entrepreneurs! You can… https://t.co/yxHmcStibu"
2019-08-23 14:01:45,"With school around the corner, there's no better way to get back into action than with #TinkerActiveWorkbooks, an e… https://t.co/PKs4NoY3Xw"
2019-08-22 23:33:00,"It’s Barnes &amp; Noble’s #bookhaul BLOWOUT: 50% off books by @nidhiart, @BeaBirdsong, @verabee, @evachen212, and more,… https://t.co/MpBuOZMizR"
2019-08-22 23:00:20,Is your Summer TBR stack in need of a few new editions? Make sure you include THE REMARKABLE JOURNEY OF COYOTE SUNR… https://t.co/DYVziBrWkn
2019-08-22 20:00:20,"With books, anything is possible... ✨✨✨⁠ ⁠ ...including getting ready for back to school! Enter to win a back to sc… https://t.co/aegsfLKZi3"
2019-08-22 19:30:00,"It’s Barnes &amp; Noble’s #bookhaul BLOWOUT: 50% off books by Natalie Babbitt, @JanetTashjian, @thejaketashjian,… https://t.co/ZMYley5NzV"
2019-08-22 19:17:41,RT @melissa_warten: 🔥🔥🔥PAID INTERNSHIP ALERT! 🔥🔥🔥  Are you a current student or May 2019 grad interested in children’s books/editorial work…
2019-08-22 19:00:15,"Did you love REAL FRIENDS by @HaleShannon and LeUyen Pham? You won't want to miss BEST FRIENDS! And, if you preorde… https://t.co/mWgcqa0j7a"
2019-08-22 17:00:09,"Tis the season...for new pencils! And where there's a pencil, there's an eraser, right? Your kids will love WHEN PE… https://t.co/Rhe2V5EK3e"
2019-08-22 15:31:00,THIS BOOK OF MINE is a dazzling depiction of the connection between readers of all ages and their books. Enter for… https://t.co/tg4jUuehwa
2019-08-22 15:09:28,"Makeda is 11-years-old, adopted, &amp; black. Read FOR BLACK GIRLS LIKE ME to find out what happens when Keda and her f… https://t.co/nCpwt8hk7Z"
2019-08-22 14:30:00,Love @junovalentine? Enter for a chance to win a trip to @evachen212's launch event for the second book in her seri… https://t.co/V3Vwm4msyI
2019-08-22 14:01:09,"We're feeling that summer vacation mood 🌞 Get camping with @NickBruel's BAD KITTY CAMP DAZE, the eleventh hilarious… https://t.co/6LKAc4D0lY"
2019-08-22 13:29:32,RT @LindsayWrites: #alltheimpossiblethings has received a STAR from @sljournal and I am so thrilled and grateful! I used to read SLJ when I…
2019-08-21 23:01:11,THE STARTUP SQUAD by @weisfeld &amp; @nicoleckear promotes the belief that entrepreneurship can empower young girls to… https://t.co/oelloPKMfd
2019-08-21 22:01:32,".@VossWriter's illustrations shine once again in IMAGINE THAT, the newest in his Hoot &amp; Olive series. This time, hi… https://t.co/TC63m1RBKG"
2019-08-21 21:30:00,"THIS BOOK OF MINE written by Sarah Stewart &amp; illustrated by David Small is a celebration of the power of reading, o… https://t.co/kdeDEZddWb"
2019-08-21 21:00:53,"Ophelia von Hairball V of Burglaria, international kitty of mystery, is back in SNAZZY CAT CAPERS: THE FAST AND THE… https://t.co/W5sEptDu6N"
2019-08-21 20:17:45,RT @blythe_russo: TODAY'S THE DAY! ONE MORE WHEEL is finally out in the world for y'all to see! AHHH! ❤️❤️❤️ Thank you @colleenaf and Justi…
2019-08-21 19:01:27,.@nytimes bestselling author @evachen212 is back with JUNO VALENTINE AND THE FANTASTIC FASHION ADVENTURE! This time… https://t.co/yVquRKTJvi
2019-08-21 18:00:59,"Did you hear?! @BNBuzz's Summer Reading Program is offering young readers the chance to earn free books, and THE RA… https://t.co/9ACJ5MaICK"
2019-08-21 17:01:15,Looking for a funny and adventurous read to pass the summer days? Go monster hunting with @7Brewington7's THE MONST… https://t.co/Iy8tYyo7vE
2019-08-21 15:32:00,🚨 Clear your shelves: the Barnes &amp; Noble #bookhaul is coming! 🚨  #BNBookHaul
2019-08-21 15:00:11,"Want the perfect summer reading book? Check out PIE IN THE SKY by @Remy_Lai, a story that is ""the perfect mixture o… https://t.co/zd1b0erMaS"
2019-08-21 14:01:12,Newbery Honor-winning author @VeeraHira calls THE MIRACULOUS “A beautifully rendered and meaningful read for young… https://t.co/1PicfzakQ8
2019-08-21 00:00:00,"Celebrate the power of reading with THIS BOOK OF MINE by Sarah Stewart, illustrated by David Small. Enter for your… https://t.co/swP0H5jcqU"
2019-08-20 23:29:44,You could meet @evachen212 at her book launch for JUNO VALENTINE AND THE FANTASTIC FASHION ADVENTURE! Enter for you… https://t.co/Bs2GbDTU9F
2019-08-20 23:00:36,"ARLO FINCH IN THE VALLEY OF FIRE by @johnaugust is masterful mix of mystery and adventure, set in a supernatural sc… https://t.co/zJABrOQigB"
2019-08-20 22:00:49,How are you supposed to know where you're going when you don't know where you came from? Start reading FOR BLACK GI… https://t.co/An449OET6v
2019-08-20 20:31:00,"There is something fishy about plastics in our oceans… this summer, join The Pout-Pout Fish and the @nyaquarium to… https://t.co/QG5QR0UfbZ"
2019-08-20 18:01:50,#TinkerActiveWorkbooks are the best way to ease back into the school year! With a blend of traditional exercises an… https://t.co/2b5yjhsE6A
2019-08-20 17:00:21,"The highly anticipated sequel to @HaleShannon's REAL FRIENDS is almost here! In BEST FRIENDS, Shannon is in sixth g… https://t.co/qxvQcu8MbD"
2019-08-20 15:55:40,"RT @LindsayWrites: We're 2 weeks from launch, and there are GIVEAWAYS! My awesome publisher @MacKidsBooks is giving away an amazing back to…"
2019-08-20 14:00:49,"Draw and revise with Pencil and Eraser, download the activity kit! These activities will remind kids of WHEN PENCIL… https://t.co/A30D9LoaeS"
2019-08-19 23:00:06,Juno Valentine is back in a new fashion fairy tale. This time she needs to pick the perfect out for school picture… https://t.co/okWh33c63w
2019-08-19 20:00:08,"There's no better time than now to check out the trailer for PIE IN THE SKY by @Remy_Lai, a beautiful story about h… https://t.co/4lsWYn55M4"
2019-08-19 19:01:46,Know a 7–14 year old girl running her own business or starting one this summer? @TheStartupSquad wants to feature h… https://t.co/MmZziCzk2V
2019-08-19 18:00:21,"Kitty's hit her head and now believes she's a DOG! So when Puppy gets shipped off to dog camp, guess who tags along… https://t.co/gGtMAkTh49"
2019-08-19 16:01:24,We're celebrating our universe in preparation for the 50th anniversary of the first moon landing! Adventure into sp… https://t.co/GspHfw3aMT
2019-08-19 15:00:34,"An emotional story, of friendship, family, and self identity #CoyoteSunrise, is an unforgettable book that should b… https://t.co/RZPx3R7lPd"
2019-08-19 14:00:46,"Hoot &amp; Olive are back in IMAGINE THAT! In a tender story about the search for Hoot's imagination, @VossWriter's sum… https://t.co/k53TFDSM3S"
2019-08-18 23:02:59,"It's back to school season, so why not celebrate with #TinkerActiveWorkbooks? Available now with hands-on activitie… https://t.co/11Gy3mgvTO"
2019-08-18 22:02:55,"Calling all #RealFriends fans! If you preorder a copy of BEST FRIENDS by @HaleShannon and LeUyen Pham, we'll send y… https://t.co/51o4M5ow0h"
2019-08-18 21:02:32,A STORM TOO SOON by Michael J. Tougias is riveting true account of a rescue at sea from the author of The Finest Ho… https://t.co/hCXfGaf2iq
2019-08-18 18:01:54,Calling all educators! Don't miss this teacher's guide for Jess Redman's THE MIRACULOUS over at @MGBookVillage!… https://t.co/vc5Os2limn
2019-08-18 16:00:45,"""A dash of history. A scoop of fun. Give this book to hungry readers everywhere!” —New York Times–bestselling autho… https://t.co/gPgZOWmyuM"
2019-08-18 14:00:19,Looking for a funny and adventurous read to pass the summer days? Go monster hunting with @7Brewington7's THE MONST… https://t.co/6umYXLBf9q
2019-08-17 23:00:09,"It's back to school season! Get some reading in and check out PIE IN THE SKY by @Remy_Lai, a touching story about a… https://t.co/NXlPiQZl1D"
2019-08-17 22:00:10,"Ever wonder why there’s a little pink eraser on every pencil? Find out in this funny, clever picture book that tell… https://t.co/7oFe768G63"
2019-08-17 21:01:34,.@NickBruel's Bad Kitty gets bonked on the head and starts to believe she's a DOG! This is definitely going to be a… https://t.co/ENKyEXeRYB
2019-08-17 20:25:00,.@01FirstSecond is hosting a readalong of the MIGHTY JACK series and ZITA THE SPACEGIRL series! 🎉🎉🎉  Follow along w… https://t.co/CH94r1x15W
2019-08-17 19:00:06,"In FOR BLACK GIRLS LIKE ME, a lyrical coming-of-age story about family, music, race, and identity, @marilock draws… https://t.co/QNhLNV2jMM"
2019-08-17 18:30:00,"Together we can help protect the planet for our ocean friends! This summer, The Pout-Pout Fish at the @nyaquarium t… https://t.co/KZb0fGy5qf"
2019-08-17 16:00:29,"Adventure, heists, and teamwork abound in SNAZZY CAT, a fun, young middle grade series brimming with cat-tastic bla… https://t.co/awp8FEdK52"
2019-08-17 15:30:00,"A unique gift for bibliophiles young and old, THIS BOOK OF MINE written by Sarah Stewart and illustrated by David S… https://t.co/jGgodFleu1"
2019-08-17 15:00:51,It's picture day &amp; Juno Valentine is having a fashion emergency! Join Juno &amp; her brother as they return to the magi… https://t.co/a5JoaqoAFI
2019-08-17 14:00:15,Follow your heart. Find your people.   Bestselling creators of REAL FRIENDS Shannon Hale and LeUyen Pham are back w… https://t.co/2csWp2mktE
