timestamp,tweet_text
2017-01-31 14:59:13,I never stopped doing music. Cause I failed; I just evolved. A true hustler can sell whatever he or she wants. #OnlineBusiness
2017-01-31 10:56:28,Ability is what separates us. Positions are imaginable crowns that burdens weak people to feel powerful.
2017-01-31 02:03:07,"""Foolish"" by Teorock featuring Hettie Barnhill https://t.co/tQm9MeyeaZ"
2017-01-31 01:31:33,"I'm very thankful to Google Inc, for saving me from any major losses in the market. What an incredible company. #Investments."
2017-01-31 01:23:04,Matsy - Matthew Parker Live at the station bar in Woodstock https://t.co/fdrqWb2QBD
2017-01-30 17:37:04,"When you are very smart, you have to be creative about demonstrating it. Always look for alternative ways to express your Genius!"
2017-01-30 16:48:09,Trump is bad for business. Who the hell does he think travels abroad? He's ruining airline businesses and disrupting their money!
2017-01-30 15:00:19,"It's obvious to me know, intellect is a threat within conflicted environments. No fear on my part. #Ethics"
2017-01-30 10:58:44,"Who owns Uber? Is it private, or did google buy it? It's on schedule to make over 2 billion this year!"
2017-01-30 02:59:18,"Meet the Echidna, an Incredible, Fire-Proof Spiny Anteater https://t.co/YnwENk1Iw0"
2017-01-29 22:10:00,"I can get thrown off course for a short period of time, but when I get back on, I recognize what distracted me, and I move with more focus."
2017-01-29 03:00:59,"If you knew how look up company stock, you would know that Instagram and Snapchat trades as ""Facebook"" stock. #FinanciallyLiterate"
2017-01-29 00:01:12,https://t.co/7xy2OGzCLC https://t.co/7xy2OGzCLC
2017-01-28 23:47:11,"I'm looking for those unusual stocks. Rotations, spreads, and profitable trades!!!!!"
2017-01-28 23:30:12,"One day I'll look back on all of this, and I'll say, ""It was all worth it."""
2017-01-28 20:38:59,A lot of the youth nowadays don't use twitter. Instead they use Instagram. #TheyDontKnowWhereTheBagIs..$$$$$$
2017-01-28 20:37:49,I got another hit on my hands. Loving it! No streams on iTunes for this one. I see mogal status. #NoiTunes
2017-01-28 20:35:16,I will have my collection of media soon. Vision is everything!
2017-01-28 18:53:56,"The moment you realize that your words have little value to the person you are talking to, it's time to learn how to silence your tongue."
2017-01-28 15:46:05,"If you're not sure how to become, how are you going to make someone else successful? #FoodForThought"
2017-01-28 13:01:11,"Trump signs order temporarily halting admission of refugees, promises priority for Christians - The Washington Post https://t.co/Q41CMecFQe"
2017-01-28 03:32:56,"Don't know how long it will last, but I'm feeling really good tonight!"
2017-01-27 20:43:43,American Airlines went down by 5.80%. Perfect day for me to buy a few shares!!!! #StocksToTrade
2017-01-27 20:25:25,"Hey, check out Robinhood. Legit free stock trading. https://t.co/NQe8s8SWeP via @robinhoodapp"
2017-01-27 16:49:29,"Focus on markets, profits, mergers, and acquisitions. Don't focus on trends, unless those trends can be monetized. #Business"
2017-01-26 19:54:59,"Having only one source of income is dangerous, and border line fragile. Sometimes you have to use your mind to make money as well."
2017-01-26 18:20:09,DJ Lady Style - Music is my life https://t.co/iUDdXdwVia
2017-01-26 16:43:38,"Making $20,000 a month on YouTube https://t.co/bQL1Q1Iihw"
2017-01-26 16:41:51,How I DOUBLED My YouTube Earnings In 3 Months ($1000 to $2000 per month) https://t.co/AeQLIsaoRY
2017-01-26 16:25:37,Teorock performs at the station bar in Woodstock https://t.co/yXcKl824Z1
2017-01-26 14:58:11,"The Dow is now at 20,091.91. So all this Facebook copy and paste is really telling me you don't understand 52 week averages!!!"
2017-01-26 11:01:24,Surprise them with your abilities!
2017-01-25 23:39:12,Mad Max - how to clear minefields | tutorial with audio (Walkthrough gam... https://t.co/x2SbOjohQR
2017-01-25 16:36:19,How to upload or change ebay account photo. https://t.co/8nx2Qbjyuw
2017-01-25 16:20:57,"If I dropped a single right now, it would be crazy. I have a lot of experience with moving music."
2017-01-25 15:13:45,"Steve Harvey, no points awarded to you sir!"
2017-01-25 14:54:11,"Right now is the perfect time to start saving, with your tax returns... start learning to invest your money. No more time for games!"
2017-01-25 13:49:41,DG2 WalkThrough | Overlook mission | campaign Elite - no cores lost https://t.co/LJqDsNcq42
2017-01-24 21:42:05,Trump's got me thinking about buying an electric car!
2017-01-24 19:28:35,"Exxon Mobil CEO in your cabinet! : Trump Advances Keystone and Dakota Pipelines, Fulfilling Pledge - Bloomberg https://t.co/bLzHR8duW9"
2017-01-24 15:02:03,"I am not at odds with who my nation supports, but most of them are covertly at odds with me because of their strong discriminate beliefs!"
2017-01-24 14:43:02,eBay Tutorial | how to upload or change account photo. https://t.co/D4bYhTm9ZY
2017-01-23 16:46:09,Tom Clancy's The Division - game Play (Napalm Production Site). https://t.co/jOqHGfQLMU
2017-01-23 13:48:12,Smart decisions work better than easy decisions!
2017-01-22 23:10:47,Super moves are being made right now. No details. No discription! Bonds and contracts!
2017-01-22 15:23:52,Wearing masks to hide your identity makes you a representative suspect of the opposing by default. You don't represent the marchers!
2017-01-22 06:50:02,This Terrifying Worm Snatches Fish from the Ocean Floor https://t.co/gjbeg2a6SR
2017-01-22 06:34:25,best cliff Jumping fails compilation https://t.co/YIh3HVpnms
2017-01-21 21:30:41,"I'm going to be interviewing people for my YouTube channels soon. If you want in, subscribe and message me: https://t.co/EWftRkXUkw"
2017-01-21 21:27:41,Let's see if I can reach 600 subscribers today!!! Looking forward to building a a larger audience: https://t.co/EWftRkXUkw
2017-01-21 19:04:12,"Women are an important part of our society. Empower them, don't mistreat them!"
2017-01-21 18:43:44,"The people holding up signs saying ""Rape Melina"" are racist people sabotaging the anti-trump rally's. Take their masks off, and share image."
2017-01-21 18:42:45,"Start grabbing this fake protestors who are really agents, and snap their faces and share it on social media. They are sabotaging us!"
2017-01-21 15:13:36,https://t.co/W6dnj6eowT https://t.co/W6dnj6eowT
2017-01-21 15:09:26,https://t.co/mmft5n9eeX https://t.co/mmft5n9eeX
2017-01-21 14:23:50,"Nobody likes your president. I guess it's because, they shouldn't!!!! Lol."
2017-01-21 13:53:26,I was always more attracted to the fast lane. My time is shorter than you're last memory. #PaperStacker
2017-01-21 13:51:40,Sometimes you have to prove you're smarter than the lot of them. Talking should never be an option. #GrindMode
2017-01-21 01:01:33,Matsy - Matthew Parker Live at the station bar in Woodstock https://t.co/fdrqWb2QBD
2017-01-20 21:06:14,"War is deception, and deception is an act of war. Those masked men are framing protestors. They hide their identity for a reason!"
2017-01-20 21:04:27,"Just so that all of you know; those masked men in all black hiding their identity are not protestors, their agents and provocateurs!"
2017-01-20 19:33:45,My forever thoughts are on how to increase my profitability! Everything
2017-01-20 17:58:16,P/E Ratio: An In-Depth Guide | Investopedia https://t.co/QItJktulzP
2017-01-20 01:24:15,Inside the mind of a master procrastinator | Tim Urban https://t.co/hjVNdy7lCc
2017-01-19 20:36:36,It pains me that I have to sell stock before tomorrow. Tech c
2017-01-19 18:45:11,When all the adults are acting like children. Sadness!
2017-01-19 16:44:54,"Wilbur Ross’s Latest Portfolio Picks (NVGS, FIT) | Investopedia https://t.co/Ju2vnyZKYr"
2017-01-19 13:42:32,"If you haven't learned to put money away in the past, you better start now. Your life depends on it!"
2017-01-18 17:41:11,T Rowe Price Equity Income Fund Gains 7 Positions in 4th Quarter https://t.co/bJd38S4Ew4 via @YahooFinance
2017-01-18 15:16:34,UPDATE: Stock market struggles for direction as retail shares weigh https://t.co/NdL0ASe1Hp
2017-01-18 15:11:28,"I diversify social media, in the same way I diversify my investments. I know which sites to use, for what, and how to make it profitable!"
2017-01-18 13:49:50,"It's not where you're from, but what you do that counts the most! #InvestYourWayToWealth."
2017-01-18 10:48:53,"You can either stress about making money, or you can let money, make money for you. #InvestmentMindset."
2017-01-18 01:43:06,These new numbers are fantastic. I think I know what to do from here on out!
2017-01-17 17:54:36,"Lesson 1 in economics: manage your money, or your money will manage you! #EconomicsInRealTime"
2017-01-17 14:47:08,"Twitter is up and down. They don't pay a dvyld, but it's the perfect stock for a day trader; catch it at the right price. #100sharesOrBetter"
2017-01-17 13:47:27,"I'm not the person people like, but let's be honest, I am the person people study. Knowing this still motivates me to create great content!"
2017-01-17 12:55:38,Focus on what you want to do forever in the next ten years... and do it with everything you have!
2017-01-17 02:06:40,"So Apple has a bunch of new pattens, and also, they're doing buy-backs! Well, how can you have apple anything without owning a share? #Stock"
2017-01-17 02:05:28,"Solid company's like IBM, or Microsoft aren't going anywhere now are they? The future is in your portfolio, not your hands! #Stocks"
2017-01-17 01:16:49,"Even if you only make minimum wage; with the right investment strategies, you can make 6 figures a year, before you retire!"
2017-01-17 01:14:57,"A trademark is supposed to represent a lot of things, but most of all, it represents the level of trust a consumer has for the company!"
2017-01-16 19:46:36,"Not sure why TDAmeritrade is so interested in politics, except to see how corporations react to new policies. #deals"
2017-01-16 19:43:51,"I can tell if you're serious about business. If the thirst for attention dominates your financial interest, I can tell. #Investments"
2017-01-16 18:47:11,All my older music projects will soon be available for viewing and streaming... $$$$. I ain't no dummy #Since2006
2017-01-16 14:49:17,"Stocks: is it better to trade as an S corp, or sole proprietor? Some might even wonder if having an LLC is better, but day trading?"
2017-01-16 14:44:33,Something's aren't worth speaking about. Make sure the person who's listening is at least initiated before you speak!
2017-01-16 02:53:37,DONALD TRUMP |  HOW TO PROFIT DURING HIS PRESIDENCY https://t.co/KMeI8UKg9P
2017-01-15 23:10:52,I'm Going to Make Black People Wealthy in One Video https://t.co/PDiN1WL6Se
2017-01-15 22:48:51,"Stop teaching your kids about politics, and start teaching them how to diversify their stock portfolio. #Investments"
2017-01-15 21:13:40,"A small fry took shots, so I gave his insignificant ass some free PR. He had one day to be viral. #UnderstandHowThisWorks"
2017-01-15 21:09:14,"It's like a movie, the vilan rises to power, defeats the good people, recruits powerful bad people, and it looks like there's no hope!"
2017-01-15 04:16:32,How to Make MONEY on Youtube WITHOUT any Subscribers! https://t.co/XIrdamD5Nv
2017-01-14 21:12:29,"How to save $1,000 - $2,000, while living paycheck to paycheck (diversif... https://t.co/Fx3vHPA5xq"
2017-01-14 21:11:14,"Trump rants on twitter, because he owns a lot of twitter stock. Don't be fooled by semantics. He's a strategist, not an idiot!"
2017-01-14 21:10:19,Social media makes billions from people who don't understand that it's a business to be on social media. Advertising dollars count!
2017-01-14 21:09:27,"There are people who have a tremendous following, but they aren't activating the monetization of their brand. Their getting attention, no $."
2017-01-14 21:04:37,"Don't waste your time with a bag full of hope, and no sense of business skills; negotiate income for your craft. #BuildYourBrand"
2017-01-14 20:00:00,They never listened. My numbers make all the difference. Trust me!
2017-01-14 19:55:22,"Some people know how to get that bag; the rest of you, you gotta figure it out. What's really important in this social media world."
2017-01-13 16:48:43,"Over here, just wishing they would shit the fuck up for at least 10 minutes! Aren't we grown? Adults acting like children!"
2017-01-13 16:02:01,"Give the youth technology, with no discipline, morals, values, or skills, and you get a generation addicted to attention. #NewValues"
2017-01-13 02:22:23,"We are the lost. The ones who have adapted to misconception, and embedded it into our culture!"
2017-01-13 01:59:44,Speed is the key to optimum performance. People sometimes forget that we have a limited amount of time in the day. Make your time count!
2017-01-13 00:42:39,The internet made it easier for us to control our destiny. We can make money online. We can build our brands through social marketing!
2017-01-12 01:37:03,"3 Tips For Getting Any Job You Want — Without A Degree, So You Can Alway... https://t.co/TRww2DdRCW"
2017-01-11 02:46:23,"Running the business model with no interference. Creative strategies support, not hinder progress. That's a winner. #KnowYourWorth"
2017-01-11 01:12:46,New Years resolution - just get into action https://t.co/Y55Xf9qPtN
2017-01-11 01:12:32,10 ideas for New Years Resolutions (short version) https://t.co/eBJxWuIbuz
2017-01-11 01:12:25,2017 Resolution https://t.co/rB8i5b6p7J
2017-01-10 21:43:40,"The company concept is one which is either alive, or dead. With branding, or economic diversification, anything is possible!"
2017-01-10 21:41:05,"Sometimes you only have to give them a taste... a sample of what you can do, and see if they realize what you're capable of. #Power"
2017-01-10 17:21:31,"Right now is a good time to invest in Ford motor company. Yes, I think very much so!"
2017-01-10 17:19:43,"One of the things that I am grateful of, is that I helped a lot of people. I've had opportunities to change people's lives! #Zen"
2017-01-10 16:38:22,Make America great again? Stop lying to yourself people. Wake up and learn economics: https://t.co/dVrGBpwpDm
2017-01-10 14:38:04,"Never wasting time. Never wasting money. I'm on that brand building path to success, which means, I sleep less, work more, and use ideas!"
2017-01-10 01:43:43,Teorock performs at the station bar in Woodstock https://t.co/yXcKl824Z1
2017-01-09 20:33:40,Some people will do anything for attention; and suffer the consequences of not recouping the investment of there time &amp; energy.
2017-01-09 18:41:52,"If you can try not to be arrogant, and focus on being of service, all that you are intrigued by, will be unrealized gains. #TrueHustle"
2017-01-09 18:10:15,"Sometimes, you have to learn how to make money with your mind, and not your body!"
2017-01-09 14:56:35,Some of these position players think the sunshines in their favor. Office politics aren't on my agenda. Building my own economy is.
2017-01-09 13:40:22,"There is no progress unless it's measurable. Create an affirmation, with dates, and with reachable goals, and you will achieve them. #Zen"
2017-01-09 13:37:32,"I've always been making the right moves, but now it's time to make good with all the right people! #BuildYourBrand."
2017-01-09 02:35:33,"I got the bag, and it's not a designer. Only the real ""knowehatimtalkingbout""."
2017-01-08 20:51:02,"@souljaboy was smart enough, to act goofy enough, to makes enough millions, and trend on every media platform. Smart move! #BuildYourBrand."
2017-01-08 20:36:58,"I don't need a major following on insignificant platforms. ""Making money online vs getting attention online. Whole different animal."
2017-01-08 20:25:40,"The smart ones know how to be scalable. The rest, well, they are just aiming blind hope at an invisible target!"
2017-01-08 20:21:57,"I'm generous with my time now, but when momentum kicks in, I may not be able to excuse myself from these brand obligations."
2017-01-08 18:30:17,"Getting strait to work, my way of adapting to a new identity. Building a brand takes pride sacrifice; of all things, the most important."
2017-01-08 18:28:35,"I'm starting to adopt a preconceived, or preset notion to ignore the uninitiated. It's really all about choice!"
2017-01-08 15:06:59,Teorock performs at the station bar in Woodstock https://t.co/yXcKl824Z1
2017-01-08 05:56:14,How to make money quick on eBay (making money online). https://t.co/kbuSCvM25f
2017-01-08 02:05:39,@souljaboy I feel like you played your hand correctly. You just set off another hustle. Nice work. Good luck at the fight!
2017-01-07 21:32:05,Teorock performs at the station bar in Woodstock https://t.co/yXcKl824Z1
2017-01-07 18:26:59,"Some people are so disrespectful. When the money starts coming in, don't start talking about nothing! #Hustling. Keeping a log!"
2017-01-07 16:11:39,These companies I own in 2017.... that's all my eyes see at the moment. Selective few talk with me. I think I'm going to keep it that way!
2017-01-07 02:16:42,Got a chance to record some really talented recording artist tonight in Woodstock. Lots of footage!
2017-01-06 16:35:28,@lizette_rachel &lt;--- follow my friend if you are #Teamfolloback
2017-01-06 02:06:13,I cannot lie. Making money only is like an addiction. Who would have ever thought that focus and determination could pay off?
2017-01-06 01:49:50,"Feel free to follow me on twitter, or buy a share of its stocks. Subscribe to my YouTube channel: https://t.co/EWftRkXUkw"
2017-01-06 00:39:15,Vegan breakfast shake with the Magic Bullet Blender https://t.co/mT4s5063Qu
2017-01-05 22:00:06,"When the projection is made to benefit the future, it is made with a great mind. In ready!"
2017-01-05 20:10:59,Got you @CloudNine845 https://t.co/2Ex8qzThWY
2017-01-04 20:48:13,Trump pick for SEC chief may have an interest in reforming foreign bribery enforcement - MarketWatch https://t.co/Gih08HzX5S
2017-01-04 20:04:19,https://t.co/wJmRIo3ozu https://t.co/wJmRIo3ozu
2017-01-04 18:36:21,"With trump appointing the CEO of Exxon in his cabinet, expect oil to go up, and pullution as well. But think stocks!!!!!"
2017-01-04 16:46:44,Live Day Trading - $300 in 45 Minutes https://t.co/hsoJCeK4To
2017-01-04 15:10:20,The markets doing really good today! Made some money... not surprised! #Stocks!
2017-01-04 03:22:49,The $100 Trading Challenge: How I Did It. https://t.co/q9vDMkw8i1
2017-01-04 03:01:18,The Neatest Little Guide to Stock Market Investing: Fifth Edition https://t.co/06G5RApQeG
2017-01-03 20:38:52,"I need Bank of America stocks to drop before 4pm, so I can grab a few shares... lol"
2017-01-03 19:56:39,"When the market is up, it's good for investors who got that stock for the right price."
2017-01-03 18:38:28,"They are going to squeeze us relentlessly, until all of our humanity is drained. Until we are no longer of value!"
2017-01-03 17:21:08,"You do not need a title from any institution, to care about the human condition. Don't consider categorizing my views!"
2017-01-03 16:45:45,Economics = language. Learn a new language in 2017
2017-01-03 15:32:19,"I like talking to the youth. It's important that you learn at a young age, how money works!"
2017-01-03 13:53:41,People who have spent a great deal of time around me can tell you that I take people to realms!
2017-01-03 13:52:01,"Someone who is insecure looks to empower themselves. Someone who invests in other people, do so because they know their own value."
2017-01-03 02:05:12,Vegan breakfast shake with the Magic Bullet Blender https://t.co/mT4s5063Qu
2017-01-02 23:23:49,She's the most dominant loser in sports. 45 seconds of proof! https://t.co/IgGASz5Hg8
2017-01-02 23:16:25,"Help make the media great again: ""Stop lying to the American people about Rhonda Rousey. About being the greatest female athlete!"""
2017-01-02 21:41:56,"In the greatest of all challenges, the ability to overcome adversity, and become knowledgeable of the traps set by your oppressor..."
2017-01-02 20:11:45,Listen to I Wish by NOE #np on #SoundCloud https://t.co/MkdCSgAktu
2017-01-02 18:47:27,"New requirement to talk with me: have an above 700 credit score, and at least 2 shares of active stock in trade. Lol. Jk. Or am I? Lol."
2017-01-02 18:28:03,"No wishful thinking in 2017. If you talk, associate, or want attention from me, it's real content only! Some people are qualified!"
2017-01-02 18:01:43,"Playing with the market this year heavy. All American companies. I don't have to like trump, just gotta be smart!"
2017-01-02 16:45:58,https://t.co/7lVJqKYJaj https://t.co/7lVJqKYJaj
2017-01-02 07:16:02,Stop living in the past. No one gives a shit. What are you doing now? Get that feeling back!
2017-01-02 04:31:48,Help make Rhonda Rousey Great again.... lol.
2017-01-02 02:44:28,"Hey, check out Robinhood. Legit free stock trading. https://t.co/NQe8s8SWeP via @robinhoodapp"
2017-01-02 01:20:52,Why is it so hard to save money? https://t.co/TuJT7p5CCq
2017-01-02 01:19:24,"How to reset ""service now!"" Setting on your 2012 Volkswagen Passat SE. https://t.co/biGFp2xbI8"
2017-01-02 01:19:09,How to change the time - settings on Volkswagen Passat 2012. https://t.co/jCK7VPuhLF
2017-01-02 01:18:43,How to reset tire pressure light on your Volkswagen Passat 2012. https://t.co/Q5ZLyWs1Lo
2017-01-02 00:21:44,2017 Resolution https://t.co/MZqGOCPnpb
2017-01-01 05:02:13,Happy new year everyone. Stay sucka free!
2016-12-31 16:12:48,10 ideas for New Years Resolutions (short version) https://t.co/RtHcMlu57R via @YouTube
2016-12-31 15:05:21,I really need to be more selective with my targets. #focusonline
2016-12-31 03:30:47,I will be boosting my channel in 2007. Nothing moves but the money!!!!! Count me in!
2016-12-30 16:23:33,Thinking about the future... I'm still going digital.
2016-12-30 13:48:11,"Thank you GE, for lowering your stock price just enough for me to see your shares explode in 2017!!! 6 billion in acquisitions!"
2016-12-30 03:14:38,"Apple, Comcast, Intel Stocks Climb Even As Buybacks Slow | Stock News &amp; Stock Market Analysis - IBD https://t.co/aoqj83T943"
2016-12-30 00:19:01,"There's nothing likable about my influences, and thoughts from a person with a regular, or normal perspective. I appeal to dreamers/SM's."
2016-12-29 19:28:37,"Trying to ignore controversy, is like trying to ignore cancer. Welcome to the purge. They say god bless America. Watch who you call ""GOD."""
2016-12-29 18:17:46,"For 2017, I am offering useful information about saving, and making money. Subscribe: https://t.co/6uD3BYkJPw"
2016-12-29 14:40:33,Hey! Join me on PayPal and we’ll get $5 each when you make your first purchase. https://t.co/wZGWZ9HGRk
2016-12-28 00:24:58,Cut cost on shipping supplies on eBay and Amazon products https://t.co/Fj0CshFc6J
2016-12-27 18:39:44,"I can't fight them anymore, I am them! Sometimes you have to make decisions!"
2016-12-27 15:56:44,Take advantage of the winning team!
2016-12-27 14:57:06,"I've always wanted to see the best for everyone. Sometimes, even argue with you to help you get yours. That's noble!"
2016-12-27 03:18:09,The Real Scam: Tai Lopez On How You've Been Lied To https://t.co/SsJEgkaCeK
2016-12-27 02:35:41,"Hate making supply purchases toward the end of the year, but I never shy away from business efficiency!"
2016-12-27 02:20:42,Umoja: means unity. First day of Kwanza.
2016-12-26 23:53:23,"Anxiously waiting for 2017 to start. I'm really waiting to launch a new fiscal business year. Very hopeful, and very ambitious!"
2016-12-26 23:16:46,https://t.co/gPgLnm1w76
2016-12-25 22:59:08,How to set up and eBay account and start selling (for beginners). https://t.co/Ei4D1DXIbv
2016-12-24 16:41:06,"I don't care about attention, just make sure my numbers are up!"
2016-12-24 03:51:41,"I love having good dialog with people who understand my processes, thoughts, and ideas. Business people mesh well."
2016-12-24 03:18:09,"My paypal going off is the only noise I hear in this house. Anything else is unheard, perhaps a distraction!"
2016-12-24 03:14:42,"What your supposed to be doing, va what you're doing!!!! https://t.co/BHEE7upoxQ"
2016-12-23 23:47:26,https://t.co/lbF1qWDLRu https://t.co/lbF1qWDLRu
2016-12-23 23:38:04,https://t.co/sYoXxUgRAl https://t.co/sYoXxUgRAl
2016-12-23 23:37:47,https://t.co/RBXXyyid6l https://t.co/RBXXyyid6l
2016-12-23 16:25:17,https://t.co/8fFevrbQ9i https://t.co/8fFevrbQ9i
2016-12-23 16:02:17,"Slim Jesus walked in the door, monitized his projects, and made himself rich without a record deal. Something to think about!"
2016-12-23 15:59:34,"You have to invest into yourself before anyone else will. Some people understand that, most don't!"
2016-12-23 13:37:21,"I'm going to have to be very strategic about who I contact, and why going forward. I think some people have a misconception about me!"
2016-12-22 23:10:22,"Think I had enough. You can't move forward unless you're gonna do what's necessary to get ahead, some people won't get it!"
2016-12-22 22:44:51,"My people!!! I know that phones are cool and all, but keep an updated laptop with Microsoft office account if you want to progress!!!"
2016-12-22 21:03:31,"Learning how to take advantage of these platforms is a challenge, but it is one that I readily accept!"
2016-12-22 15:03:12,New Years resolution - just get into action https://t.co/Y55Xf9qPtN
2016-12-21 15:50:42,I see so many musicians and artist throw money in the trash trying to chase a buzz when they could be getting paid for their music!
2016-12-21 14:44:25,"Ending 2016 is a challenge, because it's more of a fiscal launch for me. It's about changing schedules entirely #NewMolds"
