timestamp,tweet_text
,investor - Business Consultant. Follow for inspirational tweets.,
2019-11-12 09:28:31,Hilarious Donald Trump talks about the Democratic Debate. The Funniest C... https://t.co/Mjt1s029Yu via @YouTube
2019-11-10 04:39:38,https://t.co/O1v2aQJhaH
2019-11-09 15:09:35,"On page 240 of 372 of The 7 Habits of Highly Effective People, by Stephen R. Covey https://t.co/Mmh4GRRDdO"
2019-11-07 08:32:45,3 reasons to save money! https://t.co/Nw8n5IVRM9 via @YouTube
2019-11-04 08:51:04,"On page 40 of 623 of The Intelligent Investor, by Benjamin Graham https://t.co/X8ydaF9gWN"
2019-11-01 01:32:00,"“If you want something done, ask a busy person to do it. The more things you do, the more you can do.” - Lucille Ball."
2019-11-01 01:29:27,"The one thing you have to admire about @realDonaldTrump, is that he made us see the light, when it comes to these crooked politicians!"
2019-10-31 23:30:40,"On page 235 of 372 of The 7 Habits of Highly Effective People, by Stephen R. Covey https://t.co/b3mfB1BfCr"
2019-10-29 14:34:20,"On page 232 of 372 of The 7 Habits of Highly Effective People, by Stephen R. Covey https://t.co/ekwAINIHh1"
2019-10-29 00:31:58,"On page 204 of 372 of The 7 Habits of Highly Effective People, by Stephen R. Covey https://t.co/HMMaZeifpD"
2019-10-27 18:38:12,"On page 124 of 137 of Kiss That Frog!!, by Brian Tracy https://t.co/iPpnnKaFda"
2019-10-27 17:07:05,"On page 121 of 137 of Kiss That Frog!!, by Brian Tracy https://t.co/na81uM0tdt"
2019-10-27 16:35:27,"On page 108 of 137 of Kiss That Frog!!, by Brian Tracy https://t.co/UOILbEYMPZ"
2019-10-27 13:36:15,"On page 85 of 137 of Kiss That Frog!!, by Brian Tracy https://t.co/DjlWaxQpM5"
2019-10-26 15:49:40,"On page 83 of 137 of Kiss That Frog!!, by Brian Tracy https://t.co/1cCikTdnxV"
2019-10-26 14:36:32,"On page 64 of 137 of Kiss That Frog!!, by Brian Tracy https://t.co/0WvyUsfOdu"
2019-10-25 18:10:43,"On page 63 of 137 of Kiss That Frog!!, by Brian Tracy https://t.co/vnuSPgeiXY"
2019-10-25 13:35:23,The cost of financial literacy (how to be a hustler part 5) https://t.co/UcuufeTIlD via @YouTube
2019-10-25 09:38:27,"On page 56 of 137 of Kiss That Frog!!, by Brian Tracy https://t.co/mteOuQ6MiW"
2019-10-24 08:03:08,"On page 50 of 137 of Kiss That Frog!!, by Brian Tracy https://t.co/sfXJgZ001L"
2019-10-23 07:59:58,"On page 46 of 137 of Kiss That Frog!!, by Brian Tracy https://t.co/lHugkPrRgH"
2019-10-23 07:59:58,"On page 46 of 137 of Kiss That Frog!!, by Brian Tracy https://t.co/N5cYzGWhU1"
2019-10-22 08:00:47,"On page 42 of 137 of Kiss That Frog!!, by Brian Tracy https://t.co/e8vlUqU9JO"
2019-10-22 00:23:07,"On page 40 of 137 of Kiss That Frog!!, by Brian Tracy https://t.co/S7OXyzPdop"
2019-10-20 23:10:57,"On page 32 of 137 of Kiss That Frog!!, by Brian Tracy https://t.co/B2JLfk9ib0"
2019-10-20 14:01:50,"On page 22 of 137 of Kiss That Frog!!, by Brian Tracy https://t.co/geRKujfdCR"
2019-10-19 19:20:59,"On page 19 of 12 Rules for Life, Life Leverage, Eat That Frog,, by Jordan B. Peterson https://t.co/uCT8YZtLxm"
2019-10-19 15:53:25,"On page 5 of 12 Rules for Life, Life Leverage, Eat That Frog,, by Jordan B. Peterson https://t.co/K4bBafh3jV"
2019-10-19 14:55:51,How to be a hustler part 4 (Calculations). https://t.co/kl4yURImww via @YouTube
2019-10-18 21:32:49,5 of 5 stars to An Effective Life by Stephen R. Covey https://t.co/szIk7y0k6y
2019-10-18 20:45:09,"On page 52 of 201 of An Effective Life, by Stephen R. Covey https://t.co/nrItOembk3"
2019-10-18 19:49:37,"On page 25 of 201 of An Effective Life, by Stephen R. Covey https://t.co/j4tDmrN31M"
2019-10-18 09:53:36,"On page 33 of 623 of The Intelligent Investor, by Benjamin Graham https://t.co/FYeuNE9U0V"
2019-10-14 00:28:07,How to be a hustler part 3 (pricing for profit). https://t.co/SYStbx4moU via @YouTube
2019-10-12 12:18:54,How to be a hustler part 2 (when the chips are down). https://t.co/t1V3YR0Cnf via @YouTube
2019-10-11 10:10:52,How to be a Hustler Part 1 https://t.co/8MK1vQszaw via @YouTube
2019-10-06 03:19:37,#NewProfilePic https://t.co/IdiZ6mdffZ
2019-10-03 07:56:28,@Psupercoop @YouTube Thank you!
2019-10-03 07:56:21,RT @Psupercoop: @Righteousemusic @YouTube Just watched your video and it’s full of gems.
2019-10-01 18:29:11,https://t.co/psYJkV7a5V
2019-09-29 18:57:58,RT @andreaoh27: https://t.co/TDHA5bHsF5
2019-09-27 12:36:00,https://t.co/bKtOvvSpuF
2019-09-27 00:19:37,IceJJFish - My Bae (Official Video) (Prod. StunnaSezBeatz) https://t.co/woplQ7MUMj via @YouTube
2019-09-24 15:32:00,"I still have a few moves left, so come dance with me!"
2019-09-23 07:41:16,Check it out!   Take action. https://t.co/WTPoxUxz9y
2019-09-21 16:15:47,"On page 21 of 623 of The Intelligent Investor, by Benjamin Graham https://t.co/lQVNQ10UMx"
2019-09-20 13:16:58,How to Get Rich Quick in 2019 [3 Short-term Investments] https://t.co/ihdlr1eReu via @YouTube
2019-09-13 12:15:49,"On page 18 of 623 of The Intelligent Investor, by Benjamin Graham https://t.co/AdXVlud6eP"
2019-09-12 12:58:17,"On page 12 of 623 of The Intelligent Investor, by Benjamin Graham https://t.co/6GHVVF3sGH"
2019-09-11 23:07:12,🌱 Start investing with Acorns today! Get $5 when you use my invite link: https://t.co/UPBkeAz5OH
2019-09-11 13:50:31,"On page 8 of 623 of The Intelligent Investor, by Benjamin Graham https://t.co/jCAxLgPziW"
2019-09-05 22:24:03,@letamericavote @DebraMessing Just what the Democratic Party wants. Funny how they get to vote on what happens to m… https://t.co/H126bpQVmx
2019-09-01 21:44:49,Judge Judy 2019 Amazing Cases Episodes 348 https://t.co/ZeTR2G9Bvg via @YouTube
2019-08-31 20:10:15,"The numbers are low, and the efforts won’t stop. At the end of the day, it’s all about Level of Productivity. No at… https://t.co/7zcWa3SYGk"
2019-08-31 15:23:41,They’re gonna hate me! https://t.co/hMDFMaZVLg via @YouTube
2019-08-29 09:49:27,Hello World! Check this out! https://t.co/Jq52wGOvik
2019-08-25 23:01:27,How to become a millionaire https://t.co/PUfxFfI9II via @YouTube
2019-08-23 19:32:44,👊 Start investing with Acorns today! Get $5 when you use my invite link: https://t.co/UPBkeAz5OH
2019-08-23 17:14:11,How to get out of homelessness https://t.co/vXxaRy4vCt via @YouTube
2019-08-23 13:06:49,https://t.co/evu928Brd8
2019-08-17 01:20:02,"@businessinsider So, minorities are going to have to act like victims? Wow, no thanks!"
2019-08-16 05:28:12,A must listen https://t.co/9UGJFbKwfv
2019-08-15 22:45:01,Are we headed toward a recession? https://t.co/ofJCfrYmmw via @YouTube
2019-08-10 14:58:46,Finding &amp; Collecting Coins. https://t.co/2uhWWYg3OM via @YouTube
2019-08-09 17:24:50,Go and watch now!  https://t.co/1wJHccblx7
2019-08-07 20:59:11,10 Best Side Hustle Ideas: How I Made $600 in One Day https://t.co/hbErqLEpWp via @YouTube
2019-08-06 22:00:05,"If you want we releases, follow me on Spotify.  https://t.co/PUPZYvm0bK"
2019-08-03 18:35:45,https://t.co/glAl7mJm1f
2019-08-03 16:32:48,Passive Income: “REIT” investing 2 https://t.co/jsoFrz3MtQ via @YouTube
2019-08-02 10:19:44,https://t.co/QdadWBHCMr
2019-08-02 10:01:50,Now Playing Papoose - Food For Thought  via @DatPiff https://t.co/3xrOnxQ212
2019-08-01 22:55:11,Stop Hating Wealthy People! https://t.co/J0uc6zwM3v via @YouTube
2019-07-30 13:14:38,I am hoping @iamcardib debates Candice Owens!
2019-07-27 17:54:11,Bottle Returns vs Public Perception https://t.co/pa7JGqjF0D via @YouTube
2019-07-26 19:46:05,More On REIT investing! https://t.co/yaCmwufNDc via @YouTube
2019-07-25 17:05:56,"Your free stock is waiting for you! Join Robinhood and we’ll both get a stock like Apple, Ford, or Facebook for fre… https://t.co/XkCx170j6B"
2019-07-24 00:41:31,Trust in the best parts of you. They will lead you to the light at the end of the tunnel.
2019-07-22 00:01:55,How would you build wealth? https://t.co/mMH17CnKbT via @YouTube
2019-07-10 21:27:59,Is Trulia a good app for finding RE properties? &amp; 12 tips for first time... https://t.co/od90yLiCxf via @YouTube
2019-07-07 21:31:52,Work from home - Tips https://t.co/MKRotslSxd via @YouTube
2019-07-04 18:07:38,"Make an extra $200 - $300 per month, here’s why! https://t.co/z9vUCmNFnc via @YouTube"
2019-07-04 12:37:21,Try Cash App using my code and we’ll each get $5! JXLPQJW  https://t.co/1rjGsvVty7
2019-06-24 00:07:48,Saving money is a habit part 1. https://t.co/CfrCPyf4Qx via @YouTube
2019-06-21 23:21:41,Why I stopped playing video games Part 1. https://t.co/U32PF05hyX via @YouTube
2019-06-14 19:03:34,Wrong about Crypto? You judge! https://t.co/nScPnr4i7Y via @YouTube
2019-06-14 18:56:44,"@ABC7NY All I see here, is the day in the life, of a hardworking man turned into a shit show for no reason, except,… https://t.co/zRRb9R3Ltz"
2019-06-14 16:06:12,"$118,000 In Student Debt... For USELESS Drama Degree! https://t.co/Ua47OMxRDF via @YouTube"
2019-06-14 02:55:17,3 reasons why most people invest https://t.co/ZPIaQjQBB8 via @YouTube
2019-06-10 09:38:46,It’s never too late to have a plan https://t.co/2rhQsqZjKI via @YouTube
2019-06-08 03:27:33,Trump announces deal to avoid tariffs on Mexico - Los Angeles Times https://t.co/vp4Izj9pYV
2019-06-07 14:39:03,I will produce results!  https://t.co/atvbaM2Xd5
2019-06-07 01:19:04,3 things to avoid when Launching a business. https://t.co/jbpSsAa2hY via @YouTube
2019-05-31 11:36:21,I love seeing these!!! Makes my heart melt! https://t.co/dxB6HBxOnh
2019-05-27 02:17:59,Invest while you’re in debt | Simple explanations. https://t.co/0IbJckKo8J via @YouTube
2019-05-26 11:22:41,Turned 40 today. It’s not a drill. Stay productive. #DoubleOrNothing #Motivation #invest #winning
2019-05-23 00:52:19,Saving money can be an issue! https://t.co/iOilECuI1v via @YouTube
2019-05-20 01:05:15,Saving money to invest. https://t.co/0X3w4CoJse via @YouTube
2019-05-18 03:28:08,Unboxing KastKing Madbite Waterproof Floating Scale https://t.co/kPXcDL236L via @YouTube
2019-05-15 00:29:39,Robinhood app suggestions. https://t.co/2EwipMZyQO via @YouTube
2019-05-03 14:39:22,Save Money By Avoiding The Idiot Tax (6 Examples) https://t.co/xBg6639Wyc via @YouTube
2019-05-02 08:26:23,Living on Dividend Stocks (Safely) https://t.co/IBNX3SgIB0 via @YouTube
2019-05-01 01:50:56,"The things you want most will chase you, if you chase the greatness within yourself. Don’t focus on the outside; de… https://t.co/IgsZL7isTc"
2019-04-26 11:16:47,Reviewing 7 Habits of Highly Effective People https://t.co/En1SBLkTIk via @YouTube
2019-04-23 22:43:42,"Join @RobinhoodApp and we'll both get a stock like $AAPL, $F, or $S for free. Make sure to use my link.… https://t.co/J9TIkRUYiz"
2019-04-21 15:28:37,Motivation from the kitchen https://t.co/E45JbpmtYw via @YouTube
2019-04-19 11:26:33,AT&amp;T dividends in 60 seconds https://t.co/8oerk0pZDc via @YouTube
2019-04-13 11:59:41,How to buy Closed End Funds https://t.co/SkQLDYzhHk via @YouTube
2019-04-11 22:03:43,😛 Start investing with Acorns today! Get $5 when you use my invite link: https://t.co/UPBkeAz5OH
2019-04-02 01:08:10,What you do with your money matters! https://t.co/m92lt2EHpu via @YouTube
2019-04-01 17:08:17,Who is Daddy Yankee?
2019-03-31 23:16:43,What do you want your social media business to look like? #BuildYourBrand #Media #Advertising #Marketing #SundayThoughts
2019-03-31 23:14:12,@souljaboy send this to Britney for me Big homie! https://t.co/DQNtgB4BbG
2019-03-31 01:35:07,5 of 5 stars to 10 Commandments for Real Estate Inves... by Frank Gallinelli https://t.co/nngQqnLxuh
2019-03-30 13:49:55,Why you should start your own business! https://t.co/IpvndPNoWd via @YouTube
2019-03-29 09:49:37,How to invest while in debt - chapter 1 https://t.co/ZHoLP8ilX5 via @YouTube
2019-03-28 13:12:05,5 of 5 stars to The 100 Best Stocks to Buy in 2018 by Peter Sander https://t.co/9gCdyswkVk
2019-03-27 00:21:35,"On page 376 of 400 of The 100 Best Stocks to Buy in 2018, by Peter Sander https://t.co/2GpRpLytH3"
2019-03-23 16:51:11,5 Financial Rules that work https://t.co/VLJ1pqJ4kj via @YouTube
2019-03-23 12:19:49,"AT&amp;T, Viacom continue contract negotiations past deadline | Reuters https://t.co/8K3DyQf1WC"
2019-03-21 00:30:33,🎊 Start investing with Acorns today! Get $5 when you use my invite link: https://t.co/UPBkeAz5OH
2019-03-15 12:19:43,I’m cataloging the journey of one of the best business ventures of my life. It’s just too amazing. I believe in a d… https://t.co/6lDbADs6AE
2019-03-10 01:49:16,Documenting my journey. https://t.co/xoSZT0Qhdt
2019-03-07 23:56:14,How to save money and get started with acorns. https://t.co/R5Mo1lm0vs via @YouTube
2019-03-04 00:46:28,🔹 Start investing with Acorns today! Get $5 when you use my invite link: https://t.co/UPBkeAz5OH
2019-03-03 22:00:17,How The Banking System Is Making You Poorer (Without You Finding Out) https://t.co/3Y7BlcoLzJ via @YouTube
2019-03-03 17:13:39,Saving cash with IRA’s. https://t.co/gn9mDCGQ6H via @YouTube
2019-02-24 15:22:44,"Join @RobinhoodApp and we'll both get a stock like $AAPL, $F, or $S for free. Make sure to use my link.  https://t.co/NQe8s8SWeP"
2019-02-24 03:27:32,Saving money - Change jar 2.0 https://t.co/dysSNXDxc1 via @YouTube
2019-02-19 17:50:30,"On page 345 of 400 of The 100 Best Stocks to Buy in 2018, by Peter Sander https://t.co/wIVN7fCFQC"
2019-02-16 19:31:56,"On page 332 of 400 of The 100 Best Stocks to Buy in 2018, by Peter Sander https://t.co/7aIgAVQL7G"
2019-02-13 23:06:11,Lol https://t.co/naJKoO2jzD
2019-02-11 18:01:02,"On page 323 of 400 of The 100 Best Stocks to Buy in 2018, by Peter Sander https://t.co/OPh6KQOhO8"
2019-02-08 13:00:47,Why Industrial REITs Like Duke Realty and STAG Industrials Rallied Double Digits in January -- The Motley Fool https://t.co/eMc2uGDGqP
2019-02-06 16:17:43,State of the Union 2019: Donald Trump's full speech https://t.co/vgOtiqLOmb via @YouTube
2019-02-04 01:45:44,8 Stupid Mistakes My First Year Investing In Real Estate https://t.co/3nDwKKHFf7 via @YouTube
2019-02-03 17:34:27,"On page 313 of 400 of The 100 Best Stocks to Buy in 2018, by Peter Sander https://t.co/lkxdLFL1VM"
2019-02-03 14:16:18,👋 Start investing with Acorns today! Get $5 when you use my invite link: https://t.co/UPBkeAz5OH
2019-01-26 17:33:35,Why should you save money? https://t.co/Ok9fsKf2gJ via @YouTube
2019-01-26 13:49:32,TNN | Present Trend: Dine Brands Global (NYSE: DIN) https://t.co/0hdpCP7zI0
2019-01-23 12:27:52,@TheSuccessKing Great post!
2019-01-19 01:37:18,Haha! https://t.co/uY2SSpScLP
2019-01-14 09:33:32,Why Are 200 Congressional Democrats Suing the President? (Because Feelings) https://t.co/vx2zJn9QIB via @YouTube
2019-01-13 17:10:53,Listen to Britney Spears career by Righteouse #np on #SoundCloud instrumental.  https://t.co/DQNtgB4BbG
2019-01-13 14:18:37,Value vs Expectation. You need to know the difference! https://t.co/KelFvPM3qE via @YouTube
2019-01-12 03:25:18,Righteouse - Activation | Record Exchange https://t.co/G5FquixVSx
2019-01-12 03:23:31,Listen Free to Righteouse - Activation Radio on iHeartRadio | iHeartRadio https://t.co/aC7umA9mSy
2019-01-11 23:40:15,Concerns vs primary concerns https://t.co/gsAWnb30Kn via @YouTube
2019-01-09 21:46:36,Ocasio-Cortez proposes taxing the rich at 70% https://t.co/UNyYN0mpDv via @YouTube
2019-01-09 01:58:00,"SBUX $63.62 (+0.08%) on Yahoo Finance in this, I love!  https://t.co/26D3LlaSpO"
2019-01-08 01:01:39,Now Playing #WalkingBrick by @TheRealHellRell via @DatPiff https://t.co/1qug7uI15s
2019-01-06 21:04:41,5 of 5 stars to A BiggerPockets Guide by Brandon Turner https://t.co/0F62MyEFjF
2019-01-06 17:53:29,"Join @RobinhoodApp and we'll both get a stock like $AAPL, $F, or $S for free. Make sure to use my link.  https://t.co/NQe8s8SWeP"
2019-01-06 15:35:49,Keys to success for the new year. https://t.co/zCaIwKKMyi via @YouTube
2019-01-05 15:39:20,Tax returns - government shutdowns https://t.co/2enCjBPbLv via @YouTube
2019-01-01 16:50:26,New Years cash flow resolution. https://t.co/flfjfuPEvG via @YouTube
2018-12-29 12:44:40,3 of 5 stars to Real Estate Investing Made Easy by Brian Haskins https://t.co/Ua7bjk9176
2018-12-28 02:42:39,From 0 to 400 Units in 3.5 Years with Sterling White | BiggerPockets Pod... https://t.co/xaQpg0QcUs via @YouTube
2018-12-28 02:36:21,Hanging out with my cousin Annette. https://t.co/r0qKpQrWb7 via @YouTube
2018-12-27 13:01:34,But of course: Morning Brief: U.S.-China trade talks to resume https://t.co/xl9pRHACES
2018-12-26 02:49:29,Be Cautious - Tina Brulee (Featuring NOE &amp; Fred The Godson https://t.co/3fuxK1uPBH via @YouTube
2018-12-25 17:12:16,That moment when you discover just how precious your family is. It’s always a pleasure! Thank you cousin! https://t.co/bmhMqk05JG
2018-12-22 16:37:27,"On page 300 of 400 of The 100 Best Stocks to Buy in 2018, by Peter Sander https://t.co/zsOcqHttQU"
2018-12-19 13:33:22,Motivation - reinvent yourself. https://t.co/s30LVjUvdm via @YouTube
2018-12-19 01:54:22,Now Playing Righteouse's No Industry via @DatPiff https://t.co/uHFRil6UOY
2018-12-16 17:34:50,"Join @RobinhoodApp and we'll both get a stock like $AAPL, $F, or $S for free. Make sure to use my link.  https://t.co/NQe8s8SWeP"
2018-12-16 15:21:16,Now Playing Righteouse - No Industry  via @DatPiff https://t.co/uHFRil6UOY
2018-12-11 23:49:56,Business - How you can tell if you were meant to be an entrepreneur! https://t.co/8FskIMQ5cc via @YouTube
2018-12-11 01:19:25,Who Does a $15 Minimum Wage Help? https://t.co/Bu2Tvh11cE via @YouTube
2018-12-09 18:05:03,Airline Worker Makes Less Than a CEO https://t.co/xzAeerJ27W via @YouTube
2018-12-09 03:45:13,My GameCenter nick is Righteouse. Find me and fight me! #RealBoxingGame https://t.co/Jhax6JEtnl
2018-12-09 03:07:32,My GameCenter nick is Righteouse. Find me and fight me! #RealBoxingGame https://t.co/acgDoqHfcX
2018-12-08 03:12:29,My GameCenter nick is Righteouse. Find me and fight me! #RealBoxingGame https://t.co/EkKa4Xd6N7
2018-12-08 02:25:55,How to make money without a job - interview with Tarell. https://t.co/Aqw6nImSbI via @YouTube
2018-12-06 20:15:54,"On page 267 of 400 of The 100 Best Stocks to Buy in 2018, by Peter Sander https://t.co/nWtiU6H2eV"
2018-12-05 16:27:15,Listening with open ears!  https://t.co/4YSgR6B54g
2018-12-04 02:39:29,How To Invest Your Money In Your 20s https://t.co/YEahMzM4WW via @YouTube
2018-12-01 14:26:01,It’s another banger: https://t.co/IhpZM3D9Ox
2018-11-30 16:19:58,"Trump scores win with signing of North American trade pact, but deal faces hurdle in Congress - The Washington Post https://t.co/8uyZ81hALb"
2018-11-27 00:02:30,United Technologies to announce its intention to separate into 3 companies https://t.co/ReAYsPFbVg
2018-11-26 16:23:04,"People are becoming fascinated with themselves, instead of trying to accomplish things. This is very much sad. Weak… https://t.co/hl1vEgM4N2"
2018-11-25 00:48:58,Passive income: “REIT” investing! https://t.co/R5wGbTXeGu via @YouTube
2018-11-24 14:19:43,Learning to negotiate https://t.co/NKKRrrjRga via @YouTube
2018-11-23 01:07:33,Alexandria Ocasio-Cortez: Economic Genius https://t.co/UCkZ6siTej via @YouTube
2018-11-23 01:02:59,Alexandria Ocasio Cortez is Mentally a Child https://t.co/4gyFf3aBcw via @YouTube
2018-11-20 16:27:23,I am pro #hustle. Don’t tell me about people who want something for nothing!
2018-11-17 17:40:54,https://t.co/4dZGthnYGx
2018-11-14 21:10:55,Righteouse: Transmission - Music on Google Play https://t.co/IcZs3HeQjH
2018-11-12 22:41:04,How to save money without dodging your bills https://t.co/ZfHDffOIH6 via @YouTube
2018-11-12 01:07:47,Happy Veterans Day to all who served in the armed the U.S. armed forces!
2018-11-11 04:32:51,"How Spotify, Apple Music, can pay musicians more-commentary https://t.co/ayDAiwAxYD"
2018-11-10 20:16:12,Training yourself how to become more valuable. https://t.co/PvzEiLQzOD via @YouTube
2018-11-09 22:31:25,Transmission [Explicit] by Righteouse (feat. Leland Gurrieri) on Amazon Music - https://t.co/aQmswLpIb1 https://t.co/5CY8AwG41N
2018-11-05 23:33:50,Probably one of the best albums on iTunes.  https://t.co/UmopmUFaQ0
2018-11-03 17:02:14,Just Bought a Duplex – How to Avoid Potential Pitfalls? MM037 https://t.co/4QCK44hsCI via @YouTube
2018-10-28 23:39:41,"Jobs report, Apple earnings — What you need to know for the week ahead https://t.co/q5dja6oMKR"
2018-10-24 16:45:53,https://t.co/dRgBAvIaSb https://t.co/Qg8dTp9nNy
2018-10-24 16:44:25,Be Cautious Preview https://t.co/dRgBAvIaSb via @YouTube @noemoney
2018-10-22 01:17:22,"Black Unemployment Is at an All-Time Low, But ... - Bloomberg https://t.co/uZJCBsIEo1"
2018-10-21 15:18:07,Your habits are a good indication of where you are in life. What are you’re habits saying about you?
2018-10-21 15:17:28,Dozens injured after floor collapses at apartment party  https://t.co/aINSu9eIsk
2018-10-16 01:26:22,Transmission by Righteouse on Spotify https://t.co/IFCqfsVyOv
2018-10-15 00:42:12,What are #life-goals (life goals)? Motivation! https://t.co/1NJAuzonhC via @YouTube
2018-10-13 01:23:08,🎧 Beef Stew (feat. Tina Brûleè) by Noe on @PandoraMusic https://t.co/nSNV6KKpV4
2018-10-13 01:17:11,Now Playing Righteouse - Activation  via @DatPiff https://t.co/7lcL09zVyL
2018-10-11 00:24:57,AT&amp;T will launch a direct-to-consumer service next year https://t.co/oSddawN7p2
2018-10-09 23:39:02,"Most people will never have enough money, love, time, or moments to say that they have lived their best. Self-impro… https://t.co/JjLmsPGcRo"
2018-10-06 20:42:24,"Senate confirms Kavanaugh to Supreme Court, ending a clash with lasting fallout - The New York Times https://t.co/JUlKvlVijO"
2018-10-05 12:13:22,Learning how to make a great deal is the way to go. Solve problems doing business!
2018-10-03 18:50:18,Some Amazon employees say they will make less after the raise https://t.co/keyAUhzfjz
2018-10-01 12:09:01,"Morning Brief: US, Canada reach NAFTA deal https://t.co/OuTZbrf9En"
2018-10-01 12:01:51,This is what I call great news!  https://t.co/DsNLYaLLjI
2018-10-01 00:44:40,Quit social media | Dr. Cal Newport | TEDxTysons https://t.co/tQl9lUCBJO via @YouTube
2018-10-01 00:27:04,Fear of failure explained - motivation https://t.co/fhqBZDkBwW via @YouTube for the love of streaming!
2018-10-01 00:25:30,https://t.co/i5oa05gcDZ
2018-09-29 23:44:48,"All nice catches today. Here’s one of 6. Not going to post them all, just enjoy one of the best! #bassfishing… https://t.co/oVar2XfWhq"
2018-09-29 15:22:35,Fear of failure explained - motivation https://t.co/fhqBZDkBwW via @YouTube
2018-09-29 02:48:02,https://t.co/yLF9JBLBQ8
2018-09-28 01:09:21,"I only gave them a hint of my brilliance. The rest, is going to have to be strategic, and calculative!"
2018-09-26 20:24:48,Cannabis Stocks (-0.44%) on Yahoo Finance https://t.co/2Ty5WfADj1
2018-09-26 12:10:03,"There’s enough power within every individual to break the chains that bond them. Look to brighter days, and have th… https://t.co/ReB0iZT3Dy"
2018-09-25 00:13:37,"It bit... bit... bit, and thrice, yet, it was finally time to commit.   https://t.co/MQlA2WzlUz https://t.co/cm6redPsvp"
2018-09-24 18:21:30,"Yup, read it and weep. Everyone is losing money today!  https://t.co/3xS9GKOYUx"
2018-09-23 11:09:26,📱 Start investing with Acorns today! Get $5 when you use my invite link: https://t.co/UPBkeAz5OH
2018-09-22 18:49:17,Corporations usually have all angles covered prior to going into any deal.  https://t.co/EJcieCbkgl
2018-09-22 16:44:07,How to invest in real-estate with $20.00 https://t.co/J7uqYz1isV via @YouTube
2018-09-21 01:23:14,Warren Buffett Explains the 2008 Financial Crisis https://t.co/7FQa2kjzRj via @YouTube
2018-09-17 23:56:55,https://t.co/ie9e4MHv24
2018-09-16 03:15:19,Hoping that tomorrow will bring me luck. https://t.co/spbdb9ptxP
2018-09-16 03:13:21,@JustAsh48 I’m glad I chose to follow you this evening. Enjoy your Sunday. I’ll be checking out your tweets!
2018-09-16 03:11:51,@liselottroos it’s a pleasure to be following you. Hope I’ll be enjoying your tweets. Have a great weekend!
2018-09-16 03:09:27,@YOitsTaylour I followed. Looking forward to your future tweets.
2018-09-16 03:07:45,@RennieLondon I followed you. Look forward to your tweets.
2018-09-16 03:07:13,@yxdiaali you joined 1 month before me. I followed. Look forward to your tweets!
2018-09-16 03:06:18,@FollowBackFest thanks for the #teamfollowback. I’m all in since 2009.
2018-09-12 01:34:59,Why NOBODY Could Beat Floyd Mayweather Jr. (2018) https://t.co/LkDqwhjLTL via @YouTube
2018-09-09 20:48:11,https://t.co/sMpDBNH93W
2018-08-30 18:35:58,https://t.co/yPn9JD4NNA
2018-08-27 02:26:13,Carp Fishing with Bread https://t.co/PWIw28hSML via @YouTube
2018-08-16 12:08:29,Morning Brief: US-China trade talks to resume https://t.co/Cyx8JCfq5O
2018-08-13 21:31:48,I believe something can become of this!  https://t.co/gVPVDKLGUU
2018-08-12 18:09:07,"10 Largemouth bass catches! You know your fish, tight lines angler!   https://t.co/dRJtWAqNM8 https://t.co/8VRhL2oRdk"
2018-08-10 14:33:28,"Twitter, you messed up badly. In order to protect your neo nazi, you are willing to lose business! Well, say goodby… https://t.co/7QwcQJIQb2"
2018-08-10 00:55:59,"Twitter blocked us from posting on Facebook. Why, because they are protecting a maniac!"
2018-08-07 21:39:20,"Keep the keys to life in your hands, and never put them down. Let downs happen more often than goals. Keep the ambi… https://t.co/6vAh7DwZY1"
2018-08-07 21:35:43,"I thought that I was giving the blind sight; yet, I was the one who was blind. Wisdom does not have limitations, nor does it have any caps!"
2018-08-06 00:29:17,I’m thinking about re-reading “The Alchemist.” I have a lot of work to do before I can become fully acclimated to t… https://t.co/Go83Z8DcCa
