timestamp,tweet_text
2017-11-29 11:50:30,"I might require people to have a twitter account to talk to me personally, in 2018. I'm trying to make some serious deals next year!"
2017-11-29 11:41:22,Attention is it's own reward; emtiness. Value is something entirely different. Content is a component of value. The… https://t.co/kvtbg09Tuy
2017-11-29 02:07:42,"Where to find the most IQ's below 100 - Facebook. Above 100 - Twitter, and Youtube."
2017-11-29 01:55:07,"The less popular get on social media, the better. When I get fewer likes, I know the content is potent!"
2017-11-29 00:49:38,I'm still waiting to see who's smart enough to release an entire album that makes them thousands a year without iTu… https://t.co/JVnQf2xcdA
2017-11-29 00:48:12,"The more monetized content artist put out, the better for them. If you're an independent artist, you may wanna thin… https://t.co/rhU6AKeEOP"
2017-11-28 20:22:01,"Independent artist can do much better. They can own their music, and the rights to other music as well. You can als… https://t.co/7cWPhzooh7"
2017-11-28 03:47:11,"Check out GUARDIAN OF THE REPUBLIC - WEST, ALLEN/ HICKFORD, MICHELE - NEW HARDCOVER BOOK https://t.co/WgaYKmGNsb @eBay"
2017-11-28 00:34:51,"It’s time to stop looking for attention, and handouts. Do the work, do the research. Start from an ownership positi… https://t.co/Arb5KDf6JT"
2017-11-28 00:33:28,YouTube demoted my video where I share with artist how to make money on iTunes without having music. I guess the po… https://t.co/ZuKHxKZsb9
2017-11-27 13:02:01,"Y’all still talking about who’s sound is popping, meanwhile, bitcoin is making nerds rich all over the world! Who’s… https://t.co/yNGkhK9Bs3"
2017-11-27 06:03:22,"Trolling all over. So, I love all the groups I’m in on Facebook that have a lot to do with investing. It’s my equil… https://t.co/kqM1nITLcO"
2017-11-27 04:53:11,Catch me trolling on some other shit. Got those streams up anyway. Who gives a shit. Intelligence is its own reward. Fuck formalities!
2017-11-27 03:36:24,"I’ve put out enough content for most people who care enough, if they want to learn how to increase it. The youtube… https://t.co/mtHFhY0XTb"
2017-11-27 02:11:38,I actually enjoy trolling peoples facebooks when I’m not reading a good book. Stay reading though. Don’t take me serious!
2017-11-27 02:10:11,"I don’t have to worry about other people, or depend on someone’s word. I keep my business strait. I’m no nonsense w… https://t.co/KSap7czvRz"
2017-11-26 16:58:38,How to make money on iTunes without music part 1 https://t.co/E6CbDyirkV via @YouTube
2017-11-26 15:54:13,"I recently had a conversation with someone I was consulting. I gave them one really good tip, and it turned out, th… https://t.co/DIUqyIO8eB"
2017-11-26 15:52:53,"All I can do is tell you how to get it. My information isn’t popular, although it should be, even if it doesn’t come from me!"
2017-11-26 05:05:54,"Never take advice from quitters, or cry babies that don’t produce results. Stay away from people who care about strangers then themselves!"
2017-11-25 22:09:59,IBM $151.84 (+0.05%) on Yahoo Finance - dropped since last earnings call. Best time to buy is during dips!  https://t.co/BhpWNGnxZp
2017-11-25 16:20:23,Before you start a side hustle part 1 https://t.co/USj0bRSxMZ via @YouTube
2017-11-25 06:22:38,"Jeff Bezos is the richest man , again. I blame Bill Gates for letting Jeff outsmart him!"
2017-11-25 05:50:19,Wow!  https://t.co/rLSvVSScmz
2017-11-25 05:43:53,Round 2; making money on iTunes without having any music! I’m going to be making a full video on this topic soon!
2017-11-25 05:22:36,"“Let your plans be dark and impenetrable as night, and when you move, fall like a thunderbolt.” - Art of War."
2017-11-24 16:12:21,"Cashed $24.00 worth of bottle returns, adding my monthly dividend to purchase a share of KO (Coca Cola)."
2017-11-24 16:08:39,"From bottle returns, to stocks!"
2017-11-23 06:09:47,"I’m so used to doing deals, and signing contracts!!!! I mean, don’t expect anything different from me!"
2017-11-22 12:37:56,4 REITs to Buy Before December 13 – and 45 to Avoid https://t.co/Hua7hiq9C0
2017-11-22 08:21:55,"Turn up for justice, and get a building in the process! I know what it takes to get things done!"
2017-11-22 00:49:34,Trump probably made another billion dollars for twitter! Fake media (lol) is helping him push one of his biggest investments!
2017-11-22 00:48:29,"If you think that Trump is your biggest problem, congratulations... you’ve been fully brainwashed! Think bigger, an… https://t.co/wf0RahZnIj"
2017-11-22 00:47:10,"Did you get a copy of @GrantCardone’s new book? If not, you really need to get a copy! I’m reading the ebook now!"
2017-11-22 00:45:32,"What if I told you that even when an artist like future puts out new albums, I can make money on his music?"
2017-11-22 00:44:55,How to make record label money without a record label: I can show you the secrets of the ninja producers who don’t push buttons! Follow me!
2017-11-22 00:43:56,"They made you hold the back for years, now it’s time to hold your own. Stop thinking so small, and own what you holds value!"
2017-11-21 22:58:16,How to make $200.00 per month on youtube (you must subscribe to my YouTube for the information): https://t.co/EWftRkXUkw
2017-11-21 22:57:04,How to: buy songs from artist and monetize it. I may decide to write about this topic in my upcoming book (that’s 2 years overdue).
2017-11-21 22:55:30,How to make money on iTunes without a song: video coming soon! I’m going to show people (if they have operating cap… https://t.co/HliDOLdn9w
2017-11-21 22:52:08,9 Things Poor People DO That The Rich DON'T! https://t.co/O8wwQZSwnY via @YouTube
2017-11-21 20:42:20,"The market looks lovely today. If the justice department wants to sue a AT&amp;T, it’s because they’re currupt. Let competition flow!"
2017-11-21 12:30:30,UL $55.33 (+0.60%) on Yahoo Finance https://t.co/91E9RgepHb
2017-11-21 11:06:21,"What if instead of the latest gossip, families got together to discuss opportunities?"
2017-11-21 11:05:13,"If every family who wanted to create an empire all put their money together, into one portfolio, not separate portf… https://t.co/aOox5PaEwe"
2017-11-21 02:44:52,"Can can an individual measure there value without subjectivity? Could there be a measurement ranking of class, and… https://t.co/Rax8IMh9nZ"
2017-11-21 02:34:38,"One of my greatest secrets is that I listen to Beethoven when I am working on large projects, because his music helps me focus. #LudwigVan"
2017-11-21 02:33:10,https://t.co/BFgJQ2eQSi
2017-11-20 23:03:15,"The more I learn, the better off I am!"
2017-11-20 20:28:27,I have a hard time understanding why adults care about Snapchat? I really don’t get it!
2017-11-20 13:27:29,If they can sell over 75 million bottles of shampoo; you should consider looking at their balance sheets! Say it with me: “Unilever.”
2017-11-20 13:25:30,"When Ford starts selling 5 million electric cars in China per year, a lot of people would have been betting on medi… https://t.co/EzqsUMVrWd"
2017-11-20 13:20:00,"I can’t make up my mind about what stocks I want to buy! Should I purchase 10 shares of At&amp;t, Unilever, or, P&amp;G? I’… https://t.co/CEOt5ENVLn"
2017-11-20 11:57:56,On a different echelon. That’s not something I can translate to the uninitiated!
2017-11-20 04:16:48,"In your 20’s, you make a bulk of your mistakes. In your 30’s, you begin to reflect and repair the damage. In your 4… https://t.co/hmtmcbGzEJ"
2017-11-20 03:51:17,"When you have nothing of value to trade, your labor becomes a value. Use your labor as a means to credit your Inves… https://t.co/Gl9Oub07RQ"
2017-11-19 20:33:43,"Join @RobinhoodApp and we'll both get a share of stock like $AAPL, $F, or $S for free. Make sure to use my link.  https://t.co/NQe8s8SWeP"
2017-11-19 02:52:56,"Trying to make as many deals as possible. No need for any distractions, unless you know about another deal."
2017-11-18 00:50:12,GUCCI MANE CLONE GETS MARRIED!!! ILLUMINATI RITUAL EXPOSED!!! KEYSHIA KA... https://t.co/BZyy4pYiHl via @YouTube
2017-11-17 21:46:46,I’m really about to make one of the biggest deals of my life right now! I’m so excited. Entrepreneurship comes with perks!
2017-11-17 17:40:18,Sometimes you have to grow up. Staying stuck in the same mode you were in as a youth is not productive!
2017-11-17 11:37:29,"Sometimes, it’s about the evolution of a hustle, not the consistency of one. Hanging on to old models won’t always… https://t.co/vTRo2N356o"
2017-11-17 08:19:17,"People are joking on Tyrese, and missing the entire point of his rant. Seriously... he’s a father who’s being set u… https://t.co/vUqgWxlYUg"
2017-11-17 07:24:05,The illuminati doesn’t want you to defend yourself when it continues to dispose of humans like trash. Politics are… https://t.co/pajkhZKEPm
2017-11-17 03:31:32,"Sometimes you have to stand your ground; when someone violates your principles, and there can be no trust; especial… https://t.co/uuEJwCw33U"
2017-11-16 19:50:05,"House passes GOP tax bill, upping pressure on struggling Senate effort - The Washington Post https://t.co/Nqdgo0E9cf"
2017-11-16 00:30:56,"My associates tell me to get accustomed to accomplishing things. While others watch television, be creating something new! #BuildYourBrand"
2017-11-15 22:02:12,5 Ways To Get More Things Done https://t.co/pQY54typ9n via @YouTube
2017-11-15 20:11:50,🙌 Start investing with Acorns today! Get $5 when you use my invite code: https://t.co/UPBkeAz5OH
2017-11-15 00:20:10,Passive income: “REIT” investing! https://t.co/R5wGbTXeGu via @YouTube
2017-11-13 04:38:10,"If I can pull this off, it will be the greatest of many accomplishments I’ve ever achieved!"
2017-11-13 00:24:19,I’m hoping for the best in these critical times. The stress of a 9-5 alone is enough to put your health at risk. I… https://t.co/XSn2UBMYEN
2017-11-12 16:16:02,SHAKAAMA | Bill Gates Banished from African Continent https://t.co/0urrRMMdXj via @YouTube
2017-11-12 12:48:15,Today’s challenge for those who will be out and about: read all the products you purchase to determine who distribu… https://t.co/MQPKqmsb7X
2017-11-11 17:47:46,Passive income: “REIT” investing! https://t.co/R5wGbTXeGu via @YouTube
2017-11-11 14:12:30,"Don’t leave the hood, and leave your family behind; rebuild it, and rebuild your community! Stop letting outsiders… https://t.co/c0OQPRuuME"
2017-11-11 14:11:23,"It kills me how these rappers would join the illuminati, but won’t rebuild the block, and invest in real-estate, wh… https://t.co/l3QxZLb8RK"
2017-11-11 00:56:42,"Join @RobinhoodApp and we'll both get a share of stock like $AAPL, $F, or $S for free. Make sure to use my link.  https://t.co/NQe8s8SWeP"
2017-11-10 04:10:53,Stop Wasting Money on Junk - Grant Rant #158 https://t.co/xjrD8WhwIT via @YouTube
2017-11-09 23:22:36,Check out Luv Betsey Women's Crusin Cotton Weekender Black/Rose One Size https://t.co/HseNA23VRO @eBay
2017-11-09 21:34:37,How to Know Who You Can Trust for Advice https://t.co/pEZJud0qtJ via @YouTube
2017-11-09 03:59:24,Think about this!  https://t.co/DXdz3USshO
2017-11-09 03:46:10,9 Things That Are Making You Broke https://t.co/v2e0rYAkZr via @YouTube
2017-11-09 00:35:35,"All of this disruption in the market, yet I see adults giving attention a higher priority then their financial futures!"
2017-11-08 03:46:38,"What would you rather do; buy and manage Real estate properties, or invest in REIT’s consistently, and compound dividends?"
2017-11-08 03:34:45,"Join @RobinhoodApp and we'll both get a share of stock like $AAPL, $F, or $S for free. Make sure to use my link.  https://t.co/NQe8s8SWeP"
2017-11-08 03:21:50,You don’t have to go back to school to become wealthy; real-estate is the easiest way for people to make a Stash!!!… https://t.co/MyDWM2cwJu
2017-11-08 02:32:23,"I will only be supplying a select few, by demand. If my clients want a new product, a new product is what I shall g… https://t.co/MfDNOqX8Q6"
2017-11-08 00:34:34,"Just hit 1,301. 199 more until my goal of 1,500. Harry McRae https://t.co/EWftRkXUkw via @YouTube"
2017-11-08 00:33:29,Partner with opportunities that offer you a return on investment. The markets are looking really nice!
2017-11-08 00:32:20,There’s nothing wrong with wanting t
2017-11-08 00:20:18,😮 Start investing with Acorns today! Get $5 when you use my invite code: https://t.co/UPBkeAz5OH
2017-11-07 20:00:36,MC Eiht - Heart Cold ft. Lady of Rage https://t.co/3vwrwuCCsn via @YouTube
2017-11-07 19:58:46,Attention all classic producers; go find all the old school rappers with bars and retract this era what rap is! 50 new releases!
2017-11-07 19:37:04,I’d rather be influence by the creativity; not consumed in the emotion of meaningless scenarios. Who’s ready for real change?
2017-11-07 13:41:23,LXP Properties earnings call happening now!  https://t.co/N4K8ifUR3J
2017-11-06 22:45:22,"I want to get to 1,500 subscribers by FEB 2018. Subscribe now! Harry McRae https://t.co/EWftRkXUkw via @YouTube"
2017-11-06 02:25:04,"Less politics, more investments. Looking forward to a productive week in the market!"
2017-11-05 16:26:45,iPhone X sales are starting to increase! Did Apple have a sluggish release on purpose? Free advertising perhaps!
2017-11-05 16:25:24,"For all of my subscribers who follow me on twitter, retweet topics for the upcoming season, and I’ll make videos for those topics!"
2017-11-05 16:24:39,"Tis the season! Won’t be doing any hardcore resaling this year, but I will be expanding and growing my networks! Happy selling!"
2017-11-04 19:10:01,"‘‘Tis the season to be selling! Ecommerce, EBay, Amazon! https://t.co/KxLGWybhck via @YouTube"
2017-11-04 11:18:32,Here’s what I have to say to stock analyst who want to know why Starbucks has little growth; “No Howard Shultz.” It’s that simple!
2017-11-04 00:59:18,They think Paid in Full was a guide book. I heard you did a bid because you were hustling to snitches! You never listened from day one!
2017-11-03 10:07:47,My newest challenge is; finding time to ghostwrite novels. Finished up an album for someone yesterday!
2017-11-03 10:03:22,👊 Start investing with Acorns today! Get $5 when you use my invite code: https://t.co/UPBkeAz5OH
2017-11-03 06:21:39,To all the people turned millionaires from the bitcoin bubble... congrats to you for outsmarting society!
2017-11-02 23:50:04,"Sometimes, if you just read, you’ll know everything you need to know!"
2017-11-02 22:45:38,"If anyone missed the Apple earnings call, here is the 58 min recording!  https://t.co/PUNmj6718I"
2017-11-02 18:46:14,"Join @RobinhoodApp and we'll both get a share of stock like $AAPL, $F, or $S for free. Make sure to use my link.  https://t.co/NQe8s8SWeP"
2017-11-02 03:41:06,A teen single mom didn’t have enough money to buy clothes. She designed a worn looking shirt. She sold her designs. She is now rich!
2017-11-02 03:39:54,"He had a Nike shoe addiction. One day, he bought a stock after reading an article. He is now a millionaire!"
2017-11-02 03:38:48,"The single mother to taught her 14 year old son how to invest in stocks when he was 11, now has a networth over 6 figures!"
2017-11-01 21:18:31,"Facebook is focused on creating better advertising for companies. If you are trying to reach people, let your money talk!"
2017-11-01 21:14:14,Wanna know how Facebook is doing? Listen to earnings call. https://t.co/mgbJFo9SUP
2017-11-01 20:21:05,Listening in to Qualcomm’s live earnings call. This is amazing! https://t.co/lnb9jOw0sR
2017-11-01 16:32:02,Mark A. Halwick Jr https://t.co/k54oPfDO9O via @YouTube
2017-11-01 12:17:02,"Sometimes you can get lucky, and score free cash. But even lucky people need a strategy on how to keep it!"
2017-11-01 11:10:47,"A fool thinks liabilities are a come up. The more debt you put yourself in, the longer you’re slave sentence is! Learn how to do business!"
2017-11-01 02:07:57,"Tony Hsaih, the CEO of Zappos lives in a trailer, yet he is worth 800 million! Think about it!"
2017-11-01 02:05:36,"Some of the worlds riches people in the world only own 3 pairs of pants. Um, why do people feel the need to floss!"
2017-11-01 01:24:16,"The people I roll with make real moves in seconds. It goes real quick from thought, to action, then we talk about it, when it makes us $$$."
2017-10-31 11:58:16,😀 Start investing with Acorns today! Get $5 when you use my invite code: https://t.co/UPBkeAz5OH
2017-10-31 11:56:58,Here's $5. Try this out:  https://t.co/BmB3iS55AU
2017-10-30 18:38:04,https://t.co/kmFgtitTlx
2017-10-29 23:36:58,"I’ve fasted, changed my diet. I’ve been reading. I’ve been exercising, and planing. Whatever this life has to offer, I want it!"
2017-10-29 20:57:42,Sometimes you have to isolate yourself to get things done. The inner genius is stubborn; it requires a majority of your attention!
2017-10-29 17:34:44,I'm A Teenage Bitcoin Millionaire https://t.co/61kd0M4xca via @YouTube
2017-10-29 16:13:02,"How to save $1,000 - $2,000, while living paycheck to paycheck (diversif... https://t.co/rJ9ENzSTYs via @YouTube"
2017-10-29 15:27:08,"If you could own enough Investments in diversified companies, to make at least 30-40k per year, would you rather that, or chase a job?"
2017-10-29 15:25:35,"Would you rather have a business that pays you six figures a year, and have very little people know you, or try to be famous all your life?"
2017-10-28 12:00:44,"If I owned 5,000 securities that paid $2.00 per year, how much money would I make per year?"
2017-10-28 11:52:43,💸 Start investing with Acorns today! Get $5 when you use my invite code: https://t.co/UPBkeAz5OH
2017-10-28 10:12:26,"Would you rather receive dividends up to $60,000 per year, that you can reinvest; or be a famous rapper, pop singer, or actor?"
2017-10-27 18:01:25,"A great book, and a good cup of coffee makes a day like to today worth every moment!"
2017-10-27 16:42:33,Here's $5. Try this out:  https://t.co/hB5HDXCk9A
2017-10-27 11:25:50,"The people you follow, study, or lend your time to will be the ones who ultimately shape your destiny! Who, and what are you focusing on?"
2017-10-27 10:49:49,“Appear to be weak when you are strong.” I take it that acting dumb is also a great defense mechanism too!
2017-10-27 10:47:53,“Your enemy does you great honor.” - Sun Zu
2017-10-27 10:47:27,"There is a reason why, “The Art of war” is my favorite book. I can tell who my enemy is, even if they deny their opposition!"
2017-10-27 10:25:10,"Potential is like a match, but ambition creates the fire. Everybody’s got potential; what makes you different? That’s the question!"
2017-10-27 10:09:36,"Robert owns 20,000 stocks that earn him $1.00 per year, how much money will Robert make if he did not reinvest?"
2017-10-27 05:02:49,Passive Income Through Dividend Growth Investing https://t.co/DVRB41ZiAA via @YouTube
2017-10-27 03:02:38,https://t.co/TZKMt2Zc8r
2017-10-27 01:13:12,Take notes! https://t.co/l9xRFa07cy
2017-10-26 23:22:15,"I have a question for my followers; if you own 50k shares of stock that pay $1.00 per year, how much do you make per year?"
2017-10-26 22:17:48,"It’s amazing to hear that Citi Group is on the earnings call. #MicrosoftStock does have volatility, but it’s got Moat as well."
2017-10-26 22:16:41,"I’d rather bet on a company, then a person, and more important, on myself! #Investments #MP #IPC #MSCF"
2017-10-26 22:14:27,Microsoft earnings call is taking place now! I’m on the call. https://t.co/T5oBE7bB2z
2017-10-26 19:03:23,https://t.co/yQLU1oVKT9
2017-10-26 01:32:12,Disruption is a factor in investing. Use you instinct too! https://t.co/yHlLMHdiP4
2017-10-26 00:48:01,It’s 50 fever tonight! https://t.co/TOqL9dDT3E
2017-10-26 00:44:18,"One of my favorite artist, here’s why: https://t.co/dY4t8qsNQj"
2017-10-25 11:48:39,"Coca-Cola beats estimates, reaffirms full year 2017 outlo... https://t.co/ByP3r8J8us"
2017-10-25 00:13:30,Right now is the best time to learn how to make money independent from a 9-5. Your future may depend on it!
2017-10-24 20:50:39,"AT&amp;T is very bullish on this earnings call. Any state that doesn’t opt in, will automatically be opted in!!!! Lol."
2017-10-24 20:34:34,On the call. https://t.co/0X1nDpy2q3
2017-10-24 12:04:13,"I really do love real-estate investment Trusts, and Stag is my favorite thus far!  https://t.co/dNJbZRcG83"
2017-10-24 04:57:46,https://t.co/jerjh5fBL3
2017-10-24 02:43:21,What’s up with the time warner deal? Can At&amp;t get what they paid 8 billion for please?
2017-10-24 02:42:36,"The telecomm market is doing horrible, but it will pick back up. In the next ten years, I can see stocks increasing by at least 20%"
2017-10-24 02:40:50,"Bad quarter for At&amp;t. I should have held my ambition a little longer before buying more shares, and got telecomm ETF’s instead. #Stocks"
2017-10-23 18:58:26,Stash has a podcast. Listen to it!  https://t.co/cPefTr22a7
2017-10-23 11:34:52,I’m already in fire with the referrals: Here's $5. Try this out:  https://t.co/phPZrU4upg
2017-10-23 01:22:14,"Wind is sound, rock is stillness. When the pressure of wind is pressed against the rock, it is not moved; it is still!"
2017-10-23 00:20:36,"If I didn’t believe strategy was so important, I would be inconvenienced. Because I expect to be inconvenienced, I am not!"
2017-10-22 17:11:22,https://t.co/XfvYfl61Ix
2017-10-22 14:16:57,Investing in yourself - Genius season! https://t.co/997DVUUjWs via @YouTube
2017-10-22 13:15:42,"Robinhood, Stash, and Acorns, investment Apps! Making money! https://t.co/ugvWhSlADi via @YouTube"
2017-10-22 12:00:36,https://t.co/LtVZzL5FEz
2017-10-22 08:28:13,Study:  Black students are NOT able to pay their student loans https://t.co/lo4XSxhlFf via @YouTube
2017-10-22 07:34:11,https://t.co/jconRojYI0
2017-10-22 07:27:33,O $55.54 (-1.19%) on Yahoo Finance https://t.co/YzWRgqUR1s
2017-10-21 12:19:19,"Want Income? Closed-End Funds Offer Yield, But Beware Of The Risks | Stock News &amp; Stock Market Analysis - IBD https://t.co/sk6xGe1apC"
2017-10-21 11:21:01,"You can make money from google, without working for Google. Google that!!!!!"
2017-10-21 10:42:38,How to Invest in a Closed-End Fund - Personal Finance - https://t.co/zqtKmZlxrQ https://t.co/DNCwBQopYq
2017-10-21 10:30:24,Open Your Eyes To Closed-End Funds https://t.co/iPMo4USZcA
2017-10-21 10:04:39,Thanks! https://t.co/9C3MrbpmCx
2017-10-21 02:22:18,Start investing with Acorns today! Get $5 when you use my invite code: https://t.co/UPBkeAz5OH
2017-10-20 17:56:15,💥 Start investing with Acorns today! Get $5 when you use my invite code: https://t.co/UPBkeAz5OH
2017-10-20 17:11:35,3 Stocks to Buy and Hold for Decades https://t.co/Y2km4eRYQ4
2017-10-20 11:28:46,"Robinhood, Stash, and Acorns, investment Apps! Making money! https://t.co/OI7uUY9ofl"
2017-10-20 11:21:23,Here's $5. Try this out:  https://t.co/phPZrU4upg https://t.co/phPZrU4upg
2017-10-20 06:28:11,"Tax season is almost here. This is your chance to invest your money, and change your life. What will you do?"
2017-10-20 04:43:02,https://t.co/isH1oVFs2a https://t.co/isH1oVFs2a
2017-10-20 04:42:44,"""Who you calling a B*tch?"" - Queen Latifa."
2017-10-20 02:27:01,"I decided to purchase shares of Facebook, since people like to be on it so much. That way, I still make money from it."
2017-10-20 02:26:25,"My core following have 2 places they go to look for me, Youtube and Twitter. As far as facebook is concerned, I just own shares!"
2017-10-20 02:25:28,I'm so glad that goggle appreciates my work. It's not like I'm viral on these other social media platform$.
2017-10-19 13:13:02,Who's been dying to trade stocks commission free? Get started with my link: https://t.co/NQe8s8SWeP
2017-10-19 13:06:42,"Short book with a guideline of different money making strategies, and investment strategies. I feel it now!"
2017-10-19 13:06:00,I'm not kidding this time. I thinking of writing another book for my core following. This will be the best one yet.
2017-10-19 12:04:57,I'm #reading A Random Walk Down Wall Street by Burton G. Malkiel https://t.co/3oNrYKoEHE
2017-10-19 12:03:16,Current read; can't wait until I'm done with this one! https://t.co/YYkNai7e6f
2017-10-19 09:39:13,"I don't watch TV, I watch charts."
2017-10-19 09:38:37,"I confirm nothing of drake, I confirm ETF's as the best passive income engine in the world. Index investing is the best. #Stocks"
2017-10-19 05:27:02,https://t.co/XUa9YyNvJJ https://t.co/XUa9YyNvJJ
2017-10-19 02:51:15,Your enemy can weaken you just by causing you to react; which will create a cycle of unrestricted non-constructive behavior!
2017-10-18 23:20:39,10 Blue-Chip Dividend Stocks to Buy for 2018 | InvestorPlace https://t.co/FKzBJLnqGt
2017-10-18 23:16:11,Message me if you have questions: https://t.co/NQe8s8SWeP
2017-10-18 21:14:57,"Whoever wants to make $5.00, all you have to do is use my link: I promise this isn’t spam. Here’s $5! Try this out:  https://t.co/yx2M6O6VJh"
2017-10-18 20:54:46,You should be purchasing this stock if you want to get into real-estate: LXP $10.43 (-0.76%) on Yahoo Finance https://t.co/8g65kfC7sG
2017-10-18 12:41:49,If Only School Required This Lesson On Money https://t.co/DmGrvfB66y
2017-10-18 12:33:28,"Dame Dash said, saving money is for suckers. He's right, invest in yourself."
2017-10-18 12:18:55,"Some people worked for them, and didn't know about its shares! IRM $40.11 (+0.75%) on Yahoo Finance https://t.co/rkh0UpPZhF"
2017-10-18 12:13:19,"Pfizer's one year target is just above $38.00 per share, which means it has a low, but consistent EPS (earnings per share). #StayWoke$$"
