timestamp,tweet_text
2017-05-22 20:17:28,Invest in the person you wish to become in the next ten years. - my message to the youth!
2017-05-22 06:44:28,"Life is a journey. The more roads you take, the more you can draw on the map. If you're bold enough, you can create your own map!"
2017-05-21 23:06:14,"It is important that you see yourself, as an animal in the wild. This distinction will revel your fate!"
2017-05-21 22:11:03,"Busy, busy, busy... that's how I like it!"
2017-05-20 23:48:47,The 3 Best Dividend Stocks of Tomorrow -- The Motley Fool https://t.co/i5lX34oyZl
2017-05-20 22:01:17,U.S./Saudis seal $350B weapons deal - | Seeking Alpha https://t.co/2OseHyI5ic
2017-05-20 14:36:59,Even fantasies are for sale. Watch out for what you buy. The residual affects can set you back over 10 years if your not careful.
2017-05-20 13:06:11,"Thinking about going to the dealership. I can't lie, I'm thinking about a Ford this time around!"
2017-05-19 14:51:53,Making money with eBay - the easiest online business for beginners https://t.co/nwmNndGKHj
2017-05-19 08:29:04,Robinhood App - Bob Evans SPECIAL DIVIDEND! - $7.50 Per share https://t.co/dukDKUiv7a
2017-05-18 10:34:47,I wanted to teach my brothers to handle their business. Don't be flustered in emotions. Take care of business. #BusinessAsUsual
2017-05-17 21:17:41,"Breaking bondage doesn't give you freedom, it gives you power. Not understanding this only keeps you in bondage!"
2017-05-17 01:59:40,"You can tell where someone is mentally, just by the apps you see on their phone. Trust me, their are levels!"
2017-05-16 08:57:10,"I'll be 38 this month, don't ask me no stupid immature questions. Grown man business over here!"
2017-05-16 06:32:14,Make moves with the business of things! #Investments
2017-05-15 09:42:48,"Now a days, it's commutes to work. Difference is, I do what needs to be done. Chasing the paper, sacrificing social life. Oh well."
2017-05-14 14:56:45,"Happy Mother's Day to all the moms, and soon to be moms, of the world."
2017-05-14 14:48:38,Film Review: ‘Hunter Gatherer’ – Variety https://t.co/seJDQr2uFG
2017-05-14 05:59:28,"If I feel uncomfortable in a store, or if management follows me around, I will actually not do business with that company. #NoDebates"
2017-05-14 02:05:27,The best way to counter debt is dividends! #Investments
2017-05-13 17:05:05,"I stopped carrying cash a few years ago for a reason. Lost a grip today, whoever found it, enjoy it. Everything swipe from now on!"
2017-05-12 09:56:08,"I've learned how to utilize the formula of ""Supply &amp; Demand"" to my advantage. The internet has become the new block!"
2017-05-11 23:59:51,Making money with eBay - the easiest online business for beginners https://t.co/nwmNndGKHj
2017-05-11 11:34:06,"When the moves you make are centered around producing a favorable outcome, small things matter little. Fickleness is minor! #BrandBuilding"
2017-05-11 02:18:46,"""I move on with, the only direction. Can't be afraid to fail. Search your perfection. - Jay Z."
2017-05-11 00:15:42,When you can move differently!
2017-05-10 04:39:29,"Pick up your sunglasses, drive to a beach, a path, or a place of peace, and just go there. Drive, and don't think. Spend your time! #Zen"
2017-05-08 11:00:37,"I only have time to engage in powerful, life changing conversations. If you want to be in my circle, you must have substance!"
2017-05-08 07:26:39,Always have something to look forward to. The current you is not ready for the future you. #StayHumble.
2017-05-07 13:59:15,"The wisest of all deals, is the deal you make with yourself. Take your self serious. Invest your time in things that follow!"
2017-05-06 06:39:24,"""EX CAR WASHER"" Gets Emotional and Starts To Cry https://t.co/jxzZpea8t8"
2017-05-06 06:30:42,Linkin Bridge: Tough guys street gang - GONE CHRISTMAS!!! with LINKIN BR... https://t.co/fDOdSooMXD
2017-05-06 06:11:43,Linkin Bridge: Tough guys bring the HOOD TO THE 'BURBS AT CHRISTMAS -  P... https://t.co/WQZ3T2YRau
2017-05-06 06:06:46,"Prisoner Drive Thru Prank! - #TomMabePranks, I'm too late to get the cam... lo. Love the videos! https://t.co/vUUfdjRQZI"
2017-05-05 10:52:20,"To whom do you rely on for progress? If the answer is not self, you a living in a path of confusion. Recalibrate your intuition. #Wisdom"
2017-05-05 07:03:09,"Change is necessary; however, a fool will regard themselves as being original."
2017-05-04 20:16:05,AT&amp;T Invests Nearly $975 Million Over 3-Year Period to Enhance South Florida Networks https://t.co/QahioPtXFZ
2017-05-04 04:32:34,"My happiness doesn't require me to expose my moments, it requires me to experience them. The road feels nicer driving; not when parked."
2017-05-04 04:32:30,"I look at stocks the same way a farmer looks at crops, I examine the produce coming from the source. #Investments"
2017-05-04 04:09:14,"Without the proper understanding or insight, expect no one to identify with your prioritization, and organization of goals."
2017-05-03 06:47:32,Apple’s Cash Hoard Set to Top $250 Billion - The Wall Street Journal https://t.co/A1puJWdgD5
2017-05-03 06:47:12,Officers Won’t Be Charged in Black Man’s Shooting Death in Louisiana - The New York Times https://t.co/lURZisuIrO
2017-05-03 03:45:28,Focusing on the results of the process will help the process move forward.
2017-05-02 23:22:12,"Maturity makes you interpret things differently; music, conversations, movies, and perhaps, work. Don't seek to be understood immaturely."
2017-05-02 19:29:51,"I never had a fear of risk, just a fear of getting too comfortable, and forgetting not to take more chances!"
2017-05-02 19:28:33,"Vision isn't something you can inherit from someone else, it comes from within. Understanding lies under the same logic!"
2017-05-01 20:09:31,"Trends don't change me, in fact, I influence people who follow trends. #HustleOutLoud"
2017-05-01 19:54:10,"The internet changed everything. For me, it created a new version of the block. I decided to make product move online. I've done well."
2017-04-30 20:29:30,Any questions about Apple stock? Apple’s Cash Hoard Set to Top $250 Billion - The Wall Street Journal https://t.co/A1puJWdgD5
2017-04-30 17:57:45,My sleep schedule is all screwed up. I'm tired a lot because I've adapted to change. Much more is required of me know. #Focused.
2017-04-30 14:44:52,"One of my greatest strengths, is knowing that I still have a lot to learn. I am not beyond self-education, and practical knowledge! #Wisdom"
2017-04-30 01:29:14,The Pooter Episode 109 #FartPranks https://t.co/8VdErO9Cwd
2017-04-29 18:02:01,The simple things in life may be better than the expectations we have in life. Be careful to examine the mindsets of those who surround you!
2017-04-29 11:49:41,Stop spending (blowing) all your money. How to trick yourself into saving. https://t.co/Bc5UZRpZME
2017-04-29 06:04:10,CELL PHONE CRASHING at the AIRPORT 2014! https://t.co/ULFFyBgjr7
2017-04-29 02:17:47,"You create more limitations when you are not focused, than when you are. The work and consistency looks disparaging to short term thinkers!"
2017-04-29 02:01:30,Read more!
2017-04-27 19:40:16,"How to have more money than a rapper - I Harry McRae, support this message! https://t.co/oFvDzIoG3a"
2017-04-27 12:10:12,"Days like today, those are the days when I realize, the hustle is real."
2017-04-27 10:17:28,"I will be deleting profiles at random; If you post non-sense consistently, or, or completely self-centered and unaccountable; family too!"
2017-04-27 10:15:54,"You can tell where someone is mentally by what they post. Credit score, or retirement portfolio might be a qualifier too! #Focus"
2017-04-27 09:14:22,Everything is a go. Progression for the ultimate levels of accountability and adulthood. #NoHasTagRequired. Lol.
2017-04-26 16:06:51,"""When I became a man, I put away childish things."" - #Truth #WisdomWednesday"
2017-04-26 12:12:07,"My expectations are high, so don't be talking small to me at all. Forward progress! #Stocks&amp;Better #Business #TalkTrades"
2017-04-26 10:25:20,"Week 2 at my new job. Commute is crazy, but the new salary is much more rewarding than the old. #StayFocused #TradeStocks"
2017-04-26 02:54:45,You can only teach people who are interested in learning. Any attempts to help a closed mind will only result in wasted time &amp; energy! #Zen
2017-04-25 20:22:32,"My post don't get likes, but my #Tweets get retweeted. That's because there's more intellectuals on twitter, than on Facebook!"
2017-04-25 20:20:07,"I feel like pissing people off today. Don't like this status, just share if if you feel the same way. #AttentionAddicts"
2017-04-25 20:19:27,Photo filters (in my view) tell the world just how desperate you are to get attention. Must you be so simplistic. #AttentionAddicts
2017-04-25 20:17:27,"Duck lips only make you look like a moron with a child-like complex. Unless you are recovering trash, don't do it. Buy a Coach Bag."
2017-04-25 20:11:46,"Those who know how to grind lose the most sleep, others just look for opportunities to be awake. #BordemUnleashed"
2017-04-25 18:46:58,"Facebook is now the second most popular site, beating YouTube, which is bad news to me. Free viral info vs Monetized info. #AllStocksNow"
2017-04-25 10:45:42,"This new job has me so tired, but I love it. It's areal challenge. Great opportunity for me to advance!"
2017-04-25 07:12:08,"I'm always eager to achieve at setting, and accomplishing numerous goals. I don't have a one track mind!"
2017-04-24 20:01:25,"I'm not releasing my new #eBook until I see 1,000 subscribers. One way or another, this is going to pay off. $4.99."
2017-04-24 19:58:41,19 new subscribers on deck. I may actually buy a bottle of champagne when I hit 800. https://t.co/EWftRkXUkw
2017-04-24 19:56:11,"Sometimes people get hung up on perceived value, and not actual value. Tonight, I'm going to play devils advocate with my next transaction!"
2017-04-24 19:54:05,"First rule in business: value for value. What am I buying, and what are you selling? What am I pitching, and what do you need. #Business"
2017-04-24 19:52:55,"When you get on the phone with credit card companies and tell them to increase your limit, that's called a negotiation. #Options"
2017-04-24 19:51:59,I tell people that it's really important you know how to do business. Be successfully in negotiate multiple transactions. #Business
2017-04-24 10:09:44,If your only greatness is a story about your past; you are shadow walking. Continuous progression is how mature adults measure growth.
2017-04-24 07:15:59,I'm not supposed to be liked by losers. I'm supposed to be very irratating to them. I'm supposed to upset them immensely! #GrindMode
2017-04-24 02:18:51,"New skills, new qualifications, and new certifications. We are on one. Waiting for my Diamond prefered card! #MasterCard, #Stocks"
2017-04-23 17:11:11,"Unruly younger brother blocked. Next step, social media purge. If you are a loser, be aware that I will be purging you in 2017!"
2017-04-23 14:09:12,Just got approved for the citi diamond preferred card. It's time to make some major moves this year. #Investments #Credit #NewEmployement
2017-04-23 13:40:20,The people in my immediate circle know how to get it. #InvestLikeYouWannaWin
2017-04-23 01:20:56,"Not taking care of your children? That's ok, just argue with your more responsible older brother and blame him!"
2017-04-23 00:59:38,12th commandment: thy shalt not be broke.#Biblical
2017-04-23 00:58:19,11th Commandment: thy shalt not let thy credit fall below a 700. #Biblical
2017-04-22 20:49:25,I'm being coached on morals by someone who neglects their parental duties... this is funny!
2017-04-22 14:24:02,When my attorney starts following me on twitter!!! Is that a good thing? #BusinessAsUsual
2017-04-22 13:43:49,HPE - Hewlett-Packard #Stocks!
2017-04-22 13:42:35,3 Stocks You Don't Have to Babysit -- The Motley Fool https://t.co/TL5UurmEdp
2017-04-22 13:41:27,"The fastest way to build a new portfolio, is to invest in funds that pay monthly dividends, I think! #Investments"
2017-04-22 12:17:51,"The only celebrities I chase, are the executives on the marketing department that wanna pay me to ghostwrite!"
2017-04-22 12:14:11,I think I might have to go back to separating myself from siblings. I hate struggling for accountability. It annoys me!
2017-04-22 00:36:39,ROAD RAGE | ANGRY PEOPLE vs. BIKER COMPILATION 2017 | [Ep. #57] https://t.co/aSAXU9beNR
2017-04-21 22:25:50,https://t.co/QmxhCMteTy https://t.co/QmxhCMteTy
2017-04-21 19:17:55,"This awesome guy is 77, what's your excuse! https://t.co/fNID2b8W0P"
2017-04-21 05:58:23,"The only think I try too hard to do, is get this money. Anything else is just a distraction. I don't need attention, just the bag!"
2017-04-21 04:42:17,"When the money is right, you do things differently. Contract signed, distribution is easy!"
2017-04-20 23:20:50,"Day 3 of my new job. No calls, and no interruptions please. Moving along with my mixed shift! Don't bother me. #Imhustling"
2017-04-20 20:38:34,"If you are lowering your standards to get faster results, you are sacrificing long-term growth, for immediate gratification! #RaiseTheBar"
2017-04-20 20:36:00,"It's too bad super hero's don't exist. It seems to me like the villains, and their twisted agendas are winning. News is really a chess move!"
2017-04-20 19:52:02,I don't have the capacity for self-doubt; nor do I entertain the disbelieve of others in themselves. Change comes when comfort is abandoned.
2017-04-20 15:48:57,"Two options: either I'm going to be broke for the rest of my life, or I'm going to be successful. But fear is not an option. #investing"
2017-04-20 13:53:49,#Investing: the private strategy multi-million dollar companies use to create even more wealth.
2017-04-20 11:29:25,"All that I have done lately, has given me a. Post in confidence, and feed my ego. Sometimes, people, places, and things, create change."
2017-04-20 00:59:29,"You can negotiate the terms of any engagement with any interested party, but make sure your transactions are valuable first!"
2017-04-19 12:09:48,"If you have a good paying job, don't stop there. You don't need to start a business, just invest your way to passive income. #NoNetworking."
2017-04-19 09:42:48,Day 2 at my new job. Everything is going well this far. My drive on the back roads is all that concerns me!
2017-04-19 01:43:11,"When profit sharing is on the table, more investment in play, and summer weather is on its way, you just can't help but wonder? #Business"
2017-04-18 23:33:50,"Direct deposit set up... grand. Now, the market is looking good today! Who picks better investments than me? Jk. #investing #Stocks"
2017-04-18 16:03:38,"Enjoying my first day at my new job! What more can I ask for? Pay is better, better environment too!"
2017-04-18 11:43:53,"Only invest in stocks that pay a dividend! That's my strategy. If they don't really have any capital to distribute, they won't last!"
2017-04-18 10:11:20,"You cannot exploit, and empower people at the same time. Opportunity comes at a cost, but even the wealthiest have to let go of greed!"
2017-04-18 09:38:35,"Hesitation, procrastination, fear, comfort, and lack of planing all lead to immediate failure. Always have a sense of urgency!"
2017-04-18 02:39:14,"Opportunity surrounds me, yet I was blinded by comfort. Now I see the light, and my ambition shines like a light bulb! #InvestInYourself"
2017-04-18 02:36:30,"They thought I wouldn't respond; well, think again. Our policies don't coincide, so I had to slide. It's brighter on the other side. #Zen"
2017-04-18 00:24:26,"I couldn't have been more honest with myself when I said, ""Fuck that place."" My inner voice was like that of a lions roar!"
2017-04-17 17:31:58,There are levels to this game. I'm not interested in staying familiar with patterns. I'm with that change. #TaughtYouHowToWin
2017-04-17 16:10:54,This next book will probably open doors for people who are struggling to understand how to live progressively. #PowerMovesOnly
2017-04-17 15:31:27,"I'm trying to do other things, but I cannot stop looking at the stock market. Lots of gains today for smart #Investors. #InvestorsHangout!"
2017-04-17 15:18:07,I really need to get focused. It's time to make some necessary changes to my social circle. No more wasting time! #progression
2017-04-17 12:27:51,"Donell Jones ""Sorry I Hurt You"" https://t.co/sFr2uXqA5M"
2017-04-17 12:20:33,Donell Jones - Closer I Get To You [Forever 2013 - track 03] https://t.co/zUa6RwFsxT
2017-04-17 00:35:51,"When you have to reinvent yourself, being an architect is all that matters first. When the floor plans are done, transformation begins! #Zen"
2017-04-16 19:23:37,"I have one last valuable lesson to learn today; which is, I cannot control urgency, I must be, but I must not expect!"
2017-04-16 17:41:57,Focused on these power moves. I'm used to putting strategy before instinct!
2017-04-16 16:40:57,@Discover On the site now Sabina!
2017-04-16 15:14:04,"Trying to decide if I want to apply for Diamond Prefered CitI MasterCard, or, a gold Discover Card? Hmmm!!!! #creditcard"
2017-04-16 12:55:14,"When you learn how to do business, you don't need lead generators, networks, or even downlines, all you need is your activity!"
2017-04-16 12:22:15,Veggies in the crockpot already. Coffee done. Good morning. #YouTube Growth is looking very nice! https://t.co/EWftRkXUkw
2017-04-16 03:27:08,How To Pick Up Milfs! https://t.co/Wku3OPDK2g
2017-04-16 03:05:22,4 CRAZY ASS PRISONER PRANKS FEATURING DENNIS ROADY https://t.co/KlJz1z3dAL
2017-04-16 02:46:06,"Today's agenda: writing, walking, sight seeing, and driving to random places. #projectmanagement"
2017-04-15 19:51:51,https://t.co/CgHIUTR9LT https://t.co/CgHIUTR9LT
2017-04-15 19:11:21,Out walking on the trail. Great way to relieve stress. Exercise is important. #Zen! #Nature #Walks
2017-04-15 16:29:57,Havoc (Mobb Deep) Makes a beat https://t.co/1Y6jjVEyyp
2017-04-15 15:28:05,"Investing is such a fun way make money for people who aren't good at business, just as much as it is for people who are. #Investments"
2017-04-14 20:25:42,"You failed to negotiate reasonable terms with me, so I took action. I moved forward, creating my own solution!"
2017-04-14 20:22:58,"If someone, or something is taking advantage of you, get out!!!! To truly change your life, you have to make the first move, #Eliminate"
2017-04-14 19:21:03,"New chapters, new pages, and new opportunities. I'm not supporting these old ideas anymore! We moving forward. Stay in your lane, I'll pass!"
2017-04-14 19:03:03,Celebration tonight... me overcoming!
2017-04-14 18:25:28,Shout out to you if you understand this song:  https://t.co/QfxeJOuul4
2017-04-14 18:23:03,https://t.co/BBVDn3Eea6 https://t.co/BBVDn3Eea6
2017-04-14 18:00:27,"People who discuss politics in public are boring, and borderline sociopathic! Lol."
2017-04-14 17:59:47,@HudsonValleyBMW 500 series! I may have to trade my VW
2017-04-14 17:59:17,@HudsonValleyBMW It should be a BMW!
2017-04-14 17:59:03,RT @HudsonValleyBMW: @Righteousemusic that's awesome! What kind of car are you cruising in?
2017-04-14 14:08:23,"Question: are you dead, or did your internet get cut off? Damn people! Is it that hard to survive?"
2017-04-14 13:09:20,"Car washed, oil changed, new everything. Where do I go for lunch later? #socialmedia"
2017-04-13 18:23:36,"This week is winding down, as I do my best to enjoy my week off until I start my new Job on Tuesday. #Sun, #Walks"
2017-04-13 12:05:53,"Sometimes you can keep it simple and yield results. Find out what works universally, and do it over and over again. #Investments"
2017-04-13 00:38:50,"I can't give up, no matter how hard the mission. There is a reward out there for me. It's waiting for me!"
2017-04-12 23:43:07,Getting free stuff to sell on eBay. https://t.co/5vuiiShYe2
2017-04-12 23:28:52,Barista - for my ex coworkers looking!  https://t.co/cfdBJui5MR
2017-04-12 18:45:05,"Social media comes out with new trends, and teen you adults into children over night. 50% of your intelligence, gone is 60 seconds!"
2017-04-12 16:59:29,"Good presentations. Now I'm looking for substance. Lots of potential out here, but I may have to start traveling. #NewOpportunities"
2017-04-12 16:58:20,"I put my work in, and now all these companies are chasing me. Interesting how this all works! I got candidates too. Sorting through y'all!"
2017-04-12 13:30:24,"Yesterday, eye wear, prescription sunglasses, and new frames ordered; plus oil change for my car. Today, Sneakers, and a new wallet!"
2017-04-12 11:59:11,"The most exciting thing about investing is, it gives you a realistic view about how business can change to fit consumer demands! #Invest"
2017-04-12 10:54:39,Looking forward to another awesome day filled with relief that I don't work at that horrible job anymore!!!
2017-04-12 03:46:35,"You cannot teach everyone how to truly live. To them, common patterns, and limitations will be the extent of their experiences!"
2017-04-11 21:27:49,I'm thinking about deleting all the losers from my social media account! #SnapChatThis
2017-04-11 20:18:32,"Ended up shopping today!!! Spent some money, something I hardly do!"
2017-04-11 20:17:56,@HiltonSuggests I think I'll give that a try!
2017-04-11 18:12:43,"@HiltonSuggests Not really. Just want to go. I wanna see monuments, maybe museums!"
2017-04-11 17:29:48,"If you don't know how to handle your business, business will handle you. Maybe services will get cut off!!! #SnapChatThis"
2017-04-11 17:28:18,"You are a reflection of the company you keep. If it's not an upgrade, it's a downgrade. #2BrokesDontMakeARight"
2017-04-11 17:22:16,"I can actually say that I bought an item for $1.00, and sold it for $50.00, no lie. #SnapChatThat"
2017-04-11 16:42:21,I'm cruising to biggie in the whip. Your in the house chilling with Dowkie on your lips... #SnapChatThis
2017-04-11 15:48:19,"Apple is losing me money right now. Get it together #AAPL stock. Ford is doing horrible, but I'm holding anyway!"
2017-04-11 14:57:36,I walk in the dealership and get approved with no money down. You walk in the dealership and need a co-signer. #SnapChatThis
2017-04-11 14:53:03,"I'm outside enjoying nature, your inside enjoying stress and discomfort #SnapChatThis"
2017-04-11 14:52:18,Why doesn't anyone ever Snapchat their eviction notices? #SnapchatThis
2017-04-11 13:24:35,"Today, I'll wear shorts, and I will explore nature. Binoculars are coming with me. I'm going to enjoy nature!!!"
2017-04-11 12:26:15,"Growth occurs not in the specificity of the process, it exists in the long-term action of the process (its continuity)."
2017-04-10 20:39:56,"Call me a hater if you want, but this new rap sucks! Artist with nursery rhymes, simple vocabulary, and no bars!!!! #NotMyRap!"
2017-04-10 20:36:10,"One could only wish for things he or she desires. Live with, or without it, it will always be a thought. #Zen"
2017-04-10 18:14:40,Clockwork Planet | Redux Rewrite Anime Spring 2017 | 1st Impressions https://t.co/SBdxJZFMjN
2017-04-10 18:01:34,Saving money myth. It's not a pot of gold at the end of a rainbow https://t.co/KHOglOK8ln
2017-04-10 14:28:04,"Creating a projection sheet this morning. New salary, plus business and stock networth. I don't do 401k's!"
2017-04-10 13:18:33,"As soon as I start my new job, I'm actually going to work aggressively on writing my next book. #authormentormatch"
2017-04-10 12:18:57,Woke up this morning with back pain. A trip to Rite Aid was a definite. Hopefully I'll feel better later!
2017-04-10 01:34:17,Someone close to me taught me that some people aren't qualified to receive the information I knew. My great grandmother was right!
2017-04-10 01:31:49,"Be conservative with your information, and with your conversations; Not everyone wants to hear what you have to say. #DoInTheDark"
2017-04-10 00:06:19,"It is important to learn how to do business. You don't have to be a successful business owner, just have a general understanding!"
2017-04-09 21:31:39,"I have to make my list shorter. Simplifying it to the most important detail. Budget cuts, and non-productive interactions - bye!"
2017-04-09 18:39:11,Marshmello - Alone [Monstercat Official Music Video] https://t.co/fuHeNnYovd
2017-04-09 18:39:00,Marshmello - Ritual (feat. Wrabel) [Official Music Video] https://t.co/EbJNbhCkac
2017-04-09 16:45:08,I want to spend a weekend in Boston. Anyone know any places to visit there?
2017-04-09 14:45:22,"When you walk away from something, you have to have the courage to just move forward, and not look back. #Forward"
2017-04-09 13:46:53,Working on my projections heavy. Analytics are looking good. Business first. No contact about nonsense!
2017-04-08 23:11:02,"Sometimes, you have to look to those who stand on equal ground. Nonetheless, speak diligently!"
2017-04-08 16:09:09,"Which is more important to you, likes, or net worth? #Investors do it better!"
2017-04-08 14:55:26,"Be very careful how you talk to people! Measure your words in considerable rhythms, to insure you're not causing confusion!"
2017-04-08 13:29:53,I gave them too many years of my life. Moving on with grace!
2017-04-08 13:03:20,"Things are going to be difficult for a while, as I adjust to my new schedule. I still have things to toss out of my life!"
2017-04-08 11:20:05,"This time, I'm going to stay focused. I'm going to ensure that everything I do has a rhyme and reason. My grandmother taught me that!"
2017-04-07 16:30:39,"I know where to put what, so don't be surprised when the pieces come together correctly!"
2017-04-07 16:12:20,"When you're prospecting, never let your subject know what cards you are holding in hand. Keep your sharpest plays a mister!"
