timestamp,tweet_text
,"Co-founder & CEO, Reaction Commerce, @getreaction. Tweets auto archived after 30 days. she/her.",
2019-11-13 19:44:43,@adriennefriend Looks delish!
2019-11-10 19:50:07,@focusaurus Yikes is right! Brrrrrr
2019-11-10 19:49:11,Red tide this morning. https://t.co/HQzLww7SSp https://t.co/PDHwW4mAX9
2019-11-09 18:10:20,Heading home after a lovely time in Austin for #LeadDevAustin. Feeling grateful to be part of a community that is s… https://t.co/q3Ruh8zekf
2019-11-09 17:12:14,"Finished reading Chanel Miller’s memoir, Know My Name. It’s brilliant, hopeful, and also so disturbing at the same… https://t.co/LqV6twXISa"
2019-11-09 16:37:52,@spencernorman @jilljubs @ekellener @malburd cc @cshivaratri
2019-11-09 16:35:03,@spencernorman https://t.co/Lgu7F2JiWB
2019-11-09 01:46:00,@davidbrunelle @rmurphey @TheLeadDev I'll be there! 🚵‍♂️
2019-11-08 19:24:00,"@Geek_Manager @spencernorman @TheLeadDev Yes! Killed it, right? 💥"
2019-11-08 19:13:22,RT @davidbrunelle: Just watched @spencernorman deliver his first conference talk and he killed it 🙌 https://t.co/GSPfr7U68h
2019-11-08 19:05:48,RT @lara_hogan: LOVE this prompt from @spencernorman: open your 1:1 by asking where your teammate wants to start. B/c it doesn’t assume tha…
2019-11-08 19:05:24,RT @amandamunoz: Loving these prompts for the start of a 1:1 @spencernorman #LeadDevAustin https://t.co/3o08gltunT
2019-11-08 19:01:09,So proud of @spencernorman who just gave an amazing *first* conference talk at @TheLeadDev about crafting effective… https://t.co/DIvUWtEiKR
2019-11-08 18:58:55,Love hearing @spencernorman talk about the importance of kicking off 1:1 meetings with check-ins and sharing some t… https://t.co/78140qMvAH
2019-11-08 15:19:29,@davidbrunelle @spencernorman @TheLeadDev So fun to meet!
2019-11-08 12:09:56,@krwlos1 @TheLeadDev @spencernorman 😀 It’s true that no place tops LA tacos! I’m just taco obsessed! 🌮 I’ll take yo… https://t.co/gcynwwjG7D
2019-11-08 02:56:13,"Got into Austin this afternoon, and I’ve already consumed tacos, queso, and donuts. Good job, me. 🌮🧀🍩"
2019-11-08 00:16:14,@adriennefriend @theavalkyrie @getreaction @jilljubs @spencernorman So kind. Thank you! ❤️
2019-11-07 18:41:57,@_lennart @TheLeadDev @spencernorman Jealous!
2019-11-07 14:59:51,On my way to Austin for @TheLeadDev. So excited to see @spencernorman on the big stage. And breakfast tacos! 🌮
2019-11-05 12:53:24,@davidbrunelle @TheLeadDev 👋 Let’s meet up!
2019-10-28 01:37:21,😍 https://t.co/h29LPajqZt
2019-10-27 16:05:35,Hi from Scottsdale. 👋🌵 https://t.co/1Er1yBD3Al
2019-10-23 04:23:03,Good clouds. Good mountains. Good to be home. ☁️🏔 https://t.co/MbMgLrvmTb
2019-10-21 01:55:36,It was a good night to fly east. https://t.co/vfpURd0rJe
2019-10-20 01:48:04,"@joshuantaylor Hard to say, but likely a high percentage. Really depends on goals of mtg: feedback, a decision, a d… https://t.co/LdAbVbmn2z"
2019-10-20 00:21:19,"@joshuantaylor Recording and sharing out works for some use cases, but some video meetings need to be real time for… https://t.co/grHbgVcPnY"
2019-10-19 23:58:23,"@joshuantaylor Yes! Tons of room to improve. Scheduling, screen sharing, annotating, breakout rooms for big groups,… https://t.co/OpePgIkgjo"
2019-10-10 02:16:57,@schlaf Yes.
2019-10-06 01:41:13,Not the usual beach walk find... https://t.co/atpFwDPptN
2019-09-29 23:35:49,"Read this essay! I'm now looking forward to reading @annawiener's book, Uncanny Valley, in January. https://t.co/h4Eqfvfyvy"
2019-09-25 17:40:31,👀 https://t.co/ME2zK3p6Sz
2019-09-21 21:34:58,"@kennethn Agreed. I recently tried Firewall app which has the ability to pause for this very use case, but I didn’t… https://t.co/5nhWL93KQt"
2019-09-21 21:21:16,Favorite thing so far about iOS 13.0: Settings &gt; Phone &gt; Silence Unknown Callers https://t.co/iKHJ8RhLlK
2019-09-19 23:40:44,Important and informative thoughts from @dries on open source and sustainability. https://t.co/KC0EJnhgkd
2019-09-02 16:45:06,😍 https://t.co/342ueSLLqY
2019-09-02 16:08:04,From where I run. https://t.co/2I4Rgr5ouZ
2019-08-29 18:35:14,"""As the retail experience is becoming more multiplexed, digitally-savvy consumers expect a seamless experience more… https://t.co/ym3oGQfJTW"
2010-09-06 17:44:44,RT @big_picture: Pakistan in need - http://b.globe.com/d8oLa3
2009-08-23 15:08:09,"At the new Etsy office in DUMBO setting up my desk. Music cranking, white boards being installed. Good times!"
2009-07-22 22:53:42,"At Roosevelt Hotel, Mad46 Lounge for NYC Creative Good meetup"
2009-07-22 11:50:45,Love watching the Tour de France. Great memories of being there last year. Go @lancearmstrong! #livestrong #tdf
2008-10-03 16:36:35,"working in my home office, it's time to do some friday filing!"
2008-10-03 12:28:28,"up early, drinking tea, getting ready for yoga"
2008-10-03 03:31:29,watching the maverick Dodgers.
2008-10-03 00:50:58,"yum, just made some spicy sweet potato baked fries."
2008-10-03 00:10:30,installing the obama iphone application!
2008-10-02 17:02:14,Home from a 23 mile ride up Mandeville Canyon. Drinking a protein shake.
2008-10-01 23:22:36,"@foodzie thank you, much appreciated! i just sent an email about the cookies. keep up the great customer service!"
2008-10-01 20:44:34,"Loving the beach today, it's 90+ degrees in Santa Monica."
2008-10-01 02:16:36,missing the cool nights with the ocean fog...
2008-09-30 06:11:55,"When all else fails, reboot."
2008-09-28 14:58:06,Trying to motivate for a run.
2008-09-27 00:52:26,Ready for Obama to kick some butt.
2008-09-27 00:23:00,Cooking with chilies. Eyes are burning and watering. Already flushed with water twice. Good times.
2008-09-26 23:27:12,@bruinrob11 you racing? where is it at? happy friday!
2008-09-26 21:56:53,Looking forward to the debate tonight. I'll be watching on TV and reading election.twitter.com online.
2008-09-26 15:00:19,Mammogram at Santa Monica Breast Center. In and out in 20 minutes! It's almost breast cancer awareness month.
2008-09-26 13:47:57,"Thinks there should be an ""Update All"" button on iPhone for app updates. One by one is too tedious."
2008-09-26 06:19:04,My second favorite team is now OSU (first is UCLA)!
2008-09-26 01:22:16,Pretty much only get the LA Times and NY Times for the crossword puzzles. There's nothing like doing the puzzle on newsprint.
2008-09-25 17:20:51,Looking forward to the season premier of Grey's Anatomy tonight!
2008-09-24 13:28:24,Beach run on the sand. Saying sorry to my legs in advance.
2008-09-24 02:50:59,Reading about (and fascinated by) CERN: http://bit.ly/4dqaQX
2008-09-23 18:19:15,Heading down to the Promenade to meet a friend for lunch at Real Food Daily. Yum.
2008-09-22 16:48:01,"Trying to call official State of CA dept and voice prompt finally said: ""Too many callers are waiting you must call back, good bye"" - FAIL."
2008-09-22 00:12:19,must. eat. sushi.
2008-09-21 12:38:50,Going to yoga class.
2008-09-21 00:36:25,Nothing like a long nap on Saturday!
2008-09-19 04:46:50,"Catching up on ""Iconoclasts"" episodes on Tivo. I love this show. The Tom Ford on Jeff Koons episode was fascinating."
2008-09-18 20:32:50,Finally watched Tina Fey/Amy Poehler as Palin/Clinton on SNL. Brilliant.
2008-09-18 00:12:09,Making chicken noodle soup.
2008-09-14 13:02:52,Loving my early Sunday morning with the Sunday LA Times and NY Times and a cup of tea.
2008-09-13 23:13:05,Anderson Cooper looks like a doofus reporting while standing in water up to his waist.
2008-09-13 22:19:42,"@bruinrob11 9 minutes to go, down by 59 points. ugh. hope you're having a good weekend!"
2008-09-13 22:08:38,Turned on (and then off) the UCLA game. Can't watch them getting killed.
2008-09-13 14:16:13,http://twitpic.com/bdae - Obligatory picture of me on Hicks St. in Brooklyn Heights.
2008-09-12 18:34:46,Doesn't think cab drivers should be allowed to talk on cell phones while driving.
2008-09-12 16:25:00,http://twitpic.com/b84c - Walking across Brooklyn Bridge.
2008-09-12 14:23:38,http://twitpic.com/b7jg - On the Brooklyn Promenade looking at Manhattan.
2008-09-12 11:45:05,"Instead of ""Do not disturb,"" the door knob sign at my hotel says ""Don't even think about it."""
2008-09-12 01:36:18,Walking on Hicks St. in Brooklyn. Feeling at home.
2008-09-11 13:33:46,Feeling like a NYer: Wearing tennis shoes but have office shoes in bag.
2008-09-11 09:49:53,In Brooklyn. Must sleep.
2008-09-10 15:54:07,Walking through the park heading to MOMA on a gorgeous day in NYC.
2008-09-09 23:01:49,Going to see August: Osage County at Music Box Theater on Broadway.
2008-09-09 19:59:06,In the modern art wing of the Metropolitan Museum. Happy!
2008-09-08 11:20:19,"Start spreading the news, I’m leaving today. I want to be a part of it – New York, New York. LAX =&gt; JFK. In NY for the week!"
2008-09-07 23:47:36,"The 11% NV voters that spoke to me: 50% unsure, others split even McCain & Obama. Pretty much a microcosm of the polls: http://bit.ly/4xobb1"
2008-09-07 23:44:11,"Some fascinating stats from my calls to Nevada voters for Obama: 44% not home, 15% refused, 9% wrong #, 11% reached."
2008-09-07 12:38:50,Off to 6am yoga class and then to @BarackObama phone bank to call Nevada voters at 9am. Busy Sunday morning!
2008-09-03 01:21:02,Getting ready for a feast at Mastro's in Beverly Hills
2008-09-02 04:27:19,Just had a massage from a guy named Zolton. Only in the Peoples Republic of Santa Monica...
2008-08-31 17:56:09,http://twitpic.com/9rny - Tomato face at Santa Monica farmer's market
2008-08-26 02:18:36,Watching US Open and DNC. Sports and politics. Life is good.
2008-08-21 17:26:08,http://twitpic.com/8hkk - Cool barn on my ride this morning.
2008-08-21 17:06:22,http://twitpic.com/8hhc - Cool barn on my ride this morning.
2008-08-21 17:01:41,http://twitpic.com/8hg8 - Cool barn on my ride this morning.
2008-08-21 16:37:57,http://twitpic.com/8hcl - Cool barn on my ride this morning.
2008-08-19 18:20:47,"Bluetooth headset didn't survive trip in washer AND dryer. Oops, guess putting in pocket was bad idea. Shit."
2008-08-18 02:17:27,http://twitpic.com/84ls - Homemade Poptarts!
2008-08-16 01:34:50,Going to get a deep tissue massage after a brutally tough week. I'm hoping it erases some of the week.
2008-08-12 03:34:59,"Just watched ""The Last Lecture"" after finishing the book over the weekend. Incredible! Wow! http://tinyurl.com/2z3wsx"
2008-08-10 00:33:15,eating chocolate covered espresso beans. yum.
2008-08-09 16:56:33,trying to motivate for my ride. thinking that i'll go get peet's coffee first.
2008-08-09 03:23:55,"watching olympics cycling - men's road race. live commentary about weather: ""it is a miserable day to race a bicycle."""
2008-08-09 02:45:52,"forgive me, twitter, for i have sinned, it has been 3 months since my last tweet..."
2008-04-28 14:02:40,All dressed and ready for a bike ride but have a flat tire and don't want to change the tube right now. I think I'll run today instead.
2008-04-25 16:49:23,"@andrewhyde ""This is a marathon, not a sprint."""
2008-04-25 13:38:44,My dog is being a picky eater.
2008-04-25 02:46:10,Waiting not so patiently for Grey's Anatomy.
2008-04-24 18:50:38,"Turkish Embassy is in my building. Today is anniversary of Armenian genocide. Protest starting, our street is closing. Loving LA’s diver ..."
2008-04-23 17:49:32,All coffee machines are out of service in our entire office. WTF? Productivity is spiraling.
2008-04-23 16:39:18,"@robsnell Welcome to Twitter, nice to catch back up with you! Thanks for the Dummies shout out, I saw it!"
2008-04-23 12:46:25,Drinking coffee before heading out for a trail run.
2008-04-21 15:59:35,"@andrewhyde I agree! I think we can recycle them, not sure about exchange. Worth investigating. You win with 12+, I have 8!"
2008-04-21 14:26:43,Tossing out my old Nalgene bottles. http://tinyurl.com/5x9jvx
2008-04-20 14:55:46,Looking forward to the Sunday Crossword but first a 50 mile ride.
2008-04-19 20:22:12,@andrewhyde a very belated congrats on the new gig. sounds awesome!
2008-04-19 20:19:24,@jduvall that's cool! although i have to say that i have mixed views on tech patents nowadays...
2008-04-19 15:51:52,Just ordered some insoles for some shoes. The insoles were more expensive than the shoes. Something is wrong.
2008-04-15 00:12:37,Doing my about weekly forced reboot of my Blackberry. Why does it always happen when I need to use it most?
2008-04-11 23:28:50,Finally doing my expense report. One receipt is almost 10 months old. Oops.
2008-04-11 22:23:40,80+ degrees. What's not to love?
2008-04-08 21:20:36,"Red, itchy, burning eyes today. Must be allergies or too much Excel. Eye drops are my friend."
2008-04-08 15:34:15,Went to a NCAA basketball site to find out time of women's national championship game tonight. No mention at all on first page. That sucks.
2008-04-05 14:42:53,Chocolate chip pancakes before a ride are a beautiful thing.
2008-04-04 18:41:20,Heading to Westwood for lunch. Go Bruins!
2008-04-03 20:52:23,Power Point is evil. I'm spending way too much time on formatting instead of content. That needs to change.
2008-03-31 17:45:45,Really need to do my taxes...
2008-03-28 19:12:12,Driving to San Diego for the weekend.
2008-03-27 16:50:38,Worked out with new bike coach this morning. Everything hurts.
2008-03-25 20:16:06,Just ate the worlds largest burrito for lunch. I'm not kidding.
2008-03-25 16:53:40,The new Yahoo! home page with the logo in the center seems like a waste of space.
2008-03-25 13:37:31,Going surfing!
2008-03-25 13:22:13,Researching new bide pedal options.
2008-03-24 23:56:26,Way too much time with Excel today. My eyes hurt.
2008-03-24 00:49:02,Getting ready to make my first ever souffle.
2008-03-21 21:48:52,My weekend is about to begin. YeeHaa!
2008-03-21 02:12:40,Poor USC. Not.
2008-03-20 16:26:26,Kind of have a feather thing going on with my hair today. Groovy.
2008-03-19 15:29:42,Lots of traffic today.
2008-03-18 16:41:13,On hold with State of California Franchise Tax Board. The hold music sucks.
2008-03-17 23:41:47,Whoever invented jasmine pearl green tea was thinking.
2008-03-17 23:07:32,"beautiful day in Los Angeles, great views from the office to the ocean, downtown, hills. nothing like a little wind to blow out the smog."
2008-03-17 17:10:23,At the vet with Lola.
2008-03-17 16:35:32,At war with the ants in my kitchen.
2008-03-16 00:17:20,Bruins are giving me high blood pressure.
2008-03-15 13:35:08,"Ahhh, 9 hours of sleep!"
2008-03-13 21:48:57,Go Bruins!
2008-03-13 15:19:58,"Roofers are at my house putting on a new roof, it's loud."
2008-03-09 14:44:20,"forgot to change clocks, missed yoga class. oh well."
2008-03-09 01:40:14,Bruins are crazy lucky!
2008-03-07 16:37:07,Still happy about the Bruin game last night.
2008-03-07 05:30:46,Sat through 3 poorly formatted Powerpoint presentations today.
2008-03-07 04:15:14,Come on Bruins!
2008-03-05 17:02:43,I love it when I put on a pair of pants and find money in the pocket!
2008-03-05 16:42:06,"Back from 25 mile ride, now the mad scramble to get to work."
2008-03-05 04:37:01,Loving the CNN mapping screen.
2008-03-05 03:34:20,Cooking some goodness - chicken mushroom marsala with sweet potato wedges. Yum.
2008-03-04 22:24:57,"I am powerless over shopping on Amazon and my life has become full of books, fun gadgets, and other stuff."
2008-03-04 14:39:09,Walking my sweet dog.
2008-03-03 17:11:16,9am conference calls on a Monday morning end the weekend quickly. Sigh.
2008-03-01 20:10:56,40 mile ride. Check. Huge burger. Check. Chiropractor. Next. Nap. Soon.
2008-02-29 23:08:20,"Ahhhh, meeting free for the rest of the day. Bring on the weekend!"
2008-02-27 22:07:20,"@jduvall I miss our afternoon chai breaks! Funny enough though, I had green tea today, too! :)"
2008-02-27 18:22:15,Using GOOG spreadsheets for first time and finding it to be ultra annoying.
2008-02-27 13:57:03,"eating oatmeal, trying to motivate for a bike ride"
2008-02-26 21:09:48,"The microwave at my office is the grossest thing ever, it wins the ""dirtiest start-up microwave"" award."
2008-02-25 17:49:49,coffee is my friend today.
2008-02-25 09:39:47,can't sleep.
2008-02-25 03:19:27,"geez, i keep catching up to the live oscars with my tivo"
2008-02-24 16:34:24,There's a double rainbow in P.S.!
2008-02-23 05:04:21,You know it's a deep massage when your masseuse tells you to take a pain reliever when you get home.
2008-02-22 22:08:03,counting the hours until I head out to Palm Springs for the weekend
2008-02-21 02:57:28,Lunar eclipse! Wow!
2008-02-20 16:21:53,Rain and LA drivers don't mix.
2008-02-19 18:07:04,"my body is in a meeting, my mind is still in the weekend."
2008-02-19 16:10:21,wishing it was a 4-day weekend
2008-02-19 00:28:35,"kind of embarrassed to admit that I like Fergie's ""Big Girls Don't Cry"" song..."
2008-02-18 22:45:43,Helping my Aunt buy a new Mac. She's still using Eudora. Wowza.
2008-02-18 21:03:39,best thing about riding 32 miles this morning is the lunch I just got to eat.
2008-02-18 18:58:07,why is it that no matter how many times I do it I often try to put the USB plug in upside down?
2008-02-18 15:25:29,Riding my bike up Mandeville.
2008-02-17 19:33:57,At the Bob Dylan exhibit at the Skirball. Awesome!
2008-02-17 13:21:22,"Scanning my blog reader, drinking coffee, heading to yoga soon."
2008-02-17 00:44:45,Getting ready to take Lola on a walk.
2008-02-16 21:23:19,It's almost nap time. Can't wait.
2008-02-16 13:07:59,Up way too early for a Saturday morning.
2008-02-15 21:45:33,In next to last meeting of the day. WooHoo!
2008-02-15 19:04:52,"I sure do need this 3-day weekend, it's been a long week."
2008-02-15 13:20:27,"Yawn... eating some Kashi cereal, getting ready to go to meet my trainer at the gym."
2008-02-14 23:06:38,I'm tempted to eat some conversation hearts but think I'll pass since they seem to taste like flavored chalk.
2008-02-14 20:54:47,"Burrito for lunch at Chipotle in Beverly Center, this mall is ancient and it shows."
2008-02-14 18:34:07,"Slept instead of working out, yesterday was a long day. Must have been wishful thinking about Lost last night! Hope my valentine wants t ..."
2008-02-14 04:20:27,"Good thing this plane has brakes, that was a rough landing! Back in LA, just in time to watch Lost."
2008-02-13 17:24:31,Airports in the U.S. are a mess...
2008-02-13 17:16:15,"In security line at LAX, heading to OAK on SWA for the day. Line is moving fast. Nice!"
2008-02-06 03:45:34,Just voted in my neighbor's garage!
2008-02-04 02:16:17,Nachos and Superbowl. Life is good.
2008-02-03 15:52:30,"Easy like a Sunday morning... It's raining, heading to spin at YAS."
2008-02-02 20:17:06,Getting a burrito at Holy Guacamole and then eating it on the beach. Gotta love LA in February.
2008-01-25 22:26:34,It's Friday afternoon and I'm tired and needing a latte.
