timestamp,tweet_text
,I love books and coffee. And I may have a little obsession with cats.,
2019-11-12 23:44:15,"On page 246 of 448 of The Beautiful, by Renée Ahdieh https://t.co/WR0nQfjS7v"
2019-11-11 23:24:58,"On page 220 of 349 of End of Eden, by S.L. Jennings https://t.co/LD2YK69guN"
2019-11-09 17:59:34,I read Lucky Caller by Emma Mills https://t.co/s1a4mfvayS
2019-11-08 18:58:04,Marked as tbr-unreleased: Hunted by the Sky by Tanaz Bhathena https://t.co/CFUNLUHAiP
2019-11-07 00:01:55,"On page 168 of 336 of Lucky Caller, by Emma Mills https://t.co/EEPQgi2mhP"
2019-11-06 10:06:13,Marked as tbr-unreleased: The Raven and the Dove by Kaitlyn Davis https://t.co/1au4YemCTs
2019-11-05 15:50:04,Marked as tbr-unreleased: Unravel the Dusk by Elizabeth Lim https://t.co/MTxsYhJPOr
2019-11-02 22:41:43,5 of 5 stars to Sorcery of Thorns by Margaret Rogerson https://t.co/5NS3Y0KHEh
2019-11-02 19:25:33,Here’s my #BookReview of Sorcery of Thorns by Margaret Rogerson. #bookblog #bookblogger #amreading #yalit… https://t.co/MApiUHMJIO
2019-11-02 11:22:53,"Starting Wicked, by Jennifer L. Armentrout: Re-read time because I’m the worst at rememb... https://t.co/Tf05YLtPKa"
2019-10-31 23:16:51,"On page 230 of 420 of Nightshade (Redemption), by Molly McAdams https://t.co/WyoNJRJ2B4"
2019-10-31 19:28:32,5 of 5 stars to The Last Magician by Lisa Maxwell https://t.co/SeDvcA71ct
2019-10-31 19:20:31,Here’s my #BookReview of The Last Magician by Lisa Maxwell. #bookblog #bookblogger #amreading #yalit… https://t.co/3flrnkePq3
2019-10-31 08:44:55,4 of 5 stars to Blood Heir by Amélie Wen Zhao https://t.co/ZR2nDRUvGs
2019-10-30 20:47:26,Marked as tbr-unreleased: The Guinevere Deception by Kiersten White https://t.co/ih2VeysoZV
2019-10-30 19:32:47,Here’s my #BookReview of Blood Heir by Amelie Wen Zhao. #bookblog #bookblogger #amreading #yalit #arc #arcreview… https://t.co/pHcqVbVAcq
2019-10-30 17:50:51,Marked as tbr-unreleased: Where Dreams Descend by Janella Angeles https://t.co/B7rcbsIqFn
2019-10-29 19:23:58,Here's this week's #T5T topic: Favorite Books With Creepy Atmospheres! #bookblog #bookblogger #amreading #yalit… https://t.co/EYm6pHLk2x
2019-10-28 22:51:48,"On page 150 of 328 of Dirty Headlines, by L.J. Shen https://t.co/ZCCWDPNhCn"
2019-10-27 20:12:23,4 of 5 stars to Fireborne by Rosaria Munda https://t.co/WaQRA8Z8No
2019-10-27 19:21:11,Here's my #BookReview of Crown of Oblivion by Julie Eshbaugh. #bookblog #bookblogger #amreading #yalit #arc… https://t.co/E3XlwqRw6t
2019-10-26 18:25:24,Here's my #BookReview of Fireborne by Rosaria Munda. #bookblog #bookblogger #amreading #yalit #arc #arcreview… https://t.co/4SzLy6AYxo
2019-10-24 22:02:51,"On page 249 of 354 of The Bridge Kingdom, by Danielle L. Jensen https://t.co/dRlrqT8TVi"
2019-10-24 18:46:21,5 of 5 stars to A Heart So Fierce and Broken by Brigid Kemmerer https://t.co/PxTe897zxc
2019-10-24 18:29:35,Here's my #BookReview of A Heart so Fierce and Broken by Brigid Kemmerer. #bookblog #bookblogger #amreading #yalit… https://t.co/629kyalPn4
2019-10-22 22:14:59,"On page 212 of 458 of Ninth House, by Leigh Bardugo: Things are starting to become more ... https://t.co/eLR2BxzYZh"
2019-10-22 18:26:39,Here's this week's #T5T topic: Audiobooks I’d Give a Try. #bookblog #bookblogger #amreading #yalit… https://t.co/y4YEx02l3r
2019-10-22 12:31:21,Marked as tbr-unreleased: Ever Cursed by Corey Ann Haydu https://t.co/lYXBG3kXnA
2019-10-21 19:54:31,"On page 162 of 316 of Anna Dressed in Blood, by Kendare Blake https://t.co/g8vGotQo6J"
2019-10-21 18:26:11,Summer Book Haul! #bookblog #bookblogger #amreading #yalit #bookhaul #haul https://t.co/v8idNahQir https://t.co/UkqOFuLqrR
2019-10-21 10:01:13,I read Crown of Oblivion by Julie Eshbaugh https://t.co/BTdtydOsBi
2019-10-21 09:30:30,3 of 5 stars to Song of the Crimson Flower by Julie C. Dao https://t.co/ZPkYzmdmXd
2019-10-21 07:47:15,"On page 360 of 480 of Crown of Oblivion, by Julie Eshbaugh https://t.co/7CNwy9lU4C"
2019-10-20 18:24:33,Here's my #BookReview of Song of the Crimson Flower by Julie C. Dao. #bookblog #bookblogger #amreading #yalit #arc… https://t.co/eFSVDdix6V
2019-10-18 21:47:13,"On page 103 of 354 of The Bridge Kingdom, by Danielle L. Jensen https://t.co/UqEtXkB2ro"
2019-10-18 18:21:57,Books to Take To a Haunted House | Spooky Book Recommendations #bookblog #bookblogger #amreading #yalit… https://t.co/aXI0NlDCq6
2019-10-17 19:28:35,"On page 180 of 304 of The Girl from the Well, by Rin Chupeco https://t.co/QFexsfwcCb"
2019-10-17 15:35:53,Marked as tbr-unreleased: Well Played by Jen DeLuca https://t.co/t1EkMl5Eif
2019-10-16 22:08:48,"On page 346 of The Ruthless Boys, by C.M. Stunich https://t.co/gmJQ5gdfYl"
2019-10-16 18:21:55,Here's my August Wrap Up! #bookblog #bookblogger #amreading #yalit #wrapup https://t.co/hspI12CkjD https://t.co/OsKIcVNvSL
2019-10-16 17:32:09,Marked as tbr-unreleased: The Seventh Sun by Lani Forbes https://t.co/xSkuKiFCrb
2019-10-15 10:57:03,"On page 109 of 352 of The Bone Houses, by Emily Lloyd-Jones https://t.co/JYAZoGR00e"
2019-10-14 19:26:38,2 of 5 stars to Wicked Fox by Kat Cho https://t.co/KQFA0DCedb
2019-10-14 18:25:02,Here's my July Wrap Up! #bookblog #bookblogger #amreading #yalit #wrapup https://t.co/GpXYqGcu9D https://t.co/1pkSQVO984
2019-10-14 15:31:18,Marked as tbr-unreleased: She Was and She Was Not by Melissa Bashardoust https://t.co/NXs1bUlxuE
2019-10-14 09:29:22,"On page 129 of 308 of The Air He Breathes, by Brittainy C. Cherry: Don’t worry Emma, tho... https://t.co/6EMM3k8VIl"
2019-10-12 21:11:13,I read Blood Countess by Lana Popović https://t.co/FySBLAXNxG
2019-10-12 16:42:52,Marked as tbr-unreleased: The Crow Rider by Kalyn Josephson https://t.co/IEGidoyxmb
2019-10-11 20:14:12,Marked as tbr-unreleased: The Betrothed by Kiera Cass https://t.co/6o5LRF4cyy
2019-10-11 18:24:35,Here's my October TBR! #bookblog #bookblogger #amreading #yalit #tbr https://t.co/bhXT5nKBKE https://t.co/peVfx5KpH6
2019-10-11 09:19:46,Marked as tbr-unreleased: The Midnight Lie by Marie Rutkoski https://t.co/CRdWH0AsxX
2019-10-09 20:37:58,2 of 5 stars to Wild and Crooked by Leah Thomas https://t.co/VTcOgAZokd
2019-10-09 18:32:08,Here's my June Wrap Up! #bookblog #bookblogger #amreading #yalit #wrapup https://t.co/0rrOWGCJlS https://t.co/3sntsJ3fLZ
2019-10-09 15:36:04,Marked as tbr-unreleased: Blood Countess by Lana Popović https://t.co/FySBLAXNxG
2019-10-08 22:05:03,"On page 198 of 390 of Vein Of Love, by R. Scarlett https://t.co/z8yQKZsXvY"
2019-10-07 18:24:49,Here're my Most Anticipated October Releases! #bookblog #bookblogger #amreading #yalit #newreleases… https://t.co/2o6CEuwUwj
2019-10-07 11:16:55,"On page 109 of 352 of The Bone Houses, by Emily Lloyd-Jones https://t.co/4P5X72RHAM"
2019-10-06 11:52:30,I read Dark and Deepest Red by Anna-Marie McLemore https://t.co/Y4r6LeklGd
2019-10-04 15:01:44,I read A Heart So Fierce and Broken by Brigid Kemmerer https://t.co/PxTe897zxc
2019-10-04 13:53:12,Marked as tbr-unreleased: The Ballad of Songbirds and Snakes by Suzanne Collins https://t.co/i455JJ4RoT
2019-10-03 21:34:12,"On page 158 of 320 of Dark and Deepest Red, by Anna-Marie McLemore https://t.co/1FYNP88m9C"
2019-10-03 18:59:47,Marked as tbr-unreleased: Forest of Souls by Lori M. Lee https://t.co/zpNl99CnzZ
2019-10-03 12:01:33,"On page 236 of 464 of A Heart So Fierce and, by Brigid Kemmerer: My lil’ baby bean Grey.... https://t.co/Wnl9WKe340"
2019-10-01 21:50:20,I read The Map from Here to There by Emery Lord https://t.co/PKmNdRGxLy
2019-10-01 15:14:25,"On page 301 of 464 of Blood Heir, by Amélie Wen Zhao https://t.co/OIyOeCoO92"
2019-09-30 19:04:43,Marked as tbr-unreleased: You Deserve Each Other by Sarah Hogle https://t.co/3BTeuRSMo2
2019-09-29 21:35:18,4 of 5 stars to Find Me Their Bones by Sara Wolf https://t.co/O0YSZxKUit
2019-09-29 18:41:15,Here's my #BookReview of Find Me Their Bones by Sara Wolf. #bookblog #bookblogger #amreading #yalit #arc #arcreview… https://t.co/7tFBj4Z0bY
2019-09-29 09:54:46,I read A Constellation of Roses by Miranda Asebedo https://t.co/s3Uoy99u3v
2019-09-28 22:42:19,"On page 237 of 480 of His Hideous Heart, by Dahlia Adler https://t.co/6veRSKqEv3"
2019-09-28 20:48:59,"On page 240 of 336 of A Constellation of Roses, by Miranda Asebedo https://t.co/pK7xlKAkxO"
2019-09-28 18:34:38,2 of 5 stars to Songs from the Deep by Kelly Powell https://t.co/krv2snj9dl
2019-09-28 18:29:17,Here's my #BookReview of Songs From the Deep by Kerry. #bookblog #bookblogger #amreading #yalit #arc #arcreview… https://t.co/YkWALmPndQ
2019-09-27 21:31:58,"On page 309 of 376 of The Start of Me and You, by Emery Lord https://t.co/pC17yARs3U"
2019-09-27 18:22:14,Prepping for Fall: Books With Schools/ Boarding Schools | Book Recommendations. #bookblog #bookblogger #amreading… https://t.co/GJO2V4f0KX
2019-09-26 22:14:18,"On page 40 of 336 of A Constellation of Roses, by Miranda Asebedo https://t.co/ncngwZlRVe"
2019-09-26 21:06:23,"On page 154 of 376 of The Start of Me and You, by Emery Lord https://t.co/IjJLuSGLtj"
2019-09-26 18:29:35,4 of 5 stars to Sisters of Shadow and Light by Sara B. Larson https://t.co/VKrHJfp3SG
2019-09-26 18:24:49,Here's my #BookReview of Sisters of Shadow and Light by Sarah B. Larson. #bookblog #bookblogger #amreading #yalit… https://t.co/UIEwHWhZOV
2019-09-26 13:19:37,"On page 75 of 480 of His Hideous Heart, by Dahlia Adler https://t.co/GagBEXRMLu"
2019-09-25 22:01:05,I read Would Like to Meet by Rachel Winters https://t.co/8Q27hjKwNM
2019-09-25 18:37:32,4 of 5 stars to Into the Crooked Place by Alexandra Christo https://t.co/hvlmsrcR08
2019-09-25 18:20:42,Here's my #BookReview of Into the Crooked Place by Alexandra Christo. #bookblog #bookblogger #amreading #yalit #arc… https://t.co/pM3Jx8hM6W
2019-09-25 15:47:52,"On page 239 of 368 of Would Like to Meet, by Rachel Winters https://t.co/txS26WQLCn"
2019-09-25 11:25:32,"On page 297 of 395 of The Disappearance of Sloane Sullivan, by Gia Cribbs https://t.co/CWedF86Onh"
2019-09-24 22:19:02,"On page 122 of 368 of Would Like to Meet, by Rachel Winters https://t.co/KSw0BmPqrO"
2019-09-24 20:28:35,3 of 5 stars to The Harp of Kings by Juliet Marillier https://t.co/JQhqxbJReq
2019-09-24 20:22:47,Here's my #BookReview of The Harp of Lings by Juliet Marillier. #bookblog #bookblogger #amreading #yalit #arc… https://t.co/NnlUfkF82Z
2019-09-24 16:18:11,Here's this week's #T5T topic: Fall Reading Mini Recommendations. #bookblog #bookblogger #amreading #yalit… https://t.co/MVzIKnSlMW
2019-09-24 15:16:46,"I read Get a Life, Chloe Brown by Talia Hibbert https://t.co/sIkPP4VNXr"
2019-09-24 13:45:11,"On page 201 of 395 of The Disappearance of Sloane Sullivan, by Gia Cribbs https://t.co/xKenRtdauV"
2019-09-24 10:42:43,I read Capturing the Devil by Kerri Maniscalco https://t.co/k49PmHPssI
2019-09-23 22:28:34,"On page 105 of 395 of The Disappearance of Sloane Sullivan, by Gia Cribbs https://t.co/b91hMTbvXn"
2019-09-23 20:25:31,"On page 299 of 453 of Capturing the Devil, by Kerri Maniscalco https://t.co/Qe8j4n9yN3"
2019-09-23 13:38:39,"On page 248 of 384 of Get a Life, Chloe Brown, by Talia Hibbert: This is so freaking cut... https://t.co/Wdgfx4aC2b"
2019-09-22 12:43:33,"On page 151 of 453 of Capturing the Devil, by Kerri Maniscalco: Excuse me... WHAT! https://t.co/zAYAjs0O47"
2019-09-20 22:28:46,I read Dangerous Alliance by Jennieke Cohen https://t.co/GFh1ZLt7rk
2019-09-20 17:48:00,I read Crooked Kingdom by Leigh Bardugo https://t.co/xt5shtmseu
2019-09-19 22:23:59,"On page 146 of 448 of Dangerous Alliance, by Jennieke Cohen https://t.co/pTGqP0kHHm"
2019-09-19 08:42:36,5 of 5 stars to The Bear and the Nightingale by Katherine Arden https://t.co/fF9d7T8CM5
2019-09-18 22:42:14,I read Fireborne by Rosaria Munda https://t.co/WaQRA8Z8No
2019-09-18 20:52:16,"On page 290 of 404 of Cruel Prince, by Ashley Jade https://t.co/JLPfRXEk5I"
2019-09-18 13:34:37,I read Deadly Little Scandals by Jennifer Lynn Barnes https://t.co/86UG2IbZbQ
2019-09-18 10:56:02,"On page 370 of 496 of A Curse So Dark and Lonely, by Brigid Kemmerer https://t.co/eZ3NI0zs6Y"
2019-09-17 22:35:59,"On page 255 of 448 of Fireborne, by Rosaria Munda https://t.co/vbqwMgQbNY"
2019-09-17 21:21:31,"On page 107 of Cruel Prince, by Ashley Jade https://t.co/PIjXBOIJ7s"
2019-09-17 15:42:03,"On page 231 of 352 of Deadly Little Scandals, by Jennifer Lynn Barnes https://t.co/hJsJ59sDsi"
2019-09-17 13:03:23,"On page 265 of 496 of A Curse So Dark and Lonely, by Brigid Kemmerer https://t.co/gyKO3NLxR4"
2019-09-16 22:41:49,"On page 108 of 352 of Deadly Little Scandals, by Jennifer Lynn Barnes https://t.co/lS0nRtYAkS"
2019-09-16 12:35:10,"On page 151 of 496 of A Curse So Dark and Lonely, by Brigid Kemmerer https://t.co/OXBckKyCvZ"
2019-09-15 22:45:56,"On page 140 of 448 of Fireborne, by Rosaria Munda https://t.co/9r3sQJiwVf"
2019-09-15 19:55:12,5 of 5 stars to Sorcery of Thorns by Margaret Rogerson https://t.co/5NS3Y0KHEh
2019-09-15 18:22:48,Here's my #BookReview of Beyond the Black Door by A.M. Strickland! #bookblog #bookblogger #amreading #yalit #arc… https://t.co/QBPMizSA4c
2019-09-15 17:50:28,4 of 5 stars to Little White Lies by Jennifer Lynn Barnes https://t.co/UuuBXUc3oV
2019-09-14 22:33:25,"On page 181 of 328 of Dollars, by Pepper Winters https://t.co/CRd0a18K2N"
2019-09-14 19:36:06,4 of 5 stars to The Burning Shadow by Jennifer L. Armentrout https://t.co/Bnug3mJsil
2019-09-14 18:26:08,Here's my #BookReview of The Burning Shadow by Jennifer L. Armentrout! #bookblog #bookblogger #amreading #yalit… https://t.co/OAgVB9LT21
2019-09-13 18:23:04,Here's my September TBR! #bookblog #bookblogger #amreading #yalit #tbr https://t.co/ZMeiRau6CK https://t.co/6AP5w9orey
2019-09-12 19:08:52,4 of 5 stars to Shadow Frost by Coco Ma https://t.co/paqI10sG33
2019-09-12 18:25:07,Here's my #BookReview of Shadow Frost by Coco Ma! #bookblog #bookblogger #amreading #yalit #arc #arcreview… https://t.co/MDCXRQJz0u
2019-09-12 17:00:39,"On page 356 of 456 of Sorcery of Thorns, by Margaret Rogerson https://t.co/1JrBxNoe7M"
2019-09-12 12:34:03,"On page 283 of 456 of Sorcery of Thorns, by Margaret Rogerson: Nathaniel nodded. “If you... https://t.co/YpelhcEKb8"
2019-09-12 10:34:55,I read Song of the Crimson Flower by Julie C. Dao https://t.co/ZPkYzmdmXd
2019-09-11 21:41:53,"On page 155 of 288 of Song of the Crimson Flower, by Julie C. Dao https://t.co/YQa2JykMFF"
2019-09-11 18:25:09,5 of 5 stars to Crier's War by Nina Varela https://t.co/bacsce8L6h
2019-09-11 18:21:07,Here's my #BookReview of Crier’s War by Nina Varela! #bookblog #bookblogger #amreading #yalit #arc #arcreview… https://t.co/iXIbqh4noY
2019-09-11 16:53:54,"On page 256 of 456 of Sorcery of Thorns, by Margaret Rogerson: I’m so in love with this ... https://t.co/3wCcJYKhGu"
2019-09-11 16:20:40,Marked as tbr-unreleased: Be Not Far from Me by Mindy McGinnis https://t.co/4DEecWaPbt
2019-09-10 18:25:50,Here's this week's #T5T topic: Favorite 2019 Covers! #bookblog #bookblogger #amreading #yalit #top5tuesday #top5… https://t.co/sWyHU60LfF
2019-09-10 10:28:02,"On page 231 of 368 of Inked Armor, by Helena Hunting https://t.co/iMsDVS3ecx"
2019-09-10 08:56:57,Marked as tbr-unreleased: Serpent &amp; Dove #2 by Shelby Mahurin https://t.co/HpU5LKGsfC
2019-09-09 21:54:49,Marked as tbr-unreleased: Little Universes by Heather Demetrios https://t.co/asrl2otvsc
2019-09-09 21:13:03,I read Sisters of Shadow and Light by Sara B. Larson https://t.co/VKrHJfp3SG
2019-09-09 18:20:54,Here're my Most Anticipated September Releases! #bookblog #bookblogger #amreading #yalit #newreleases… https://t.co/rgnXpvNrwZ
2019-09-09 10:20:21,"On page 128 of 368 of Inked Armor, by Helena Hunting https://t.co/DpbYZ72meT"
2019-09-08 20:50:42,4 of 5 stars to Twice in a Blue Moon by Christina Lauren https://t.co/CjgTPyIjFC
2019-09-08 20:30:33,Here's my #BookReview of Twice In a Blue Moon by Christina Lauren! #bookblog #bookblogger #amreading #yalit… https://t.co/mVPLMrc6GK
2019-09-08 18:29:30,3 of 5 stars to Now Entering Addamsville by Francesca Zappia https://t.co/heqfsE9rnV
2019-09-08 18:24:44,Here's my #BookReview of Now Entering Addamsville by Francesca Zappia! #bookblog #bookblogger #amreading #arc… https://t.co/nMOA9ryJoU
2019-09-07 23:16:33,"On page 118 of 368 of Sisters of Shadow and Light, by Sara B. Larson https://t.co/RnwKsx0zx8"
2019-09-07 18:53:50,"On page 406 of 518 of Traitor to the Throne, by Alwyn Hamilton https://t.co/bU0077XcTU"
2019-09-07 18:38:27,Here's my #BookReview of The Tenth Girl by Sara Faring! #bookblog #bookblogger #amreading #yalit #arcreview #arc… https://t.co/Jl6G6OIWYY
2019-09-06 08:40:04,"On page 275 of 391 of Clipped Wings, by Helena Hunting https://t.co/UCmwnaXptc"
2019-09-05 22:21:30,I read Find Me Their Bones by Sara Wolf https://t.co/O0YSZxKUit
2019-09-05 10:04:08,"On page 182 of 391 of Clipped Wings, by Helena Hunting https://t.co/4TLp3cKVQn"
2019-09-04 22:08:18,I read The Harp of Kings by Juliet Marillier https://t.co/JQhqxbJReq
2019-09-04 11:22:32,"On page 271 of 518 of Traitor to the Throne, by Alwyn Hamilton https://t.co/Rrb4dv2ufY"
2019-09-03 23:02:21,"On page 271 of 464 of The Harp of Kings, by Juliet Marillier https://t.co/R0rms2zuC2"
2019-09-03 20:25:37,"On page 150 of 518 of Traitor to the Throne, by Alwyn Hamilton https://t.co/qmP9kALh6Z"
2019-09-03 17:29:39,Here's this week's #T5T topic: Series I Need to Finish &amp; Catch On! #bookblog #bookblogger #amreading #yalit #top5… https://t.co/MxODhStqFR
2019-09-02 22:30:42,"On page 138 of 464 of The Harp of Kings, by Juliet Marillier https://t.co/7cCcqdEuBu"
2019-08-30 22:45:12,"On page 74 of 367 of Broken Knight, by L.J. Shen https://t.co/8a7hxkJood"
2019-08-30 18:25:22,I read Songs from the Deep by Kelly Powell https://t.co/krv2snj9dl
2019-08-30 11:47:36,"On page 499 of 512 of The Last Magician, by Lisa Maxwell: I cannot begin to express how ... https://t.co/1cf3KhFvky"
2019-08-30 09:42:49,Marked as tbr-unreleased: Deadly Little Scandals by Jennifer Lynn Barnes https://t.co/86UG2IbZbQ
2019-08-29 14:46:33,"On page 435 of 512 of The Last Magician, by Lisa Maxwell https://t.co/fiEzAcOI54"
2019-08-28 22:09:27,"On page 82 of 304 of Songs from the Deep, by Kelly Powell https://t.co/MnJVR1wbQ4"
2019-08-28 17:26:14,Marked as tbr-unreleased: KINGDOM OF THE WICKED by Kerri Maniscalco https://t.co/WeOyNWVUEK
2019-08-28 14:45:40,I read Beyond the Black Door by A.M. Strickland https://t.co/EZUc7OmM1D
2019-08-28 13:52:31,"On page 323 of 512 of The Last Magician, by Lisa Maxwell: JUST STOP TALKING AND MAKE UP ... https://t.co/lrT0P2eYeN"
2019-08-27 22:40:19,"On page 318 of 400 of Beyond the Black Door, by A.M. Strickland https://t.co/6OS9BEIT2Z"
2019-08-27 14:41:36,"On page 228 of 512 of The Last Magician, by Lisa Maxwell https://t.co/8ZTlOrQRMq"
2019-08-27 13:51:23,Marked as tbr-unreleased: The Harp of Kings by Juliet Marillier https://t.co/JQhqxbJReq
2019-08-26 22:27:24,"On page 145 of 400 of Beyond the Black Door, by A.M. Strickland https://t.co/BoqsE1eYUO"
2019-08-26 15:14:04,"On page 125 of 512 of The Last Magician, by Lisa Maxwell https://t.co/eM2rUkbzKc"
2019-08-26 10:34:43,"On page 165 of 354 of The Near Witch, by Victoria Schwab https://t.co/KbnkzuKbQH"
2019-08-25 20:02:18,I read All the Things We Do in the Dark by Saundra Mitchell https://t.co/KUEYPhHi3R
2019-08-25 13:43:13,"On page 84 of 354 of The Near Witch, by Victoria Schwab https://t.co/7jJNizqH4e"
2019-08-24 22:39:22,"On page 125 of 304 of All the Things We Do in the Dark, by Saundra Mitchell https://t.co/Glzo4niIfK"
2019-08-24 20:20:45,3 of 5 stars to Tiger Queen by Annie Sullivan https://t.co/a1Pf8mgopk
2019-08-24 19:35:03,Here's my #BookReview of Tiger Queen by Annie Sullivan! #bookblog #bookblogger #amreading #yalit #arc #arcreview… https://t.co/n9bkRDNbM7
2019-08-24 15:24:02,I read The Never Tilting World by Rin Chupeco https://t.co/augFdZOIzK
2019-08-24 12:17:34,"On page 245 of 368 of If We Were Villains, by M.L. Rio https://t.co/4OcHjiO4KX"
2019-08-23 22:56:06,"On page 203 of 400 of The Never Tilting World, by Rin Chupeco https://t.co/Oyltty8lpK"
2019-08-23 19:25:24,4 of 5 stars to Well Met by Jen DeLuca https://t.co/E2zlKdExU6
2019-08-23 19:21:50,Here's my #BookReview of Well Met by Jen Deluca! #bookblog #bookblogger #amreading #yalit #arc #arcreview… https://t.co/2u1FmXUB11
2019-08-23 14:33:02,"On page 165 of 368 of If We Were Villains, by M.L. Rio: I’m so in love with this book https://t.co/wo3BV7xY4S"
2019-08-23 09:39:05,"On page 305 of 391 of An Affair of Poisons, by Addie Thorley https://t.co/LySLoyKGme"
2019-08-22 22:27:38,"On page 90 of 400 of The Never Tilting World, by Rin Chupeco https://t.co/xKbh3qlpEc"
2019-08-22 18:21:21,Here's my #BookReview of There Will Come a Darkness by Katy Rose Pool! #bookblog #bookblogger #amreading #yalit… https://t.co/segdRkdb3V
2019-08-22 16:48:39,Marked as tbr-unreleased: Ruthless Gods by Emily A. Duncan https://t.co/akjqaSELq5
2019-08-22 09:55:54,I read The Memory Thief by Lauren Mansy https://t.co/WHzKhPOm3u
2019-08-22 09:05:12,"On page 204 of 391 of An Affair of Poisons, by Addie Thorley https://t.co/eMmnyFtd6y"
2019-08-21 22:19:00,"On page 192 of 320 of The Memory Thief, by Lauren Mansy https://t.co/Z1FWD4z9S4"
2019-08-21 20:44:05,3 of 5 stars to Kingdom of Souls by Rena Barron https://t.co/XO2lu6XEIU
2019-08-21 20:22:20,Here's my #BookReview of Kingdom of Souls by Rena Barron! #bookblog #bookblogger #amreading #yalit #arc #arcreview… https://t.co/XSQ5p9o3GV
2019-08-21 18:29:14,5 of 5 stars to Legendary by Stephanie Garber https://t.co/rj4Vs4x5g3
2019-08-21 18:26:18,Here's my May Wrap Up! #bookblog #bookblogger #amreading #yalit #wrapup https://t.co/MAd93UhDQa https://t.co/7HvHX5dSB9
2019-08-21 15:11:53,"On page 81 of 368 of If We Were Villains, by M.L. Rio: Holy shit things are starting to ... https://t.co/GtAPS18UZ4"
2019-08-21 12:33:19,"On page 104 of 391 of An Affair of Poisons, by Addie Thorley https://t.co/n5QDpYfBIN"
2019-08-21 09:25:10,I read Crier's War by Nina Varela https://t.co/bacsce8L6h
2019-08-20 22:30:33,"On page 310 of 448 of Crier's War, by Nina Varela: ALFLSLCJSK I’m freaking loving this b... https://t.co/CJ63X9kuM2"
2019-08-20 20:19:40,4 of 5 stars to The Lady Rogue by Jenn Bennett https://t.co/Pfc7QP83Yg
2019-08-20 20:07:50,Here's my #BookReview of The Lady Rogue by Jenn Bennet! #bookblog #bookblogger #amreading #yalit #arc #arcreview… https://t.co/WeDcl0shv9
2019-08-20 16:01:24,Here's this week's #T5T topic: Top 5 Dystopian! #bookblog #bookblogger #amreading #yalit #top5tuesday… https://t.co/RMrQrYoG3t
2019-08-19 22:25:51,"On page 296 of 400 of Shadow Frost, by Coco Ma https://t.co/QuddLLo1Kq"
2019-08-19 17:37:35,"Marked as tbr-unreleased: Get a Life, Chloe Brown by Talia Hibbert https://t.co/sIkPP4VNXr"
2019-08-19 13:04:18,Marked as tbr-unreleased: Fireborne by Rosaria Munda https://t.co/WaQRA8HxoO
2019-08-18 22:22:22,"On page 84 of 400 of Shadow Frost, by Coco Ma: Every time they talk about the Affinity s... https://t.co/xI7hTcB2Ej"
2019-08-18 14:12:59,I read Into the Crooked Place by Alexandra Christo https://t.co/hvlmsrcR08
2019-08-18 10:08:55,"On page 307 of 384 of Wicked Sexy Liar, by Christina Lauren https://t.co/fR7xpCVmHC"
2019-08-17 22:56:24,"On page 237 of 384 of Into the Crooked Place, by Alexandra Christo https://t.co/47kf9jn7Gg"
2019-08-17 14:00:42,"On page 181 of 336 of Queen of Ruin, by Tracy Banghart https://t.co/6xxlLpYkR4"
2019-08-17 11:34:26,"On page 207 of 384 of Wicked Sexy Liar, by Christina Lauren https://t.co/Beohj6YTSz"
2019-08-17 08:59:32,Marked as tbr-unreleased: Reverie by Ryan La Sala https://t.co/kzJXuBpfDl
2019-08-16 10:31:16,"On page 91 of 336 of Queen of Ruin, by Tracy Banghart https://t.co/0IIfA019U7"
2019-08-15 21:03:51,I read Kingdom of Souls by Rena Barron https://t.co/XO2lu6XEIU
2019-08-15 12:53:57,"Marked as tbr-unreleased: Loveboat, Taipei by Abigail Hing Wen https://t.co/GB4pKtaMog"
2019-08-13 11:48:57,I read Now Entering Addamsville by Francesca Zappia https://t.co/heqfsE9rnV
2019-08-12 20:38:23,Marked as tbr-unreleased: Songs from the Deep by Kelly Powell https://t.co/krv2snj9dl
2019-08-12 09:05:18,"On page 200 of 432 of Now Entering Addamsville, by Francesca Zappia https://t.co/AbrMj6tr18"
2019-08-11 20:03:04,4 of 5 stars to Serpent &amp; Dove by Shelby Mahurin https://t.co/9G5eYsk5Vf
2019-08-11 18:40:06,1 of 5 stars to Here There Are Monsters by Amelinda Bérubé https://t.co/yj0ndkGaib
2019-08-11 18:25:28,Here's my #BookReview of Serpent &amp; Dove by Shelby Mahurin. #bookblog #bookblogger #amreading #yalit #arc #arcreview… https://t.co/YG1CXILfZ2
2019-08-10 21:50:54,4 of 5 stars to The Girl the Sea Gave Back by Adrienne Young https://t.co/bxhgHRNuCo
2019-08-10 18:21:11,Here's my #BookReview of The Girls the Sea Gave Back by Adrienne Young. #bookblogger #bookblog #amreading #yalit… https://t.co/yVgwVyIBIf
2019-08-09 22:20:04,"On page 178 of 416 of Unchained, by J. Lynn https://t.co/nad65YZklo"
2019-08-09 18:25:18,Here's my August TBR! #bookblog #bookblogger #amreading #yalit #arc #tbr https://t.co/27Ao4ZIxL1 https://t.co/NVaX5pfKEJ
2019-08-08 22:20:56,"On page 70 of 496 of Kingdom of Souls, by Rena Barron https://t.co/a7KRhwtPZH"
2019-08-08 18:48:46,3 of 5 stars to Crown of Coral and Pearl by Mara Rutherford https://t.co/oBmkM0Gkoz
2019-08-08 18:24:08,Here's my #BookReview of Crown of Coral and Pearl by Mara Rutherford. #bookblog #bookblogger #amreading #yalit #arc… https://t.co/bhU7airtBl
2019-08-08 09:50:56,"On page 282 of 336 of A Thousand Beginnings and Endings, by Ellen Oh https://t.co/crZOw7sfUf"
2019-08-07 21:23:22,"On page 150 of 371 of Black Iris, by Leah Raeder https://t.co/PlS3fMpRk4"
2019-08-07 13:14:46,I read A Treason of Thorns by Laura E. Weymouth https://t.co/K63V3wvEp7
