timestamp,tweet_text
,"Love reading, going to Disneyland, and watching 'I Love Lucy.'",
2019-11-13 05:02:58,Marked as to-read: A Beautiful Day in the Neighborhood by Fred Rogers https://t.co/s5xjwOZXgw
2019-11-09 15:34:41,Marked as to-read: The Aviator's Wife by Melanie Benjamin https://t.co/slB5BJFq4o
2019-11-09 11:46:22,Marked as to-read: The Little Women Cookbook by Wini Moranville https://t.co/SKEuzn1EPT
2019-11-09 02:05:08,Marked as to-read: Love &amp; Olives by Jenna Evans Welch https://t.co/JxGrkuNLPT
2019-11-01 07:54:18,Marked as to-read: The Giver of Stars by Jojo Moyes https://t.co/1Pr2oeCaYB
2019-10-31 21:48:02,"RT @ChanelCleeton: I am so thrilled to share the STUNNING cover for my next book, The Last Train to Key West. The @berkleypub art departmen…"
2019-10-30 02:20:52,Marked as to-read: Downton Abbey by Emma Marriott https://t.co/KHhIT0gRT4
2019-10-29 03:34:45,Marked as to-read: Call Down the Hawk by Maggie Stiefvater https://t.co/V02XJ3SB04
2019-10-28 03:21:47,Marked as to-read: The One and Only Bob by Katherine Applegate https://t.co/2RveinnqvO
2019-10-27 16:14:44,4 of 5 stars to Out to Get You by Josh Allen https://t.co/1xN2Oa0nMw
2019-10-27 12:54:59,"On page 124 of 192 of Out to Get You, by Josh Allen https://t.co/jB9pgHDcKu"
2019-10-27 12:08:39,Marked as to-read: Supernova by Marissa Meyer https://t.co/hyWZ50tFel
2019-10-27 08:15:56,"On page 110 of 192 of Out to Get You, by Josh Allen https://t.co/E7vWaok0Qu"
2019-10-27 02:58:45,"On page 58 of 192 of Out to Get You, by Josh Allen https://t.co/PGiQwTzZQq"
2019-10-26 11:03:51,4 of 5 stars to The Unhoneymooners by Christina Lauren https://t.co/igZtyWBwhq
2019-10-26 04:19:23,"On page 315 of 400 of The Unhoneymooners, by Christina Lauren https://t.co/3dIMeHcHws"
2019-10-25 02:59:28,"Marked as to-read: Glass Slippers, Ever After, and Me by Julie Wright https://t.co/AIHrjEpFNc"
2019-10-24 21:24:46,Marked as to-read: Renegades by Marissa Meyer https://t.co/evHYkNcgrS
2019-10-24 03:50:42,"On page 186 of 400 of The Unhoneymooners, by Christina Lauren https://t.co/wvmRUwR8GP"
2019-10-23 22:40:54,Marked as to-read: Color Me In by Natasha Diaz https://t.co/gHLG2hgmOg
2019-10-23 01:21:25,Marked as to-read: The Furies by Katie Lowe https://t.co/YYe1aLYRam
2019-10-22 04:16:29,"On page 98 of 400 of The Unhoneymooners, by Christina Lauren https://t.co/1k490suaQC"
2019-10-21 19:01:07,5 of 5 stars to The Lemonade War by Jacqueline Davies https://t.co/4q4lnnm1Zw
2019-10-21 02:46:59,Marked as to-read: The Coldest Girl in Coldtown by Holly Black https://t.co/fkSryuEeTT
2019-10-20 18:35:48,3 of 5 stars to Pemberley Ranch by Jack Caldwell https://t.co/NdHf68UN0T
2019-10-19 01:30:54,Marked as to-read: Carnival Row by Stephanie K. Smith https://t.co/ndYGbamgW4
2019-10-17 02:17:32,Marked as to-read: Well Met by Jen DeLuca https://t.co/7UlWIftNyk
2019-10-15 01:59:31,Marked as to-read: Holding Up the Universe by Jennifer Niven https://t.co/HXBTa4BHFi
2019-10-14 08:23:53,4 of 5 stars to A Name Unknown by Roseanna M. White https://t.co/5uGddwWKCT
2019-10-13 22:39:39,Marked as to-read: The Bride of Northanger by Diana Birchall https://t.co/CSyvw21xV4
2019-10-12 08:34:43,Marked as to-read: An American Princess by Annejet van der Zijl https://t.co/XUL1sYYHNZ
2019-10-12 04:28:09,Marked as to-read: Winterwood by Shea Ernshaw https://t.co/SYp3SbQIFy
2019-10-11 03:07:17,Marked as to-read: The Bromance Book Club by Lyssa Kay Adams https://t.co/qTjSRJnDDK
2019-10-11 00:43:23,Marked as to-read: Shine by Jessica Jung https://t.co/DjwurQQbwG
2019-10-10 09:31:32,"50% done with A Name Unknown, by Roseanna M. White https://t.co/XEiW9U9DjF"
2019-10-09 13:02:22,Marked as to-read: There's Something About Darcy by Gabrielle Malcolm https://t.co/uDBqWGBtKR
2019-10-09 02:51:56,Marked as to-read: The Candy Cane Caper by Josi S. Kilpack https://t.co/2jwuZ8AF7p
2019-10-09 01:57:45,Marked as to-read: Promises and Primroses by Josi S. Kilpack https://t.co/HACRLo0zZh
2019-10-07 04:46:46,Marked as to-read: Sea Witch Rising by Sarah Henning https://t.co/2V5h9EKLrz
2019-10-07 03:37:44,Marked as to-read: Toil &amp; Trouble by Augusten Burroughs https://t.co/7pFbHzZnN8
2019-10-07 00:06:03,Marked as to-read: The Particular Charm of Miss Jane Austen by Ada Bright https://t.co/bQt8STo9Az
2019-10-06 22:20:45,Marked as to-read: Oath Taker by Audrey Grey https://t.co/POye3cwDh2
2019-10-06 18:16:54,RT @BernieSanders: Maybe I'm old fashioned. But I believe we should have a president who believes in the United States Constitution.
2019-10-06 18:15:54,"RT @ChurchNewsroom: President @NelsonRussellM announced plans to build 8 new temples:  1. Freetown, Sierra Leone 2. Orem, Utah 3. Port More…"
2019-10-06 17:39:31,Marked as to-read: The Lemonade Crime by Jacqueline Davies https://t.co/O2PXsAXCKC
2019-10-06 05:01:13,"On page 145 of 320 of Lies, Love, and Breakfast at Tiffany's, by Julie Wright https://t.co/cxFAKHmdn5"
2019-10-06 00:53:09,Marked as to-read: The Timepiece by Beverly Lewis https://t.co/UcE9S1zdqz
2019-10-05 20:15:56,Marked as to-read: Love Lettering by Kate Clayborn https://t.co/9RNpkm701i
2019-10-05 19:21:39,Marked as to-read: The Jane Austen Society by Natalie Jenner https://t.co/yffYCaTyPX
2019-10-05 18:28:26,Marked as to-read: Christmas Jars by Jason F. Wright https://t.co/LNvqD2hzUz
2019-10-05 15:20:54,Marked as to-read: Heaven Looks a Lot Like the Mall by Wendy Mass https://t.co/0wRjwV3gGn
2019-10-05 05:05:25,Marked as to-read: Royal Holiday by Jasmine Guillory https://t.co/z3UUboWMZ7
2019-10-04 18:04:20,"RT @Scholastic: RETURN TO THE HUNGER GAMES! THE BALLAD OF SONGBIRDS AND SNAKES from Suzanne Collins is coming out on May 19, 2020. Pre-orde…"
2019-10-04 04:16:02,"55% done with Looking for Alaska, by John Green https://t.co/zaRH3DA4g8"
2019-10-03 11:10:22,"On page 52 of 254 of Looking for Alaska, by John Green https://t.co/4U6Yxn1gmP"
2019-10-03 10:25:05,Marked as to-read: The Overdue Life of Amy Byler by Kelly Harms https://t.co/WkQqKFk3Rw
2019-10-03 04:42:44,"On page 40 of 254 of Looking for Alaska, by John Green https://t.co/r7Ir8lgufI"
2019-10-03 02:22:03,5 of 5 stars to House of Salt and Sorrows by Erin A. Craig https://t.co/PQxX1xYv6Y
2019-10-03 00:56:13,RT @LBardugo: My last name has never sounded better. Day One!! https://t.co/THXWL3GPHc
2019-10-02 16:51:57,"RT @LBardugo: The full character breakdown. A reminder to my readers, the Darkling has had many names. https://t.co/cOYqcyUsBG"
2019-10-02 09:20:36,"On page 274 of 416 of House of Salt and Sorrows, by Erin A. Craig https://t.co/vg4z4FFjiX"
2019-10-02 04:58:08,"On page 240 of 416 of House of Salt and Sorrows, by Erin A. Craig https://t.co/u54oCKhMtq"
2019-10-01 23:07:17,Marked as to-read: The Fountains of Silence by Ruta Sepetys https://t.co/xF2pBZcdud
2019-10-01 17:31:19,Marked as to-read: Fair Play by Eve Rodsky https://t.co/9g86kZowF7
2019-10-01 16:35:47,Marked as to-read: Full Disclosure by Camryn Garrett https://t.co/VpFGgCDfGi
2019-10-01 03:54:53,"On page 97 of 416 of House of Salt and Sorrows, by Erin A. Craig https://t.co/GYpu8b2dMX"
2019-09-30 16:54:45,Marked as to-read: 100 Days of Sunlight by Abbie Emmons https://t.co/2ZgXd9Y708
2019-09-30 06:51:02,"On page 50 of 416 of House of Salt and Sorrows, by Erin A. Craig https://t.co/Gz5nQzHa1g"
2019-09-29 23:29:31,4 of 5 stars to Tell Me Three Things by Julie Buxbaum https://t.co/8MmCrP2c8p
2019-09-29 12:46:36,Marked as to-read: Wayward Son by Rainbow Rowell https://t.co/H7xJGp0wQm
2019-09-29 05:48:24,Marked as to-read: The Bad Guys by Aaron Blabey https://t.co/FPe46trJZR
2019-09-28 01:38:02,Marked as to-read: Untitled by Leigh Bardugo https://t.co/U61JN4sjTd
2019-09-24 23:49:24,Marked as to-read: The Magnolia Story by Chip Gaines https://t.co/rQLH5biR53
2019-09-24 02:07:03,Marked as to-read: Assassin's Quest by Robin Hobb https://t.co/UfRzvZWF60
2019-09-23 04:09:27,3 of 5 stars to The Cruel Prince by Holly Black https://t.co/2KqCUcwfRw
2019-09-22 00:18:01,Marked as to-read: The Secret Diary of Lizzie Bennet by Bernie Su https://t.co/WExfK6UnpV
2019-09-21 14:20:43,"51% done with The Cruel Prince, by Holly Black https://t.co/hRsSngOQC5"
2019-09-21 13:42:32,Marked as to-read: Variant Lost by Kaydence Snow https://t.co/lw84JEeBnm
2019-09-21 07:50:04,Marked as to-read: Mr. Dickens and His Carol by Samantha Silva https://t.co/Bo45zLCQZW
2019-09-18 22:38:26,Marked as to-read: American Royals by Katharine McGee https://t.co/YF0h0dBrdm
2019-09-18 22:38:25,Marked as to-read: A Treason of Thorns by Laura E. Weymouth https://t.co/p9fczDdGiA
2019-09-18 03:57:12,Marked as to-read: The Boy and Girl Who Broke the World by Amy Reed https://t.co/oYZclwAwq5
2019-09-17 23:49:50,Marked as to-read: I'm Not Dying with You Tonight by Kimberly Jones https://t.co/LpcEcU44Ni
2019-09-17 01:03:05,Marked as to-read: A Wolf Called Wander by Rosanne Parry https://t.co/NomWeaXleU
2019-09-16 22:41:42,5 of 5 stars to The One and Only Ivan by Katherine Applegate https://t.co/f4xmr3H9Mg
2019-09-16 03:32:03,"On page 67 of 370 of The Cruel Prince, by Holly Black https://t.co/Nd9FsTEBej"
2019-09-15 23:50:17,"On page 260 of 307 of The One and Only Ivan, by Katherine Applegate https://t.co/l5rWSc2F93"
2019-09-15 16:21:38,Marked as to-read: Nefarious by Nicole Clarkston https://t.co/HTuCbp6OZM
2019-09-15 00:04:19,Marked as to-read: Wild Swans by Jung Chang https://t.co/YuFI9lVE7h
2019-09-14 21:04:09,Marked as to-read: A Name Unknown by Roseanna M. White https://t.co/5uGddwWKCT
2019-09-14 14:08:12,4 of 5 stars to Blackmoore by Julianne Donaldson https://t.co/lj49tGFrbo
2019-09-14 07:30:16,RT @LBardugo: This is so beautiful and my heart is just exploding. Congratulations!!!!! https://t.co/NxDZ6JhMTY
2019-09-14 03:10:30,Marked as to-read: LMNO Peas by Keith Baker https://t.co/AXY9VUXPE1
2019-09-12 00:51:05,Marked as to-read: How to Steal a Dog by Barbara O'Connor https://t.co/eWBnCBI8V2
2019-09-11 03:16:32,Marked as to-read: Towers Falling by Jewell Parker Rhodes https://t.co/doZTybxLyZ
2019-09-08 03:50:57,Marked as to-read: Crown of Coral and Pearl by Mara Rutherford https://t.co/b79ueQeG1f
2019-09-07 04:05:34,Marked as to-read: The Darkest Star by Jennifer L. Armentrout https://t.co/q7H53avtNJ
2019-09-06 02:31:09,4 of 5 stars to The Art of Racing in the Rain by Garth Stein https://t.co/34suolS3j7
2019-09-06 01:17:32,Marked as to-read: The Traitor's Game by Jennifer A. Nielsen https://t.co/wdowOPhC6i
2019-09-05 23:48:34,Marked as to-read: Tell Me Three Things by Julie Buxbaum https://t.co/8MmCrP2c8p
2019-09-05 03:43:27,Marked as to-read: Ruthless Gods by Emily A. Duncan https://t.co/mfOt66NpkE
2019-09-04 03:51:07,Marked as to-read: Lemon Tart by Josi S. Kilpack https://t.co/cwlcTJLBlH
2019-09-04 03:07:32,Marked as to-read: Lost in Scotland by Julianne Donaldson https://t.co/sW6SMl0LHC
2019-09-02 16:17:25,Marked as to-read: Long Way Down by Jason Reynolds https://t.co/Iay8CpLAs2
2019-09-02 13:47:57,4 of 5 stars to Is Everyone Hanging Out Without Me? by Mindy Kaling https://t.co/FAzv7520UL
2019-09-02 12:31:31,Marked as to-read: The Starless Sea by Erin Morgenstern https://t.co/Ww5itWtVmO
2019-09-01 15:39:23,4 of 5 stars to Sadie by Courtney Summers https://t.co/QOZeAO9inC
2019-09-01 02:49:19,Marked as to-read: The Secrets We Kept by Lara Prescott https://t.co/XbQCfXtSIZ
2019-08-31 15:55:58,Marked as to-read: Club Dead by Charlaine Harris https://t.co/pX38bPAw8L
2019-08-31 14:00:04,Marked as to-read: The Turn of the Key by Ruth Ware https://t.co/UEuSn1UnW3
2019-08-31 03:43:28,Marked as to-read: Passage on the Titanic by Anita Stansfield https://t.co/bcnOfJrbcp
2019-08-30 01:12:59,4 of 5 stars to Educated by Tara Westover https://t.co/gir1Utp5bg
2019-08-30 00:33:21,Marked as to-read: Practical Magic by Alice Hoffman https://t.co/VwYhuLwm2V
2019-08-24 02:14:38,Marked as to-read: Lucy's Last Honeymoon in Havana by Scott Jarol https://t.co/hkqOswpD7u
2019-08-20 03:50:56,Marked as to-read: The Husband's Secret by Liane Moriarty https://t.co/2zEAVWhwTp
2019-08-17 16:23:53,Marked as to-read: Home Front Girls by Suzanne Hayes https://t.co/oi7tEwLlHZ
2019-08-13 06:36:37,"On page 217 of 363 of Pemberley Ranch, by Jack Caldwell https://t.co/6HGa0dPLAK"
2019-08-13 06:02:14,5 of 5 stars to City of Bones by Cassandra Clare https://t.co/aHXOYdfyQ7
2019-08-13 05:05:44,Marked as to-read: Shamed by Linda Castillo https://t.co/E3VcY7TKn1
2019-08-12 20:05:56,Marked as to-read: Landline by Rainbow Rowell https://t.co/KWVMYupmxf
2019-08-11 05:49:13,Marked as to-read: Rules of Civility by Amor Towles https://t.co/l9hvi0KWeI
2019-08-09 11:50:24,"Marked as to-read: Ten, Nine, Eight by Molly Bang https://t.co/K60XxoOEot"
2019-08-04 10:55:26,Marked as to-read: The Queen's Assassin by Melissa de la Cruz https://t.co/TPnzJIoPpR
2019-07-31 16:43:05,Marked as to-read: The Last House Guest by Megan Miranda https://t.co/VLRVOuU99P
2019-07-31 15:52:06,Marked as to-read: Finale by Stephanie Garber https://t.co/K1oLzfmwxj
2019-07-30 12:40:06,Marked as to-read: The Burning Shadow Sneak Peek by Jennifer L. Armentrout https://t.co/wbV4qHZaHR
2019-07-27 19:06:36,Marked as to-read: I Found You by Lisa Jewell https://t.co/JrZqkbV0mT
2019-07-27 01:17:42,3 of 5 stars to Nine Coaches Waiting by Mary Stewart https://t.co/gaUBWBE2Yg
2019-07-26 19:18:05,RT @LBardugo: I'M TRYING. https://t.co/xk0P59Ssep
2019-07-24 20:05:20,RT @HillaryClinton: We will not and cannot accept this. https://t.co/9WLFsnzpTL
2019-07-24 06:29:19,Marked as to-read: Magnolia Table by Joanna Gaines https://t.co/est0Bvd0JR
2019-07-24 03:51:43,@blissfulrevries @LBardugo @monolimeart I notice this too. We’re not pariahs!
2019-07-23 04:38:11,5 of 5 stars to Beautiful Creatures by Kami Garcia https://t.co/vIMpjGZqab
2019-07-20 19:13:15,RT @MichelleObama: What truly makes our country great is its diversity. I’ve seen that beauty in so many ways over the years. Whether we ar…
2019-07-18 06:17:11,"RT @SenGillibrand: Whether it's ""send her back"" or ""lock her up,"" ""there has to be some form of punishment"" or ""grab her by the p***y""—the…"
2019-07-16 22:25:56,Marked as to-read: The Distance from Me to You by Marina Gessner https://t.co/fJwRHwZYlb
2019-07-13 19:35:56,4 of 5 stars to One of Us Is Lying by Karen M. McManus https://t.co/6u1uNq3GTH
2019-07-13 06:46:11,RT @sarahdessen: Cleaning out my office and once again found these. I am the author of 14 published novels. These are another 14 that I *co…
2019-07-12 08:02:22,Marked as to-read: Before She Knew Him by Peter Swanson https://t.co/FApE2jJrXq
2019-07-11 06:15:47,"On page 199 of 361 of One of Us Is Lying, by Karen M. McManus https://t.co/WnfW05AYSs"
2019-07-11 05:07:23,Marked as to-read: Siren by Kiera Cass https://t.co/Dg39VOz6xX
2019-07-07 22:54:46,Marked as to-read: One of Us Is Next by Karen M. McManus https://t.co/sy8DvdiFDq
2019-07-04 07:54:50,"On page 192 of 363 of Pemberley Ranch, by Jack Caldwell: Still chugging along https://t.co/6ht91VTsTi"
2019-07-01 15:33:04,Marked as to-read: Whisper Network by Chandler Baker https://t.co/wOpMUZgO9D
2019-06-30 17:41:51,4 of 5 stars to An Enchantment of Ravens by Margaret Rogerson https://t.co/QkD3LOBXXy
2019-06-30 05:49:43,Marked as to-read: Jane Austen by David Nokes https://t.co/jbzpfSp9pG
2019-06-30 05:09:00,Marked as to-read: Sulwe by Lupita Nyong’o https://t.co/SBWBcm3JlB
2019-06-29 06:36:04,No... I’m not obsessed... look who’s on the cover rosie_girl_24 ... lol #kyloren #kylo #kreepykylo #creepykylo https://t.co/YHYJBHMbZU
2019-06-29 02:27:47,Hanging out at the Farmer’s Market with my gal pals! Great pre-birthday outing! #farmersmarket #prebirthday natasha… https://t.co/7aCcuWigKA
2019-06-29 02:25:49,"When you can get Dole Whip, even in Rexburg, ID (the DL version is still the best though). #dolewhip @ Rexburg, Ida… https://t.co/hbJempVcMv"
2019-06-28 18:36:24,I've been loving the books I choose from @bookofthemonth—get a free book when you use my referral link… https://t.co/VyFdClkogu
2019-06-28 00:10:06,Toby will never miss out on the chance to want papi’s pizza. #toby #tobytheshihtzu #shihtzusofinstagram #shihtzu https://t.co/4qbpVedd7a
2019-06-28 00:09:15,Toby is doing much better today! You can see the burst pore or whatever in heavens got us to take him to the vet. M… https://t.co/RlmtedwdsS
2019-06-27 22:00:03,"I’m so excited, but what is @poptv ??? #Repost @poptv ・・・ Dance like 𝙚𝙫𝙚𝙧𝙮𝙤𝙣𝙚 is watching! 💃  #OneDayAtATime… https://t.co/ICRnx7zJte"
2019-06-27 05:37:38,"On page 112 of 363 of Pemberley Ranch, by Jack Caldwell https://t.co/S5Yf2zVRyy"
2019-06-27 04:36:49,Marked as to-read: Scavenge the Stars by Tara Sim https://t.co/lSprBgbbIQ
2019-06-27 02:23:41,"This is Jeffrey’s attempt at wrapping my birthday gifts for next week... he really tried, and some how ended up wit… https://t.co/7Vu9lDVx6M"
2019-06-27 00:33:44,#Repost worldstar ・・・ The movies are lit 👀🎥 #WSHH https://t.co/Gu1tovAwNl
2019-06-26 22:15:29,Toby’s so miserable... doggy fevers suck!!! #toby #shihtzu #shihtzusofinstagram https://t.co/kPr68c2LCo
2019-06-26 21:31:01,"Toby might be running a fever, but he wants papi’s burger! #shihtzu #shihtzusofinstagram #toby https://t.co/DzWfheFLbx"
2019-06-26 13:39:27,Nooooooooo!!!!! @netflix @nbc #theoffice #theofficeshow https://t.co/xDotxUJtuS
2019-06-26 13:31:42,Crap!!! Now I gotta get the DVDs!!! https://t.co/YQJ0BESWf6
2019-06-26 05:54:51,Marked as to-read: Untitled Panem Novel by Suzanne Collins https://t.co/A3jLU5qBRY
2019-06-26 04:03:07,My 1800 page prize for the summer reading program! Two more tiers and I’m done!!! #summerreading… https://t.co/yYqgASUBOZ
2019-06-25 19:22:29,Marked as to-read: Nine Coaches Waiting by Mary Stewart https://t.co/gaUBWBE2Yg
2019-06-24 16:54:46,"RT @nowthisnews: A Trump official tried to argue that detained children don’t need soap, toothbrushes, or beds to be ‘safe and sanitary’ wh…"
2019-06-24 05:52:40,Marked as to-read: Cannery Row by John Steinbeck https://t.co/XICDQkOGaC
2019-06-23 11:52:23,"#Repost @Tech_and_Teach ・・・ All summer long.  Right now I’m catching up on some of my shows, but I’ve got a ton of… https://t.co/PBOv9p3FDc"
2019-06-23 11:52:19,"#Repost @Tech_and_Teach ・・・ All summer long.  Right now I’m catching up on some of my shows, but I’ve got a ton of… https://t.co/LwbiSfxlTB"
2019-06-22 11:02:58,"RT @HIGHzurrer: Hard to tell in this pic, but each knife is inscribed with the name of a saint. #SanktaAlina #NoMournersNoFunerals https://…"
2019-06-22 00:50:05,Trying Crispy Cone for the first time!!!! #crispycone @ConesCrispy https://t.co/rSYlvAvXeH
2019-06-22 00:49:45,RT @LBardugo: This is excellent and I love it https://t.co/F5hlz8Smfj
2019-06-21 11:51:53,"Well crap, I’m addicted! #harrypotter #harrypotterwizardsunite https://t.co/VLkHutYkev"
2019-06-21 11:26:40,Let's be Friends in Harry Potter: Wizards Unite! My Friend Code is: 6299 4831 9606.
2019-06-21 05:48:18,"RT @GeoffRBennett: ""A team of attorneys who recently visited the facility near El Paso told The Associated Press that three girls, ages 10…"
2019-06-20 18:07:05,Buy me tacos and tell me I’m sweet! Trying out the new taco place! #taco 🌮🌮🌮🌮 https://t.co/jawcMLpeTc
2019-06-20 17:36:30,When you’re ready for Lucille Ball’s Birthday!!!! Now to wait... #ilovelucy #lucilleball https://t.co/bQbohWAlOa
2019-06-20 07:53:08,I’ve been obsessed with this song! Have it on repeat! #currentlylistening https://t.co/D6mX9vFhIu
2019-06-20 00:25:50,"RT @BarackObama: Outside the Oval Office, I kept a painting of a small crowd huddled around a pocketwatch, waiting for the moment the Emanc…"
2019-06-19 07:53:21,"On page 53 of 363 of Pemberley Ranch, by Jack Caldwell https://t.co/huoD7KPtdN"
2019-06-19 05:06:20,#Repost @iLoveTeachers3 ・・・ Summer break life 😎 tag a teacher and share below! teachruncreate https://t.co/talEwsOcDI
2019-06-19 00:05:32,"So this was our life for 30ish minutes . Small funnels reported over us, but it passed. https://t.co/oMLwSnXSIX"
2019-06-18 06:54:05,"On page 33 of 363 of Pemberley Ranch, by Jack Caldwell https://t.co/XgPnrG1NBa"
2019-06-18 02:13:24,Went to the library to claim my 1200 page prize (I’m currently at 2061 pages actually read since the start of the c… https://t.co/HOssFnjxYa
2019-06-17 15:43:19,#Repost teachersconnect ・・・ Double tap if you’re in a “good place”!!! Credit: @LizzyRuck https://t.co/NSv2WdqMtC
2019-06-17 15:34:37,Gah!!!! Yes!!!!!!! Love this series!!!! #hungergames #read #reading https://t.co/wtllUEm4TH
2019-06-17 15:27:41,"RT @Scholastic: Exciting news, Hunger Games fans: A prequel novel set 64 years before the events of The Hunger Games is coming May 2020! Re…"
2019-06-17 08:53:36,"As I’m cleaning my apartment, I’m listening to An Enchantment of Ravens by Margaret Rogerson. #currentlyreading… https://t.co/xLcDMYPnWF"
2019-06-16 22:07:39,"To my daddy, Happy Father’s Day. I miss you tons. Photo by mariaelenaphotos https://t.co/69xOTm4ItV"
2019-06-16 07:19:24,Currently Reading: Pemberley Ranch by Jack Caldwell. I love retellings of Pride and Prejudice!!! #read #reading… https://t.co/z5NhzfC0GK
2019-06-16 07:19:23,Currently Reading: Pemberley Ranch by Jack Caldwell. I love retellings of Pride and Prejudice!!! #read #reading… https://t.co/U6TMqiBKOf
2019-06-16 06:52:34,4 of 5 stars to The Gender Game by Bella Forrest https://t.co/dlY5T8cTln
2019-06-16 06:27:01,#Repost @deleandersen ・・・ Reading simply makes you a better person 😊  Repost: @adamspagesabuja . . .… https://t.co/EBuNoazfDu
2019-06-16 05:53:59,"When you love Toby so much, you can practically squeeze him!!! #toby #tobytheshihtzu #shihtzu #shihtzusofinstagram https://t.co/WqpjPc6lfO"
2019-06-16 05:20:38,"#Repost utahanimaladvocacyfoundation ・・・ While you’re scrolling through your phone this weekend, please don’t forge… https://t.co/j3AGbi8tB8"
2019-06-16 04:51:30,Marked as to-read: Merry and Bright by Debbie Macomber https://t.co/TTa5JfORGo
2019-06-15 18:31:11,4 of 5 stars to The Iron King by Julie Kagawa https://t.co/BFMtpmVZ3d
2019-06-15 07:23:04,"On page 298 of 363 of The Iron King, by Julie Kagawa https://t.co/penc7ZTuBJ"
2019-06-14 18:28:09,#Repost @VrcsRdrsOnly ・・・ Readers... Authors... Join Us at https://t.co/eZBPVuojBc ! (Link in bio)  Source:… https://t.co/gGd4YSmWl3
2019-06-14 17:17:26,Marked as to-read: The Downstairs Girl by Stacey Lee https://t.co/Q1X8aWL3YN
2019-06-14 08:00:36,"On page 245 of 363 of The Iron King, by Julie Kagawa https://t.co/Q8fSIYocxL"
2019-06-13 21:24:35,RT @LBardugo: Well damn. #grishaverse https://t.co/wzQO0ZHFx5
2019-06-13 08:16:52,"On page 180 of 363 of The Iron King, by Julie Kagawa https://t.co/iza3A24uCE"
2019-06-13 00:57:12,"#Repost @nealshusterman ・・・ ""You cannot end a book like that!"" I can't tell you how many times I've heard that sent… https://t.co/oUpH1ytDAX"
2019-06-13 00:24:59,Marked as to-read: Who Is the Dalai Lama? by Dana Meachen Rau https://t.co/NgUKrrvftD
2019-06-12 17:46:01,Marked as to-read: Batman by Marie Lu https://t.co/LFZ1Ih2mU8
2019-06-12 02:08:52,Taco Tuesday!!! 🌮🌮🌮🌮🌮 #tacotuesday #tacos https://t.co/K8Ari0WVe1
2019-06-11 16:11:29,Marked as to-read: Memento by Amie Kaufman https://t.co/rzD7yuiuiM
2019-06-11 07:32:42,"On page 160 of 363 of The Iron King, by Julie Kagawa https://t.co/AHEQ80r1k8"
2019-06-11 05:08:22,5 of 5 stars to Speak by Laurie Halse Anderson https://t.co/rsWhBxelAB
2019-06-11 00:42:10,I read Speak by @halseanderson years ago. Now I’m gladly reading the graphic novel. Already loving it. #read… https://t.co/8dGTIQGEd6
2019-06-10 22:17:09,Picked up the graphic novel version of Speak and my 600 page prize for the summer reading program. Don’t know why t… https://t.co/d5sJ4tVSgb
2019-06-10 22:15:15,"My #BookoftheMonth came in today, along with my two YA add-ons. Cannot wait to read them! @bookofthemonth #book… https://t.co/s41rlJJajy"
2019-06-10 03:38:57,This is how Toby sleeps... sleepy time #Toby #tobytheshihtzu #shihtzu #shihtzusofinstagram https://t.co/6EWsLpHb7p
2019-06-09 22:46:52,Just posted a photo https://t.co/tBvaiOFFQi
2019-06-09 22:10:51,#Repost @ScholasticClub ・・・ The summer slide: Research shows that many students “slide” back in reading and math sk… https://t.co/8YFWljig3q
2019-06-09 21:52:34,Marked as to-read: The Gender Lie by Bella Forrest https://t.co/7IeA2VjBVK
2019-06-09 17:29:57,#Repost disneyinwithkristen ・・・ Happy birthday to the OG Disney Duck! 85 never looked so good! . . .… https://t.co/aJ1f40BTsL
2019-06-09 17:22:42,Currently Listening to: The Gender Game. Need something to listen to as I do chores or get ready for my day. #book… https://t.co/OScDwd61cZ
2019-06-09 06:51:08,"On page 96 of 363 of The Iron King, by Julie Kagawa https://t.co/PUTB4E81Yb"
2019-06-09 06:30:48,RT @BStubbles: Unknown Playwright Redux: Idaho's very own Mattie Rydalch!! #idahowriter #rexburg #unkownplaywrights https://t.co/TNU2Lwxa1y
2019-06-09 05:32:46,"Marked as to-read: Normally, This Would be Cause for Con... by Danielle Fishel https://t.co/M826AkCeYQ"
2019-06-08 16:39:14,Marked as to-read: The Bane Chronicles by Cassandra Clare https://t.co/JMIOzi0kgb
2019-06-08 16:09:39,Just posted a photo https://t.co/8ASdHHCdqP
2019-06-08 05:12:21,Toby is all about that #thuglife #toby #tobytheshihtzu #shihtzu #shihtzusofinstagram https://t.co/uYa8FVx17h
2019-06-08 05:07:55,Currently Reading: The Iron King by juliekagawaauthor Reading it for Book club this month! #read #reading #iread… https://t.co/MHK9I6qVAL
2019-06-08 03:04:26,"5 of 5 stars to Again, but Better by Christine Riccio https://t.co/9OyVDDHp4I"
