timestamp,tweet_text
2018-12-12 08:59:49,"On page 115 of 393 of Someday, by David Levithan https://t.co/MlI6C7aHVc"
2018-12-12 01:28:35,#Repost thehungryteacher5th ・・・ LITERALLY. #icanteven https://t.co/mcvtYpPKCZ
2018-12-11 23:52:50,Marked as to-read: Archenemies by Marissa Meyer https://t.co/5tGyXWKEqj
2018-12-11 21:45:47,"On page 196 of 288 of The Wild Robot Escapes, by Peter Brown https://t.co/6OSBbCW6y1"
2018-12-11 08:03:45,"On page 58 of Someday, by David Levithan https://t.co/dluCdmJaup"
2018-12-11 01:42:02,Got my first ever @bookofthemonth today! It also happens to be reesesbookclubxhellosunshine @RWitherspoon December… https://t.co/U8tqCfx2bt
2018-12-10 17:59:05,RT @AngelaBelcamino: @BarackObama Remember when we had a president that could spell?
2018-12-10 17:58:44,RT @BarackObama: No jump shots. No ferns. No memes. Not this time. I’m going to give it to you straight: If you need health insurance for 2…
2018-12-10 03:05:31,Marked as to-read: Miss Bingley Requests by Judy McCrosky https://t.co/zE2cL6BMJh
2018-12-10 01:50:49,Marked as to-read: Chilling Adventures of Sabrina #2 by Roberto Aguirre-Sacasa https://t.co/lHxf8uae3I
2018-12-10 00:33:47,#Repost thecharmedteacher ・・・ Canceled plans are my favorite type of plans.  The holiday season is always hard with… https://t.co/dobWFRfSsS
2018-12-09 14:00:01,Marked as to-read: Angela's Ashes by Frank McCourt https://t.co/u7tPJLRua5
2018-12-08 03:18:48,This is the gift you get when you do a left/right Christmas story with your staff. Bahahahaha! #christmas @ Rexburg… https://t.co/XDFV23J9x4
2018-12-07 23:42:34,When your 2019 Always Fully Booked Planner arrives!!!! So exited to dig into it! My reading hola for next year: 80… https://t.co/Ud4X0kvwsA
2018-12-07 23:32:15,#Repost @shopharpe ・・・ T A R G E T 🎯🎯 || #targettherapy https://t.co/BrW8z5vfWi
2018-12-07 02:13:23,"Currently Reading: Someday by davidlevithan I read the first two books in the series at the beginning of the year,… https://t.co/9QPiqYiXdE"
2018-12-07 00:44:05,How amazing is this teacher/fandom survival kit! One of my student teachers this semester had a love for Harry Pott… https://t.co/E3Pmt6j5MV
2018-12-06 23:12:04,"RT @MuslimIQ: I love this!   Teaching kids consent, bodily autonomy, mutual love &amp; respect, and decision making—all in one!  Love the last…"
2018-12-06 05:31:17,Marked as to-read: This Is How It Always Is by Laurie Frankel https://t.co/pG9EX9UtBS
2018-12-06 04:55:50,5 of 5 stars to Dry by Neal Shusterman https://t.co/8v3IX34u2P
2018-12-06 00:18:56,Marked as to-read: America's First Daughter by Stephanie Dray https://t.co/TPqNTCnCkJ
2018-12-05 15:07:07,When you cannot feel your face in the morning... #rexburg #iceburg #cold #winter https://t.co/yZkcOFYvmd
2018-12-05 03:51:22,"On page 231 of 390 of Dry, by Neal Shusterman https://t.co/W4Dtri9UPs"
2018-12-05 03:19:26,#Repost natalielynnkindergarten ・・・ Anyone else feel like December hit and their class just fell apart? We’ve forgo… https://t.co/AaRlZqjIUg
2018-12-05 02:55:35,I liked a @YouTube video https://t.co/oq5YmWWXn6 Press On Nails that Last a Week (at Least): Your Questions Answered! | Bailey B.
2018-12-05 00:43:40,Marked as to-read: The Diviners by Libba Bray https://t.co/4Rctddr3TF
2018-12-04 03:51:54,"On page 134 of 390 of Dry, by Neal Shusterman: I’m going to need a fun, chilled out book... https://t.co/Oiah2mA7KL"
2018-12-04 02:17:13,When you’ve a got a book stressing the heck out of you! #read #reading #currentlyreading #book #books https://t.co/LwhvMqrHNp
2018-12-04 02:15:49,#Repost teachinglittleleaders ・・・ I meannnn... am I right or??🎄😜 Just over here embracing the chaos https://t.co/OouWhsTGYE
2018-12-04 00:24:10,Marked as to-read: Serious Moonlight by Jenn Bennett https://t.co/1cAGZOtrZa
2018-12-03 08:30:32,Marked as to-read: Unwrapping Mr. Darcy by L.L. Diamond https://t.co/Df3XdGVzfg
2018-12-03 04:14:57,"So I never got around to posting what book I was reading this week, but I just finished reading Shadow and Bone by… https://t.co/H9fXKLy71k"
2018-12-03 04:06:47,5 of 5 stars to Shadow and Bone by Leigh Bardugo https://t.co/XdxrGaSfdU
2018-12-03 03:57:23,My tia Ofelia found this picture of me from my grandma Juanita’s collection of pictures. This must have been me in… https://t.co/zDe8xGIi1p
2018-12-03 03:16:09,My new favorite Christmas candle! It smells like a Christmas tree! #bathandbodyworks #bathandbodyworkscandles https://t.co/VBX5iNzhlz
2018-12-01 23:30:35,Me after the Bath and Body Works candle sale! #bathandbodyworks #bathandbodyworkscandles @ Grand Teton Mall https://t.co/4H4geQiOM2
2018-12-01 15:53:27,Marked as to-read: Midnight in Austenland by Shannon Hale https://t.co/6LbWqch5lJ
2018-12-01 15:01:21,#Repost bathandbodyworks ・・・ ❗ IT’S FINALLY HERE ❗ TODAY ONLY: ALL 3-Wick Candles (yep – we said ALL) are $8.95! Th… https://t.co/Mb4i7HEesg
2018-11-30 04:40:07,Marked as to-read: Chilling Adventures of Sabrina #1 by Roberto Aguirre-Sacasa https://t.co/5U4clGTNqe
2018-11-29 04:31:57,"On page 186 of 352 of Shadow and Bone, by Leigh Bardugo https://t.co/Bq0Fwr8c0P"
2018-11-29 01:39:19,#Repost targetgems ・・・ Me! EVERY TIME! 🙋🏻‍♀️😂 📸: whiskeyandwhinedesignco https://t.co/vvTkfmBNEY
2018-11-28 05:51:09,"On page 132 of 352 of Shadow and Bone, by Leigh Bardugo https://t.co/nwWwmYNPG6"
2018-11-27 05:20:55,"On page 103 of 352 of Shadow and Bone, by Leigh Bardugo https://t.co/9PlfYw502f"
2018-11-27 03:33:47,"I haven’t seen the latest Fantastic Beasts, but this is too much!!! Bahahaha! #teach #teaching #iteach #iteachtoo https://t.co/Ub8kaBzvnK"
2018-11-27 02:34:28,Marked as to-read: Damsel by Elana K. Arnold https://t.co/UjKvsv58Oa
2018-11-27 02:22:59,No... I’m not obsessed... #kylo #kyloren #kylotrash https://t.co/fZZ4FIMykd
2018-11-26 02:11:26,When even our desk fairy is ready to go for Christmas! #teach #teacher #deskfairy #teaching #iteach #iteachtoo @ Li… https://t.co/DtfhDHtdxD
2018-11-26 01:14:58,When you come in on Sunday to set up your classroom Christmas tree! Totally worth the $20 from Michael’s!… https://t.co/lFVUdmUxTb
2018-11-24 04:34:10,Marked as to-read: Witches of East End by Melissa de la Cruz https://t.co/rqRGEHm19n
2018-11-24 01:10:11,When left overs taste so good! #panconpollo #salvi https://t.co/8wZr10DcuF
2018-11-23 15:53:44,When you wait around from 5pm to 12am to buy these cozy socks for $1 each at Old Navy (originally $5) #oldnavy… https://t.co/DvrtSzNdif
2018-11-23 00:01:09,Happy Thanksgiving friends and family! On our way to go Black Friday shopping! #thanksgiving https://t.co/bPea99hsak
2018-11-22 22:31:51,Pan con Pollo! Salvadorian Thanksgiving! #salvi #thanksgiving https://t.co/C5dM3arVH9
2018-11-22 22:14:38,"#raedunn #thanksgiving @ Rexburg, Idaho https://t.co/gDUUXzziQI"
2018-11-22 18:55:01,#Repost teachtoinspireothers ・・・ So thankful for the 43 littles I get to teach and be with everyday ❤️💕☀️ https://t.co/RrV99Wtxfd
2018-11-22 05:57:38,"On page 10 of 358 of Shadow and Bone, by Leigh Bardugo https://t.co/VUT9kx9I38"
2018-11-22 05:25:09,Marked as to-read: Fangirl by Rainbow Rowell https://t.co/oRkgefVmc8
2018-11-21 22:12:10,Marked as to-read: Treasury of Greek Mythology by Donna Jo Napoli https://t.co/1uNoI7gmvP
2018-11-21 19:44:04,Season 8 and 9 are the worst. #Repost dwightschrutee ・・・ My exact reaction 😂 #theoffice #theofficememes… https://t.co/L5JvKqhlvx
2018-11-21 16:27:36,"My students loved the fact that I personalizes, individualized, and hand colored a note just for them this year! I’… https://t.co/Cbi4CvBFgJ"
2018-11-21 13:01:49,Marked as to-read: Fantastic Beasts by J.K. Rowling https://t.co/pM1js72clF
2018-11-21 06:30:19,#Repost @mrsfreibrun ・・・ Gotta get to that turkey! 🍽 #teachersonbreak #teachersfollowteachers #teachersofinstagram… https://t.co/vluimtnBFi
2018-11-20 10:55:26,#Repost @AdventuresinKin ・・・ Give me allllllll the peppermint things! Are you team peppermint too? https://t.co/1vwNnwQCdE
2018-11-20 05:24:09,#Repost adamdriver_iamkyloren ・・・ Happy Birthday Adam Driver 🎂🎉🎊🥳 #adamdriver #adamdriverbirthday… https://t.co/Y5kaqTCIJJ
2018-11-19 12:52:36,#Repost burkeworktpt ・・・ We can do it! https://t.co/2mzEOWF3xm
2018-11-19 12:40:44,Marked as to-read: North and South by Elizabeth Gaskell https://t.co/XSGTPK4r9T
2018-11-19 06:35:57,"#Repost @asiadraws ・・・ ✨Happy 90th Birthday Mickey (&amp; Minnie too of course)! ✨Many of my dreams, passion, and motiv… https://t.co/3YVPPTi8iJ"
2018-11-18 17:40:32,I liked a @YouTube video https://t.co/DjbcpPwZmm OMK! Ellen's Favorite Food Critic Is Back with More Outrageous Food Reviews!
2018-11-18 15:52:41,Marked as to-read: Good Night Stories for Rebel Girls 2 by Elena Favilli https://t.co/9UJdO3vSO0
2018-11-17 10:00:55,5 of 5 stars to The Next Person You Meet in Heaven by Mitch Albom https://t.co/WYRWK33iqC
2018-11-17 04:08:17,Marked as to-read: A Holiday by Gaslight by Mimi Matthews https://t.co/tGqf1cwSIp
2018-11-16 17:18:11,So thankful! Resource from littlemissfiesta_ #teach #teacher #iteach https://t.co/8KUNCpOJFp
2018-11-16 09:13:06,"On page 130 of 224 of The Next Person You Meet in Heaven, by Mitch Albom https://t.co/pLwF5DywPP"
2018-11-16 04:21:29,"On page 81 of 224 of The Next Person You Meet in Heaven, by Mitch Albom https://t.co/4a01qSvERz"
2018-11-16 03:02:03,5 of 5 stars to The Wild Robot by Peter Brown https://t.co/vzu9eFuOp4
2018-11-15 21:00:42,The after math... https://t.co/wnZ94UA8ho
2018-11-15 21:00:28,Just posted a photo https://t.co/PAoE5mV47B
2018-11-15 20:15:13,So we did an ancient form of art called Gyotaku in class today... Fish impressions. #teach #teacher #iteach https://t.co/vGR1xuOxtw
2018-11-15 08:01:46,Marked as to-read: Little White Lies by Jennifer Lynn Barnes https://t.co/3hFZtqJ1e6
2018-11-15 05:04:07,"On page 40 of The Next Person You Meet in Heaven, by Mitch Albom https://t.co/mczHjL1wm9"
2018-11-14 18:43:49,"After my evaluation, I reward myself with a Diet Coke. #lifeisgood #teach #teacher #iteach #iteachtoo… https://t.co/p5yGtslqXI"
2018-11-14 17:15:43,Marked as to-read: The Christmas Sisters by Sarah Morgan https://t.co/rL6X0Ft00T
2018-11-14 06:10:59,Currently Reading: The Next Person You Meet in Heaven by Mitch Albom. I reread the first book over the summer and I… https://t.co/r2GOmB7WTL
2018-11-14 05:38:35,5 of 5 stars to Thunderhead by Neal Shusterman https://t.co/7Fqjkiw9sl
2018-11-13 22:23:24,"RT @BarackObama: Of course, @MichelleObama’s my wife, so I’m a little biased here. But she also happens to be brilliant, funny, wise – one…"
2018-11-13 03:51:11,"On page 289 of 504 of Thunderhead, by Neal Shusterman https://t.co/TpqEQmfV1W"
2018-11-13 00:18:47,"#Repost barnesandnoble ・・・ Thank you, Stan Lee. #RIP #Excelsior https://t.co/yBw8QowhK0"
2018-11-12 13:07:52,#Repost @loveframethis ・・・ Feels 😫Let's rewind and start again just one more time shall we? 🙏🏼 https://t.co/EgWmE6kI5Y
2018-11-12 04:40:18,"On page 200 of 504 of Thunderhead, by Neal Shusterman https://t.co/xc5Q3oUXWL"
2018-11-12 00:55:53,Currently Reading: Thunderhead. I’m enjoying every minute of it. So good! I haven’t even finished it and I’m alread… https://t.co/AiDEvOxiB5
2018-11-12 00:42:40,"When you gotta put on the heater, thick socks, and Christmas movies! It’s super cold! #cold #winter #fall #snow… https://t.co/ueh98ft4HE"
2018-11-11 18:09:36,RT @BarackObama: To all our veterans and your families: thank you. There's no tribute that can truly match the magnitude of your service an…
2018-11-11 04:51:28,"On page 101 of 504 of Thunderhead, by Neal Shusterman https://t.co/40TCyj3Ksg"
2018-11-10 23:45:48,#Repost @friendssfpl ・・・ 😂😂🤣 so true! Can’t wait to buy more books! https://t.co/n4rjDi5j1w
2018-11-10 21:52:05,Marked as to-read: The Stupidest Angel by Christopher Moore https://t.co/0JhmewNpdS
2018-11-10 10:48:12,RT @matthewjdowd: I worked on the Bush campaign in 2000 and was chief strategist in 2004.  Not counting all the votes in Florida in 2000 wa…
2018-11-10 10:47:58,RT @NoelSznn: When you in public with your girl and she grabs your ass https://t.co/VrGCnazvrH
2018-11-10 10:46:45,Marked as to-read: Mr. Darcy's Diary by Amanda Grange https://t.co/cP3c2LwUsk
2018-11-10 10:46:12,#Repost theclassroomsparrow ・・・ 😬 T.G.I.F. I may or may not be diving into a box of Pop Tarts right away!!… https://t.co/9U56eadwqU
2018-11-10 05:01:09,"56% done with Miss Burton Unmasks a Prince, by Jennifer Moore https://t.co/lzlVKk2NC7"
2018-11-10 03:48:11,Marked as to-read: This Is My Brain on Boys by Sarah Strohmeyer https://t.co/4oBKFrh4rZ
2018-11-09 05:21:39,"44% done with Miss Burton Unmasks a Prince, by Jennifer Moore https://t.co/KtHvO7Sre6"
2018-11-09 02:42:04,"Relief Soceting it off! Christmas prep! #rs #reliefsociety #lds #thechurchofjesuschristoflatterdaysaints @ Rexburg,… https://t.co/qSdVY5QNtS"
2018-11-09 01:18:18,RT @OhNoSheTwitnt: The right is more outraged by Jim Acosta who didn’t assault a woman than they are by men who do assault women or shoot u…
2018-11-09 01:17:50,"When I suddenly want the baby Grinch, but it’s sold out everywhere!!!!!!! #grinch #cute https://t.co/5LDDdjd9J8"
2018-11-09 00:53:56,Nothing is more true than this ☝🏻☝🏻☝🏻☝🏻☝🏻 #Repost thesassyapple_ ・・・ Such a magical time 📖💗 https://t.co/r7flTZKgqe
2018-11-08 23:24:45,The cover of the Fall General Conference edition of the Ensign is gorgeous! #lds… https://t.co/tXPvbbtMUS
2018-11-08 04:23:28,"37% done with Miss Burton Unmasks a Prince, by Jennifer Moore https://t.co/Nic7yeii0U"
2018-11-07 14:49:27,"On page 29 of 168 of From Reading to Math, Grades K-5, by Maggie Siena https://t.co/VyYppOz29X"
2018-11-07 03:39:45,"Toby and his jean jacket voted today, did you? #vote #ivoted #midterms #midtermelections #midterms2018 https://t.co/rSaTD1P35o"
2018-11-07 02:11:16,RT @lauren_hoggs: In a society that tries so hard to suppress our vote the action of actually casting a vote in itself is an act of strengt…
2018-11-07 02:10:49,RT @lauren_hoggs: Sending my thoughts and prayers to every NRA backed politician tonight. (;
2018-11-07 01:20:07,#bitmoji #vote #election #midterms #midtermelections #midterms2018 https://t.co/YoVBNRjdpT
2018-11-06 23:36:22,Did you guys rock the #vote ??? Super important! Use your right to vote! #voting #ivoted electionday2018 @ Madison… https://t.co/MO3i3AVU1M
2018-11-06 22:43:13,Giving my book book a much needed refreshing by adding these free posters by monsterwranglermike #teach #teaching… https://t.co/k9KGQOymfM
2018-11-05 17:09:19,Just posted a photo https://t.co/WayIPidJjw
2018-11-05 17:08:29,Just posted a photo https://t.co/LzsInzClgj
2018-11-05 13:08:11,"25% done with Miss Burton Unmasks a Prince, by Jennifer Moore https://t.co/qikxro1edq"
2018-11-05 04:12:45,"9% done with Miss Burton Unmasks a Prince, by Jennifer Moore https://t.co/D0ylf5t2zw"
2018-11-05 03:28:32,#Repost @laneyjjohnson ・・・ The official schedule for the 4th quarter of 2018 ☝🏼 Merry Christmas y’all! 🎅🏼😂 https://t.co/CEsQlMQ8o5
2018-11-05 03:01:27,Our Disney World stockings that purchased last year! Love them! #christmas #christmasdecor https://t.co/NqVycOSV5d
2018-11-05 02:59:50,And our Christmas tree is up! I wonder how long it will take me to take it down this year... last year’s record was… https://t.co/VdohL6Jzvv
2018-11-04 05:00:12,Marked as to-read: Anne Frank's Diary by Ari Folman https://t.co/HxgUlQFved
2018-11-03 23:00:57,"On page 139 of 279 of The Wild Robot, by Peter Brown https://t.co/b06MIXI1LM"
2018-11-03 20:26:11,"My favorite Harry Potter character, but when he was a Hogwarts student. 😍😍😍😍 #Repost @NaomiLordArt ・・・ ✨🌕 Remus Lup… https://t.co/38Z8h4drez"
2018-11-03 20:08:06,#Repost christmasallyear_round ・・・ 51 Days to go!!! 🎄🎄🎄🎄🎄🎄🎄🎄🎄🎄🎄🎄🎄🎄🎄🎄🎄🎄🎄🎄🎄🎄🎄🎄🎄🎄🎄🎄🎄🎄🎄🎄🎄🎄🎄🎄🎄🎄🎄 https://t.co/6UvB1M3R2K
2018-11-03 18:12:05,RT @jouvetr: YOURE JOKING THEY ARE REALLY PLAYING CHASING CARS IN SPANISH #GreysAnatomy https://t.co/9FEXqZJ39N
2018-11-03 18:11:22,"RT @KateSny: Okay, but for real, as soon as @GreysABC started playing Chasing Cars by Snow Patrol in Spanish I just KNEW something was comi…"
2018-11-03 18:10:48,RT @TriniShawdy: Chasing cars in Spanish #GreysAnatomy https://t.co/H0OI0kOVUA
2018-11-03 17:18:32,"Me, 24/7 after watching this week’s episode of Grey’s Anatomy!!!! All of the ugly crying!!! 😭😭😭😢😢😰😰😰😭😭😭😭… https://t.co/0gRYKhLjLH"
2018-11-03 16:16:12,#Repost barnesandnoble ・・・ PSA: You get an extra hour of reading tonight. #DaylightSavings https://t.co/omcxVxe3xK
2018-11-03 16:00:53,Just posted a photo https://t.co/rtadgX6uU6
2018-11-03 08:32:45,Here’s better view of the table. On the very left we have my Tia Elvia. She passed away a few days after dad. My Ti… https://t.co/AR99kmPrtX
2018-11-03 08:26:19,"My family sent me follow up pictures to the ofrenda table. I suggested that they put a Coke in front mom, since she… https://t.co/ZZuUOs6hC1"
2018-11-02 06:41:22,My Tia’s family ofrenda for Día de los Muertos. Mom and dad are on the very left. #diadelosmuertos #diademuertos https://t.co/ZJqzsUUPSE
2018-11-02 04:07:25,Finishing this year strong! #book #books #read #reading #reader #ireadtoo Planner by littleinklingsdesign https://t.co/8PIQiO9AgG
2018-11-02 04:06:21,"It’s short, but realistically, I can only read about a book a week. Which is still pretty good for me. I’ve read 61… https://t.co/Ga8oIAorX6"
2018-11-02 03:57:48,Currently Reading: Miss Burton Unmasks a Prince by Jennifer Moore for book club. Love me a good historical drama!… https://t.co/UV0wq0F5HO
2018-11-02 03:46:32,Marked as to-read: Inside Out &amp; Back Again by Thanhha Lai https://t.co/pkOzKjcUkg
2018-11-02 03:09:53,Marked as to-read: The Moon in the Palace by Weina Dai Randel https://t.co/6WMOcVoZSO
2018-11-02 01:41:25,Marked as to-read: A Literary Tea Party by Alison Walsh https://t.co/Aj68yWBmaC
2018-11-01 22:33:03,Marked as to-read: The Ring Reader by Keira K. Barton https://t.co/XaJkhMyzKs
2018-11-01 18:32:32,#Repost @toddlandstore ・・・ Merry Christmas from toddland and Linda! Go get those trees up!! #BobsBurgers  https://t.co/0wdvx40FPY
2018-11-01 17:47:08,Marked as to-read: The Other Woman by Sandie Jones https://t.co/0mKQVE748H
2018-11-01 13:44:39,#thankful #thanks #thankyou #thanksgiving @ Lincoln Elementary School https://t.co/BYzOi9q5DY
2018-11-01 12:01:55,#Repost teachinginfullbloom ・・・ Happy November 1st! Bring on the Christmas carols! https://t.co/n9HgsApDob
2018-11-01 04:12:04,"On page 394 of 486 of See Me, by Nicholas Sparks https://t.co/ipn4pB6jyG"
2018-11-01 03:24:19,@mickee28 Why not???
2018-11-01 01:56:06,Got the chance to mummified today in our class Halloween party! The kids had a blast #halloweencostume #halloween… https://t.co/k1zqY8RiB9
2018-10-31 23:38:31,Toby was a popular puppers today at school! Everyone wanted to let him. My cute little Batdog! #batman #shihtzu… https://t.co/emXFQnTIgR
2018-10-31 22:13:34,I was Lucille Ball again... had to educate my students on who this great woman is! #teach #teacher #iteach… https://t.co/aPQkAoAoAz
2018-10-31 03:18:56,#Repost @thecr8tiveclass ・・・ Is it Friday yet? 😂😂😂#teachermemes #teachers #teachersofinstagram https://t.co/7Gj79D4n4C
2018-10-31 00:05:33,When you be prepping your Christmas playlist for Nov. 1st! Lol #christmas #christmasmusic https://t.co/kLE0Yw83YR
2018-10-30 23:05:59,Working on last minute Halloween treats! #halloween #teach #teacher #teaching #iteach #happyhalloween #halloween2018 https://t.co/gB4RZKuyFO
2018-10-30 21:25:34,"On page 15 of 168 of From Reading to Math, Grades K-5, by Maggie Siena https://t.co/CF4NGusvNV"
2018-10-30 18:29:00,"On page 133 of 279 of The Wild Robot, by Peter Brown https://t.co/Cg6159F2xj"
2018-10-30 03:10:49,"On page 351 of 486 of See Me, by Nicholas Sparks https://t.co/VqyL56bX4U"
2018-10-29 19:27:43,I liked a @YouTube video https://t.co/mG0XOOkN3M Cancer Makeup Look ♋ ZODIAC SIGNS SERIES 💕🦀
2018-10-29 18:37:47,"On page 117 of 279 of The Wild Robot, by Peter Brown https://t.co/8GSH927YYX"
2018-10-29 03:24:00,"On page 249 of 486 of See Me, by Nicholas Sparks: Oh gosh! I got through half the book i... https://t.co/UgxY2uA51H"
2018-10-28 23:25:29,Marked as to-read: The Lottery and Other Stories by Shirley Jackson https://t.co/3bSamD2fg9
2018-10-28 20:00:32,"#Repost thecleverclove ・・・ ✨Surprise pin drop! ✨Books have the power to shape and transform us, and we carry their… https://t.co/tsr0uD7EZL"
2018-10-28 19:40:53,"I’ve preordered mine, have you? #Repost littleinklingsdesign ・・・ Last call to preorder the 2019 Always Fully Booked… https://t.co/UrQ6Y1LtDS"
2018-10-28 16:44:43,"RT @rmayemsinger: Dear media. All of you. Stop broadcasting his rallies. Don't show clips either. PLEASE. For the love of America, cut off…"
2018-10-28 16:44:18,RT @MichaelSkolnik: 11 Jews were murdered and multiple others were injured (including 4 police officers) at the Tree of Life Synagogue this…
2018-10-28 16:43:42,"RT @johnpavlovitz: Dear Non-Hateful People of America,  If we all get to the polls and vote Blue in November, this madness will be severely…"
2018-10-28 16:43:21,"RT @rtraister: It’s happening on all fronts, all around us, every day, the move backwards, the reversal of progress made over generations b…"
2018-10-28 16:43:07,RT @Weinsteinlaw: This is the 300th day of the year.   There have been 294 mass shootings in 2018.   There are 10 days until Election Day.…
2018-10-28 16:42:58,"RT @TheRaDR: Joyce Feinberg, 75 Richard Gottfried, 65 Rose Mallinger, 97 Jerry Rabinowitz, 66 Cecil Rosenthal, 59 David Rosenthal, 54 Berni…"
2018-10-28 16:42:55,RT @brianschatz: I don’t want to arm synagogues and churches and schools. I want to live in a society where nazism and white supremacy craw…
2018-10-28 16:42:46,RT @tonyposnanski: Numerous terrorist attacks in America this week...  Not from people in a caravan Not from people from Mexico Not from pe…
2018-10-28 16:42:22,RT @MichaelSkolnik: Home Office Airport Church Concert Daycare Hospital Nightclub Newsroom Post office Restaurant Pre-school Synagogue High…
2018-10-28 16:41:55,RT @BarackObama: We grieve for the Americans murdered in Pittsburgh. All of us have to fight the rise of anti-Semitism and hateful rhetoric…
2018-10-28 15:25:40,#Repost @urbanteefarm ・・・ Just one more season... . . . #netflix #netflixandchill #saturday #weekend… https://t.co/9E7KdF0qaI
2018-10-28 09:56:20,"On page 90 of 486 of See Me, by Nicholas Sparks https://t.co/zmS8UJ6wsT"
2018-10-28 04:39:21,#Repost @TeenAuthorBC ・・・ 📚Are you putting off your TBR?💀 Read a book!📚 #read #tbr #booksarelife #booknerd… https://t.co/RXcogUm4Op
2018-10-28 04:35:50,"On page 50 of 486 of See Me, by Nicholas Sparks https://t.co/hgDOiHJ6A6"
2018-10-27 18:42:02,When heaven knows I gotta work on my hand writing  ✍️ Book from @handlettereddes #handlettering… https://t.co/oznfEtbjsa
2018-10-27 16:57:15,"#Repost teachergolz ・・・ So I didn’t move from the couch for three hours, but I made this... and I can’t NOT turn it… https://t.co/Jd5XCORYis"
2018-10-27 15:35:35,Currently Reading: See Me by nicholassparks I always enjoy his books. Still have no clue how manages to punch a boo… https://t.co/xv1SWueof5
2018-10-27 09:56:57,3 of 5 stars to The Wicked Deep by Shea Ernshaw https://t.co/BgR738BdhQ
2018-10-27 03:21:21,"On page 262 of 310 of The Wicked Deep, by Shea Ernshaw https://t.co/dWeTh2Ksqq"
2018-10-27 02:33:26,"When you’re several years late into watching The Office, but this tee by @magicalmonogram had to be yours!!!!… https://t.co/PeAzfiDXaC"
2018-10-27 01:05:14,"#Repost @157ofgemma ・・・ For some of us, pets are loving family members but did you know that pets are seen as repla… https://t.co/GWksAR00VR"
2018-10-27 00:49:23,"#Repost @nakedanxiety ・・・ To everyone who didn’t get invited anywhere this weekend, to everyone spending it alone d… https://t.co/HROJbtvOZW"
2018-10-26 19:07:14,"On page 91 of 279 of The Wild Robot, by Peter Brown https://t.co/5NcJKqxImB"
2018-10-26 02:07:39,"I don’t have a book problem... YOU DO! These are all of the books I purchased this month, not including the couple… https://t.co/bTcv9led9P"
2018-10-26 01:32:40,Marked as to-read: Two Can Keep a Secret by Karen M. McManus https://t.co/tdeP35bKrt
2018-10-26 01:22:28,#Repost @AdventuresinKin ・・・ I never read anything more truer than this! Thanks digitaldivideconquer #truth… https://t.co/jyzhd6IAdo
2018-10-25 23:11:06,"#Repost barnesandnoble ・・・ Happy birthday, Anne Tyler! Let us know why you read in the comments below. https://t.co/MPW7UiNvxr"
2018-10-25 18:37:52,"On page 69 of 279 of The Wild Robot, by Peter Brown https://t.co/zduiykVsVq"
2018-10-25 03:47:05,Marked as to-read: A Map of Days by Ransom Riggs https://t.co/Jy3N7jCj2I
2018-10-25 01:36:24,"On page 177 of 310 of The Wicked Deep, by Shea Ernshaw: “Love is an enchantress-devious ... https://t.co/jg5PZjvwqb"
2018-10-24 12:05:11,Marked as to-read: A Spark of Light by Jodi Picoult https://t.co/LGiYrhlY0b
2018-10-24 03:00:09,Marked as to-read: Dragonwatch by Brandon Mull https://t.co/Bzv4Yodyhc
2018-10-24 02:43:17,If pretzels and hot Cheetos had a baby... you get my new favorite snack!!!! Genius!!!! https://t.co/JZq1UHaIaD
2018-10-23 02:33:45,"On page 102 of 308 of The Wicked Deep, by Shea Ernshaw https://t.co/8gSDCAfa2k"
