timestamp,tweet_text
2018-05-23 19:25:08,Marked as to-read: The Last of August by Brittany Cavallaro https://t.co/SpPzuQsSHW
2018-05-23 17:24:59,Marked as to-read: By Your Side by Kasie West https://t.co/plnv5TY1Tq
2018-05-23 05:57:24,"I’ve been told this before, heck it happened… https://t.co/ZoY1fE0ouz"
2018-05-23 05:44:28,Marked as to-read: The Librarian of Auschwitz by Antonio Iturbe https://t.co/lb8MSIQAzg
2018-05-23 05:17:06,#Repost @glitterglue4k2 ・・・ Yep! I go to Target… https://t.co/xH2bEQfVTY
2018-05-23 00:12:32,Marked as to-read: The Memory Keeper's Daughter by Kim Edwards https://t.co/7s7pHfTQro
2018-05-22 15:01:14,Marked as to-read: The Space Between Us by Thrity Umrigar https://t.co/EGaYIj5uRp
2018-05-22 08:07:44,"On page 110 of 342 of To Kill a Kingdom, by Alexandra Christo https://t.co/UE5ynqIrqU"
2018-05-22 03:05:25,Marked as to-read: Defiance by C.J. Redwine https://t.co/j40a24BLOe
2018-05-22 01:13:56,I liked a @YouTube video https://t.co/N7Mluc5lWW Full Coverage?! COVERGIRL VITALIST HEALTHY ELIXIR FOUNDATION! Acne/Oily Skin {First
2018-05-22 01:03:14,I liked a @YouTube video https://t.co/kp0jyf6DvH BEST FOUNDATIONS FOR OILY SKIN! Drugstore &amp; High End Options
2018-05-22 00:55:16,"#Repost @Miss_Johnston5 ・・・ Summer, I can feel… https://t.co/8PEjh9Hcgj"
2018-05-22 00:50:46,#Repost @jennyhan ・・・ I made my assistant make… https://t.co/rz7ABB9RR3
2018-05-22 00:46:44,Marked as to-read: To All the Boys I've Loved Before by Jenny Han https://t.co/q43NnR2nVg
2018-05-21 13:05:48,Marked as to-read: The Kite Runner by Khaled Hosseini https://t.co/TaSkLtsBDz
2018-05-21 04:28:31,"On page 79 of 342 of To Kill a Kingdom, by Alexandra Christo: If The Little Mermaid and ... https://t.co/xmXDvmbWqE"
2018-05-20 04:23:16,Marked as to-read: Smoke in the Sun by Renee Ahdieh https://t.co/Wt0OC7Ckxk
2018-05-20 01:19:33,Currently Reading: To Kill a Kingdom by… https://t.co/7JfBYrUmP3
2018-05-20 01:10:52,#Repost @TheSilverLoft ・・・ I wonder if he has… https://t.co/RgeFOo1TLi
2018-05-19 21:39:25,Marked as to-read: Echo by Pam Muñoz Ryan https://t.co/RZUc3A2HDw
2018-05-19 18:07:36,Marked as to-read: American Street by Ibi Zoboi https://t.co/graW9R7i0t
2018-05-19 15:28:28,RT @bbcthree: just saying ¯\_(ツ)_/¯ https://t.co/1zoOGFKeU3
2018-05-19 15:27:22,RT @emiliederavin: 6. ...And Ever.     #onceuponatimefinale @robertcarlyle_ #rumbelle @onceabcofficial 💙 https://t.co/JfocMJsRcM
2018-05-19 15:27:06,RT @MichaelSkolnik: A home. An office. A college. A concert. A daycare. An airport. A post office. A high school. A military base. A movie…
2018-05-19 03:27:41,#Repost @thecr8tiveclass ・・・ My heart broke a… https://t.co/nRHr3z7FHD
2018-05-18 22:13:09,#Repost @bookshelftees ・・・ “A well read woman… https://t.co/UiE48BTnvs
2018-05-18 13:21:37,#Repost northernlibertiesart ・・・ Lately I can't… https://t.co/PZkX1cRFgJ
2018-05-18 01:44:00,"Marked as to-read: Alex, Approximately by Jenn Bennett https://t.co/2MUIZGawY4"
2018-05-17 23:31:01,Marked as to-read: Wintersong by S. Jae-Jones https://t.co/QffxPm3e89
2018-05-17 18:56:24,3 of 5 stars to Stuart Little by E.B. White https://t.co/NCZ1jle8Er
2018-05-17 04:49:49,Marked as to-read: From the Earth to the Shadows by Amanda Hocking https://t.co/VcQgWgbJIR
2018-05-17 00:35:20,Marked as to-read: The Kissing Booth by Beth Reekles https://t.co/nEe2htknAx
2018-05-17 00:04:05,Happy Birthday to my little bro!!!… https://t.co/C9anfSsZIF
2018-05-16 18:04:36,#Repost @gerrybrooksprin ・・・ Join the… https://t.co/BKJQ7EIOq7
2018-05-16 17:52:48,I liked a @YouTube video https://t.co/eyUmkkpJEd Foundation Wear Test 14 HOUR | Best Foundation for Oily Skin?!
2018-05-16 01:10:51,#Repost @onesharpbunch ・・・ Thank you… https://t.co/tfOpDLBMMQ
2018-05-16 01:02:17,"On page 52 of 426 of The Warrior Heir, by Cinda Williams Chima https://t.co/oImzLHlICM"
2018-05-15 23:17:10,Marked as to-read: Ana of California by Andi Teran https://t.co/tp9pT0bKSp
2018-05-15 22:38:43,Marked as to-read: Saints and Misfits by S.K. Ali https://t.co/jzsJDwYcK8
2018-05-15 16:06:40,Marked as to-read: The Girl Who Smiled Beads by Clemantine Wamariya https://t.co/AUvpuKi2VQ
2018-05-15 03:29:59,"On page 12 of 426 of The Warrior Heir, by Cinda Williams Chima https://t.co/8vgfGwwTUz"
2018-05-15 01:12:35,I liked a @YouTube video https://t.co/AXCmDwiSYX Shih Tzu - Top 10 Interesting Facts
2018-05-15 00:43:48,Currently Reading: The Warrior Heir by Cinda Williams Chima.… https://t.co/lZY94aGU7k
2018-05-14 22:59:08,Marked as to-read: Loteria by Patty Rodríguez https://t.co/sckC9PTXPs
2018-05-14 04:19:40,4 of 5 stars to Emergency Contact by Mary H.K. Choi https://t.co/b0SUuo9JYp
2018-05-13 14:03:32,"#Repost wellhayley ・・・ Happy Mother’s Day, America ❤️ https://t.co/8EsTtfUcwf"
2018-05-13 10:52:16,3 of 5 stars to Three Cups of Tea by Greg Mortenson https://t.co/xmWNU5RmLA
2018-05-13 03:05:15,"On page 297 of 349 of Three Cups of Tea, by Greg Mortenson https://t.co/gbCKLCBL2w"
2018-05-13 01:03:41,Marked as to-read: Confessions of an Ugly Stepsister by Gregory Maguire https://t.co/HuXbh2rAJ5
2018-05-12 18:00:23,When your order from dandyhearts comes in and it comes with a… https://t.co/34kuzn4d4Z
2018-05-12 17:49:47,Just posted a photo https://t.co/UQAAGVbbJo
2018-05-12 14:28:12,#Repost @hansonhallway ・・・ Readers are rebels!… https://t.co/6yY9v8XWjU
2018-05-12 12:45:46,#Repost tinatbh ・・・ OUCH #tinabelcher #bobsburgers #tinatbh https://t.co/iySVjcRr5c
2018-05-12 12:04:33,"On page 90 of 131 of Stuart Little, by E.B. White https://t.co/8hJZF8KgQZ"
2018-05-12 04:28:43,Marked as to-read: Pride and Prometheus by John Kessel https://t.co/J023n9TAkl
2018-05-12 03:35:06,Yaaassss!!!!! Congrats to my friend andybri_leiva I helped set up… https://t.co/zdquXVZ2zS
2018-05-11 16:16:24,"Today we got a RedBox code from the PTO, and our Principal got us… https://t.co/arJzEjWVO7"
2018-05-11 13:17:52,#Repost @thecr8tiveclass ・・・ Like a game of Simon Says...… https://t.co/b3CzjbpuhY
2018-05-11 03:12:03,#Repost @Miss_Johnston5 ・・・ It finally hit room 29.… https://t.co/2LexHXfxd2
2018-05-11 02:54:00,"On page 172 of 394 of Emergency Contact, by Mary H.K. Choi https://t.co/ACQ6xvIH1d"
2018-05-11 02:11:48,"On page 278 of 349 of Three Cups of Tea, by Greg Mortenson https://t.co/WM8JvhEEMc"
2018-05-10 17:52:34,"Today for teacher appreciation week, the PTO got us BBQ! #teach… https://t.co/DwcQQLb187"
2018-05-10 03:14:24,Marked as to-read: Behind the Scenes at Downton Abbey by Emma Rowley https://t.co/CcXteKNjMl
2018-05-10 02:20:11,"On page 261 of 349 of Three Cups of Tea, by Greg Mortenson https://t.co/KyXVqpVZOb"
2018-05-10 01:34:54,Marked as to-read: A Study in Charlotte by Brittany Cavallaro https://t.co/yetjMQpJ32
2018-05-09 19:54:26,#Repost allthelittlethingsshop23 ・・・ Might be a new clue for the… https://t.co/Ud2fvYNXuS
2018-05-09 16:34:02,Tons of treats from the PTO today for teacher appreciation week!… https://t.co/XyDs3ESXdL
2018-05-09 04:08:52,"On page 241 of 349 of Three Cups of Tea, by Greg Mortenson https://t.co/k6R5tPDe2I"
2018-05-09 00:04:51,Just posted a photo https://t.co/vLaIIF891R
2018-05-09 00:02:54,Just posted a photo https://t.co/eKNvoCY8pH
2018-05-09 00:02:37,Just posted a photo https://t.co/2NrEDE6EgX
2018-05-09 00:01:29,Just posted a photo https://t.co/OPAsUkSBRR
2018-05-09 00:00:31,The last picture I had with mom https://t.co/9bi83j0ZFR
2018-05-08 23:59:26,Abuelita https://t.co/TBxwJDQHqb
2018-05-08 18:10:19,Today we got a large drink from the PTO for teacher appreciation… https://t.co/ST3k8ad8rv
2018-05-08 00:35:38,Got my 4 Things Tote today!!! @theshopforward #4thingstote #4things https://t.co/Um21OXhSXH
2018-05-07 13:59:35,My breakfast for teacher appreciation week! #teach #teacher #teacherappreciation https://t.co/OFdTgp5Qv4
2018-05-07 04:46:52,"On page 81 of 394 of Emergency Contact, by Mary H.K. Choi https://t.co/JgI1HV1nsZ"
2018-05-06 19:35:49,Marked as to-read: Graceling by Kristin Cashore https://t.co/DlwwLcU8HL
2018-05-06 14:00:52,Marked as to-read: Brave Jane Austen by Lisa Pliscou https://t.co/6UOwp50HVh
2018-05-06 03:36:33,"On page 174 of 349 of Three Cups of Tea, by Greg Mortenson https://t.co/GwcmbAAih5"
2018-05-06 00:45:05,Bought 3 books at Barnes &amp; Noble. The one on the left is the new Book we are… https://t.co/RdSLYiqdRi
2018-05-05 22:40:28,When you go out for a girls night to watch I Feel Pretty! #ifeelpretty https://t.co/ADXsgnytTM
2018-05-05 22:35:53,"On Star Wars Day, I posed with Han Solo! #statwarsday #maythe4thbewithyou @… https://t.co/6Jn58w3N8Y"
2018-05-05 22:03:51,When Clifford is at Barnes &amp; Noble and you must take a picture with him!… https://t.co/lHStjFER7b
2018-05-05 20:48:29,Free Comic Book Day!!! #freecomicbookday @ Outland Comics https://t.co/76enxiAiie
2018-05-05 19:19:56,Marked as to-read: The Knife of Never Letting Go by Patrick Ness https://t.co/fT3AiWzqSb
2018-05-05 18:33:41,Marked as to-read: The Warrior Heir by Cinda Williams Chima https://t.co/AptDCDzPZA
2018-05-05 16:40:17,Marked as to-read: Red Sky in Mourning by Tami Oldham Ashcraft https://t.co/Be8Slcu4Fk
2018-05-04 23:18:24,"When it be Cinco de Mayo tomorrow, and Case de Ochoa made pozole!!! @ Casa de… https://t.co/V4QqpbrkvS"
2018-05-04 21:57:14,#Repost jmaruyama ・・・ Happy Star Wars Day! #maythe4thbewithyou #StarWarsDay… https://t.co/6ski5AkBp0
2018-05-04 21:56:05,My door was decorated for teacher appreciation week!!! Darling!!!! #teach… https://t.co/GNraBAnFxm
2018-05-04 03:34:29,"On page 145 of 349 of Three Cups of Tea, by Greg Mortenson https://t.co/SQ8ssYM7jD"
2018-05-04 03:28:43,When you find out what the PTO is doing for Teacher Appreciation Week! How… https://t.co/FPrXmOO6FA
2018-05-04 02:50:26,5 of 5 stars to Because of Winn-Dixie by Kate DiCamillo https://t.co/1XAO2zSIKd
2018-05-04 00:30:35,When you get your first Karie Anne’s of the season. #karieannes… https://t.co/mEK2kcSwn0
2018-05-03 03:57:03,#Repost @weheart1st ・・・ Not sure I'm going to survive! I think I have 19… https://t.co/Fp1ZWVkbWX
2018-05-03 00:21:14,Just posted a photo https://t.co/rjDt9hALLr
2018-05-02 03:02:49,"Marked as to-read: The Green Mile, Part 1 by Stephen King https://t.co/jiLaSKuFJs"
2018-05-02 02:52:29,#Repost @tcmotivate ・・・ I mean 🤷🏼‍♀️😂 jk on my way to the gym 🤦🏼‍♀️😩 https://t.co/CaSItEwyx1
2018-05-02 01:52:21,You’re too extra when you make bookmarks with your Bitmoji of yourself for… https://t.co/rznKn0bKgV
2018-05-02 01:48:27,New books! #book #books #read #reading https://t.co/6JaCuMKFCT
2018-05-01 21:12:10,When you’re ready for Star Wars Day! #maythe4thbewithyou… https://t.co/rflkjtC1yJ
2018-05-01 18:01:05,Marked as to-read: Dear Martin by Nic Stone https://t.co/4toJ9XoocV
2018-05-01 13:02:48,Let the countdown begin! #summer #teacheronsummerbreak @ Lincoln Elementary… https://t.co/DWAOPomKN3
2018-05-01 13:01:53,My TBR list for May. It might get s bit longer with Book Club selections.… https://t.co/v1fwsadsAn
2018-05-01 13:01:02,The May quote in my Fully Booked Planner by littleinklingsdesign #book #books… https://t.co/2QHgomJ4RQ
2018-05-01 02:56:40,"On page 136 of 349 of Three Cups of Tea, by Greg Mortenson https://t.co/7mfN9cxXfU"
2018-05-01 02:10:15,Nothing has been more true than that!!!! Bahahahaha! #marvel #marvelsavengers… https://t.co/Bfj42UcEPR
2018-05-01 02:03:46,I’ve read 27 books this year. Still planning on a ton more! #book #books… https://t.co/IHcq5w16sG
2018-05-01 01:55:19,#Repost @Nellie_Nel516 ・・・ It’s official folks 😏 My birthday officially… https://t.co/TJXAazNdgN
2018-04-30 02:55:26,Marked as to-read: Morning Star by Pierce Brown https://t.co/Vs66VZuTdm
2018-04-30 01:20:00,Two new books! #book #books #reading #read https://t.co/KPkvj4kUHq
2018-04-30 01:08:16,Currently Reading: Emergency Contact by Mary H. K. Choi I’m reading it for @bookshelftees ‘… https://t.co/UdsDZX5vJw
2018-04-30 00:32:36,4 of 5 stars to When Dimple Met Rishi by Sandhya Menon https://t.co/vpLo2wR6RG
2018-04-29 21:22:35,When you catch your kitty reading one of your new books from Costco... He was reading Ash… https://t.co/POchkoAPS9
2018-04-29 15:35:30,#Repost @Miss_Johnston5 ・・・ Four. More. 💁🏼‍♀️ #teacherproblems https://t.co/BRHF6NBiEk
2018-04-29 13:54:23,"On page 125 of 349 of Three Cups of Tea, by Greg Mortenson https://t.co/ojifHVHUiu"
2018-04-29 03:22:00,"When you go and watch Infinity Wars, you wear matching tees! #marvel #marvelinfinitywar @… https://t.co/MWUm15uaXd"
2018-04-28 23:21:58,We bough these two weeks ago! #marvel #marvelsavengers #marvelsavengersinfinitywar https://t.co/dW9h7mfTDA
2018-04-28 23:00:07,You’ve been waiting 10 years for this night!!! #marvel #marvelsavengers… https://t.co/1oLKOuXsOz
2018-04-28 03:49:07,Marked as to-read: Six of Crows by Leigh Bardugo https://t.co/Czb3L5Cc3V
2018-04-28 02:18:14,When you renew (it’s been YEARS) your Barnes &amp; Noble membership and you get some book… https://t.co/mbGYtbDU5C
2018-04-27 13:01:19,Marked as to-read: It Won't Be Easy by Tom Rademacher https://t.co/0fKZJmcfAQ
2018-04-27 04:28:27,Cause nothing be more true! #kylo #kyloren #kylotrash #kylotrashforever pin by @alchemyandinkco https://t.co/BlVETwmTrI
2018-04-26 03:57:00,Just posted a photo https://t.co/kMGHK2fcqQ
2018-04-26 03:45:53,"On page 111 of 349 of Three Cups of Tea, by Greg Mortenson https://t.co/0E74ySswOK"
2018-04-25 21:03:12,Marked as to-read: Sea Witch by Sarah Henning https://t.co/5uJSAWlh0Z
2018-04-25 17:59:38,"On page 65 of 182 of Because of Winn-Dixie, by Kate DiCamillo: Darling Book so far https://t.co/0Uz8E1Xpim"
2018-04-25 05:52:08,Marked as to-read: Before We Were Yours by Lisa Wingate https://t.co/Ml7X6W8rV9
2018-04-25 00:51:11,"On page 98 of 349 of Three Cups of Tea, by Greg Mortenson: I wish this book was in first... https://t.co/miIr4JSSeF"
2018-04-24 06:03:37,"On page 59 of 380 of When Dimple Met Rishi, by Sandhya Menon https://t.co/0c2O31c7hJ"
2018-04-24 04:37:11,Marked as to-read: Unravel Me by Tahereh Mafi https://t.co/NWwpJAXH8v
2018-04-23 02:26:21,"On page 20 of 380 of When Dimple Met Rishi, by Sandhya Menon https://t.co/57tpwWgtxy"
2018-04-23 02:14:19,#Repost northernlibertiesart ・・・ Who gets caught in this Gilmore Girls circle? 🤣🙋‍♀️😂 Tag your… https://t.co/I3O2nd9OAC
2018-04-22 23:52:34,Marked as to-read: Stay Sweet by Siobhan Vivian https://t.co/qiGfhikanf
2018-04-22 22:13:44,"I’m having a hard time reading Three Cups of Tea, so I’m reading When Dimple Met Rishi by… https://t.co/JN2YeqfUEh"
2018-04-22 21:39:37,"On page 47 of 349 of Three Cups of Tea, by Greg Mortenson https://t.co/oOtJclriC1"
2018-04-22 18:45:43,Marked as to-read: 99 Days by Katie Cotugno https://t.co/onUBxSc9Ha
2018-04-22 16:56:00,Marked as to-read: Furyborn by Claire Legrand https://t.co/bTqGRUQOqR
2018-04-22 15:24:49,Marked as to-read: Scarlet by Marissa Meyer https://t.co/67MgZVQVWt
2018-04-22 13:33:09,Today is the 20th anniversary of Disney’s Animal Kingdom. It became my 2nd most favorite park… https://t.co/5ehATBXLB1
2018-04-22 04:40:29,"On page 19 of 349 of Three Cups of Tea, by Greg Mortenson https://t.co/3hrs41EOLc"
2018-04-21 18:13:51,Toby before his grooming and after his grooming! He needed it desperately! #toby #tobesters #emo… https://t.co/wnN4WksNBn
2018-04-21 17:09:55,Marked as to-read: My Lucky Life in and Out of Show Busi... by Dick Van Dyke https://t.co/ECaiBgZzg7
2018-04-21 17:09:02,#Repost @besamecosmetics ・・・ A Gabriela Surprise... she reveals in our Live Stream that you have… https://t.co/TskkdNS1ZH
2018-04-21 16:02:07,#Repost secondgradelife ・・・ Saturday vibes✌💤 https://t.co/bs7Fjr0l5j
2018-04-21 13:05:46,Marked as to-read: Destroy Me by Tahereh Mafi https://t.co/KOLikrqIEV
2018-04-20 08:32:09,4 of 5 stars to Deadly Inheritance by Clair M. Poulson https://t.co/RszpOIYsUd
2018-04-20 07:16:36,Marked as to-read: Sam &amp; Ilsa's Last Hurrah by David Levithan https://t.co/9CZQHLnHZS
2018-04-20 06:45:27,Marked as to-read: A Date with Darcy by Tiffany Schmidt https://t.co/NFccI4uGUJ
2018-04-20 03:55:58,"On page 176 of 272 of Deadly Inheritance, by Clair M. Poulson https://t.co/JsUn2jLsva"
2018-04-20 03:48:08,#Repost beinspired2bebetter https://t.co/8lyejVmUxs
2018-04-20 02:10:18,Marked as to-read: Mount Hope by Sarah Price https://t.co/gm1GKm4xT4
2018-04-20 00:47:44,Marked as to-read: The Immortalists by Chloe Benjamin https://t.co/bHVQdM2TRB
2018-04-19 20:44:54,4 of 5 stars to Wayside School Gets A Little Stranger by Louis Sachar https://t.co/vnQ1lZATYs
2018-04-19 19:49:47,Oh yeah! Celebrating Earth Day! 🌏 #earthday #earthday🌎 #Teach #teacher #iteach #iteachtoo… https://t.co/bgLIQvrB56
2018-04-19 05:22:31,"On page 105 of 272 of Deadly Inheritance, by Clair M. Poulson https://t.co/UMDtn6zQO9"
2018-04-19 03:50:23,"Marked as to-read: From Twinkle, with Love by Sandhya Menon https://t.co/uypOH4SOH7"
2018-04-19 02:34:21,#Repost @thyroidchange ・・・ Is it your thyroid? Here are just a few symptoms. What were… https://t.co/L7szyJk1FP
2018-04-19 00:47:24,"Marked as to-read: Spies, Lies, and Allies by Lisa Brown Roberts https://t.co/tUJrpyEiVG"
2018-04-18 04:07:40,"On page 21 of 272 of Deadly Inheritance, by Clair M. Poulson https://t.co/aALwUjDOB3"
2018-04-18 03:11:44,Marked as to-read: Setting Limits in the Classroom by Robert J. MacKenzie https://t.co/sXK5cgVFsO
2018-04-18 00:49:49,Marked as to-read: The Home for Unwanted Girls by Joanna Goodman https://t.co/48u1Js1al4
2018-04-17 23:48:31,kori_flores @mickee28 #Repost @urbanteefarm ・・・ Just the foods of Gilmore girls… https://t.co/kQxgnGHn8b
2018-04-17 23:42:01,#Repost mrshenryinfirst ・・・ 😂😂😂 aperfectblendteaching never disappoints! I'm obsessed with her… https://t.co/tvWpksAeqV
2018-04-17 23:06:33,This is the book I’m reading for the first book club I’m in. Deadly Inheritance by Clair M.… https://t.co/80eDxbk2BP
2018-04-17 23:03:15,I’ve got my small earth day gift ready for my students! Idea from @sparklingin2nd #earthday… https://t.co/bMG2yeUMmB
2018-04-17 02:13:33,"On page 130 of 251 of What Light, by Jay Asher https://t.co/UOw9dzICwt"
2018-04-17 01:36:29,Marked as to-read: The Dark Side of Innocence by Terri Cheney https://t.co/fhm8ceO3Gg
2018-04-16 23:14:12,"#Repost @TOFWLive ・・・ When Tom Christofferson came out to his parents as gay, their loving and… https://t.co/9OWBCBpANU"
2018-04-16 22:27:40,The next book club read for the second book club I’m in. I’ll start it after I finish the 1st… https://t.co/2csPOnFYOd
2018-04-16 18:37:14,"On page 107 of 176 of Wayside School Gets A Little Stranger, by Louis Sachar https://t.co/rcNdag3S7P"
2018-04-16 02:31:42,Marked as to-read: Kalona's Fall by P.C. Cast https://t.co/arVm5CAy3g
2018-04-16 01:56:48,Story of my life... #Repost glittersips ・・・ ☕️Deal of the Week!☕️ Our popular “She believed she… https://t.co/40K28rNYXo
2018-04-15 20:24:09,"Currently reading: What Light by Jay Asher. It’s Christmas themed, so it feels off to read it… https://t.co/pkkiSTQlqP"
2018-04-15 18:07:05,5 of 5 stars to Alex and Eliza by Melissa de la Cruz https://t.co/VFYpCHR3ol
2018-04-15 04:55:44,"On page 238 of 368 of Alex and Eliza, by Melissa de la Cruz: Marry for love or marry for... https://t.co/sUwTRWtU3C"
2018-04-14 20:58:32,Marked as to-read: The Watchmaker's Daughter by C.J. Archer https://t.co/9bNMc5ygQK
2018-04-14 19:45:40,Marked as to-read: Deadly Inheritance by Clair M. Poulson https://t.co/RszpOIYsUd
2018-04-14 13:53:30,Just posted a photo https://t.co/OaRpSc8FIW
2018-04-14 13:52:44,Just posted a photo https://t.co/hnxvCRHArh
2018-04-14 08:21:31,#Repost bippityboppitybuttons ・・・ Someone come mop up my tears 😭 https://t.co/oapcYcFMKq
2018-04-14 06:08:45,"On page 121 of 368 of Alex and Eliza, by Melissa de la Cruz: Sweet story so far https://t.co/2pojycB1nf"
2018-04-13 22:38:11,#Repost disneylifestylers ・・・ Repost from disney4men - Here’s a close up of the May mickeymouse… https://t.co/gozsOIGox4
2018-04-13 03:17:25,"On page 33 of 368 of Alex and Eliza, by Melissa de la Cruz https://t.co/LesSLIYrj6"
2018-04-12 23:08:14,Marked as to-read: Girls of Paper and Fire by Natasha Ngan https://t.co/Bzj1bmu16Q
2018-04-12 22:09:14,Wants!!!!! #Repost @victoriaaveyard ・・・ Want this most excellent Scarlet Guard pull-out map with… https://t.co/OhL3UZIbJ3
2018-04-12 03:11:13,"On page 6 of 368 of Alex and Eliza, by Melissa de la Cruz https://t.co/JdE2bLcPZv"
2018-04-12 02:30:58,Currently Reading: Alex &amp; Eliza by Melissa De La Cruz #read #reading #currentlyreading #book #books https://t.co/1sJpbLSMJa
2018-04-12 02:25:25,4 of 5 stars to King's Cage by Victoria Aveyard https://t.co/i5ywmaeQxJ
2018-04-12 00:24:19,#Repost teaformanatee ・・・ ✨Pet Portrait Giveaway✨ I'm giving away a FREE digital pet portrait… https://t.co/H7Gywn3u3u
2018-04-11 23:02:48,Marked as to-read: You Know Me Well by Nina LaCour https://t.co/6StEb57Rho
2018-04-11 23:00:50,When @gerrybrooksprin likes your repost!!!! #suriously #fangirl #fangirling https://t.co/njTqsxGkpu
2018-04-11 22:48:49,Buy me books and tell me I’m pretty! I heard this books series is good. From a friend and… https://t.co/we1spgrHfe
2018-04-11 13:08:20,Dragging on to get to the last day of school #Repost @Historyinheels_ ・・・ #testingseason has… https://t.co/pcKDhnDOfi
2018-04-11 03:49:25,"On page 430 of 528 of King's Cage, by Victoria Aveyard https://t.co/dx8tRzAwzJ"
2018-04-11 01:20:45,Marked as to-read: Not That Bad by Roxane Gay https://t.co/kujjMd20c4
2018-04-10 22:31:38,Marked as to-read: Save the Date by Morgan Matson https://t.co/tUi8HVgKPz
2018-04-10 22:23:31,"This is the greatest movie! #thegreatestshowman #movie #movienight @ Rexburg, Idaho https://t.co/P3dVn8AZuU"
2018-04-10 08:17:19,"On page 377 of 528 of King's Cage, by Victoria Aveyard https://t.co/GGYxSfxmxa"
2018-04-10 02:41:07,"On page 356 of 528 of King's Cage, by Victoria Aveyard https://t.co/iq6590gWtU"
2018-04-09 23:57:20,Marked as to-read: The Female Persuasion by Meg Wolitzer https://t.co/kg6v4YLNbd
2018-04-09 20:47:36,Marked as to-read: Dread Nation by Justina Ireland https://t.co/jwXJa7FfhD
2018-04-09 05:01:36,"On page 319 of 528 of King's Cage, by Victoria Aveyard: Daaaaang! Craziness. https://t.co/F6iqjeutSd"
2018-04-09 00:12:37,"On page 254 of 528 of King's Cage, by Victoria Aveyard: Dang Maven! Not Mare, not Evange... https://t.co/0nWyK8zAcP"
2018-04-08 22:58:52,#mondaystilsummer thewholewheatclass https://t.co/3SEx3kTHOn
2018-04-08 18:15:15,I am still peeved about the film Every Day. Sigh... #thebookwasbetter shirt by @bookshelftees… https://t.co/2QgXjjn9tb
2018-04-08 06:09:28,"On page 186 of 528 of King's Cage, by Victoria Aveyard https://t.co/zDIBFFOhR5"
2018-04-08 04:50:23,Oh gosh it was different than the book... loved the books way more! #everyday #anotherday… https://t.co/yMy17r1jXt
2018-04-07 23:17:07,"Marked as to-read: Will Grayson, Will Grayson by John Green https://t.co/pUwuWf966o"
2018-04-07 16:47:58,Marked as to-read: President Darcy by Victoria Kincaid https://t.co/qbNiVknITU
2018-04-07 14:22:50,Marked as to-read: The Dead and the Gone by Susan Beth Pfeffer https://t.co/br4R307c29
2018-04-07 07:00:56,"On page 161 of 528 of King's Cage, by Victoria Aveyard https://t.co/NF8GYHRnYg"
2018-04-07 06:45:40,#Repost wearemitu ・・・ Never gonna happen lol https://t.co/iI1Ws2OPIh
2018-04-07 06:18:34,Marked as to-read: My Dear Hamilton by Stephanie Dray https://t.co/pDKzV1b2Hx
2018-04-07 03:34:23,Marked as to-read: Bad Girls Throughout History by Ann Shen https://t.co/BVe7X21dDg
2018-04-06 06:43:34,"On page 150 of 528 of King's Cage, by Victoria Aveyard https://t.co/x8YfbyEgcZ"
2018-04-06 05:54:08,Marked as to-read: Lenobia's Vow by P.C. Cast https://t.co/Xedpojr8TB
2018-04-06 02:44:54,Marked as to-read: Circe by Madeline Miller https://t.co/Mms6t5EVjB
2018-04-05 23:44:24,Marked as to-read: Is Everyone Hanging Out Without Me? by Mindy Kaling https://t.co/FAzv7520UL
2018-04-05 21:11:59,Marked as to-read: Words in Deep Blue by Cath Crowley https://t.co/S2d5UF5e6n
2018-04-05 05:34:58,"On page 56 of 528 of King's Cage, by Victoria Aveyard https://t.co/CHLsazWZ11"
2018-04-04 18:32:19,Currently Reading: Kong’s Cage. The final book in the series is being released next month. Gotta… https://t.co/JaZG9Xw1LM
2018-04-04 05:47:14,Marked as to-read: Blood Water Paint by Joy McCullough https://t.co/idEaCDeLfZ
2018-04-04 04:42:24,Marked as to-read: The Hundredth Queen by Emily R. King https://t.co/lfEXzHvkcH
2018-04-04 04:23:20,#Repost magicalvacationplanner ・・・ We are obsessed with Disney snacks! Which one is your… https://t.co/AHW4mLzys5
2018-04-04 01:44:00,I need this candle #Repost madriverlaser ・・・ #tuesday https://t.co/NpFXPjyrNQ
2018-04-04 01:27:21,Marked as to-read: Brazen by Pénélope Bagieu https://t.co/ykAzQ4JeVG
2018-04-03 20:51:07,Marked as to-read: The Female of the Species by Mindy McGinnis https://t.co/rCf060oXEc
2018-04-03 04:44:34,"On page 96 of 232 of Ella Enchanted, by Gail Carson Levine: Gosh, the book and the movie... https://t.co/6fGfYmv4JC"
2018-04-02 18:36:13,#Repost thecwtvd ・・・ No need to wait forever. The final season of #TheOriginals begins… https://t.co/3aIcw8gGzC
2018-04-02 15:23:15,@mickee28 !!!!!!!! #Repost trendmood1 ・・・ OMG! #MakeupNews 💄☕️🙀 The Beauty Industry is… https://t.co/5UxPvtBiSV
2018-04-02 14:37:16,Currently reading: Ella Enchanted. #currentlyreading #read #reading #book #books https://t.co/DP121sKcqr
