timestamp,tweet_text
2019-06-09 04:12:15,@jadynbee_ It’s dobby! https://t.co/8lJsfLPHIq
2019-06-08 16:11:51,"26% done with Montauk, by Nicola Harrison https://t.co/pnW1G5Xaks"
2019-06-08 15:18:21,@lucindariley @panmacmillan I love all the books but this was a particular favorite. Such a marvelous series. Also… https://t.co/jGLKXHuG8n
2019-06-08 13:48:37,Review: The Shadow Sister (The Seven Sisters #3) by Lucinda Riley (Audible Edition) https://t.co/tBIPmA3A8m… https://t.co/BF1fjrjBD9
2019-06-08 13:46:55,Anyone here read this series before 🙋🏼‍♀️. I’m reading it for the second time and loving it even more this time thr… https://t.co/Q9Glx28syO
2019-06-08 04:52:20,RT @AnnaLeeHuber: I'm absolutely thrilled to announce that A BRUSH WITH SHADOWS is a finalist for the 2019 Daphne Award in the Historical R…
2019-06-08 03:26:57,"RT @SusanMacNeal: Twelve secret agents imprisoned on a remote Scottish island during #WWII—what could go wrong? #ThePrisonerintheCastle, #m…"
2019-06-08 03:23:31,"13% done with Montauk, by Nicola Harrison https://t.co/XLQmaTbKdM"
2019-06-07 14:30:03,Review: The Right Sort of Man (Sparks and Bainbridge Mystery #1) by Allison Montclair https://t.co/nFJEN6qp5T @MinotaurBooks
2019-06-07 14:24:04,🚨 GIVEAWAY ALERT 🚨 ⠀⠀⠀⠀ I am so happy to announce that I have a copy of this wonderful book up for giveaway this we… https://t.co/oFo4gcQsq6
2019-06-07 00:14:11,"85% done with The Right Sort of Man, by Allison Montclair https://t.co/1gxBNzXnyc"
2019-06-06 19:04:03,"56% done with The Right Sort of Man, by Allison Montclair https://t.co/9ue32Zx07g"
2019-06-06 13:00:42,@abruno77 Congrats friend!!!! https://t.co/dTjxGvybxm
2019-06-06 13:00:04,Review: At the Mountain's Edge by Genevieve Graham https://t.co/qrP0xZJHgO @GenGrahamAuthor @simonschuster @SimonBooks
2019-06-06 12:50:14,I have this book up for review on the blog today! I’ve consistently been impressed with Genevieve Graham’s novels.… https://t.co/QPqoPmiiZd
2019-06-06 04:15:12,"RT @Soraya_Lane: So excited to share the cover of my upcoming release! The Girls of Pearl Harbor, available 16th July! #sneakpeak #coverlov…"
2019-06-06 02:24:03,"41% done with The Right Sort of Man, by Allison Montclair https://t.co/nC1oDKnowt"
2019-06-05 22:07:25,4 of 5 stars to The Night Before by Wendy Walker https://t.co/uFiOtRhiCk
2019-06-05 21:10:28,"29% done with The Right Sort of Man, by Allison Montclair https://t.co/S9m7xXGF1X"
2019-06-05 16:40:02,RT @msheatherwebb: 8 weeks to go to the launch of #MeetMeinMonaco and @WmMorrowBooks surprised us with this gorgeous little video! Are we r…
2019-06-05 14:01:20,Review: The Night Before by Wendy Walker https://t.co/WdxrWDuzv1 @StMartinsPress
2019-06-05 13:56:28,@AnnaLeeHuber I’m sure they are going to be great! I can’t wait for the third book!
2019-06-05 13:43:17,One of my favorite Instagram props is my antique typewriter. I bought it at a thrift store for $30. It’s so heavy b… https://t.co/csdjuER0Qr
2019-06-05 04:21:33,@MarsalLyonLit @AlisonStuart14 @AnnaLeeHuber Sounds like a wonderful read!
2019-06-05 04:20:45,"6% done with The Right Sort of Man, by Allison Montclair https://t.co/OPifIFpDc1"
2019-06-05 04:19:15,@crystallyn @bookfrolic @HFVBT @AtriaBooks @oc_readers @CometReadings @GirlsJustRead @coffeeandink2 @bookreviewscan… https://t.co/IEPxgI0Ihr
2019-06-05 01:26:56,RT @Austenprose: $3.99 #sale of the #ebook of THE LOST GIRLS OF PARIS: A Novel by @PamJenoff. #histfic @parkrowbooks @HarlequinBooks   “Pam…
2019-06-04 20:39:07,Review: The Vanishing Man (Charles Lenox Mysteries 0.2) by Charles Finch https://t.co/9STePKtN6q @CharlesFinch @MinotaurBooks
2019-06-04 16:41:20,"84% done with At the Mountain's Edge, by Genevieve Graham https://t.co/oM7vmYshoO"
2019-06-04 13:48:05,🚨 GIVEAWAY ALERT 🚨 ⠀⠀⠀ I am so happy to announce that I have a copy of this wonderful book up for giveaway this wee… https://t.co/9oRfsjIOku
2019-06-04 02:29:13,"Iceland, Egypt, and Israel  #3PlacesToSeeBeforeIDie"
2019-06-03 22:23:03,"81% done with The Night Before, by Wendy Walker https://t.co/6jkeml5gvA"
2019-06-03 14:26:49,Review: The Friends We Keep by Jane Green https://t.co/x6luidcF0A @BerkleyPub #mondayblogs #amreading
2019-06-03 14:25:37,I have this lovely novel about friendships up for review on the blog today! Jane Green could easily become a favori… https://t.co/d276998mMI
2019-06-03 08:47:26,"84% done with The Vanishing Man, by Charles Finch https://t.co/QvffRwaohq"
2019-06-03 02:22:38,"67% done with The Vanishing Man, by Charles Finch https://t.co/HYVGFNno9t"
2019-06-03 01:33:22,"48% done with The Vanishing Man, by Charles Finch https://t.co/AZfGs0Ckfv"
2019-06-02 21:15:56,"30% done with The Vanishing Man, by Charles Finch https://t.co/0sDcFXRw4Z"
2019-06-02 17:43:29,It’s Sunday people and I have another peak at some of my bookshelves for today’s #shelfiesunday ⠀ ⠀ I had them orga… https://t.co/YS3Y8EJhhf
2019-06-02 04:26:15,"13% done with The Vanishing Man, by Charles Finch https://t.co/RHIPuvV3I9"
2019-06-01 23:59:46,"67% done with The Night Before, by Wendy Walker https://t.co/ibyttbgMt1"
2019-06-01 16:07:48,Special Feature/Excerpt: THE SUMMER OF SUNSHINE AND MARGOT by Susan Mallery https://t.co/2MnNbbgzmW @SusanMallery @TLCBookTours #amreading
2019-06-01 16:05:26,Yesterday apaperescape asked who your first ever book boyfriend was and I have to admit I was sort of stumped for a… https://t.co/eGjCsmXjQt
2019-06-01 14:01:51,RT @erinmorgenstern: Good morning #BookCon day. https://t.co/vgUWO4K5Vb
2019-06-01 14:00:52,"RT @SusanMallery: Today's stop on the #excerpt tour for THE SUMMER OF SUNSHINE &amp; MARGOT has, I think, the first-ever look at chapter TWO :)…"
2019-06-01 14:00:21,"43% done with The Night Before, by Wendy Walker https://t.co/n1o9WMTfPb"
2019-06-01 03:56:24,"On page 333 of 384 of The Friends We Keep, by Jane Green https://t.co/2t94rmx76s"
2019-05-31 22:15:55,Review: Murder Once Removed (Ancestry Detective #1) by S.C. Perkins https://t.co/qdAHyhLri1 @BerkleyMystery @BerkleyPub
2019-05-31 21:27:26,"On page 294 of 384 of The Friends We Keep, by Jane Green https://t.co/dP8I6rZPBx"
2019-05-31 21:22:30,🚨 GIVEAWAY ALERT 🚨   THANK YOU EVERYONE WHO HELPED ME GET TO 1K!   Yet that’s right I finally made it to 1K and I h… https://t.co/36kvRIXjaG
2019-05-31 21:07:25,I have this new mystery series up for review on my blog today! Come check it out!   QOTD: this book features a gene… https://t.co/T7MqE6s20T
2019-05-31 11:49:34,"On page 197 of 384 of The Friends We Keep, by Jane Green https://t.co/wDoqnv6A7O"
2019-05-30 21:18:23,Review: The Alchemist of Lost Souls (Bianca Goddard Mysteries #4) by Mary Lawrence https://t.co/OjHnpOuLJc via @wordpressdotcom
2019-05-30 20:55:44,"19% done with At the Mountain's Edge, by Genevieve Graham https://t.co/KZw3GsNKhz"
2019-05-30 16:30:03,I’ve got this awesome book up for review on the blog today! If you like historical mysteries then this book is for… https://t.co/kIshOe4Oyr
2019-05-30 03:15:20,"On page 104 of 384 of The Friends We Keep, by Jane Green https://t.co/12wBnIErbN"
2019-05-29 21:18:25,"On page 68 of 384 of The Friends We Keep, by Jane Green https://t.co/NFqIJW5O6g"
2019-05-29 14:45:09,"10% done with At the Mountain's Edge, by Genevieve Graham https://t.co/HoqXoAkRIo"
2019-05-29 13:41:56,"I’ve asked the question quite a bit in the past, the most underrated classics. Now I want to know what classic do y… https://t.co/JEkRUiZhsK"
2019-05-28 15:04:22,Review: Resistance Women by Jennifer Chiaverini https://t.co/2cQNhjCeZn @Morrow_PB #amreading
2019-05-28 15:02:51,I have a treat for you guys this morning! This book is up for review on my blog today so come by and check it out!… https://t.co/9oAhDLphaz
2019-05-28 02:15:54,"78% done with Murder Once Removed, by S.C. Perkins https://t.co/gmNNtDGFkS"
2019-05-27 21:52:26,4 of 5 stars to The Storm Sister by Lucinda Riley https://t.co/4YcPc7OmXU
2019-05-27 20:58:01,"Finished with The Alchemist of Lost Souls, by Mary Lawrence https://t.co/4wbV6Q1vRw"
2019-05-27 13:41:43,Its been a busy 3 day weekend at my house. I’ve been reading and catching up on my blog posts for this week.⠀ ⠀ QOT… https://t.co/5oq7PVbp3a
2019-05-26 19:30:58,"On page 500 of 608 of Resistance Women, by Jennifer Chiaverini https://t.co/CqNvFQLffD"
2019-05-26 15:02:05,Take Two Review: The Storm Sister (The Seven Sisters #2) by Lucinda Riley (Audible) https://t.co/W9W1qflhw8 via @wordpressdotcom
2019-05-26 14:13:18,It's #shelfesunday and I love sharing my bookshelves with you guys! I have since added a lot of books to this photo… https://t.co/gStCzSAV28
2019-05-25 22:55:23,"On page 456 of 608 of Resistance Women, by Jennifer Chiaverini https://t.co/fpTNJbvi2n"
2019-05-25 16:46:41,Special Feature: Excess Baggage by Laura Barnard https://t.co/XTJFg1n06H @BarnardLaura
2019-05-25 16:21:18,I have this book coming up for review tomorrow on my blog. This will be a 'take two' review for me since I already… https://t.co/C1h9cbb8Z1
2019-05-25 15:52:33,"On page 132 of 320 of The Alchemist of Lost Souls, by Mary Lawrence https://t.co/vyJDNO9c1i"
2019-05-24 22:09:39,"On page 98 of 320 of The Alchemist of Lost Souls, by Mary Lawrence https://t.co/Ze5pv7qSvw"
2019-05-24 14:06:35,"On page 336 of 608 of Resistance Women, by Jennifer Chiaverini https://t.co/JSMjoXRysT"
2019-05-24 14:05:29,"@AnnaLeeHuber Agree! As an educator myself, sick kids coming to school is not helpful! Everyone gets sick. So pointless!"
2019-05-24 14:04:22,Review: How We Disappeared by Jing-Jing Lee https://t.co/Zf8bchMTPR @TLCBookTours #fridayreads
2019-05-24 13:54:36,Today I am really missing the fall and it’s even raining out today here in the PacNW which makes me miss it even mo… https://t.co/13ZxPAeRhM
2019-05-24 02:56:38,"On page 301 of 608 of Resistance Women, by Jennifer Chiaverini https://t.co/0NJexvAzO4"
2019-05-23 21:33:42,"On page 31 of 320 of The Alchemist of Lost Souls, by Mary Lawrence https://t.co/sSjaDsecxR"
2019-05-23 15:27:12,"On page 266 of 608 of Resistance Women, by Jennifer Chiaverini https://t.co/wHzbGq7GaT"
2019-05-23 13:48:59,"REVIEW: Pride, Prejudice, and Other Flavors (The Rajes #1) by Sonali Dev https://t.co/pvUyWgCW22 @TallPoppyWriter"
2019-05-23 13:45:39,I love Jane Austen re-tellings and this book was an absolute treat to read! You will find many of the Austen hallma… https://t.co/L0C66guKp5
2019-05-23 02:57:52,RT @KateMoretti1: Show of hands 🙌 to all the moms who are 💯 over the month of May. #sendwine #maycember #done #momlife #softball🥎#springtim…
2019-05-23 02:57:13,RT @BloomsburyRaven: It seems fitting to announce on #WorldGothDay that signed copies of BONE CHINA by @spookypurcell are now available to…
2019-05-23 02:25:21,"64% done with How We Disappeared, by Jing-Jing Lee https://t.co/k9eAMO5xzP"
2019-05-22 22:20:20,#1stVideoGameCrush https://t.co/C8Nhx90uub
2019-05-22 21:55:15,"50% done with How We Disappeared, by Jing-Jing Lee https://t.co/uhRLPzk1Xb"
2019-05-22 20:05:00,"In honor of Sir Arthur Conan Doyle’s birthday today, I am so including a second post! ⠀ ⠀ QOTD: which of the Sherlo… https://t.co/1qwCjGTXZN"
2019-05-22 19:54:53,REVIEW: The Royal Secret by Lucinda Riley https://t.co/6BChBWKnHy via @wordpressdotcom
2019-05-22 19:51:03,I have this exceptional book up for review on my blog today! I am a HUGE Lucinda Riley fan people and this book was… https://t.co/48dELvw7Mc
2019-05-22 19:22:24,"35% done with How We Disappeared, by Jing-Jing Lee https://t.co/7Y7spE1qxr"
2019-05-22 14:04:09,@SusanMacNeal @penguinrandom @PenguinRH_News Yesssssssss https://t.co/hwQ0Xjjnon
2019-05-21 20:27:15,Prince Eric  #1stCartoonCrush https://t.co/vkIlmzJyEY
2019-05-21 15:45:44,Review: Mistress of the Ritz by Melanie Benjamin https://t.co/fTwBAJsiuz via @wordpressdotcom
2019-05-21 14:01:42,Summer reading is fully underway! I’ve read so many wonderful beach reads lately and I can’t wait until it’s consis… https://t.co/A9Ay4wLXLu
2019-05-21 11:27:55,"15% done with How We Disappeared, by Jing-Jing Lee https://t.co/XOq7VDmBce"
2019-05-20 15:47:25,"89% done with The Royal Secret, by Lucinda Riley https://t.co/VwCMSxh6mt"
2019-05-20 15:40:50,Who here feels a Game of Thrones hangover today? I know I do but all good things must come to an end. ⠀ ⠀ QOTD: did… https://t.co/E36SODhwvI
2019-05-20 00:56:06,RT @GameOfThrones: Send a raven.  #TheFinalEpisode is about to begin.
2019-05-19 23:55:54,3 of 5 stars to A Murderous Malady by Christine Trent https://t.co/8JAOUc5LIH
2019-05-19 22:31:59,"77% done with Pride, Prejudice, and Other Flavors, by Sonali Dev https://t.co/CCu3B6iUSQ"
2019-05-19 19:31:47,"75% done with The Royal Secret, by Lucinda Riley https://t.co/lXvGSDFDfn"
2019-05-19 14:59:52,"The final episode, ever, is tonight. I feel like it’s the ending of an era. I have no idea what I’m going to watch… https://t.co/EvCNfnB6zO"
2019-05-18 21:00:24,"57% done with The Royal Secret, by Lucinda Riley https://t.co/kxrTTBI2Wm"
2019-05-18 13:44:31,"30% done with Pride, Prejudice, and Other Flavors, by Sonali Dev https://t.co/oAsS77zTQx"
2019-05-18 13:42:37,Special Feature: Smoke In Her Eyesby Anna Belfrage https://t.co/Y6VhX8QO2Q @HFVBT @AnnaBelfrage
2019-05-18 13:31:09,Today I’m gearing up for the final episode ever of Game of Thrones tomorrow! Last episode was full of controversy.… https://t.co/KrriKtOy1Y
2019-05-18 04:08:33,"89% done with Mistress of the Ritz, by Melanie Benjamin https://t.co/q2lf1uYk6p"
2019-05-17 13:37:05,Review: A Murderous Malady (Florence Nightingale Mystery #2) by Christine Trent https://t.co/FpqZdh5Z52 @HFVBT #FridayReads
2019-05-17 13:31:51,I’ve got this wonderful historical mystery up for review today on my blog as a #partner with the hfvbt be sure to c… https://t.co/4hfUxPnGHL
2019-05-17 11:41:52,"74% done with Mistress of the Ritz, by Melanie Benjamin https://t.co/6smDivQmLv"
2019-05-17 11:29:01,@thereaderbee Also where did you get your currently reading bookmark?! So cute!!
2019-05-17 11:28:34,@thereaderbee I hope to start we hunt the flame this weekend as well!!
2019-05-17 03:05:46,"23% done with Pride, Prejudice, and Other Flavors, by Sonali Dev https://t.co/EqwMDiE1BS"
2019-05-16 19:58:51,"41% done with Mistress of the Ritz, by Melanie Benjamin https://t.co/OVZfHPd0j6"
2019-05-16 16:00:28,"RT @HesterBFox: Doing my 1st arc giveaway for THE WIDOW OF PALE HARBOR!   Send me proof of a donation (any amount) to @yellowfund, @PPFA or…"
2019-05-16 14:50:57,Review: Sunset Beach by Mary Kay Andrews https://t.co/7Vs1atYPiK via @wordpressdotcom
2019-05-16 14:38:02,Some people think e-readers are soulless and that you just don’t get the same experience reading on an e-reader tha… https://t.co/db1lRxETqI
2019-05-16 13:46:06,RT @HFVBT: A huge thanks to THE SILENT WOMAN #blogtour hosts!  @coffeeandink2 @2readornot2read @Linda_MRC @PursuingStacie @_quirkybookworm…
2019-05-16 04:24:48,"14% done with Pride, Prejudice, and Other Flavors, by Sonali Dev https://t.co/wyEgoaFz4p"
2019-05-16 00:32:24,@hafsahfaizal Bummer but at least I got a copy of your book so I’m happy about that 🥰🥰🥰🥰
2019-05-16 00:28:46,@hafsahfaizal Any chance your tour will bring you to Portland OR
2019-05-15 16:03:05,"On page 301 of 336 of A Murderous Malady, by Christine Trent https://t.co/6xLOaZphXD"
2019-05-15 15:07:16,@andydiacetis @fimoculous https://t.co/fkaQyAiiDP
2019-05-15 15:06:13,@fimoculous I have so so so many I could list here. But I play it safe and go with wearing CK One as my signature s… https://t.co/77EHKiF0To
2019-05-15 15:05:34,"RT @dontforgetjames: A big shout out to Lena Headey who made $1,000,000 an episode this season for standing at a window drinking a glass of…"
2019-05-15 15:01:23,Review: The Silent Woman (Cat Carlisle #1) by Terry Lynn Thomas https://t.co/J3N86akS4P @HFVBT
2019-05-15 13:52:04,I love reading classics but sometimes I wonder how and why one became a classic?! Gullivers Travels I’m looking at… https://t.co/e37ff9apIX
2019-05-14 22:03:15,"On page 105 of 336 of A Murderous Malady, by Christine Trent https://t.co/DwWOG1MzYu"
2019-05-14 14:08:08,Review: The Overdue Life of Amy Byler by Kelly Harms https://t.co/4cLIA1yuv3 @TallPoppyWriter #tallpoppybloggers #tallpoppywriters
2019-05-14 14:07:14,Special Feature: Good Trouble: Stories by Joseph O'Neill https://t.co/aJCveqWV4p via @wordpressdotcom
2019-05-14 14:04:42,I have this absolutely amazing book up for review on my blog today! If you are a mom and a mom that especially love… https://t.co/sy07vHsUiB
2019-05-14 13:31:24,"RT @TallPoppyWriter: Congrats to our @TifMarcelo on the much-anticipated #newrelease THE KEY TO HAPPILY EVER AFTER, a charming #romcom ""Ful…"
2019-05-14 11:51:57,"7% done with The Royal Secret, by Lucinda Riley https://t.co/OSWQPgIE4j"
2019-05-14 02:26:17,4 of 5 stars to Naughty in Nice by Rhys Bowen https://t.co/P98thWa1jH
2019-05-14 02:24:03,"Be sure to come check out my special feature and excerpt for, The Catherine Howard Conspiracy by Alexandra Walsh… https://t.co/NfjlG3xBzC"
2019-05-13 22:06:14,"60% done with The Silent Woman, by Terry Lynn Thomas https://t.co/o53FM93pTu"
2019-05-13 17:15:36,"36% done with The Silent Woman, by Terry Lynn Thomas https://t.co/zBd7NAtMXy"
2019-05-13 15:58:07,I’m suffering from  major Game of Thrones hang over today. I just don’t know what to say about this last episode. J… https://t.co/ogTrUHUpBX
2019-05-13 03:01:29,"Finished with Sunset Beach, by Mary Kay Andrews https://t.co/HQ4MmZnDnV"
2019-05-12 21:48:28,"10% done with The Silent Woman, by Terry Lynn Thomas https://t.co/GK9zN0ShLh"
2019-05-12 16:00:48,"75% done with Sunset Beach, by Mary Kay Andrews https://t.co/EFTDCBqIul"
2019-05-12 14:02:21,Tonight’s Game of Thrones episode looks like it’s going to be another epic battle and I’m nervous and excited all a… https://t.co/6wynqM7TmR
2019-05-11 23:45:51,"67% done with The Overdue Life of Amy Byler, by Kelly Harms https://t.co/gNr1t8J0iC"
2019-05-11 15:04:32,Review: Naughty in Nice (Royal Spyness #5) by Rhys Bowen https://t.co/jqJvqT56OX
2019-05-11 14:53:38,Another weekend in upon us and here in the PacNW we are experiencing an unusually warm temperatures! What are you d… https://t.co/AGre6wQv1k
2019-05-11 14:34:14,"50% done with Sunset Beach, by Mary Kay Andrews https://t.co/UiYYEjvx93"
2019-05-11 04:42:07,"55% done with The Overdue Life of Amy Byler, by Kelly Harms https://t.co/EvY8O8pdMR"
2019-05-11 00:25:42,Review: The Great Pretenders by Laura Kalpakian https://t.co/9FTVu3oPos via @wordpressdotcom
2019-05-10 18:07:00,"26% done with Sunset Beach, by Mary Kay Andrews https://t.co/V9qMlZpHQM"
2019-05-10 16:03:06,It’s Friday and I’m dying to know what’s on your bookshelf this weekend!⠀ ⠀ QOTD: what are you reading currently an… https://t.co/Fbd5Lrno1x
2019-05-10 04:13:47,"7% done with Sunset Beach, by Mary Kay Andrews https://t.co/S0PVSCJqaw"
2019-05-09 14:15:23,I love long lazy summer days! I don’t mind reading outside but to be honest I don’t really have a comfortable spot… https://t.co/eDIfgLtEMU
2019-05-09 14:10:10,Review: One Summer in Paris by Sarah Morgan https://t.co/ORhujFIgBw @HarlequinBooks
2019-05-09 03:19:22,"86% done with The Great Pretenders, by Laura Kalpakian https://t.co/2PEnvBGwN4"
2019-05-08 15:35:27,Special Feature: Theater of Spies (Tales from the Black Chamber #2) by S.M. Stirling https://t.co/ArpEDP0xt5
2019-05-08 13:50:22,What constitutes are 5 star rating for you? I know everyone is different. I gage mine on how likely I am to recomme… https://t.co/HWJCUrAFCl
2019-05-08 03:32:44,"57% done with The Great Pretenders, by Laura Kalpakian https://t.co/DsXWfkM55b"
2019-05-07 21:53:50,"46% done with The Overdue Life of Amy Byler, by Kelly Harms https://t.co/58YmPlALeR"
2019-05-07 19:38:39,@kristywharvey @TallPoppyWriter You are most welcome! Love love love your books 🥰🥰🥰 #fangirl
2019-05-07 18:42:35,Review: The Southern Side of Paradise (Peachtree Bluff #3) by Kristy Woodson Harvey https://t.co/h9i5NL4I29 @kristywharvey @TallPoppyWriter
2019-05-07 17:17:31,🚨 GIVEAWAY ALERT 🚨 ⠀⠀ I am so happy to announce that I have a copy of this wonderful book up for giveaway this week… https://t.co/Oip7V6LzGn
2019-05-07 02:31:43,"15% done with The Great Pretenders, by Laura Kalpakian https://t.co/EDrRzvhZtW"
2019-05-06 20:45:35,Take Two Review: The Seven Sisters (Seven Sisters #1) by Lucinda Riley https://t.co/bwgR1HrVgI
2019-05-06 13:50:13,"Who here loves Lucinda Riley’s books? I’ve read them all but am re-reading them, well listening to them, on Audible… https://t.co/fmHewmvl1u"
2019-05-06 01:32:21,@deannaraybourn So sorry to hear this 💔💔💔
2019-05-05 15:39:26,"81% done with The Southern Side of Paradise, by Kristy Woodson Harvey https://t.co/UGC6fFCKRm"
2019-05-05 14:38:28,Another Game of Thrones Sunday is here! We have so few left and I’m so sad that it will soon be over! Side note how… https://t.co/bA0LBNeKPr
2019-05-05 02:55:57,"85% done with One Summer in Paris, by Sarah Morgan https://t.co/oDtwcxYpkb"
2019-05-05 02:17:31,4 of 5 stars to Royal Blood by Rhys Bowen https://t.co/501LBwyEsV
2019-05-04 23:49:14,"67% done with One Summer in Paris, by Sarah Morgan https://t.co/kVV4SJBSgh"
2019-05-04 15:42:56,Who here loves book carts? 🙋🏼‍♀️ ⠀ ⠀ How do you use your book cart? Is it purely storage or do you use it was your… https://t.co/N3yD6V5cgy
2019-05-04 15:37:26,Review: Royal Blood (Royal Spyness #4) by Rhys Bowen https://t.co/yOGWvQ6VWg @BerkleyMystery @BerkleyPub
2019-05-03 23:54:10,"RT @SignePike: Hot-off-the-press and on-sale June 4th, the lovely paperback of THE LOST QUEEN! Thanks for the pic, @TrishTodd718 and cheers…"
2019-05-03 23:00:17,RT @KevanLyon: If you ❤️ The Crown...you will love this wonderful novel!  THE OTHER WINDSOR GIRL by Georgie Blalock out November 5th! @WmMo…
2019-05-03 23:00:15,@KevanLyon @Austenprose @WmMorrowBooks This looks sooooooo good!!!’ 🥰🥰🥰🥰🥰🥰
2019-05-03 22:10:06,@tarheelreader Yeah congrats
2019-05-03 22:10:00,RT @tarheelreader: It’s my first blogiversary! Help me celebrate! Woo hoo! #tarheelreader #giveaway #bookgiveaway https://t.co/kHutahYpEM h…
2019-05-03 21:09:04,"19% done with The Southern Side of Paradise, by Kristy Woodson Harvey https://t.co/FmGBPaET3q"
2019-05-03 13:25:26,Review: The Missing Years by Lexie Elliott https://t.co/ivtFf6vhY6 #fridayreads #weekendreads #amreading
2019-05-03 13:24:30,It’s the weekend readers! What do you have on your nightstand this weekend? I just finished this slow burn thriller… https://t.co/69qLKjSEMd
2019-05-03 04:12:13,"RT @strandbookstore: I don't know who needs to hear this, but if you don't stop reading now, you'll never go to sleep. 📙 #latenightreader"
2019-05-03 02:26:07,RT @kerstinmarch: 🌼Can't think of a better way to celebrate #MayDay than with a wonderful new book! Wishing @TallPoppyWriter Kelly Harms th…
2019-05-03 02:26:01,"RT @Gr8Thoughts: My latest column in Good Life Family @jenniferweiner, @JaneGreen @elinhilderbrand @mkayandrews @laurenwillig @HHoangWrites…"
2019-05-03 02:19:46,"30% done with One Summer in Paris, by Sarah Morgan https://t.co/TJQ9y6YDul"
2019-05-03 00:34:52,"Love tea? Here is $5 to save at Adagio, my favorite vendor. GC, good for 24 hours: 4199633195. https://t.co/AZJLi9LNbh"
2019-05-02 15:20:04,@HFVBT @Gobookyourselfx @JennyQinVA @PATTIRSMITH @abookishaffair @crookedlanebks @coffeeandink2 @inkjunkie1984… https://t.co/53N57nEAKb
2019-05-02 15:19:29,"RT @HFVBT: We are getting excited for Christine Trent's A MURDEROUS MALADY #blogtour kicking off next week! Follow along for reviews, inter…"
2019-05-02 14:45:54,"16% done with One Summer in Paris, by Sarah Morgan https://t.co/YsRUo2xFVu"
2019-05-02 13:59:04,Review: The Austen Playbook (London Celebrities #4) by Lucy Parker https://t.co/UA9yShrVIa
2019-05-02 13:44:54,Who here loves Jane Austen retellings or inspirations? 🙋🏼‍♀️⠀ ⠀ I have this lovely Austen-esque book up for review… https://t.co/Tf9EVcIhz5
2019-05-02 03:40:16,"RT @MimiMatthewsEsq: BadRx: How Victorians Survived Cold Season With Chloroform, Garlic Syrup, And More, my article @bust_magazine https://…"
2019-05-02 03:32:41,"RT @kristywharvey: Congrats to @TallPoppyWriter Kelly Harms on the launch of her latest, THE OVERDUE LIFE OF AMY BYLER. Laugh out loud fun!…"
2019-05-02 01:59:44,"RT @kriswaldherr: Cambridge, I’ve arrived! See you soon @HarvardBooks. 😁📚👻 https://t.co/wO2nZIJ8gm"
2019-05-01 22:54:30,"On page 291 of 352 of Naughty in Nice, by Rhys Bowen https://t.co/Xx9WbYAUYn"
2019-05-01 15:31:15,"@LyndsayFaye Good for you! Just wow I can’t imagine ever contacting, let alone researching, and author just to tell… https://t.co/K1eCrAMJRl"
2019-05-01 15:24:25,Review: The Invited by Jennifer McMahon https://t.co/k3uZtOSR4e via @wordpressdotcom
2019-05-01 14:29:15,"88% done with The Missing Years, by Lexie Elliott https://t.co/v2SovAnrH6"
2019-05-01 13:35:35,Who here loves ghost stories? I’m new to the genre but I love discovering new creepy writers! I recently discovered… https://t.co/yvXlgGSe5B
2019-05-01 01:04:17,RT @StephMThornton: Who wants to read about strong women? (Correct answer: Everyone!) https://t.co/mrvJrolkbq
2019-05-01 00:22:38,"64% done with The Missing Years, by Lexie Elliott https://t.co/0JRiFvoKGu"
2019-04-30 18:04:50,3 of 5 stars to The View from Alameda Island by Robyn Carr https://t.co/Lk29Msc5O3
2019-04-30 17:16:54,🚨 GIVEAWAY ALERT 🚨 ⠀⠀ I am so happy to announce that I have a copy of this wonderful book up for giveaway this week… https://t.co/ttb9M5k75R
