timestamp,tweet_text
,"Literary aggressive go-getter. Blogging book reviews since 2009, INTJ #bookstagram",
2019-11-14 05:15:19,"On page 161 of 304 of Lady Takes the Case, by Eliza Casey https://t.co/uFMyEEjPlI"
2019-11-13 23:43:04,"36% done with Midnight at the Blackbird Café, by Heather Webber https://t.co/7CD9k6d64s"
2019-11-13 23:20:38,Happy birthday beauty_andthebook_ here is my selfie with my current read for your #beautyandthebookbirthday challen… https://t.co/qzAtPDxk9L
2019-11-13 17:00:39,Review: Beyond a Reasonable Stout (Sloan Krause #3) by Ellie Alexander https://t.co/cUExFGDpF2 @MinotaurBooks
2019-11-12 20:25:40,@KevanLyon @AuthorJenniferR Pretty sure I need the other Windsor girl
2019-11-12 20:24:25,@BerkleyRomance @thebestjasmine @HHoangWrites @jaydee_ell @UzmaWrites @penguinrandom @penguinusa @BerkleyPub… https://t.co/NcqGZ7Pvh5
2019-11-12 20:07:31,"On page 89 of 304 of Lady Takes the Case, by Eliza Casey https://t.co/JmSgYLy27D"
2019-11-12 18:21:21,Excerpt and Feature: The Highlander's Christmas Bride by Vanessa Kelly https://t.co/Ro3NDVewlG @HFVBT
2019-11-12 15:17:59,It's time for a little #teatuesday and today I am sipping on my favorite tea blends from @plumdeluxe I absolutely l… https://t.co/kN9yiTCfMK
2019-11-12 04:40:22,@BerkleyRomance I’m totally dating myself but this was THE first kiss freshman year! 🥰 https://t.co/1AV8RzIGhR
2019-11-12 04:39:59,@BerkleyRomance I’m here for this thread 😘
2019-11-12 04:32:13,RT @AnnaLeeHuber: And I just learned that the ebook of #LadyDarby Book 3 is on sale for a limited time. ✅ Got your Thanksgiving road trip r…
2019-11-11 22:35:50,"On page 89 of 208 of A Christmas Gathering, by Anne Perry https://t.co/UC33YaNYFE"
2019-11-11 15:23:34,"On page 26 of 208 of A Christmas Gathering, by Anne Perry https://t.co/LCc7ddXH6D"
2019-11-11 15:15:07,Special Feature: A Sanctuary of Spirits (Spectral City #2) by Leanna Renee Hieber https://t.co/S0I5EK5irZ @KensingtonBooks @Leannarenee
2019-11-11 14:56:30,"Now that we are into our second week of November, is anyone feeling a little nostalgic for October and all the spoo… https://t.co/cmvjRTM1fp"
2019-11-10 18:49:01,@TallPoppyWriter @JanieChang33 It’s so beautiful 🥰🥰🥰
2019-11-10 18:48:54,"RT @TallPoppyWriter: We can’t stop staring at this gorgeous cover of The Library of Legends by @JanieChang33, available May 2020. #CoverRev…"
2019-11-10 17:43:37,4 of 5 stars to A Cup of Holiday Fear by Ellie Alexander https://t.co/tJhApyVReA
2019-11-10 17:33:44,Pretty much loved this book with all of my being! I adore gothic romances....swoon!   Review: The Widow of Rose Hou… https://t.co/EQnUjqrzIp
2019-11-10 17:06:59,5 of 5 stars to The Widow of Rose House by Diana Biller https://t.co/r13PKVIdVT
2019-11-10 15:46:12,It's time for a #shelfiesunday and these books have been sitting hidden on my self for far too long! Last Sunday I… https://t.co/LNx4KCsm7K
2019-11-09 21:51:49,"69% done with Beyond a Reasonable Stout, by Ellie Alexander https://t.co/eU3J50RURV"
2019-11-09 16:17:09,Review: The Widow of Rose House by Diana Biller https://t.co/Md20uzWHuz @StMartinsPress
2019-11-09 15:11:32,"50% done with Beyond a Reasonable Stout, by Ellie Alexander https://t.co/jsSf5Rjov9"
2019-11-09 14:22:21,Please excuse me while I sing the praises of this wonderful Gothic Romance! I absolutely adored it! It had witty ba… https://t.co/JjmhXN13HQ
2019-11-09 05:08:50,"30% done with Beyond a Reasonable Stout, by Ellie Alexander https://t.co/BvJY4h0a5t"
2019-11-08 21:32:48,@MimiMatthewsEsq @BookishHQ Yaaaaaasssssss
2019-11-08 19:15:55,Review: The Painted Castle (Lost Castle #3) by Kristy Cambron https://t.co/OMgCbXbCbN @TLCBookTours @ThomasNelson
2019-11-08 17:19:54,"15% done with Beyond a Reasonable Stout, by Ellie Alexander https://t.co/qUAsRjqy7x"
2019-11-08 14:49:06,Who here loved castle or big grande homes? I know I do! I have this lovely book about an old castle up for review t… https://t.co/apq2xcEjBE
2019-11-07 22:54:43,I read The Duke and I by Julia Quinn https://t.co/sAhWa7n7Y7
2019-11-07 22:29:42,@KensingtonBooks @AnnaLeeHuber Aww thank you! I loved this one. Such a great series
2019-11-07 16:41:05,@HFVBT You betcha! https://t.co/ZYeYjVP9iO
2019-11-07 16:40:40,RT @HFVBT: It's the last day to enter to win a $10 Amazon Gift Card via @LianainBloom's #blogtour for TO TAME A SCANDALOUS LADY! Stop by @t…
2019-11-07 14:54:37,Special Feature: To Tame a Scandalous Lady by Liana De la Rosa https://t.co/mU3Kc9XwLy @HFVBT
2019-11-07 14:27:40,"73% done with The Painted Castle, by Kristy Cambron https://t.co/HFTsIskUYJ"
2019-11-07 14:10:48,I've been brainstorming a lot lately about my IG. One of the thing I really want to do this coming new year is up m… https://t.co/vDoc4OMil4
2019-11-06 23:09:01,"Voted for ""The Overdue Life of Amy..."" in the Opening Round of the 2019 #GoodreadsChoice Awards… https://t.co/a3M15Fk93A"
2019-11-06 23:07:46,"40% done with The Painted Castle, by Kristy Cambron https://t.co/IAW37xzRnM"
2019-11-06 18:50:42,@kristywharvey 🥰😘😍
2019-11-06 18:50:38,RT @kristywharvey: Thanks @thelitbitch! https://t.co/sm0aWLPLBC https://t.co/EXMAuqbjSB
2019-11-06 18:50:29,Passed 10K words for my new WIP! Was meant to be editing my finished draft but this story came to me instead and no… https://t.co/eWTYBGH0d8
2019-11-06 16:24:19,Review: A Cup of Holiday Fear (A Bakeshop Mystery #10) by Ellie Alexander https://t.co/vJoCutAaVy @MinotaurBooks
2019-11-06 16:18:30,The holiday reading is happening people and this book is up for review on my blog today so be sure to pop by and ch… https://t.co/1Zygq8gdNP
2019-11-05 23:53:11,Review: Penny for Your Secrets (Verity Kent #3) by Anna Lee Huber https://t.co/woAEvEg2EZ @KensingtonBooks @AnnaLeeHuber
2019-11-05 18:13:30,Isn't yellow one of the happiest colors? Every time I see something yellow it just makes me happy and think of suns… https://t.co/aileR5aNYc
2019-11-04 22:58:03,"56% done with A Cup of Holiday Fear, by Ellie Alexander https://t.co/wc8JkTFJJC"
2019-11-04 19:18:52,Review: The Christmas Spirits on Tradd Street (Tradd Street #6) by Karen White https://t.co/s7xO5CvVoI @BerkleyMystery @BerkleyPub
2019-11-04 16:38:01,"Let's talk book quotes! I have so many, but since I re-read Wuthering Heights every Thanksgiving break, I thought i… https://t.co/JYGaJLIfK7"
2019-11-04 03:37:49,"40% done with A Cup of Holiday Fear, by Ellie Alexander https://t.co/1jACn3iuPM"
2019-11-04 00:02:53,"RT @MimiMatthewsEsq: An excerpt from The Winter Companion (Parish Orphans of Devon, Book 4) is now up on my website! If you missed the snea…"
2019-11-04 00:02:36,@HFVBT @MimiMatthewsEsq Yaaaaassssss I can’t WAIT for the next one!!! Excuse me while I fan girl!!!
2019-11-03 17:07:21,@ImMeganCollins Wow I’m appalled you some of these comments!
2019-11-03 17:06:46,RT @kristywharvey: 😍 😍 😍  this praise for The Secret to Southern Charm! https://t.co/TPcxEi0841
2019-11-03 15:10:35,How soon is too soon to bust out my Christmas props?! I usually wait until after Thanksgiving to bring them all out… https://t.co/HOPPvBONGR
2019-11-03 03:39:45,"86% done with The Christmas Spirits on Tradd Street, by Karen White https://t.co/LdFxSY1hRQ"
2019-11-02 23:53:54,5 of 5 stars to A Convenient Fiction by Mimi Matthews https://t.co/6PDRipHtcA
2019-11-02 23:21:45,4 of 5 stars to All About Evie by Cathy Lamb https://t.co/oV829BjMMR
2019-11-02 22:08:13,"78% done with The Christmas Spirits on Tradd Street, by Karen White https://t.co/lI6xt0l3Rg"
2019-11-02 14:33:31,The holiday season is officially underway! Does anyone do any kind of “thankful goals” during November? I personall… https://t.co/RMN7nnWLn4
2019-11-01 19:58:52,"29% done with A Cup of Holiday Fear, by Ellie Alexander https://t.co/Obj7TGP97L"
2019-11-01 18:22:58,Review: All About Evie by Cathy Lamb https://t.co/hBGnDybwLk @TallPoppyWriter @KensingtonBooks #fridayreads
2019-11-01 18:21:29,ALL ABOUT EVIE by the lovely cathylamb91 is out in the world now and you should go check it out! I have it up for r… https://t.co/EE9sVcu3mr
2019-10-31 23:16:06,"26% done with The Christmas Spirits on Tradd Street, by Karen White https://t.co/uHDC6BJw15"
2019-10-31 13:46:45,Review: The Widow of Pale Harbor by Hester Fox https://t.co/60qJabOalO @HarlequinBooks 🎃👻
2019-10-31 13:30:25,Happy Halloween everyone! This is my favorite holiday and I can’t wait to take my son trick or treating tonight! He… https://t.co/YHYIzjX9VY
2019-10-31 03:31:11,"16% done with The Christmas Spirits on Tradd Street, by Karen White https://t.co/QBdLKRHgX9"
2019-10-31 00:46:51,"RT @MimiMatthewsEsq: OMG folks, I just found out that A CONVENIENT FICTION squeaked onto the USA Today bestseller list!!! Thank you so much…"
2019-10-30 23:49:10,Yesterday a completely new WIP came to me and now I’m quickly trying to outline things and form a plot line before… https://t.co/EMnHFpKTta
2019-10-30 23:46:29,"85% done with All About Evie, by Cathy Lamb https://t.co/Hsw6okCX41"
2019-10-30 16:13:32,@SusanMacNeal 😂😂😂😂
2019-10-30 16:07:12,Review: The Shining by Stephen King https://t.co/tODKiXlHTu via @wordpressdotcom
2019-10-30 15:50:00,"66% done with All About Evie, by Cathy Lamb https://t.co/WzQxzT6Y3B"
2019-10-30 15:25:32,I have my review of The Shining up today on my blog so be sure to pop over and check it out (link in bio).  . . QOT… https://t.co/NEmvkvY2MV
2019-10-29 15:35:34,RT @AnnaLeeHuber: I'm taking over @KensingtonBooks Tumbler today! *rubs hands gleefully* Mwahahaha! And my first post is about the History…
2019-10-29 15:35:23,"RT @cnoepagan: Happy release day to @AuthorCathyLamb on her 13th novel, ALL ABOUT EVIE! Reading it right now and loving it! https://t.co/Vh…"
2019-10-29 14:56:54,"Happy release day go @AuthorCathyLamb and her lovely book ALL ABOUT EVIE! I will have a review up on Friday, so far… https://t.co/FsT14qYTpK"
2019-10-29 14:55:39,Happy release day to @AnnaLeeHuber PENNY FOR YOUR SECRETS is out today and I have a review coming next week! Loved… https://t.co/sJCipdYoxp
2019-10-29 14:33:46,Rep search entry for lichen_and_limestone  . . My name is Anne and I haven’t been a rep before so I’m super excited… https://t.co/dXYlWHo3bc
2019-10-29 13:36:55,RT @KensingtonBooks: Author @AnnaLeeHuber is taking over our Tumblr all day long to celebrate the release of PENNY FOR YOUR SECRETS! https:…
2019-10-29 13:36:31,Happy release day to @AuthorCathyLamb ALL ABOUT EVIE is so much fun! Reading it now 🤗 https://t.co/ZlPrxhh14Z
2019-10-29 13:32:17,"RT @AnnaLeeHuber: It's release day!!!!! So excited PENNY FOR YOUR SECRETS, #VerityKent Book 3 is now out in the world! :) You can snap up y…"
2019-10-29 13:32:09,Review: Bringing Down the Duke (A League of Extraordinary Women #1) by Evie Dunmore https://t.co/KaZoqE8MX1 @BerkleyRomance
2019-10-29 13:26:14,I picked this book on a whim for my @bookofthemonth and boy oh boy am I glad I did! It was fantastic and I loved ev… https://t.co/v7rTnhuawL
2019-10-29 13:19:26,Happy release day to Anna Lee Huber! Her latest Verity Kent mystery is in the world today! I have it up for review… https://t.co/QASv6eSqJR
2019-10-29 11:28:41,"45% done with All About Evie, by Cathy Lamb https://t.co/JbJi5kP83P"
2019-10-28 23:54:17,"On page 298 of 352 of The Widow of Pale Harbor, by Hester Fox https://t.co/1zZcqvxdh5"
2019-10-28 16:23:09,"On page 250 of 352 of The Widow of Pale Harbor, by Hester Fox https://t.co/spKC1ufwVb"
2019-10-28 14:46:54,@KateMoretti1 Hahahah you go girl!!!!!!
2019-10-28 14:33:30,Review: Cilka's Journey (The Tattooist of Auschwitz #2) by Heather Morris https://t.co/vRlfEGZZ5a @StMartinsPress
2019-10-28 14:32:27,I have this extra special book up for review on my blog today so be sure to come by and check it out! It’s an excel… https://t.co/bGJRKL06pr
2019-10-28 03:48:48,RT @dcbiller: THE WIDOW OF ROSE HOUSE is a week old today! It's hard to believe so many people have met Alva and Sam (and Henry and Benedic…
2019-10-27 23:27:53,"On page 146 of 352 of The Widow of Pale Harbor, by Hester Fox https://t.co/Jn4ZE7YtPQ"
2019-10-27 15:52:22,"We are getting closer and closer to Halloween, and I don’t know about you but I always try to read something spooky… https://t.co/39NnGiSONc"
2019-10-26 21:37:38,"RT @Austenprose: Congratulations to @MimiMatthewsEsq. In the 3 days since publication, her new, A CONVENIENT FICTION, has (28) 5 STAR revie…"
2019-10-26 20:34:20,"On page 68 of 352 of The Widow of Pale Harbor, by Hester Fox https://t.co/ZkcCROxR5w"
2019-10-26 15:14:11,The weekend is here and with it Halloween parties! I know a ton of people who are going to Halloween parties this w… https://t.co/fuAoouuCFV
2019-10-26 04:00:53,"On page 39 of 352 of The Widow of Pale Harbor, by Hester Fox https://t.co/ueadkqoLVk"
2019-10-25 21:20:06,"RT @dcbiller: Oooh I think it's GRAPHIC TIME (the promotional kind, that is, not the sex kind THE WIDOW OF ROSE HOUSE sometimes gets yelled…"
2019-10-25 17:46:25,Excerpt and Special Feature: Meant to Be Yours (Happily Inc. #5) by Susan Mallery https://t.co/7eQ26EJjYs @HarlequinBooks #fridayreads
2019-10-25 16:44:20,I have had a lot of new followers lately and I thought it might be nice to do a little 'meet the bookstagramer' tod… https://t.co/rCfq1fGxD6
2019-10-25 15:27:23,"On page 280 of 352 of Cilka's Journey, by Heather Morris https://t.co/IEkdYUottB"
2019-10-25 03:35:48,@AlyssInWnderlnd Agree!!!!
2019-10-25 03:35:36,@MimiMatthewsEsq Thank you!! And I’m actually so glad you brought this up because it’s such a great point to make!… https://t.co/fR81eSL3Je
2019-10-25 02:26:16,@AlyssInWnderlnd I love this. My WIP isn’t a book of my heart. It’s more like the story that came to me first and I… https://t.co/X3lJoIf0ET
2019-10-25 02:24:36,@MimiMatthewsEsq Ps you’re the best 😂🧡😍
2019-10-25 02:24:23,@MimiMatthewsEsq 3/3 I love “predictable” romances and I love that u have brought this up because it challenges me… https://t.co/rDZn9dOaKx
2019-10-25 02:22:57,"@MimiMatthewsEsq 2/2 otherwise why would I pick up a romance? I love the romance journey and story, and when I say… https://t.co/kuVqTuWtjd"
2019-10-25 02:21:33,@MimiMatthewsEsq 1/1 I know I’ve said something like that when I review romances before but I don’t intend it as ru… https://t.co/34JkooB7r7
2019-10-25 02:18:53,@OnFrolic @msheatherwebb https://t.co/KUYKwo5vHf
2019-10-24 22:10:08,"On page 198 of 352 of Cilka's Journey, by Heather Morris https://t.co/8pOmXwBaV8"
2019-10-24 17:10:59,@MimiMatthewsEsq Wow what a beautiful photo
2019-10-24 14:51:33,"Finished with Penny for Your Secrets, by Anna Lee Huber https://t.co/5aKMxC8lcU"
2019-10-24 14:24:05,Review: The Art of Theft (Lady Sherlock #4) by Sherry Thomas https://t.co/2qBfdTOLm9 @BerkleyMystery
2019-10-24 13:55:33,"Now that I’ve officially read for my first Stephen King book, I’m considering reading some others but I don’t know… https://t.co/quEEhx2uQl"
2019-10-24 13:49:51,🚨Giveaway Alert 🚨⁠⠀ ⁠⠀ Historical mystery fans here is your chance to win a copy of one of the falls most anticipat… https://t.co/V74McMbOuE
2019-10-24 13:21:03,@CameraCourt @MimiMatthewsEsq @HFVBT Awwww thank you 🥰🥰🥰 I adore her books so much
2019-10-23 20:18:21,@MimiMatthewsEsq @HFVBT So good!!! I loved it so much
2019-10-23 20:17:46,@MimiMatthewsEsq @HFVBT Same!!!!! I’m so sad I love October and thank you 🥰🎃 https://t.co/NQHxXRczTm
2019-10-23 15:44:46,Review: A Convenient Fiction (Parish Orphans of Devon #3) by Mimi Matthews https://t.co/ql9ZUJheT5 @MimiMatthewsEsq @HFVBT
2019-10-23 15:43:43,Mimi Matthews stole my heart with each book and I couldn't be more thriller to share this book with you guys today… https://t.co/cdPyiQyMvX
2019-10-23 01:47:27,"On page 200 of 297 of The Art of Theft, by Sherry Thomas https://t.co/nBiXeY92U1"
2019-10-22 22:42:58,"On page 260 of 336 of Penny for Your Secrets, by Anna Lee Huber https://t.co/qh5JzzNWwv"
2019-10-22 16:21:24,RT @HFVBT: Today is the day! A Convenient Fiction by @MimiMatthewsEsq is out today in ebook and paperback 🎉🥳  Amazon https://t.co/ZRSi3hPRw…
2019-10-22 16:21:11,"RT @MimiMatthewsEsq: A Convenient Fiction (Parish Orphans of Devon, Book 3) is out today in ebook and paperback! Amazon https://t.co/iYzZ0x…"
2019-10-22 16:20:49,RT @kristywharvey: I am so darn proud to be part of this AMAZING group of authors! https://t.co/UFrRTogI2N
2019-10-22 16:17:01,Review: Secrets of the Chocolate House (Found Things #2) by Paula Brackston https://t.co/xJl5dPTZ9s @DetectiveGretel
2019-10-22 16:16:27,RT @DetectiveGretel: Book Birthday: Secrets of the Chocolate House! https://t.co/8UgZmkL0Rl via @YouTube
2019-10-22 15:00:36,"On page 109 of 297 of The Art of Theft, by Sherry Thomas https://t.co/srgDaI2lVz"
2019-10-22 14:46:34,Review: Secrets of the Chocolate House (Found Things #2) by Paula Brackston https://t.co/xJl5dPTZ9s @StMartinsPress
2019-10-22 14:33:31,"In case you were wondering, my favorite holiday/season is Halloween 🎃👻  There is something about Harry Potter that… https://t.co/JRXu9OTUoD"
2019-10-22 14:25:17,"I have this awesome book inspired by cult classic icon, Jeff Goldblum called The Goldblum Variations⁠ by Helen McCl… https://t.co/c15ZoiHEnE"
2019-10-21 18:13:41,Special Feature: Things She's Seen (Northern Circle Coven #2) by Pat Esden https://t.co/hdXLi6iAFB @KensingtonBooks
2019-10-21 18:00:36,"On page 70 of 297 of The Art of Theft, by Sherry Thomas https://t.co/N6i48Z34Jf"
2019-10-21 18:00:14,"Have you ever had tour fortune told with tarot cards or maybe by a fortune teller or psychic? Tell me about it, I w… https://t.co/rSZIlts8Qc"
2019-10-21 03:41:49,"On page 148 of 336 of Penny for Your Secrets, by Anna Lee Huber https://t.co/eR2SYtP9vz"
2019-10-20 22:52:30,5 of 5 stars to The Giver of Stars by Jojo Moyes https://t.co/hJSXRbwF2l
2019-10-20 13:41:35,Halloween is just around the corner and I want to know what you are going as for Halloween? ⁠⠀ ⁠⠀ I am going as Jes… https://t.co/gGUh9tK7RJ
2019-10-20 05:43:54,"80% done with Secrets of the Chocolate House, by Paula Brackston https://t.co/wOMqAgD33U"
2019-10-20 04:38:42,Review: The Giver of Stars by Jojo Moyes https://t.co/tVMZtac0pU @PamelaDormanBks
2019-10-19 22:55:17,"69% done with Secrets of the Chocolate House, by Paula Brackston https://t.co/RYXKPEQVcd"
2019-10-19 18:43:55,RT @deannaraybourn: Delighted to see Veronica on this list! Heaps of great recs here.  https://t.co/Pp0oEiMORF
2019-10-19 14:58:02,I have this super interesting book up for review on my blog today so pop by and check it out. Here is a little hint… https://t.co/JXeGImoZbD
2019-10-19 02:40:33,"RT @sarahw: I love that Stephen King's house is going to be a non-profit, hosting his archive and retreats for writers. https://t.co/Nz6hvc…"
2019-10-19 02:40:19,@TheLincoln 💯 agree
2019-10-18 23:44:22,@mi_mutter 😂 twins
2019-10-18 23:32:18,"On page 126 of 336 of Penny for Your Secrets, by Anna Lee Huber https://t.co/gdz8Gtxrii"
2019-10-18 17:22:56,I have completed my challenge of 150 books! https://t.co/wtU5RGt7wX
2019-10-18 16:14:45,Still trying to fit in a terrifying book before Halloween? Why not start with something by Laura Purcell? She's wri… https://t.co/GtrChCyEU8
2019-10-18 11:47:54,"On page 356 of 400 of The Giver of Stars, by Jojo Moyes https://t.co/8jQS2rsU1T"
2019-10-17 22:52:57,"On page 309 of 400 of The Giver of Stars, by Jojo Moyes https://t.co/asdvmtFUEt"
2019-10-17 21:32:36,"On page 74 of 336 of Penny for Your Secrets, by Anna Lee Huber https://t.co/1gQmQpafGy"
2019-10-17 17:52:09,@SignePike Hahaha the wait will be worth it! I’m totally going to request it!!! Dying to read
2019-10-17 17:51:39,@SignePike @ColossusHammer I can’t wait I know it will be worth it!!! 🧡🧡🧡
2019-10-17 14:42:42,RT @TallPoppyWriter: We are excited that @LydiaYKang is taking over our Bloom book club all day! Join us here: https://t.co/GI5eHw9BxT #Boo…
2019-10-17 14:42:40,@TallPoppyWriter @LydiaYKang I read this book and loved it! 5 stars for sure
2019-10-17 14:41:57,@SignePike So cool! Also getting excited for the next book https://t.co/VJe5a3tcLq
2019-10-17 13:37:08,Review: Christmas Angels by Nancy Naigle https://t.co/H05g3d9ptH @nancynaigle @StMartinsPress
2019-10-17 13:34:40,"On page 268 of 400 of The Giver of Stars, by Jojo Moyes https://t.co/i2h6o4b043"
2019-10-17 13:12:18,@kimberlydbrock @TallPoppyWriter Loved this one so much she totally gets it
2019-10-17 13:11:23,@AlyssInWnderlnd My words exactly
2019-10-17 13:11:08,@TheRosieWalsh Yeah congrats it was sooooo good
2019-10-17 13:07:11,One of the more underrated horror novels for me is The Picture of Dorian Grey. I don't know that it's officially a… https://t.co/u2X77eYTFh
2019-10-16 23:27:04,@SalHernandez At first I too thought this was a complete and utter joke. And it’s not. That should give all of America pause!
2019-10-16 23:23:28,Finished my WIP!!! 85K words. Letting it simmer a while before I start making any edits etc.  Now contemplating ano… https://t.co/GflNBPzajt
2019-10-16 16:12:13,Special Feature: That Was Awkward: The Art and Etiquette of the Awkward Hug by Emily Flake https://t.co/vWUXsKjQm9
2019-10-16 16:06:39,Can you tell that I am a huge fan of Halloween? While it might look like Christmas over on my blog (I have a ton of… https://t.co/S96rObd2sF
2019-10-16 11:49:06,"On page 200 of 400 of The Giver of Stars, by Jojo Moyes https://t.co/ojQB8hXS5z"
2019-10-16 03:48:30,"On page 140 of 400 of The Giver of Stars, by Jojo Moyes https://t.co/x67NjYyZI6"
2019-10-16 01:34:39,Review: Christmas in Vermont by Anita Hughes https://t.co/rlbz04JAnh @StMartinsPress
2019-10-16 00:32:05,@deannaraybourn @BerkleyPub It’s beautiful
2019-10-15 19:04:10,@soapachu https://t.co/oezVBLLn21
2019-10-15 19:00:55,"RT @KensingtonBooks: The Rockhams may have had a rocky marriage, but when Lord Rockham  winds up dead Verity must prove his wife's innocenc…"
2019-10-15 19:00:41,RT @SuzyApproved: Just saw this on Amazon: True Places: A Novel by Sonja Yoerg for $1.99 https://t.co/1nrFnXB99w via @amazon @SonjaYoerg @T…
2019-10-15 18:36:38,"RT @MimiMatthewsEsq: Only 1 more week until the release of A Convenient Fiction (Parish Orphans of Devon, Book 3)!! It will be out on Octob…"
2019-10-15 18:36:34,@MimiMatthewsEsq It’s sooooo good!🧡🧡🧡🧡
2019-10-15 14:19:14,Happy pub day to @NancyNaigle her book CHRISTMAS ANGELS is out in the world today! My review will be up tomorrow! I… https://t.co/FUwlKZQQK3
2019-10-15 14:16:26,"On page 253 of 356 of Bringing Down the Duke, by Evie Dunmore https://t.co/HxYrs5rR85"
2019-10-15 13:47:10,"In #Victorian England, a post-mortem photographer unearths the dark secrets of a famed poet’s marriage in this ghos… https://t.co/OvOjH2G5jV"
2019-10-14 23:19:05,"On page 198 of 356 of Bringing Down the Duke, by Evie Dunmore https://t.co/nWGmmC2Ta5"
2019-10-14 19:53:05,"67% done with Christmas Angels, by Nancy Naigle https://t.co/wviWjlswQ1"
2019-10-14 19:30:10,Review: Horror Stories by Liz Phair https://t.co/ZfS3FGChK8 @randomhouse
2019-10-14 15:42:40,"If you can believe it, I have never read anything by VC Andrews. She is an author that I saw a lot as a kid and was… https://t.co/HlXK7qybk3"
2019-10-14 15:42:28,"I also have this lovely book up for review on my blog today! I don't know about anyone else, but Liz Phair was the… https://t.co/9izbzUwSRh"
2019-10-14 03:26:32,"30% done with Christmas Angels, by Nancy Naigle https://t.co/OgkPyXDVec"
2019-10-13 22:50:14,"Finished with Christmas in Vermont, by Anita Hughes https://t.co/hzFNto44DT"
2019-10-13 21:43:41,4 of 5 stars to Love Poems for People with Children by John Kenney https://t.co/HcPWcMqJ9M
2019-10-13 03:32:15,"On page 582 of 659 of The Shining, by Stephen King https://t.co/AEsSF5s4si"
2019-10-12 22:35:10,Dennis over at @scaredstraightt is hosting a #scaredstraightstack challenge this month for spooky books and I could… https://t.co/Em8lauo5wb
2019-10-12 19:06:43,Working on a new WIP outline at Starbucks when a guy sat down next to me with terrible BO so relocated to the libra… https://t.co/fUkv8Vvo8N
2019-10-12 16:20:05,RT @joriestory: 10mins until we start #SatBookChat  I am looking forward to introducing everyone to M.J. Logue and hosting a #bookchat abou…
2019-10-12 14:16:54,Erin Morgenstern is a favorite author of mine and I was lucky enough to meet her in person at the Portland Wordstoc… https://t.co/9Eb42gb9h9
2019-10-12 14:11:52,@AlyssInWnderlnd 😂
2019-10-12 13:59:33,"59% done with Christmas in Vermont, by Anita Hughes https://t.co/47mUwSnBTA"
2019-10-12 03:10:06,"36% done with Christmas in Vermont, by Anita Hughes https://t.co/bDb0e3cjPw"
2019-10-12 03:09:22,"@joriestory Any kind of action movie really....super hero movies like avengers etc, adventure movies like Indiana J… https://t.co/XdLfYCDF3M"
2019-10-12 02:52:34,@AlyssInWnderlnd I hate that! It’s like books with sex can only be bodice ripper romances and that’s so unfair! Lik… https://t.co/XjV9fithkK
2019-10-12 02:51:08,6 things I like (no particular order): 1. Books 📚  2. Chai tea lattes ☕️ 3. Halloween /Fall 🎃 4. Dogs 🐶  5. Action… https://t.co/N1qYddiMy0
2019-10-11 22:51:35,@hafsahfaizal What a great giveaway 🧡
2019-10-11 22:51:23,@hafsahfaizal @joriestory
2019-10-11 22:51:08,RT @hafsahfaizal: Hey hey! It's Friday! So let's have a giveaway for this WE HUNT THE FLAME tote bag featuring the zumra and one of my favo…
2019-10-11 13:32:39,Review: Love Poems for People with Children by John Kenney https://t.co/xXzQ16fUOv @PutnamBooks @penguinrandom
