timestamp,tweet_text
2018-10-23 13:53:03,RT @BBCGaryR: Archaeologists say they've discovered the oldest intact shipwreck at the bottom of the Black Sea.  The Greek trading vessel i…
2018-10-23 13:51:59,Review: The Lost Queen (The Lost Queen Trilogy #1) by Signe Pike. Go read this one immediately! ⭐️⭐️⭐️⭐️⭐️… https://t.co/08zzpK6N7Q
2018-10-23 13:40:17,@AlyssInWnderlnd Oh man it’s soooooo good. 🧡🏴󠁧󠁢󠁳󠁣󠁴󠁿⚔️
2018-10-23 13:29:13,What is your favorite part of the Arthurian legends? Merlin? Lancelot and Guinevere? Or was it Camelot itself? I pe… https://t.co/uvfmLxDGlB
2018-10-23 11:49:09,"20% done with True Places, by Sonja Yoerg https://t.co/ZG9RtguacD"
2018-10-23 00:24:15,"13% done with True Places, by Sonja Yoerg https://t.co/PsLHCFqU9P"
2018-10-22 20:26:05,"RT @hafsahfaizal: So now that ARCs are here, it's time for a giveaway! Want to win one of the first galleys of WE HUNT THE FLAME, my YA fan…"
2018-10-22 13:48:52,Special Feature: The Petticoat Letters (Rebels of the Revolution) by Kelly Lyman https://t.co/YbbsJpjOkH
2018-10-22 13:48:37,Special Feature: The Petticoat Letters (Rebels of the Revolution) by Kelly Lyman https://t.co/YbbsJpjOkH @HFVBT
2018-10-22 13:28:13,What are some of your favorite true crime novels? I love anything by Ann Rule. Her true crime novels are unparallel… https://t.co/DXvT6pAT5P
2018-10-22 03:09:17,"On page 239 of 384 of The Girl from Berlin, by Ronald H. Balson https://t.co/bRRdhLnqy9"
2018-10-22 00:44:06,"On page 52 of 235 of The Haunting of Hill House, by Shirley Jackson https://t.co/0LmpTJ4pFu"
2018-10-21 22:56:32,"On page 201 of 384 of The Girl from Berlin, by Ronald H. Balson https://t.co/GaTtJuzNMw"
2018-10-21 20:07:43,"On page 145 of 384 of The Girl from Berlin, by Ronald H. Balson https://t.co/mycB1S2w1F"
2018-10-21 19:02:10,1 of 5 stars to Frankenstein by Mary Wollstonecraft Shelley https://t.co/x5O1oiFxSb
2018-10-21 16:02:01,"On page 105 of 384 of The Girl from Berlin, by Ronald H. Balson https://t.co/HtFi14yAwo"
2018-10-21 14:40:42,"There is a dense fog advisory in my town today, there can be no better reading weather. What’s your go to fall read… https://t.co/WbPu1RlXKn"
2018-10-20 15:15:17,Review: Frankenstein by Mary Shelley https://t.co/kQFqoLDpHp #amreading #bookreview 🎃
2018-10-20 15:14:56,I don’t normally post reviews on the weekend but sometimes I make exceptions. Come check out my thoughts on Franken… https://t.co/L0LgvQK15J
2018-10-20 14:35:42,"Frankenstein or Dracula? I’ve asked this question before, but now I’ve read both and I can firmly say I’m in the Dr… https://t.co/C5RCT0JPVs"
2018-10-20 05:28:41,When u have 60 ish pages left of your book and want to keep reading but you’re so tired u can barely keep your eyes… https://t.co/W9O32msih0
2018-10-20 05:25:22,"On page 453 of 527 of The Lost Queen, by Signe Pike https://t.co/czfogVqjxV"
2018-10-19 21:50:18,"On page 378 of 527 of The Lost Queen, by Signe Pike https://t.co/hcHU72jNsJ"
2018-10-19 16:08:30,"On page 31 of 384 of The Girl from Berlin, by Ronald H. Balson https://t.co/ZdzCJ0Qkth"
2018-10-19 14:10:43,@SignePike @TouchstoneBooks So. Good.
2018-10-19 14:10:34,@hafsahfaizal So exciting!! I can’t wait to read it!!
2018-10-19 14:10:06,Review: The Game of Hope by Sandra Gulland https://t.co/ywerXHpKci #bookreview #fridayreads
2018-10-19 13:41:58,What’s on your nightstand this weekend? I’m reading THE LOST QUEEN by @SignePike and I can’t put it down. I’ll be a… https://t.co/SKZWSS8Qvo
2018-10-19 13:11:18,What was the worst candy you got trick or treating when you were younger? I hated any of the sugar candies....smart… https://t.co/bH2j158lvN
2018-10-19 04:30:00,"On page 319 of 527 of The Lost Queen, by Signe Pike https://t.co/uaVHHCp4zL"
2018-10-18 21:12:19,"RT @SAChakrabooks: It's live! Go check out a new, exclusive excerpt of THE KINGDOM OF COPPER over at @BookRiot. Go on, just pretend you're…"
2018-10-18 20:52:03,RT @KensingtonBooks: Did you know women were a key part of the British Secret Service during the Great War? @AnnaLeeHuber shared the fascin…
2018-10-18 19:53:04,"80% done with The Game of Hope, by Sandra Gulland https://t.co/WZ1nvOq7jB"
2018-10-18 16:05:51,RT @kriswaldherr: Eek!! They’re here!! LOST HISTORY advance reader copies! And with lovely endorsements from @seacitysky @hazelgaynor @crys…
2018-10-18 14:17:55,"65% done with The Game of Hope, by Sandra Gulland https://t.co/z9bUAELJhy"
2018-10-18 14:08:11,Cover Reveal: BAGGING ALICE by Laura Barnard https://t.co/OlEYpjY77e via @wordpressdotcom
2018-10-18 14:08:07,I’ve got a lovely cover reveal for you all this morning on my blog! Be sure to come check it out! 🧡 #amreading https://t.co/OlEYpjY77e
2018-10-18 13:58:11,Would you rather be a vampire doomed to live forever or a werewolf where you’re doomed to turn into an animal every… https://t.co/HarRpqJdnF
2018-10-18 03:55:40,"On page 231 of 527 of The Lost Queen, by Signe Pike https://t.co/qHUkU3QBZT"
2018-10-17 22:09:53,"On page 188 of 527 of The Lost Queen, by Signe Pike https://t.co/nHqKK0oGgn"
2018-10-17 14:43:42,@AlyssInWnderlnd Omg I need this journal hahaha
2018-10-17 14:43:10,Review: Believe Me by J.P. Delaney https://t.co/YJP5X4SegX @penguinrandom #amreading #bookreview #mysteries
2018-10-17 14:42:07,New book review up today. Come check out this latest thriller! #bookreview #amreading https://t.co/YJP5X4SegX
2018-10-17 13:34:52,"Do you and/or you family, go trick or treating in a neighborhood or do you attend community events indoors? The las… https://t.co/sxirpC1Ks1"
2018-10-17 13:15:27,"38% done with The Game of Hope, by Sandra Gulland https://t.co/YOGzeGICBb"
2018-10-17 13:15:26,"38% done with The Game of Hope, by Sandra Gulland https://t.co/SQPWMKWkQv"
2018-10-16 22:28:53,4 of 5 stars to The Pint of No Return by Ellie Alexander https://t.co/2ezAw1iCr4
2018-10-16 21:42:48,"19% done with The Game of Hope, by Sandra Gulland https://t.co/af2R1cQdXc"
2018-10-16 20:17:43,"7% done with The Game of Hope, by Sandra Gulland https://t.co/WqicxPoJ7L"
2018-10-16 14:55:41,Happy #bookbirthday to some of my favorite @StMartinsPress Authors who all have books our today Anita Hughes (Chris… https://t.co/Zq0zlK9xH0
2018-10-16 14:49:09,October is always a big review month for me! I usually spend quite a bit of time prepping and reading my@books (som… https://t.co/PlUxOAINF6
2018-10-16 14:12:14,October is a big review month for me. I usually spend a month or so preparing so come check out my latest review up… https://t.co/ThxtY70q6I
2018-10-16 13:58:26,New #bookreview up this morning! Come check it out! Review: The Pint of No Return (A Sloan Krause Mystery #2) by El… https://t.co/tmsMuMo5iC
2018-10-16 13:35:09,I always forget about The Picture of Dorian Gray when it comes to creepy reads. Have you read it? Do you consider i… https://t.co/hrdW24M59v
2018-10-16 03:36:29,"On page 98 of 527 of The Lost Queen, by Signe Pike https://t.co/pb2NEgyHIq"
2018-10-15 23:07:41,"On page 210 of 334 of Believe Me, by J.P. Delaney https://t.co/joUJZsyL12"
2018-10-15 20:39:08,@WiCnet This would be so sweet https://t.co/SihYGETYCz
2018-10-15 14:34:18,Anyone else here preorder Fire and Blood? I wasn’t too excited about it because I need Winds of Winter and am tired… https://t.co/nvh8BD2lSU
2018-10-15 13:50:28,Come check out which book I’m featuring this week https://t.co/S4jldX1YFn
2018-10-15 13:49:23,Special Feature: Lady of a Thousand Treasures by Sandra Byrd https://t.co/S4jldX1YFn @HFVBT #historicalfiction #amreading #mondayblogs
2018-10-15 13:39:05,"Last night I dreamt I went to Manderly again. This famous opening line from Rebecca hooked me on that book, now I’m… https://t.co/B4zNfoNRvA"
2018-10-15 11:54:30,RT @HCPO_NYDFS: Dutch museums found more than 170 works stolen by Nazis in their collections. https://t.co/iMJOtmw2fs via @artsy
2018-10-15 11:50:12,"On page 120 of 334 of Believe Me, by J.P. Delaney https://t.co/UYnHXddtOU"
2018-10-15 03:40:09,"On page 66 of 527 of The Lost Queen, by Signe Pike https://t.co/GWDfJiTDfo"
2018-10-15 01:59:00,3 of 5 stars to Not Her Daughter by Rea Frey https://t.co/gukMsBbBQJ
2018-10-15 01:23:06,5 of 5 stars to Becoming Mrs. Lewis by Patti Callahan https://t.co/tsGH4YqniE
2018-10-14 19:19:21,"RT @Tudorscribe: My 18th c thriller THE BLUE is on pre-order. Discounted to $2.99 in US: https://t.co/muWSOSIHlU ""Transports the reader int…"
2018-10-14 17:46:35,"86% done with The Pint of No Return, by Ellie Alexander https://t.co/H2qxw2zqIk"
2018-10-14 17:19:29,@WiCnet 🤯
2018-10-14 16:57:24,RT @MyOutlanderPurg: Mark your calendars—the episode of #thegreatamericanread featuring #Outlander and @Writer_DG is set for this Tuesday!…
2018-10-14 16:56:26,@alyssaeatherly Fingers crossed! This looks so good!
2018-10-14 16:55:55,RT @alyssaeatherly: I love this spooky book so much I want so share with others ❤️ so I’m doing my first giveaway! Kiersten is one of my ab…
2018-10-14 16:55:35,@WiCnet I can hardly wait ❄️🐺
2018-10-14 16:55:10,RT @WiCnet: The reunion many are looking forward to. (Via Reddit: https://t.co/F9GbqqSnMz) https://t.co/YwtJpinz4W
2018-10-14 16:22:02,@kriswaldherr Requested!!! I am dying to read this one
2018-10-14 16:19:28,@2020fight Right there with u. What exactly@is he talking about here hahah 🧐🧐🤔🤔
2018-10-14 16:18:36,@goodreads To escape
2018-10-14 14:57:38,"77% done with The Pint of No Return, by Ellie Alexander https://t.co/GDIkYKubcE"
2018-10-14 14:04:10,This Halloween season I’ve discovered that apparently this is a difference between horror and slasher novels. I alw… https://t.co/MKzNKobKkF
2018-10-14 03:48:47,"RT @WiCnet: Old Valyria was once the most beautiful, technically advanced place in the Known World. What destroyed it? It's time for a #Gam…"
2018-10-14 01:56:11,@deannaraybourn This thread is making my night 😂😂😂😂😒😂
2018-10-14 01:55:56,@queazle @bcgotschall @Nicole_Cliffe This thread is making my night 😂😂😂😂😂
2018-10-14 01:52:52,"48% done with The Pint of No Return, by Ellie Alexander https://t.co/fT2fyvOLYv"
2018-10-13 17:32:48,@StephMThornton It looks great!
2018-10-13 14:03:43,"36% done with The Pint of No Return, by Ellie Alexander https://t.co/27MJSrTn8L"
2018-10-13 13:51:57,Who’s your favorite ghoul? Do you love vampires? Ghosts? Werewolves? The Headless Horseman? Zombies? I personally l… https://t.co/xrpj4Lj4in
2018-10-13 02:33:17,"25% done with The Pint of No Return, by Ellie Alexander: Hubby is gone for the weekend a... https://t.co/rsdnWK0m4T"
2018-10-12 19:40:06,"RT @hafsahfaizal: Casual reminder: we're SEVEN MONTHS away from the release of WE HUNT THE FLAME, where a reluctant gang of warriors who sp…"
2018-10-12 16:16:47,@AlyssInWnderlnd I want to read THE DARK DESCENT OF ELIZABETH FRANKENSTEIN I have heard great things
2018-10-12 15:23:54,The weekend is finally here. Anyone reading anything spooky as we head closer to Halloween? 🧛🏼‍♀️🎃👻
2018-10-12 15:17:12,New book review up this morning on the blog just in time for #fridayreads https://t.co/hRQ2PfCz7i
2018-10-12 15:04:02,"7% done with The Pint of No Return, by Ellie Alexander https://t.co/2x5CphV4cb"
2018-10-12 15:03:25,@AudioShelfMe Awesome and I might take u up on that offer. My goal is to start podcasting in January
2018-10-12 15:02:48,If your looking for your next #FridayReads then look no further than this excellent novel! Review: Becoming Mrs. Le… https://t.co/Ti91JmxVat
2018-10-12 13:48:29,I have this excellent novel up for review on my blog this morning. Come check it out and tell me if you’ve read the… https://t.co/AeXq3floLb
2018-10-12 03:15:58,@joriestory @CaseyInSoDak @AudioShelfMe As always @joriestory thank u for ur thoughtful feedback!
2018-10-12 03:15:36,@joriestory @CaseyInSoDak @AudioShelfMe I agree. It’s so much easier to listen on the go too. Also I feel weird jus… https://t.co/uLwzMSrDrx
2018-10-12 02:50:57,@joriestory Oh yeah that makes me even more excited to read it
2018-10-12 02:42:38,@joriestory No I haven’t read the first but im so excited to read it.
2018-10-12 02:27:47,RT @KensingtonBooks: How do seances and the Great War collide in history? @AnnaLeeHuber is here with the answer: https://t.co/cwB4Oht3BY ht…
2018-10-12 02:10:45,@JaneAustenLIVES Elizabeth Bennet which surprised me lol
2018-10-12 02:10:09,"I got Elizabeth Bennet, from ""Pride and Prejudice""! https://t.co/hR9oRk2EuQ"
2018-10-12 02:08:16,Podcasts or BookTube (YouTube) for reviews or general book discussion? I was thinking of doing a weekly podcast/dis… https://t.co/vkz0W3Y67r
2018-10-12 02:05:04,"RT @Tudorscribe: It's a big day. My new historical thriller THE BLUE is available for pre-orders, print and ebook, on amazon UK.  'With ric…"
2018-10-12 02:03:08,@joriestory I’m reviewing this one soon and I can’t wait! It looks so good! 🧡
2018-10-12 01:39:45,And way a great book to end my challenge on!
2018-10-12 01:39:12,I have completed my challenge of 100 books! https://t.co/IeLa6ryOH8
2018-10-11 20:52:57,"91% done with Becoming Mrs. Lewis, by Patti Callahan: So close to being done and it’s so... https://t.co/SUAUyp7NTB"
2018-10-11 13:23:39,Review: Christmas at the Chalet by Anita Hughes https://t.co/H67BBbUVvO
2018-10-11 13:18:58,Review: Christmas at the Chalet by Anita Hughes https://t.co/H67BBbUVvO #bookreview #amreading
2018-10-11 13:13:04,What was the first horror or paranormal book that you loved? For me it was hands down Dracula. I read it when I was… https://t.co/84IGbYxNrZ
2018-10-11 12:56:00,"74% done with Becoming Mrs. Lewis, by Patti Callahan https://t.co/A6F0UUhlHk"
2018-10-11 03:27:54,"On page 89 of 223 of Frankenstein, by Mary Wollstonecraft Shelley https://t.co/VmoCJwTYOR"
2018-10-11 02:06:42,"62% done with Becoming Mrs. Lewis, by Patti Callahan https://t.co/AmffSkA3x4"
2018-10-10 14:15:34,New post for this lovely audiobook up this morning! #amreading #bookreview https://t.co/MQ7goFy6Yk
2018-10-10 14:14:57,Review: Absolute Proof by Peter James (Audio Edition Narrated by Hugh Bonneville) https://t.co/MQ7goFy6Yk via @wordpressdotcom
2018-10-10 13:41:10,Something about Harry Potter always gets me in the mood for fall and Halloween! Which Harry Potter book is your fav… https://t.co/PIlRn53gNO
2018-10-10 11:44:26,"40% done with Becoming Mrs. Lewis, by Patti Callahan https://t.co/HN5g6kROVr"
2018-10-10 03:47:40,"23% done with Becoming Mrs. Lewis, by Patti Callahan https://t.co/LiNEgNXgYl"
2018-10-09 23:34:26,@kristywharvey @TallPoppyWriter @BookTrib @pcalhenry I just started this one and I’m hooked and ready to abandon my… https://t.co/Szf4grKIny
2018-10-09 23:20:02,"12% done with Becoming Mrs. Lewis, by Patti Callahan: Was going to read more frakenstein... https://t.co/UVm55ZOkzB"
2018-10-09 22:20:02,"On page 51 of 223 of Frankenstein, by Mary Wollstonecraft Shelley https://t.co/sagFp7KKXD"
2018-10-09 22:02:23,RT @SignePike: I have some exciting news to share.... I’m so thrilled to be working with Bruna Papandrea and Made Up Stories to develop THE…
2018-10-09 22:01:37,@AvalinahsBooks Hahaha yes agreed. At least something good came out of his idiotic comments 🧡📚
2018-10-09 22:00:55,@minibrownies @ReaFrey_Author I just finished The Alienist by Caleb Carr and it was excellent! Purely historical thriller but so good!
2018-10-09 15:35:39,RT @msheatherwebb: Happy publication day to my brilliant friend @HazelGaynor on her gorgeous new novel #TheLighthouseKeepersDaughter. Join…
2018-10-09 15:31:23,"RT @HFVBT: A brilliant review for A DUEL FOR CHRISTMAS by @RosanneLortz at @hjsnyder28's blog! https://t.co/KIgD93jZPH  ""If you enjoy myste…"
2018-10-09 15:30:44,@veronica_henry @HFVBT Agree. And thank you for your support 🧡
2018-10-09 15:30:05,@HannahKateSmith @joriestory Thank you! 🧡🧡🧡
2018-10-09 15:29:29,@AvalinahsBooks This guy.....what a dick. He clearly has no idea how social media works
2018-10-09 15:26:17,RT @TallPoppyWriter: Happy publication day to our friend @HazelGaynor on her new novel #TheLighthouseKeepersDaughter. Join her on #Bloom (F…
2018-10-09 14:25:05,@minibrownies @ReaFrey_Author That was a great read as well! 👻👻👻👻
2018-10-09 13:46:15,Another suspenseful read in the books! Come check out my review this morning! #amreading #bookreview https://t.co/9YHWUWPnPd
2018-10-09 13:45:14,Review: Not Her Daughter by Rea Frey https://t.co/9YHWUWxMqD #bookreview #amreading
2018-10-09 13:44:49,@ReaFrey_Author You’re most welcome!
2018-10-09 13:28:12,My review of NOT HER DAUGHTER by @ReaFrey_Author is up today on my blog. What is the last memorable thriller that y… https://t.co/tCryeuydzU
2018-10-09 11:42:54,"72% done with Christmas at the Chalet, by Anita Hughes https://t.co/fDLtexULAs"
2018-10-09 11:42:54,"72% done with Christmas at the Chalet, by Anita Hughes https://t.co/sbIrtpqeuY"
2018-10-08 23:47:11,"60% done with Christmas at the Chalet, by Anita Hughes https://t.co/M7VUmRVLBD"
2018-10-08 18:28:02,I voted for #TeamBale on @TheTylt—no other actor can top Christian Bale’s Batman https://t.co/22EfZSlPFP
2018-10-08 18:27:35,"51% done with Christmas at the Chalet, by Anita Hughes https://t.co/o4MtfmGiR9"
2018-10-08 13:51:14,What are your favorite stories by Poe? I love The Tell Tale Heart but The Fall of the House of Usher is a close sec… https://t.co/FlyG4RC13c
2018-10-08 11:46:21,"37% done with Christmas at the Chalet, by Anita Hughes https://t.co/kh4hwQn0Y4"
2018-10-08 04:07:37,"On page 473 of 498 of The Alienist, by Caleb Carr https://t.co/42sqGuYheG"
2018-10-08 01:58:52,"26% done with Christmas at the Chalet, by Anita Hughes https://t.co/MhNaQzzSdU"
2018-10-07 21:44:40,"Finished with Not Her Daughter, by Rea Frey https://t.co/d5K2PMgbM5"
2018-10-07 20:07:42,"Finished with Absolute Proof, by Peter James https://t.co/siqJjgy5iz"
2018-10-07 14:32:29,Have you ever searched and searched for an edition or cover that you actually liked of a book? I have searched for… https://t.co/qXnhymK8oP
2018-10-07 14:21:20,"On page 301 of 352 of Not Her Daughter, by Rea Frey https://t.co/0plfoeJEpp"
2018-10-06 22:45:58,"On page 249 of 352 of Not Her Daughter, by Rea Frey https://t.co/TqxX0Hi8fn"
2018-10-06 15:01:13,"On page 202 of 352 of Not Her Daughter, by Rea Frey https://t.co/8HPoAkNWzv"
2018-10-06 14:46:17,QOTD: What are your weekend plans? Anything spooky? ~~~~~~~~~~~~~~~~~~~~~~~~~~~ Tonight I’m going to see Dracula at… https://t.co/gnopUsqI4t
2018-10-06 04:50:51,"On page 389 of 498 of The Alienist, by Caleb Carr https://t.co/zHdUguyNPD"
2018-10-06 01:50:38,"On page 170 of 352 of Not Her Daughter, by Rea Frey https://t.co/PEThMuLuci"
2018-10-05 14:25:17,"RT @SAChakrabooks: Some NYCC news! If you buy a copy of THE CITY OF BRASS, you can get an advanced copy of THE KINGDOM OF COPPER as well! h…"
2018-10-05 14:25:08,It’s Friday and this weekend I’m reading The Alienist by Caleb Carr and Not Her Daughter by @ReaFrey_Author… https://t.co/MnVTA5kWQR
2018-10-05 14:23:46,@AlyssInWnderlnd @simone_stjames Omg it was so so so good. I literally read all of her books immediately after I finished this one!
2018-10-05 13:46:18,What’s on your nightstand this weekend? I’m finishing The Alienist and continuing Not Her Daughter and Frankenstein… https://t.co/47LT8oAMJz
2018-10-05 11:43:09,"On page 156 of 352 of Not Her Daughter, by Rea Frey https://t.co/YQyfWYlmFf"
2018-10-05 04:03:28,"On page 351 of 498 of The Alienist, by Caleb Carr https://t.co/8rhToVZp88"
2018-10-04 23:22:39,"72% done with Absolute Proof, by Peter James https://t.co/KkoA3HVpEN"
2018-10-04 23:13:06,@HazelGaynor @TallPoppyWriter This is a bloom discussion that I don’t want to miss!!
2018-10-04 23:01:42,@Anna_Mazz @spookypurcell @WilliamRyan_ @SJIHolliday Fingers crossed for the win! They all look so good!
2018-10-04 23:01:21,"RT @Anna_Mazz: The Great Gothic Giveaway!  For spooky season, I’m giving away a signed copy of The Story Keeper and signed proofs of 3 bril…"
2018-10-04 23:00:02,RT @DebHarkness: Thank you #AllSouls readers and viewers! We've had an amazing week. TIME'S CONVERT is on the New York Times Bestseller lis…
2018-10-04 22:59:16,RT @KevanLyon: Pre-order THE HUNTRESS by @KateQuinnAuthor and get a BONUS short story! https://t.co/S12XVsWCdz @WmMorrowBooks https://t.co/…
2018-10-04 22:48:36,@msheatherwebb @HazelGaynor @IrishTimes I pre ordered a copy and I can’t wait for it to arrive!!!
2018-10-04 20:58:10,"On page 105 of 352 of Not Her Daughter, by Rea Frey https://t.co/pntgfQ709E"
2018-10-04 20:58:10,"On page 105 of 352 of Not Her Daughter, by Rea Frey https://t.co/xOZc4LckmI"
2018-10-04 15:29:04,@caitiemcwrites @AlyssInWnderlnd Coolest book launch ever
2018-10-04 15:06:20,"On page 75 of 352 of Not Her Daughter, by Rea Frey https://t.co/mowlwUpwJk"
2018-10-04 14:05:01,@AlyssInWnderlnd You’re so welcome! 🧡🎃
2018-10-04 14:04:29,Review: The Spellbook of Katrina Van Tassel by Alyssa Palombo https://t.co/mpSP2jTKSH
2018-10-04 13:56:43,@AlyssInWnderlnd Omg yaaaaaaasssss 😂😂😂😂 https://t.co/Bu8WUfullT
2018-10-04 13:56:06,It’s the one I’ve been waiting for! New #bookreview up this morning! 🎃Review: The Spellbook of Katrina Van Tassel b… https://t.co/SN5aCwDzpj
2018-10-04 13:25:55,I’ve been waiting for months for this book and it was released on Tuesday and today my review is up! What fall rele… https://t.co/IW08tX3xnj
2018-10-04 03:50:20,"On page 309 of 498 of The Alienist, by Caleb Carr https://t.co/52bD1CtEgI"
2018-10-03 22:41:07,"On page 276 of 498 of The Alienist, by Caleb Carr https://t.co/hv4hGIVDUY"
2018-10-03 20:27:04,"On page 39 of 352 of Not Her Daughter, by Rea Frey https://t.co/leN5XgbhFc"
2018-10-03 13:55:28,"On page 23 of 352 of Not Her Daughter, by Rea Frey https://t.co/eUEb6Fkk1s"
2018-10-03 13:23:14,"When it comes to spooky reading which do you prefer, ghost stories (or other supernatural elements), vampire storie… https://t.co/0ilKoEE0VW"
2018-10-03 03:50:18,"On page 248 of 498 of The Alienist, by Caleb Carr https://t.co/6fvB6b5m5c"
2018-10-02 22:25:58,Friends! If your shopping for bookish gifts for your bookish friends be sure to check out Literary Book gifts! I ha… https://t.co/lyCqRlsyUv
2018-10-02 20:08:26,"50% done with Absolute Proof, by Peter James https://t.co/4ythHxbA1v"
2018-10-02 15:10:57,It’s heeeeerrrrrrrreeeeee!!! Happy #bookbirthday to @AlyssInWnderlnd her lovely novel THE SPELLBOOK OF KATRINA VAN TASSEL is out today! 🎃🎃🎃🎃
2018-10-02 15:09:59,"RT @HazelGaynor: One week to go USA and Canada!! I hope you enjoy this short excerpt from the audio book of #TheLighthouseKeepersDaughter,…"
2018-10-02 14:07:30,It's Horror Week readers! What spooky books are you reading? I am reading The Alienist and Frankenstein!  https://t.co/zOzMHP5HRp
2018-10-02 14:04:48,3 of 5 stars to The Clockmaker's Daughter by Kate Morton https://t.co/zpUQUJ1AVN
2018-10-02 14:02:21,New #bookreview up this morning! Come check it out! #amreading https://t.co/o5H9Ft2uzq
2018-10-02 14:01:49,"Review: Conan Doyle for the Defense: The True Story of a Sensational British Murder, a Quest for Justice, and the W… https://t.co/pLOkpZDlMD"
2018-10-02 13:34:54,@TallPoppyWriter @pcalhenry @goodhousemag @Southern_Living @ParadeMagazine Reading this one in a couple of weeks! I can’t wait!
2018-10-02 13:33:59,Are you a Dracula fan or a Frankenstein fan or perhaps both? I personally prefer Dracula but I haven’t read Franken… https://t.co/D8lvC555CS
2018-10-02 03:52:59,"On page 222 of 498 of The Alienist, by Caleb Carr https://t.co/Dao29L9sAh"
2018-10-01 23:35:56,RT @abruno77: Yours truly will be hosting this on Thursday! Stop by to learn more about me and enter to win my giveaway! https://t.co/xYyK7…
2018-10-01 23:28:04,@AlyssInWnderlnd I agree the relationship between then is so different and so intimate I loved it!
2018-10-01 22:02:26,I have been over today chatting with the lovely people at Ann Garvin-Founder Tall Poppy Writers and it's been a bla… https://t.co/1F2H5yfgwf
2018-10-01 20:31:55,@HazelGaynor @TheSundayIndo @IndoEnts @HCinIreland Eke I want to read this one so bad!!!
2018-10-01 20:31:46,RT @HazelGaynor: To celebrate lots of lovely news and reviews for #TheLighthouseKeepersDaughter I'm giving away a signed copy! RT to enter.…
2018-10-01 20:12:00,"On page 184 of 498 of The Alienist, by Caleb Carr https://t.co/juMozhM2mv"
2018-10-01 18:03:41,RT @abruno77: The sign ups are open for the 2019 Historical Fiction Reading Challenge! I hope you will be joining us this year! Time to get…
2018-10-01 14:55:49,@abruno77 My sister and I are buddy reading The Haunting on Hill House and Frankenstein and I’m finishing the Alienist this week!
2018-10-01 14:54:16,RT @SonjaYoerg: Go chat with @thelitbitch today in Bloom!   https://t.co/Cw8ofVtkAq  #bookbloggers #litchat #bookreviews https://t.co/Dffff…
2018-10-01 14:35:18,Special Feature: Clash of Empires by Paul Bennett https://t.co/mF7A3KnfQb @HFVBT #HistoricalFiction #historicalfix #mondayblogs #amreading
2018-10-01 13:41:16,"The lovely bookartbookmarks is hosting a rep search! For my entry, I picked a few of my favorite photos. I have bee… https://t.co/6Uul6iSpTp"
2018-10-01 13:24:39,Alright people it’s October 1st and that means I can now officially flood my feed with Halloween-ish photos! Today… https://t.co/uKRPemf5Op
2018-10-01 00:14:30,"On page 285 of 352 of Conan Doyle for the Defense, by Margalit Fox https://t.co/Gd7KXEJbhs"
2018-09-30 15:10:34,"On page 266 of 352 of Conan Doyle for the Defense, by Margalit Fox https://t.co/U8poOBnBD4"
