timestamp,tweet_text
,"A BookTuber who reads lots of classics, nonfiction, poetry, and occasionally literary fiction. My channel is called Totally Pretentious, because, you know...",
2019-11-14 00:01:14,@stdonoghue Drunk in a tavern? Doesn’t sound like the Thucydides I know...
2019-11-13 13:54:27,@7DaysatSea1 It's excellent!
2019-11-13 13:53:07,"I'm doing an article search for a meta-analysis I'm beginning to work on, and just found an article titled ""Persona… https://t.co/bmU3VTiZ1j"
2019-11-13 12:35:03,"70% done with Nothing to Be Frightened of, by Julian Barnes https://t.co/jY4bEyLdNs"
2019-11-13 10:17:40,RT @OLRReview: Ingenious by Peter Gluckman and Mark Hanson https://t.co/bsw1rlqM6X
2019-11-11 23:30:16,"41% done with Nothing to Be Frightened of, by Julian Barnes https://t.co/8xNMrnJ3QA"
2019-11-10 22:54:38,"30% done with The Penguin Book of English Verse, by Paul Keegan https://t.co/EW5loFEqnB"
2019-11-10 22:19:53,"This isn't a rhetorical question, by the way. I'm really curious!"
2019-11-10 22:19:24,"When you have too many books for your shelves, and know that you will receive larger shelves for Christmas and ther… https://t.co/yosmiKPApF"
2019-11-10 02:43:13,"32% done with A Brief History Of Painting, by Roy Bolton https://t.co/fYG7tK9Q9v"
2019-11-10 01:58:53,"25% done with The Battle for God, by Karen Armstrong https://t.co/nKGr1JRBL7"
2019-11-09 19:30:42,I read The Origin of Species by Charles Darwin https://t.co/FAJJ5IXrim
2019-11-09 14:47:23,"86% done with The Origin of Species, by Charles Darwin https://t.co/HFxJpnSMr6"
2019-11-09 02:23:16,"73% done with The Origin of Species, by Charles Darwin https://t.co/9q5c3GJvzN"
2019-11-09 01:18:54,"@NonficNovember On the Origin of Species, by Charles Darwin, and The Battle for God: A History of Fundamentalism, by Karen Armstrong!"
2019-11-08 20:50:03,"@FairyTalesEtc Funny you should mention Heidegger again, because one of the books I found on the second day was Being and Time!"
2019-11-08 19:48:59,@sharongoforth3 That’s what it’s looking like! 🤯
2019-11-08 18:14:23,"Wait to go back to the library sale until Sunday, he said. I’ll have the willpower to do it, he said."
2019-11-08 16:40:22,RT @recluse017: I’m turning 30 in a couple of weeks and word on the street is that it’s all downhill from there! It would be great to reach…
2019-11-08 13:00:11,"Darwin doesn’t get sassy very often in his writing, but when he does, it cracks me up."
2019-11-07 18:55:55,"50% done with The Origin of Species, by Charles Darwin https://t.co/hfkaPuf7lC"
2019-11-07 18:33:47,I read novels about wild cats and talking owls as a kid. So... https://t.co/hrz6Vp9DWR
2019-11-07 13:32:26,@FairyTalesEtc @sharongoforth3 no-buy year*
2019-11-07 13:16:10,"@FairyTalesEtc @sharongoforth3 ‘Tis true, ‘tis true! 2020 will be a no-but year for me!"
2019-11-07 02:18:14,@7DaysatSea1 I love how that’s ALWAYS the first thing people who’ve just started it say 😂🤣
2019-11-07 00:22:32,@books_abe I love The Way to Rainy Mountain!
2019-11-06 22:42:58,RT @books_abe: In celebration of 100 subs I am doing a Q&amp;A. here is the video if you would prefer to submit questions there. https://t.co/q…
2019-11-06 22:42:46,"There’s a library sale starting tomorrow. Should I go? No, no I shouldn’t. Will I go? Probably."
2019-11-06 00:39:20,"33% done with The Origin of Species, by Charles Darwin https://t.co/DXrm9nhdm4"
2019-11-05 12:47:53,@mcsbooks My little Bessie 😀 https://t.co/njvnuaYytI
2019-11-04 16:22:28,"21% done with The Origin of Species, by Charles Darwin https://t.co/7tHwSmonCL"
2019-11-04 13:43:07,"Reading On the Origin of Species is making me want to read more of Darwin's books, in particular The Descent of Man… https://t.co/lJtfwrQBa6"
2019-11-03 23:10:45,"When I read books on paintings (or visit art museums), I often come away thinking that my brain is far more suited… https://t.co/GOMnyj70YC"
2019-11-03 01:57:34,"76% done with The Essays of Ralph Waldo Emerson, by Ralph Waldo Emerson https://t.co/Ktt56Cf7CY"
2019-11-03 00:30:16,@shawnmooney Angry reacts only 😡
2019-11-02 23:05:54,"66% done with Psalm 44, by Danilo Kiš https://t.co/su2QELQN9r"
2019-11-02 12:27:31,"12% done with The Origin of Species, by Charles Darwin https://t.co/I8jw4CYWed"
2019-11-01 23:40:46,"33% done with Psalm 44, by Danilo Kiš https://t.co/TIbdDe6KPE"
2019-10-31 10:44:37,@_MelanieMartin Yay for going skating! Have fun!!
2019-10-30 22:25:20,"@LWestwoodAuthor Well I tend to over-explain, so I'm probably an adder!"
2019-10-30 22:24:45,I read God Emperor of Dune by Frank Herbert https://t.co/ognEUC1IHs
2019-10-30 14:36:23,**tries to revise paper to reduce word count**  **increases word count** https://t.co/uf3RlBUdbO
2019-10-29 23:03:31,"85% done with God Emperor of Dune, by Frank Herbert https://t.co/hWsR1HEKWU"
2019-10-29 12:55:36,I read On Elizabeth Bishop by Colm Tóibín https://t.co/vlU3HzlRns
2019-10-29 02:13:35,I feel like Twitter is an excellent way for me to indulge my worst habits of complaining about the pettiest issues imaginable.
2019-10-28 23:56:35,"75% done with On Elizabeth Bishop, by Colm Tóibín https://t.co/0kHBnefnTB"
2019-10-28 18:12:32,"RT @thegoodgodabove: Booing a fascist while watching a baseball game is the most patriotic, American thing you could ever do."
2019-10-28 17:45:29,"Then again, books arrived in the mail. So maybe it’s not so bad?"
2019-10-28 17:30:37,We might have to accept that it’s a bad omen if the first thing you realize on Monday morning is that your toaster oven doesn’t work.
2019-10-28 13:06:31,@FairyTalesEtc I’m enjoying it. He provides some good insights into Bishop’s poems that are helping me appreciate her work more.
2019-10-28 02:59:31,"Spilled a glass of water sitting next to my bed, and NONE of the three books next to it were affected! 👌🏻"
2019-10-28 01:47:51,"50% done with On Elizabeth Bishop, by Colm Tóibín https://t.co/ohYOLZ9BVI"
2019-10-27 15:33:53,"@WordsWordsBooks Stop poking holes, YOU!"
2019-10-27 01:47:50,You know that it was the right decision to get rid of a book if later on the very same day you forget it was ever on your shelf!
2019-10-26 21:59:33,"25% done with On Elizabeth Bishop, by Colm Tóibín https://t.co/GkpOinPtdj"
2019-10-26 21:10:01,"41% done with A Poetry Handbook, by Mary Oliver https://t.co/QgEXbMWcfA"
2019-10-26 19:10:47,@sharongoforth3 Ah! Not good! 😬
2019-10-26 18:46:46,Got rid of enough books so that I now have some free space on my shelves... just in time for some books to come in the mail 😂😂😂
2019-10-26 16:13:24,Is it a law universally recognized that bookshelves in need of reorganizing will always have more books that need t… https://t.co/vQ4bm1qDC7
2019-10-26 11:21:05,@Britta_Boehler I already heard someone in the office chatting about how she’s watched three Christmas movies this week 😭😭😭😭😭😭
2019-10-26 03:13:14,RT @BPegged: The History Shelf is on YouTube! Subscribe and keep up to date on the best of the past. https://t.co/FKMU7bAVUW via @BPegged #…
2019-10-26 00:13:02,@BPegged @nyrbclassics Omg! I need to read that!
2019-10-26 00:12:17,@BookishSpider I re-watch it every year around Halloween!
2019-10-25 23:39:23,"“The world is a miserable place. Life isn’t fun, Greg.” The wisdom of Over the Garden Wall 😂"
2019-10-25 14:49:54,“Studies using 10 self-report items to ‘control’ for all of personality can no more prove the incremental validity… https://t.co/xPOchHHuHO
2019-10-25 01:03:26,"87% done with The Year of Magical Thinking, by Joan Didion https://t.co/a7oQOWTezc"
2019-10-24 15:11:59,"Well I'll be darned. As an Iowa State student, I have free access to both the Wall Street Journal AND the New York Times!"
2019-10-24 14:31:30,"74% done with The Year of Magical Thinking, by Joan Didion https://t.co/hajiCdtExz"
2019-10-24 00:46:55,"Some Rossini, as sung by Tito Gobbi, to brighten your Wednesday! https://t.co/Qcsj7Fw7YZ via @YouTube"
2019-10-24 00:00:58,"@FairyTalesEtc I once had a cat named Lily! Also very cute, although she had an incredibly bizarre personality."
2019-10-23 20:07:24,@lena_makridina @stdonoghue Moose are honestly my favorite... just as long as one isn’t staring me straight in the face.
2019-10-23 13:35:56,@shawnmooney Figures I’d be the emo one 😭😭😭😭😭😭😭😭
2019-10-23 11:19:03,"Just took two quizzes about which Brontë sister I am, and both told me that I'm Emily. Go figure."
2019-10-23 00:46:29,Me too https://t.co/pN9u2HEacG
2019-10-23 00:22:49,"70% done with God Emperor of Dune, by Frank Herbert https://t.co/5pxmco8JR3"
2019-10-22 11:39:04,@shawnmooney https://t.co/CmVWzG2LYW
2019-10-22 03:09:26,One of those evenings where I'm tempted to start five books all at once.
2019-10-21 15:21:53,It’s the Bessie. https://t.co/6xq0HHzxhi
2019-10-21 14:37:20,"37% done with The Year of Magical Thinking, by Joan Didion https://t.co/g7XZHfZZYp"
2019-10-21 11:25:00,"@stdonoghue @shawnmooney So, like, Alice Munro?"
2019-10-20 16:31:33,@shawnmooney @FairyTalesEtc https://t.co/op3IBWnn5M
2019-10-20 15:59:19,"15% done with The Year of Magical Thinking, by Joan Didion https://t.co/gDWfcrK0Zo"
2019-10-20 13:01:30,Do other BookTubers re-watch their own videos?
2019-10-20 12:42:40,@shawnmooney @nytopinion I love this show!
2019-10-19 21:17:00,I really need to make a ritual of cooking or baking and listening to the opera on Saturdays. They make such a good combination!
2019-10-19 16:56:38,Am I allowed to quote Bojack Horseman in a scathing review of a terrible book?
2019-10-19 16:54:50,"75% done with Why I Read, by Wendy Lesser https://t.co/AP0JEtJQts"
2019-10-18 22:40:42,@BrianBruce7 @Britta_Boehler Happened for us both on the same day! Congratulations!!!
2019-10-18 14:27:03,@shawnmooney https://t.co/np8dxjBn9h
2019-10-18 14:13:33,"50% done with Why I Read, by Wendy Lesser https://t.co/bCvMl0eSn8"
2019-10-18 12:07:45,Feeling kinda dirty after ordering too many books online 😅
2019-10-18 01:58:48,A little sort-of mid-month wrap-up and also sort-of (?) Friday reads. https://t.co/OCYFQx6HJI via @YouTube
2019-10-17 23:11:22,@AminTheReader I do. I prefer that to the page counts because it seems to indicate my progress more accurately (sin… https://t.co/Ofy4Sj6fjC
2019-10-17 22:45:24,"@AminTheReader No, this is just a Goodreads update"
2019-10-17 18:06:48,"After an evening of powering through a terrible book, I’m excited to get back to reading stuff I’m excited about tonight!"
2019-10-17 11:02:04,"@recluse017 I’m supposed to write a review of it, so unfortunately no. 😣"
2019-10-17 02:44:18,"@FairyTalesEtc Ingenious, by Peter Gluckman and Mark Hanson. Just finished it, thank goodness!"
2019-10-17 01:56:53,"First time I’ve ever used a swear word in an annotation. Also, I’m annotating with a pen because if this book doesn… https://t.co/1E35ejvn8u"
2019-10-17 01:02:14,"47% done with God Emperor of Dune, by Frank Herbert https://t.co/EPciiEJ4Cc"
2019-10-17 00:52:19,You know a book is bad when it’s only 230 pages long and you’ve been working on it for six days but it feels like i… https://t.co/cGmBpUeRQO
2019-10-16 23:16:28,Really sucks when you read a book that makes you sigh in exasperation in almost every page 😬
2019-10-15 22:01:02,@recluse017 No I can totally see why you’d be annoyed. Personally I usually at least go subscribe if someone who co… https://t.co/nZk29CEMmr
2019-10-15 21:57:47,@recluse017 I think the only time a TBR has worked for me is if I can literally read every book within a week or so… https://t.co/izTYFQMRSP
2019-10-15 21:53:36,"@BPegged Wow! Good for you! I’d signed up for two but then changed it to one, because I got intimidated by the amou… https://t.co/3suO9vhhfe"
2019-10-15 19:14:55,@BPegged Woohoo! What round are you judging? I’m judging the nonfiction in April/May!
2019-10-15 17:16:24,RT @neilgriffiths: For me Harold Bloom’s great insight was the oddness of canonical works. They are odd because the artist strives to copy…
2019-10-15 01:36:56,"@FairyTalesEtc I'm not sure. I'm guessing an actual merry-go-round, based on the way it was described in the book I… https://t.co/a3RLqqZ0Iv"
2019-10-15 00:52:06,Learning that the Seattle Opera once used a merry-go-round to stage the Ride of the Valkyries once just made my day.
2019-10-15 00:10:42,And once again I prove to myself that trying to formulate a TBR list is the most effective way of getting me NOT to… https://t.co/O58sfrTpQA
2019-10-14 23:02:34,"56% done with Ingenious, by Peter Gluckman https://t.co/6G8mFESHxs"
2019-10-14 21:39:29,"RT @NYTObits: Harold Bloom, often called “the most notorious literary critic in America,” has died. His NYT obit: https://t.co/GEMnIuVp1z"
2019-10-14 19:40:44,@lena_makridina @stdonoghue Haha I was joking. I don’t think I’m ready to take on such a behemoth yet! Maybe someda… https://t.co/W7enaLwxaf
2019-10-14 17:45:06,"@lena_makridina @stdonoghue Oh, you mean you and I AREN’T about to start buddy reading Gibbon’s Decline and Fall of… https://t.co/ryayC59cPN"
2019-10-14 15:34:49,"As an Aquarius, I feel personally attacked 😭😭😭😭😭 https://t.co/QXP95oIAqq"
2019-10-13 12:24:48,RT @BookTubePrize: It's time to sign up as a judge for the 2020 BookTube Prize. Video and signup here: https://t.co/N1F9bBkjbP https://t.co…
2019-10-12 21:43:38,Saw a live broadcast of Turandot from the @MetOpera today and it was terrific! Christine Goerke (@HeldenMommy) was… https://t.co/5KzxaNJNgZ
2019-10-12 19:28:06,@godandgodzilla I’ll have to check out his work. Thanks for the recommendations!
2019-10-12 17:51:26,"@godandgodzilla He’s a director, right?"
2019-10-12 15:08:23,"33% done with Ingenious, by Peter Gluckman https://t.co/TncdeEx7oe"
2019-10-12 10:08:51,"My review of For the Love of Music: A Conductor’s Guide to the Art of Listening, by John Mauceri, was published in… https://t.co/pzJSEBtRzs"
2019-10-12 02:40:38,@7DaysatSea1 I need to try that!
2019-10-12 01:26:43,@7DaysatSea1 You know me too well!
2019-10-12 00:51:54,@periodicallypod @FairyTalesEtc Never! 😎
2019-10-12 00:40:21,I feel like the works of art that stick with us the most are those that acknowledge the melancholy inherent in the… https://t.co/B0fPK74XTs
2019-10-12 00:04:33,"It's 7 PM on Friday and I have simply HOURS of BookTube (i.e., Friday reads) to watch! #Booktube"
2019-10-11 23:46:49,"33% done with The Divine Comedy, by Dante Alighieri https://t.co/SZi4bjNcSh"
2019-10-11 16:29:26,@everalwaysdoing Stay safe!!
2019-10-11 16:24:55,"75% done with Thebaid, by Publius Papinius Statius https://t.co/PUnhuWwboe"
2019-10-11 15:46:45,@BookishIslander Sounds like a good Friday!
2019-10-11 15:01:51,@7DaysatSea1 Ah nice! I've wanted to read this ever since watching the Ken Burns documentary (twice) earlier this year.
2019-10-11 15:00:23,"RT @voxdotcom: What would a needy person do if you gave them $500 a month, no strings attached?  Stockton, California, is finding out.  The…"
2019-10-11 13:46:21,@7DaysatSea1 I didn't realize she was so acclaimed. I thought of her as a kind of obscure author until I saw that s… https://t.co/ZkoSrP4hgj
2019-10-11 12:01:07,@shawnmooney Stay safe!!
2019-10-11 01:37:47,"22% done with Why I Read, by Wendy Lesser https://t.co/YWkS8dTNFA"
2019-10-10 21:39:03,RT @john_self: Something about the title of this book (from an Auden poem) really delights me. The book is very good too—essays on music fr…
2019-10-10 14:16:03,I love how over-night there are twelve holds on the two novels by Olga Tokarczuk that are in the public library here. #NobelPrizeLiterature
2019-10-10 14:09:59,"Ok I’ve gotta get out of my car to walk to class now, so if it could stop raining for a few minutes instead of gett… https://t.co/1ZdRhOa9Nv"
2019-10-10 13:21:16,"10% done with The Penguin Book of English Verse, by Paul Keegan https://t.co/9Ndvy0JFgQ"
2019-10-09 23:02:14,RT @AynRandPaulRyan: This should be happening at every single one of Trump's hotels right now.  #KurdsBetrayedByTrump #RepublicanCampaignSl…
2019-10-09 22:17:54,That’s what everyone’s thinking by the mid-point of the week. https://t.co/guXZiPOIN4
2019-10-09 20:22:44,“It’s a weird assignment. It’s about lower back pain.” Things you only hear in a statistics class.
2019-10-09 15:16:06,That awkward moment when you decide to pile up all the nonfiction books you’re pumped to read to get yourself psych… https://t.co/stwA90K2VA
2019-10-08 22:45:09,"24% done with God Emperor of Dune, by Frank Herbert https://t.co/xDfEPsiaeU"
2019-10-08 19:19:28,"50% done with Thebaid, by Publius Papinius Statius https://t.co/uuhWQemzMV"
2019-10-08 15:45:05,"Always fun to use needing to do laundry as an excuse to “work from home” (i.e., get nothing done) when I should’ve… https://t.co/lCKayP251p"
2019-10-08 14:00:50,@7DaysatSea1 Rut roh https://t.co/eiildJsasi
2019-10-08 13:58:22,"@heatherrlucke Honestly I imagined right from the start that Bessie was named after Bessie Smith, but I’ve only jus… https://t.co/92kIEJsDb0"
2019-10-08 13:57:01,@7DaysatSea1 Something wrong with that author? 😂
2019-10-08 03:10:53,Finally listening to The Essential Bessie Smith all the way through and I think I’ve found a new musical love!
2019-10-08 02:44:00,@sharongoforth3 Cool! I haven’t been able to tell where to go with Mantel’s work outside her Cromwell trilogy—aside… https://t.co/j1GtN8Ajel
2019-10-08 02:42:31,"@BPegged Ah—that’s a book I’d love to read as well! Not sure when I’ll get to it, but I read Chris Hitchens’s intro… https://t.co/2X1CPUSpP9"
2019-10-08 01:30:04,"In the back of her book, Why I Read, Wendy Lesser includes a list of 100 books to read for pleasure. Here it is for… https://t.co/61Y4dMI1Sm"
2019-10-07 19:57:32,@BrianBruce7 He’s destroyed the economy of Turkey before? Impressive.
2019-10-07 17:52:49,"I’m endeavoring to read through the entirety of the Penguin Book of English  Verse right now, and some of these ear… https://t.co/VqhabYFvGo"
2019-10-06 21:17:27,That awkward moment when it's Sunday afternoon and all of a sudden you're reading six books all at once.
2019-10-06 18:19:01,"12% done with God Emperor of Dune, by Frank Herbert https://t.co/7CCg7Itx8W"
2019-10-06 17:06:25,@BPegged Haha it is indeed that guy...
2019-10-06 16:41:54,@AminTheReader This is the third or fourth comment like this that he’s left on a video of mine.
2019-10-06 15:45:15,I like how this troll of mine feels the need to like his own comment. I’m not sure whether I find this guy funny or… https://t.co/AF4O5rp9W3
2019-10-06 14:27:59,"24% done with Thebaid, by Publius Papinius Statius https://t.co/4bRbil5B2l"
2019-10-06 13:23:55,"@BrianBruce7 Sometimes I hear things like this, and I think, “Have these people even HEARD of 1984???”"
2019-10-06 11:25:32,@SiljeRis I love that your cat is named Alberta!
2019-10-06 10:44:27,@sharongoforth3 @amygetslit Oh no! That’s terrible!
2019-10-06 02:28:18,"One of the most satisfying videos to finally be able to post! Not sure my discussion is all that substantive, but I… https://t.co/oUtctYMIBJ"
2019-10-05 23:44:57,"Trying to push my way through Lucan’s Civil War, but within five pages I’ve already been reminded of why I wasn’t a… https://t.co/zabJAaIopX"
2019-10-05 22:57:17,Anyone else's cat drink out of the toilet?
2019-10-05 17:59:56,That awkward moment when you’ve read the last 75 pages of a huge book you’ve been working on for at least two month… https://t.co/J7Rf6bQYDk
2019-10-05 14:45:40,"93% done with Friedrich Nietzsche, by Curtis Cate https://t.co/W5CgF9HxYQ"
2019-10-05 14:01:24,"I now own two different translations of the Iliad and the Odyssey, The Oresteia, Ovid’s Metamorphoses, Horace’s Ode… https://t.co/e7N48CJm88"
2019-10-05 12:58:15,"@stdonoghue We’ve all seen you not only pet a cat but also try to invite one onto your lap now, so I’m not sure you… https://t.co/GWFC6o7vNk"
2019-10-05 03:15:53,@WilsonnShugart @stdonoghue Oh damn. Was it YOU who wrote King John???
2019-10-05 02:47:27,"Feeling a little sentimental tonight. To be fair, this is also just a great song... https://t.co/rwd4N9Ul9n via @YouTube"
2019-10-05 01:25:49,A sort of bookshelf reorganization and a little haul! https://t.co/jud8IzQzoG via @YouTube
2019-10-04 15:07:22,"@FairyTalesEtc I’ve always written “advisor,” but occasionally spell check doesn’t like that 🤷🏻‍♂️"
2019-10-04 02:02:07,"So is it just me, or do I hear a ton of people saying, ""So-and-so person did [insert verb] in an [insert adjective]… https://t.co/NAV6lWWGqM"
2019-10-04 01:03:05,"@BPegged I often end up doing that, too. But I always feel guilty about it. Maybe that's foolish of me, but it's how I tend to be =/"
2019-10-04 00:05:06,"@BPegged That's how I feel, too! Even with a book that's really good, I'm torn between just wanting to finish it al… https://t.co/F7DIUt9hVX"
2019-10-03 23:50:43,"I often get burnt out in the last 100 pages of a very long book that is very dense, very information-heavy, or very… https://t.co/DnYLVi6EnS"
2019-10-03 23:31:08,"82% done with Friedrich Nietzsche, by Curtis Cate https://t.co/0w9DFykVRX"
2019-10-03 18:07:11,"Tuesday: literally actually works for eight hours straight. Thursday: works for one hour, goes to class, spends the… https://t.co/72Bvbu122N"
2019-10-03 17:06:53,@SiljeRis Dinosaur shirts are the best! I have one of a t-rex shooting rainbows out of its mouth!
2019-10-03 14:30:10,Already more than a third of the way through the semester. Crazy!
2019-10-03 00:58:57,"@goodreads Whoops, late 1800s, not late 1900s!"
2019-10-03 00:21:21,"@goodreads Either Switzerland in the late 1900s, the orbit above Endor, or Arrakis."
2019-10-02 23:14:27,"You know there’s no going back when the words, “Next week we’ll start with good ol’ regression!” from a professor m… https://t.co/akbF35irJf"
2019-10-01 23:55:19,Curtis Cate’s two chapters on Thus Spoke Zarathustra in his biography of Nietzsche are so good. Made me immediately want to reread it!
2019-10-01 00:48:14,"@WilsonnShugart I love the book, and even I think it explains a lot! 😂🤣"
2019-10-01 00:31:43,Friedrich Nietzsche wrote Thus Spoke Zarathustra in ten days. #MotivationMonday
2019-09-30 19:16:41,@amygetslit Maybe doing really casual reading update videos? Just Friday reads or “am reading” videos that go for a… https://t.co/Buus3vgAkM
2019-09-30 12:07:15,"My little discussion of Ethan Frome, by Edith Wharton! https://t.co/uwp1ROG6Xv via @YouTube"
2019-09-29 20:57:05,"My wrap-up of everything I read in September. Even as my channel goes, it's a bit of a doozy! https://t.co/zwLGG932Wr via @YouTube"
2019-09-29 20:25:16,"65% done with Friedrich Nietzsche, by Curtis Cate https://t.co/4tQfLgGK7R"
2019-09-29 19:04:19,@HardcoverHearts Oh no! That sounds terrible!
2019-09-29 15:43:33,That awkward moment when you record a BookTube video and don’t realize until the very end of the half-hour that the… https://t.co/1tjVnpJoPc
2019-09-29 14:20:52,RT @FairyTalesEtc: 100 Must-Read Classics by People of Color https://t.co/vIkeOWYug6
2019-09-29 13:03:18,Listening to Richard Wagner’s orchestral works while reading Ethan Frome: who would have thought that Edith Wharton… https://t.co/5BCVFAi5Ub
2019-09-29 02:35:43,@WhatPageRYouOn Same though
2019-09-28 23:41:57,"@BPegged Ethan Frome, and Marjorie Garber's chapters in her book, Shakespeare After All, on Measure for Measure and… https://t.co/Kj4Vprt77b"
2019-09-28 20:09:11,"50% done with Ethan Frome, by Edith Wharton https://t.co/quk2aITxxj"
2019-09-28 16:28:14,Honestly 80% of the reason my apartment feels so messy is because of the books lying around everywhere.
2019-09-28 13:07:38,@BrianBruce7 Feel free to! I’ll just whip me up some popcorn and watch the fireworks that ensue! 😂
2019-09-28 13:00:43,"Think I’ve got my first official troll. Not sure if I’m afraid or proud, but his comments are hilarious. https://t.co/UOdH1wxBQJ"
2019-09-27 21:57:34,Making it to the weekend feels like an accomplishment.
2019-09-27 21:55:18,"The Two Gentlemen of Verona: that one Shakespeare play where there are 15 characters, of whom only two are remotely interesting."
2019-09-27 01:15:39,Nothing makes you feel older than proctoring a freshmen psychology exam. A) Your back hurts and B) these students l… https://t.co/HFjPb8bjxj
2019-09-26 21:26:12,In which I free associate about reading multiple books at once (or not)! https://t.co/kpGRlgzm49 via @YouTube
2019-09-26 19:32:44,@BookishIslander You’re simply zooming through this one!
2019-09-26 18:51:29,@FairyTalesEtc Awesome!
2019-09-26 13:44:05,#FirstWorldProblems
2019-09-26 13:43:26,I have to proctor from 6-8 PM today and that makes me sad.
2019-09-26 01:15:30,"**receives a set of all nine of Beethoven's symphonies conducted by Herbert von Karajan, only two of which he's lis… https://t.co/bc8Sl49csI"
2019-09-26 00:39:53,"@FromTheDusty Well it doesn't feel like much has happened yet, so I don't know whether I can speak to how the story… https://t.co/ml3wHSq6sh"
2019-09-26 00:10:57,"13% done with Middlemarch, by George Eliot https://t.co/Y0nkloSjgO"
2019-09-25 23:41:47,"Sometimes you come home tired from a full day, and just making it through 25 pages of a novel feels like an accomplishment..."
2019-09-25 22:42:31,"“Among all forms of mistake, prophecy is the most gratuitous.”  - George Eliot, Middlemarch"
2019-09-25 18:07:20,"This is kind of old news now, but I’m delighted to see The Heartbeat of Wounded Knee on the longlist for the Nation… https://t.co/569lRzlZZ1"
