timestamp,tweet_text
2019-09-25 11:00:07,"""...the mistakes that we male and female mortals make when we have our own way might fairly raise some wonder that… https://t.co/PW9ggeZk3m"
2019-09-25 00:39:22,"Ever read a book where on the whole it was a ""meh"" reading experience, but there were a few sections of the books t… https://t.co/ZpRyw9WrgJ"
2019-09-25 00:07:08,I read For the Love of Music by John Mauceri https://t.co/9RFcWx5zXr
2019-09-24 13:25:19,@FairyTalesEtc Happy birthday!!
2019-09-24 00:04:57,"75% done with For the Love of Music, by John Mauceri https://t.co/2xQwznyR40"
2019-09-23 23:16:04,"“When I had journeyed half of our life’s way, I found myself within a shadowed forest” And so begins my reread of D… https://t.co/NoQbCfLPeg"
2019-09-23 18:07:15,Isn’t this what everyone thinks on Mondays? https://t.co/lHgY6FCZg4
2019-09-23 17:06:09,"At first I was Russian, but then I Czech’d my speed..."
2019-09-23 15:04:11,"@sharongoforth3 I lived in one in Illinois (IL, IA, MO) and apparently Westchester County, NY (i.e., NYC suburbs) i… https://t.co/lCv3n3EJfB"
2019-09-23 13:30:50,"RT @GradSkoolStrugs: Monday Funday   -no one, ever."
2019-09-23 02:16:19,How many different tri-state areas are there in the United States?
2019-09-22 22:49:58,@BookishIslander Been meaning to read this for a longggg time!
2019-09-22 21:26:30,"My little discussion of The House of Mirth, by Edith Wharton! https://t.co/dwMveNzeTd via @YouTube"
2019-09-22 20:27:59,"After two hours of ignoring me, the precise second at which my cat wants my attention again is when I hit the recor… https://t.co/lDiD1srd0d"
2019-09-22 15:49:26,RT @nationalbook: The #NBAwards excitement continues with the fourth category of the week's announcements. These are the ten titles longlis…
2019-09-22 15:04:33,"What a weird thing. I read a translation of Sappho this morning, then went to read some of Middlemarch, and wouldn'… https://t.co/ki4RkBg5WP"
